OPA Case Number,Status,Status Description,Due Date,Completed Date,Task Creation Date,External Case Number,Due_Date,Completed_Date,Task_Creation_Date,CurrentStatus
2016OPA-0675,Done,OPA Close SA,,08/03/2016 12:00:00 AM,08/03/2016 12:00:00 AM,,,2016-08-03T00:00:00.000,2016-08-03T00:00:00.000,Done
2017OPA-0498,Done,OPA Close SA,,07/17/2017 12:00:00 AM,07/17/2017 12:00:00 AM,,,2017-07-17T00:00:00.000,2017-07-17T00:00:00.000,Done
2017OPA-0556,Done,OPA Close CL,06/28/2017 12:00:00 AM,06/30/2017 12:00:00 AM,06/23/2017 12:00:00 AM,2016-309226,2017-06-28T00:00:00.000,2017-06-30T00:00:00.000,2017-06-23T00:00:00.000,Done
2018OPA-1069,Done,OPA Close CL,12/09/2018 12:00:00 AM,12/12/2018 12:00:00 AM,12/04/2018 12:00:00 AM,2018-419172,2018-12-09T00:00:00.000,2018-12-12T00:00:00.000,2018-12-04T00:00:00.000,Done
2019OPA-0311,Done,OPA Close CL,06/03/2019 12:00:00 AM,05/31/2019 12:00:00 AM,05/29/2019 12:00:00 AM,,2019-06-03T00:00:00.000,2019-05-31T00:00:00.000,2019-05-29T00:00:00.000,Done
2020OPA-0149,Done,OPA Close CL,03/20/2020 12:00:00 AM,03/27/2020 12:00:00 AM,03/13/2020 12:00:00 AM,,2020-03-20T00:00:00.000,2020-03-27T00:00:00.000,2020-03-13T00:00:00.000,Done
2015OPA-1835,Done,OPA Close CL,12/23/2015 12:00:00 AM,12/21/2015 12:00:00 AM,12/18/2015 12:00:00 AM,,2015-12-23T00:00:00.000,2015-12-21T00:00:00.000,2015-12-18T00:00:00.000,Done
2017OPA-0506,Done,OPA Close SA,,07/19/2017 12:00:00 AM,07/19/2017 12:00:00 AM,,,2017-07-19T00:00:00.000,2017-07-19T00:00:00.000,Done
2018OPA-0331,Done,OPA Close Case,09/21/2018 12:00:00 AM,10/17/2018 12:00:00 AM,09/11/2018 12:00:00 AM,2018-085340,2018-09-21T00:00:00.000,2018-10-17T00:00:00.000,2018-09-11T00:00:00.000,Done
2018OPA-0724,Done,OPA Close CL,09/25/2018 12:00:00 AM,09/21/2018 12:00:00 AM,09/20/2018 12:00:00 AM,,2018-09-25T00:00:00.000,2018-09-21T00:00:00.000,2018-09-20T00:00:00.000,Done
2018OPA-0921,Done,OPA Training Referral,03/01/2019 12:00:00 AM,03/20/2019 12:00:00 AM,02/19/2019 12:00:00 AM,2018-311985,2019-03-01T00:00:00.000,2019-03-20T00:00:00.000,2019-02-19T00:00:00.000,Done
2019OPA-0620,Done,OPA Close Case,04/10/2020 12:00:00 AM,04/14/2020 12:00:00 AM,02/23/2020 12:00:00 AM,2019-280794,2020-04-10T00:00:00.000,2020-04-14T00:00:00.000,2020-02-23T00:00:00.000,Done
2019OPA-0856,Done,OPA Close SA,,01/13/2020 12:00:00 AM,01/13/2020 12:00:00 AM,2019-439726,,2020-01-13T00:00:00.000,2020-01-13T00:00:00.000,Done
2015OPA-0011,Done,OPA Close Case,08/12/2015 12:00:00 AM,08/12/2015 12:00:00 AM,07/29/2015 12:00:00 AM,2014-398333,2015-08-12T00:00:00.000,2015-08-12T00:00:00.000,2015-07-29T00:00:00.000,Done
2018OPA-0824,Done,OPA Close CL,09/18/2018 12:00:00 AM,09/13/2018 12:00:00 AM,09/13/2018 12:00:00 AM,,2018-09-18T00:00:00.000,2018-09-13T00:00:00.000,2018-09-13T00:00:00.000,Done
2018OPA-0943,Done,OPA Close Case,03/28/2019 12:00:00 AM,04/01/2019 12:00:00 AM,03/18/2019 12:00:00 AM,2018-355377,2019-03-28T00:00:00.000,2019-04-01T00:00:00.000,2019-03-18T00:00:00.000,Done
2019OPA-0511,Done,OPA Close Case,01/25/2020 12:00:00 AM,03/25/2020 12:00:00 AM,01/15/2020 12:00:00 AM,,2020-01-25T00:00:00.000,2020-03-25T00:00:00.000,2020-01-15T00:00:00.000,Done
2015OPA-0968,Done,OPA Close SA,10/11/2015 12:00:00 AM,10/06/2015 12:00:00 AM,10/06/2015 12:00:00 AM,,2015-10-11T00:00:00.000,2015-10-06T00:00:00.000,2015-10-06T00:00:00.000,Done
2016OPA-1142,Done,OPA Close CL,10/17/2016 12:00:00 AM,10/15/2016 12:00:00 AM,10/12/2016 12:00:00 AM,,2016-10-17T00:00:00.000,2016-10-15T00:00:00.000,2016-10-12T00:00:00.000,Done
2016OPA-1276,Done,OPA Close Case,04/07/2017 12:00:00 AM,04/07/2017 12:00:00 AM,03/28/2017 12:00:00 AM,,2017-04-07T00:00:00.000,2017-04-07T00:00:00.000,2017-03-28T00:00:00.000,Done
2017OPA-0168,Done,OPA Close SA,,04/21/2017 12:00:00 AM,04/14/2017 12:00:00 AM,2017-060865,,2017-04-21T00:00:00.000,2017-04-14T00:00:00.000,Done
2018OPA-0909,Done,OPA Close CL,10/16/2018 12:00:00 AM,10/19/2018 12:00:00 AM,10/11/2018 12:00:00 AM,,2018-10-16T00:00:00.000,2018-10-19T00:00:00.000,2018-10-11T00:00:00.000,Done
2019OPA-0669,Done,OPA Close SA,,10/29/2019 12:00:00 AM,10/29/2019 12:00:00 AM,2019-338590,,2019-10-29T00:00:00.000,2019-10-29T00:00:00.000,Done
2015OPA-0386,Done,OPA Close CL,,03/30/2015 12:00:00 AM,10/20/2015 12:00:00 AM,,,2015-03-30T00:00:00.000,2015-10-20T00:00:00.000,Done
2015OPA-0439,Done,OPA Close Case,10/27/2015 12:00:00 AM,10/27/2015 12:00:00 AM,08/31/2015 12:00:00 AM,,2015-10-27T00:00:00.000,2015-10-27T00:00:00.000,2015-08-31T00:00:00.000,Done
2015OPA-1872,Done,OPA Close CL,12/23/2015 12:00:00 AM,01/05/2016 12:00:00 AM,12/18/2015 12:00:00 AM,,2015-12-23T00:00:00.000,2016-01-05T00:00:00.000,2015-12-18T00:00:00.000,Done
2016OPA-0726,Done,OPA Close CL,07/25/2016 12:00:00 AM,07/27/2016 12:00:00 AM,07/20/2016 12:00:00 AM,,2016-07-25T00:00:00.000,2016-07-27T00:00:00.000,2016-07-20T00:00:00.000,Done
2016OPA-1208,Done,OPA Missed 180 Day Deadline,03/22/2017 12:00:00 AM,01/23/2018 12:00:00 AM,02/26/2019 12:00:00 AM,2016-344998,2017-03-22T00:00:00.000,2018-01-23T00:00:00.000,2019-02-26T00:00:00.000,Done
2017OPA-0060,Done,OPA Close SA,03/14/2017 12:00:00 AM,03/07/2017 12:00:00 AM,02/17/2017 12:00:00 AM,,2017-03-14T00:00:00.000,2017-03-07T00:00:00.000,2017-02-17T00:00:00.000,Done
2017OPA-0148,Done,OPA Close CL,03/15/2017 12:00:00 AM,02/22/2017 12:00:00 AM,02/13/2017 12:00:00 AM,,2017-03-15T00:00:00.000,2017-02-22T00:00:00.000,2017-02-13T00:00:00.000,Done
2018OPA-0285,Done,OPA Close Case,08/23/2018 12:00:00 AM,10/10/2018 12:00:00 AM,08/13/2018 12:00:00 AM,2018-106773,2018-08-23T00:00:00.000,2018-10-10T00:00:00.000,2018-08-13T00:00:00.000,Done
2019OPA-0223,Done,OPA Close Case,10/05/2019 12:00:00 AM,10/11/2019 12:00:00 AM,09/25/2019 12:00:00 AM,2019-126481,2019-10-05T00:00:00.000,2019-10-11T00:00:00.000,2019-09-25T00:00:00.000,Done
2015OPA-0874,Done,OPA Close Case,12/09/2015 12:00:00 AM,12/14/2015 12:00:00 AM,11/25/2015 12:00:00 AM,,2015-12-09T00:00:00.000,2015-12-14T00:00:00.000,2015-11-25T00:00:00.000,Done
2015OPA-0947,Done,OPA Close SA,09/21/2015 12:00:00 AM,09/17/2015 12:00:00 AM,09/16/2015 12:00:00 AM,,2015-09-21T00:00:00.000,2015-09-17T00:00:00.000,2015-09-16T00:00:00.000,Done
2016OPA-0258,Done,OPA Close CL,04/04/2016 12:00:00 AM,03/31/2016 12:00:00 AM,03/30/2016 12:00:00 AM,,2016-04-04T00:00:00.000,2016-03-31T00:00:00.000,2016-03-30T00:00:00.000,Done
2016OPA-0693,Done,OPA Close CL,07/25/2016 12:00:00 AM,07/28/2016 12:00:00 AM,07/20/2016 12:00:00 AM,,2016-07-25T00:00:00.000,2016-07-28T00:00:00.000,2016-07-20T00:00:00.000,Done
2016OPA-1170,Done,OPA Close Case,03/25/2017 12:00:00 AM,03/30/2017 12:00:00 AM,03/15/2017 12:00:00 AM,2016-341870,2017-03-25T00:00:00.000,2017-03-30T00:00:00.000,2017-03-15T00:00:00.000,Done
2015OPA-0865,Done,OPA Close Case,12/09/2015 12:00:00 AM,12/14/2015 12:00:00 AM,11/25/2015 12:00:00 AM,,2015-12-09T00:00:00.000,2015-12-14T00:00:00.000,2015-11-25T00:00:00.000,Done
2016OPA-1264,Done,OPA Close Case,04/28/2017 12:00:00 AM,05/04/2017 12:00:00 AM,04/18/2017 12:00:00 AM,2016-260109,2017-04-28T00:00:00.000,2017-05-04T00:00:00.000,2017-04-18T00:00:00.000,Done
2018OPA-0997,Done,OPA Close Case,05/19/2019 12:00:00 AM,05/20/2019 12:00:00 AM,05/09/2019 12:00:00 AM,,2019-05-19T00:00:00.000,2019-05-20T00:00:00.000,2019-05-09T00:00:00.000,Done
2015OPA-0313,Done,OPA Director SA Review,04/07/2015 12:00:00 AM,04/13/2015 12:00:00 AM,04/02/2015 12:00:00 AM,2015-078226,2015-04-07T00:00:00.000,2015-04-13T00:00:00.000,2015-04-02T00:00:00.000,Done
2015OPA-0355,Done,OPA SA Review Lieutenant,03/19/2016 12:00:00 AM,04/07/2016 12:00:00 AM,03/14/2016 12:00:00 AM,,2016-03-19T00:00:00.000,2016-04-07T00:00:00.000,2016-03-14T00:00:00.000,Done
2016OPA-0785,Done,OPA Close CL,08/15/2016 12:00:00 AM,08/15/2016 12:00:00 AM,08/10/2016 12:00:00 AM,,2016-08-15T00:00:00.000,2016-08-15T00:00:00.000,2016-08-10T00:00:00.000,Done
2017OPA-0132,Done,OPA Close CL,02/21/2017 12:00:00 AM,02/22/2017 12:00:00 AM,02/16/2017 12:00:00 AM,,2017-02-21T00:00:00.000,2017-02-22T00:00:00.000,2017-02-16T00:00:00.000,Done
2017OPA-0450,Done,OPA Close CL,05/24/2017 12:00:00 AM,05/26/2017 12:00:00 AM,05/19/2017 12:00:00 AM,2014-222756,2017-05-24T00:00:00.000,2017-05-26T00:00:00.000,2017-05-19T00:00:00.000,Done
2018OPA-0990,Done,OPA Close CL,11/05/2018 12:00:00 AM,10/31/2018 12:00:00 AM,10/31/2018 12:00:00 AM,,2018-11-05T00:00:00.000,2018-10-31T00:00:00.000,2018-10-31T00:00:00.000,Done
2019OPA-0317,Done,OPA Close Case,02/27/2020 12:00:00 AM,02/17/2020 12:00:00 AM,02/17/2020 12:00:00 AM,2019-167905,2020-02-27T00:00:00.000,2020-02-17T00:00:00.000,2020-02-17T00:00:00.000,Done
2016OPA-0267,Done,OPA Close CL,04/19/2016 12:00:00 AM,04/19/2016 12:00:00 AM,04/14/2016 12:00:00 AM,2016-084748,2016-04-19T00:00:00.000,2016-04-19T00:00:00.000,2016-04-14T00:00:00.000,Done
2017OPA-0028,Done,OPA Close SA,,03/14/2017 12:00:00 AM,03/14/2017 12:00:00 AM,,,2017-03-14T00:00:00.000,2017-03-14T00:00:00.000,Done
2017OPA-1325,Done,OPA Close Case,06/11/2018 12:00:00 AM,08/24/2018 12:00:00 AM,06/01/2018 12:00:00 AM,2017-446027,2018-06-11T00:00:00.000,2018-08-24T00:00:00.000,2018-06-01T00:00:00.000,Done
2019OPA-0129,Done,OPA Close SA,,03/04/2019 12:00:00 AM,03/04/2019 12:00:00 AM,,,2019-03-04T00:00:00.000,2019-03-04T00:00:00.000,Done
2015OPA-0433,Done,OPA Close CL,,03/31/2015 12:00:00 AM,10/20/2015 12:00:00 AM,,,2015-03-31T00:00:00.000,2015-10-20T00:00:00.000,Done
2015OPA-0930,Done,OPA Close SA,08/17/2015 12:00:00 AM,08/13/2015 12:00:00 AM,08/12/2015 12:00:00 AM,,2015-08-17T00:00:00.000,2015-08-13T00:00:00.000,2015-08-12T00:00:00.000,Done
2016OPA-0372,Done,OPA Close Case,02/06/2017 12:00:00 AM,02/06/2017 12:00:00 AM,01/27/2017 12:00:00 AM,2016-111760,2017-02-06T00:00:00.000,2017-02-06T00:00:00.000,2017-01-27T00:00:00.000,Done
2016OPA-0763,Done,OPA Close Case,12/17/2016 12:00:00 AM,12/17/2016 12:00:00 AM,12/07/2016 12:00:00 AM,,2016-12-17T00:00:00.000,2016-12-17T00:00:00.000,2016-12-07T00:00:00.000,Done
2020OPA-0264,Done,OPA 5 Day Notice,05/04/2020 12:00:00 AM,05/05/2020 12:00:00 AM,05/05/2020 12:00:00 AM,2019-378115,2020-05-04T00:00:00.000,2020-05-05T00:00:00.000,2020-05-05T00:00:00.000,Done
2016OPA-1248,Done,OPA Close CL,10/21/2016 12:00:00 AM,11/10/2016 12:00:00 AM,10/16/2016 12:00:00 AM,,2016-10-21T00:00:00.000,2016-11-10T00:00:00.000,2016-10-16T00:00:00.000,Done
2017OPA-1253,Done,OPA Close SA,,02/21/2018 12:00:00 AM,02/21/2018 12:00:00 AM,,,2018-02-21T00:00:00.000,2018-02-21T00:00:00.000,Done
2018OPA-1163,Done,OPA Training Referral,06/13/2019 12:00:00 AM,06/17/2019 12:00:00 AM,06/03/2019 12:00:00 AM,2018-467454,2019-06-13T00:00:00.000,2019-06-17T00:00:00.000,2019-06-03T00:00:00.000,Done
2019OPA-0304,Done,OPA Close CL,06/08/2019 12:00:00 AM,06/11/2019 12:00:00 AM,06/03/2019 12:00:00 AM,,2019-06-08T00:00:00.000,2019-06-11T00:00:00.000,2019-06-03T00:00:00.000,Done
2019OPA-0638,Done,OPA Close Case,03/08/2020 12:00:00 AM,04/14/2020 12:00:00 AM,02/23/2020 12:00:00 AM,2019-312455,2020-03-08T00:00:00.000,2020-04-14T00:00:00.000,2020-02-23T00:00:00.000,Done
2015OPA-0826,Done,OPA Close Case,,12/23/2015 12:00:00 AM,12/04/2015 12:00:00 AM,2015-191974,,2015-12-23T00:00:00.000,2015-12-04T00:00:00.000,Done
2015OPA-1866,Done,OPA Close Case,06/10/2016 12:00:00 AM,06/29/2016 12:00:00 AM,05/31/2016 12:00:00 AM,,2016-06-10T00:00:00.000,2016-06-29T00:00:00.000,2016-05-31T00:00:00.000,Done
2016OPA-0284,Done,OPA Close CL,05/16/2016 12:00:00 AM,05/16/2016 12:00:00 AM,05/11/2016 12:00:00 AM,,2016-05-16T00:00:00.000,2016-05-16T00:00:00.000,2016-05-11T00:00:00.000,Done
2016OPA-0710,Done,OPA Close CL,07/05/2016 12:00:00 AM,07/07/2016 12:00:00 AM,06/30/2016 12:00:00 AM,,2016-07-05T00:00:00.000,2016-07-07T00:00:00.000,2016-06-30T00:00:00.000,Done
2017OPA-1196,Done,OPA Close Case,05/26/2018 12:00:00 AM,08/23/2018 12:00:00 AM,05/16/2018 12:00:00 AM,2017-219301,2018-05-26T00:00:00.000,2018-08-23T00:00:00.000,2018-05-16T00:00:00.000,Done
2017OPA-1327,Done,OPA Director Certification/Finding,06/11/2018 12:00:00 AM,06/11/2018 12:00:00 AM,01/30/2019 12:00:00 AM,2017-387572,2018-06-11T00:00:00.000,2018-06-11T00:00:00.000,2019-01-30T00:00:00.000,Done
2018OPA-0659,Done,OPA Close Case,01/20/2019 12:00:00 AM,01/23/2019 12:00:00 AM,01/10/2019 12:00:00 AM,2018-245400,2019-01-20T00:00:00.000,2019-01-23T00:00:00.000,2019-01-10T00:00:00.000,Done
2018OPA-1083,Done,OPA Training Referral,05/13/2019 12:00:00 AM,05/14/2019 12:00:00 AM,05/08/2019 12:00:00 AM,,2019-05-13T00:00:00.000,2019-05-14T00:00:00.000,2019-05-08T00:00:00.000,Done
2015OPA-0405,Done,OPA Close CL,,03/27/2015 12:00:00 AM,10/20/2015 12:00:00 AM,,,2015-03-27T00:00:00.000,2015-10-20T00:00:00.000,Done
2015OPA-0514,Done,OPA Director SA Review,05/17/2015 12:00:00 AM,05/20/2015 12:00:00 AM,05/12/2015 12:00:00 AM,,2015-05-17T00:00:00.000,2015-05-20T00:00:00.000,2015-05-12T00:00:00.000,Done
2018OPA-0478,Done,OPA Close SA,,08/13/2018 12:00:00 AM,08/13/2018 12:00:00 AM,,,2018-08-13T00:00:00.000,2018-08-13T00:00:00.000,Done
2018OPA-0718,Done,OPA Training Referral,02/07/2019 12:00:00 AM,08/05/2019 12:00:00 AM,02/19/2019 12:00:00 AM,2018-264823,2019-02-07T00:00:00.000,2019-08-05T00:00:00.000,2019-02-19T00:00:00.000,Done
2019OPA-0012,Done,OPA Close CL,01/30/2019 12:00:00 AM,02/01/2019 12:00:00 AM,01/25/2019 12:00:00 AM,,2019-01-30T00:00:00.000,2019-02-01T00:00:00.000,2019-01-25T00:00:00.000,Done
2019OPA-0502,Done,OPA Close CL,08/20/2019 12:00:00 AM,08/21/2019 12:00:00 AM,08/15/2019 12:00:00 AM,,2019-08-20T00:00:00.000,2019-08-21T00:00:00.000,2019-08-15T00:00:00.000,Done
2019OPA-0841,Done,OPA Close SA,,01/30/2020 12:00:00 AM,01/30/2020 12:00:00 AM,2019-415832,,2020-01-30T00:00:00.000,2020-01-30T00:00:00.000,Done
2015OPA-0910,Done,OPA Close SA,08/17/2015 12:00:00 AM,08/13/2015 12:00:00 AM,08/12/2015 12:00:00 AM,,2015-08-17T00:00:00.000,2015-08-13T00:00:00.000,2015-08-12T00:00:00.000,Done
2015OPA-1905,Done,OPA Close SA,02/23/2016 12:00:00 AM,02/18/2016 12:00:00 AM,02/18/2016 12:00:00 AM,2015-439142,2016-02-23T00:00:00.000,2016-02-18T00:00:00.000,2016-02-18T00:00:00.000,Done
2016OPA-0338,Done,OPA Close CL,04/05/2016 12:00:00 AM,03/31/2016 12:00:00 AM,03/30/2016 12:00:00 AM,,2016-04-05T00:00:00.000,2016-03-31T00:00:00.000,2016-03-30T00:00:00.000,Done
2017OPA-0215,Done,OPA Training Referral,09/15/2017 12:00:00 AM,09/27/2017 12:00:00 AM,09/05/2017 12:00:00 AM,2017-071945,2017-09-15T00:00:00.000,2017-09-27T00:00:00.000,2017-09-05T00:00:00.000,Done
2017OPA-0938,Done,OPA Close Case,01/10/2018 12:00:00 AM,09/26/2018 12:00:00 AM,09/18/2018 12:00:00 AM,2017-297672,2018-01-10T00:00:00.000,2018-09-26T00:00:00.000,2018-09-18T00:00:00.000,Done
2018OPA-0312,Done,OPA Final Discipline Action Report,,09/25/2018 12:00:00 AM,01/22/2019 12:00:00 AM,2018-103685,,2018-09-25T00:00:00.000,2019-01-22T00:00:00.000,Done
2015OPA-0567,Done,OPA Close CL,,05/11/2015 12:00:00 AM,10/20/2015 12:00:00 AM,2014-425387,,2015-05-11T00:00:00.000,2015-10-20T00:00:00.000,Done
2015OPA-0861,Done,OPA SA Review Lieutenant,08/03/2015 12:00:00 AM,07/29/2015 12:00:00 AM,07/29/2015 12:00:00 AM,,2015-08-03T00:00:00.000,2015-07-29T00:00:00.000,2015-07-29T00:00:00.000,Done
2016OPA-0190,Done,OPA Close SA,04/12/2016 12:00:00 AM,04/04/2016 12:00:00 AM,03/28/2016 12:00:00 AM,,2016-04-12T00:00:00.000,2016-04-04T00:00:00.000,2016-03-28T00:00:00.000,Done
2017OPA-0992,Done,OPA Close CL,10/22/2017 12:00:00 AM,10/23/2017 12:00:00 AM,10/17/2017 12:00:00 AM,,2017-10-22T00:00:00.000,2017-10-23T00:00:00.000,2017-10-17T00:00:00.000,Done
2018OPA-0256,Done,OPA Close Case,09/21/2018 12:00:00 AM,10/16/2018 12:00:00 AM,09/11/2018 12:00:00 AM,2017-289855,2018-09-21T00:00:00.000,2018-10-16T00:00:00.000,2018-09-11T00:00:00.000,Done
2018OPA-1085,Done,OPA Close SA,,01/31/2019 12:00:00 AM,01/31/2019 12:00:00 AM,,,2019-01-31T00:00:00.000,2019-01-31T00:00:00.000,Done
2015OPA-0049,Done,OPA Close CL,,01/26/2015 12:00:00 AM,10/23/2015 12:00:00 AM,,,2015-01-26T00:00:00.000,2015-10-23T00:00:00.000,Done
2015OPA-1048,Done,OPA Close Case,12/09/2015 12:00:00 AM,12/09/2015 12:00:00 AM,12/01/2015 12:00:00 AM,2015-142748,2015-12-09T00:00:00.000,2015-12-09T00:00:00.000,2015-12-01T00:00:00.000,Done
2015OPA-1158,Done,OPA Close CL,,08/27/2015 12:00:00 AM,10/15/2015 12:00:00 AM,,,2015-08-27T00:00:00.000,2015-10-15T00:00:00.000,Done
2015OPA-1358,Done,OPA Close SA,02/07/2016 12:00:00 AM,02/02/2016 12:00:00 AM,02/02/2016 12:00:00 AM,,2016-02-07T00:00:00.000,2016-02-02T00:00:00.000,2016-02-02T00:00:00.000,Done
2019OPA-0573,Done,OPA Close CL,09/01/2019 12:00:00 AM,09/06/2019 12:00:00 AM,08/27/2019 12:00:00 AM,2019-290928,2019-09-01T00:00:00.000,2019-09-06T00:00:00.000,2019-08-27T00:00:00.000,Done
2020OPA-0030,Done,OPA Close SA,,04/07/2020 12:00:00 AM,04/07/2020 12:00:00 AM,2019-067469,,2020-04-07T00:00:00.000,2020-04-07T00:00:00.000,Done
2020OPA-0108,Done,OPA Close CL,03/11/2020 12:00:00 AM,03/11/2020 12:00:00 AM,03/03/2020 12:00:00 AM,,2020-03-11T00:00:00.000,2020-03-11T00:00:00.000,2020-03-03T00:00:00.000,Done
2015OPA-1777,Done,OPA Close CL,11/28/2015 12:00:00 AM,11/30/2015 12:00:00 AM,11/23/2015 12:00:00 AM,,2015-11-28T00:00:00.000,2015-11-30T00:00:00.000,2015-11-23T00:00:00.000,Done
2017OPA-0883,Done,OPA Close Case,02/14/2018 12:00:00 AM,06/01/2018 12:00:00 AM,02/14/2018 12:00:00 AM,2017-317547,2018-02-14T00:00:00.000,2018-06-01T00:00:00.000,2018-02-14T00:00:00.000,Done
2017OPA-0998,Done,OPA Close Case,06/18/2018 12:00:00 AM,09/26/2018 12:00:00 AM,09/17/2018 12:00:00 AM,,2018-06-18T00:00:00.000,2018-09-26T00:00:00.000,2018-09-17T00:00:00.000,Done
2018OPA-0122,Done,OPA Close CL,03/05/2018 12:00:00 AM,03/01/2018 12:00:00 AM,02/05/2018 12:00:00 AM,,2018-03-05T00:00:00.000,2018-03-01T00:00:00.000,2018-02-05T00:00:00.000,Done
2018OPA-1097,Done,OPA Close CL,12/03/2018 12:00:00 AM,11/28/2018 12:00:00 AM,11/28/2018 12:00:00 AM,2018-379151,2018-12-03T00:00:00.000,2018-11-28T00:00:00.000,2018-11-28T00:00:00.000,Done
2015OPA-0582,Done,OPA Close CL,,05/11/2015 12:00:00 AM,10/20/2015 12:00:00 AM,,,2015-05-11T00:00:00.000,2015-10-20T00:00:00.000,Done
2017OPA-1311,Done,OPA Close Case,01/26/2018 12:00:00 AM,01/17/2018 12:00:00 AM,01/16/2018 12:00:00 AM,,2018-01-26T00:00:00.000,2018-01-17T00:00:00.000,2018-01-16T00:00:00.000,Done
2019OPA-0287,Done,OPA Close SA,,05/30/2019 12:00:00 AM,05/30/2019 12:00:00 AM,2019-151802,,2019-05-30T00:00:00.000,2019-05-30T00:00:00.000,Done
2019OPA-0680,Done,OPA Close Case,,02/04/2020 12:00:00 AM,01/30/2020 12:00:00 AM,2019-061327,,2020-02-04T00:00:00.000,2020-01-30T00:00:00.000,Done
2015OPA-1412,Done,OPA Close CL,,10/06/2015 12:00:00 AM,10/13/2015 12:00:00 AM,,,2015-10-06T00:00:00.000,2015-10-13T00:00:00.000,Done
2015OPA-1665,Done,OPA Close Case,05/05/2016 12:00:00 AM,05/05/2016 12:00:00 AM,04/26/2016 12:00:00 AM,,2016-05-05T00:00:00.000,2016-05-05T00:00:00.000,2016-04-26T00:00:00.000,Done
2015OPA-1878,Done,OPA Close Case,09/25/2016 12:00:00 AM,09/22/2016 12:00:00 AM,09/01/2016 12:00:00 AM,,2016-09-25T00:00:00.000,2016-09-22T00:00:00.000,2016-09-01T00:00:00.000,Done
2017OPA-0964,Done,OPA Close CL,10/16/2017 12:00:00 AM,10/13/2017 12:00:00 AM,09/18/2017 12:00:00 AM,,2017-10-16T00:00:00.000,2017-10-13T00:00:00.000,2017-09-18T00:00:00.000,Done
2019OPA-0147,Done,OPA Close Case,09/20/2019 12:00:00 AM,09/17/2019 12:00:00 AM,09/10/2019 12:00:00 AM,2019-068071,2019-09-20T00:00:00.000,2019-09-17T00:00:00.000,2019-09-10T00:00:00.000,Done
2019OPA-0758,Done,OPA 180 Extension Request,05/14/2020 12:00:00 AM,06/13/2020 12:00:00 AM,04/02/2020 12:00:00 AM,2019-254981,2020-05-14T00:00:00.000,2020-06-13T00:00:00.000,2020-04-02T00:00:00.000,Done
2019OPA-0776,Done,OPA Close SA,,12/24/2019 12:00:00 AM,12/24/2019 12:00:00 AM,,,2019-12-24T00:00:00.000,2019-12-24T00:00:00.000,Done
2015OPA-1482,Done,OPA Close SA,11/21/2015 12:00:00 AM,11/20/2015 12:00:00 AM,11/16/2015 12:00:00 AM,,2015-11-21T00:00:00.000,2015-11-20T00:00:00.000,2015-11-16T00:00:00.000,Done
2015OPA-1705,Done,OPA Close CL,02/03/2016 12:00:00 AM,01/28/2016 12:00:00 AM,01/25/2016 12:00:00 AM,,2016-02-03T00:00:00.000,2016-01-28T00:00:00.000,2016-01-25T00:00:00.000,Done
2018OPA-1036,Done,OPA Close CL,12/01/2018 12:00:00 AM,12/04/2018 12:00:00 AM,11/26/2018 12:00:00 AM,,2018-12-01T00:00:00.000,2018-12-04T00:00:00.000,2018-11-26T00:00:00.000,Done
2019OPA-0135,Done,OPA Close Case,09/09/2019 12:00:00 AM,09/11/2019 12:00:00 AM,08/30/2019 12:00:00 AM,,2019-09-09T00:00:00.000,2019-09-11T00:00:00.000,2019-08-30T00:00:00.000,Done
2015OPA-0066,Done,OPA Director SA Review,03/07/2015 12:00:00 AM,03/11/2015 12:00:00 AM,03/02/2015 12:00:00 AM,2014-252059,2015-03-07T00:00:00.000,2015-03-11T00:00:00.000,2015-03-02T00:00:00.000,Done
2015OPA-0126,Done,OPA Close Case,08/10/2015 12:00:00 AM,08/10/2015 12:00:00 AM,07/29/2015 12:00:00 AM,2014-222942,2015-08-10T00:00:00.000,2015-08-10T00:00:00.000,2015-07-29T00:00:00.000,Done
2015OPA-0225,Done,OPA Close CL,,03/05/2015 12:00:00 AM,10/22/2015 12:00:00 AM,2014-159965,,2015-03-05T00:00:00.000,2015-10-22T00:00:00.000,Done
2015OPA-0290,Done,OPA Close CL,,03/23/2015 12:00:00 AM,10/21/2015 12:00:00 AM,,,2015-03-23T00:00:00.000,2015-10-21T00:00:00.000,Done
2015OPA-1767,Done,OPA Close SA,01/16/2016 12:00:00 AM,01/12/2016 12:00:00 AM,01/11/2016 12:00:00 AM,,2016-01-16T00:00:00.000,2016-01-12T00:00:00.000,2016-01-11T00:00:00.000,Done
2016OPA-0395,Done,OPA Close Case,10/20/2016 12:00:00 AM,10/21/2016 12:00:00 AM,10/17/2016 12:00:00 AM,2016-018096,2016-10-20T00:00:00.000,2016-10-21T00:00:00.000,2016-10-17T00:00:00.000,Done
2016OPA-1074,Done,OPA Close CL,10/06/2016 12:00:00 AM,10/07/2016 12:00:00 AM,10/01/2016 12:00:00 AM,,2016-10-06T00:00:00.000,2016-10-07T00:00:00.000,2016-10-01T00:00:00.000,Done
2017OPA-0368,Done,OPA Close SA,,05/22/2017 12:00:00 AM,05/22/2017 12:00:00 AM,,,2017-05-22T00:00:00.000,2017-05-22T00:00:00.000,Done
2018OPA-0239,Done,OPA Training Referral,,11/06/2018 12:00:00 AM,03/07/2019 12:00:00 AM,2018-002256,,2018-11-06T00:00:00.000,2019-03-07T00:00:00.000,Done
2018OPA-0502,Done,OPA Close Case,05/06/2019 12:00:00 AM,01/08/2019 12:00:00 AM,04/26/2019 12:00:00 AM,,2019-05-06T00:00:00.000,2019-01-08T00:00:00.000,2019-04-26T00:00:00.000,Done
2015OPA-0114,Done,OPA Close SA,03/23/2016 12:00:00 AM,03/18/2016 12:00:00 AM,03/18/2016 12:00:00 AM,2014-410666,2016-03-23T00:00:00.000,2016-03-18T00:00:00.000,2016-03-18T00:00:00.000,Done
2017OPA-0043,Done,OPA Close CL,02/12/2017 12:00:00 AM,02/08/2017 12:00:00 AM,01/17/2017 12:00:00 AM,,2017-02-12T00:00:00.000,2017-02-08T00:00:00.000,2017-01-17T00:00:00.000,Done
2018OPA-0069,Done,OPA Close Case,10/20/2018 12:00:00 AM,10/23/2018 12:00:00 AM,10/10/2018 12:00:00 AM,2016-098059,2018-10-20T00:00:00.000,2018-10-23T00:00:00.000,2018-10-10T00:00:00.000,Done
2019OPA-0768,Done,OPA Close SA,,03/19/2020 12:00:00 AM,03/19/2020 12:00:00 AM,,,2020-03-19T00:00:00.000,2020-03-19T00:00:00.000,Done
2019OPA-0907,Done,OPA Close SA,,03/03/2020 12:00:00 AM,03/03/2020 12:00:00 AM,2019-466062,,2020-03-03T00:00:00.000,2020-03-03T00:00:00.000,Done
2015OPA-0555,Done,OPA Director SA Review,05/20/2015 12:00:00 AM,06/17/2015 12:00:00 AM,05/15/2015 12:00:00 AM,,2015-05-20T00:00:00.000,2015-06-17T00:00:00.000,2015-05-15T00:00:00.000,Done
2015OPA-0601,Done,OPA Close Case,10/30/2015 12:00:00 AM,10/30/2015 12:00:00 AM,10/27/2015 12:00:00 AM,2015-139918,2015-10-30T00:00:00.000,2015-10-30T00:00:00.000,2015-10-27T00:00:00.000,Done
2016OPA-0574,Done,OPA Close Case,11/21/2016 12:00:00 AM,11/21/2016 12:00:00 AM,11/15/2016 12:00:00 AM,2016-185319,2016-11-21T00:00:00.000,2016-11-21T00:00:00.000,2016-11-15T00:00:00.000,Done
2017OPA-0352,Done,OPA Close CL,05/13/2017 12:00:00 AM,05/15/2017 12:00:00 AM,04/07/2017 12:00:00 AM,,2017-05-13T00:00:00.000,2017-05-15T00:00:00.000,2017-04-07T00:00:00.000,Done
2017OPA-0943,Done,OPA Missed 180 Day Deadline,02/10/2018 12:00:00 AM,02/16/2018 12:00:00 AM,02/26/2019 12:00:00 AM,,2018-02-10T00:00:00.000,2018-02-16T00:00:00.000,2019-02-26T00:00:00.000,Done
2019OPA-0051,Done,OPA Close CL,02/17/2019 12:00:00 AM,02/22/2019 12:00:00 AM,02/12/2019 12:00:00 AM,,2019-02-17T00:00:00.000,2019-02-22T00:00:00.000,2019-02-12T00:00:00.000,Done
2019OPA-0248,Done,OPA Close SA,,06/20/2019 12:00:00 AM,06/20/2019 12:00:00 AM,,,2019-06-20T00:00:00.000,2019-06-20T00:00:00.000,Done
2015OPA-0325,Done,OPA Director SA Review,05/06/2015 12:00:00 AM,05/20/2015 12:00:00 AM,05/01/2015 12:00:00 AM,,2015-05-06T00:00:00.000,2015-05-20T00:00:00.000,2015-05-01T00:00:00.000,Done
2015OPA-0717,Done,OPA Close CL,,09/25/2015 12:00:00 AM,10/14/2015 12:00:00 AM,,,2015-09-25T00:00:00.000,2015-10-14T00:00:00.000,Done
2016OPA-0450,Done,OPA Close CL,05/04/2016 12:00:00 AM,05/04/2016 12:00:00 AM,05/04/2016 12:00:00 AM,,2016-05-04T00:00:00.000,2016-05-04T00:00:00.000,2016-05-04T00:00:00.000,Done
2016OPA-0772,Done,OPA Close CL,08/08/2016 12:00:00 AM,08/08/2016 12:00:00 AM,08/03/2016 12:00:00 AM,,2016-08-08T00:00:00.000,2016-08-08T00:00:00.000,2016-08-03T00:00:00.000,Done
2016OPA-1175,Done,OPA Close CL,10/26/2016 12:00:00 AM,10/25/2016 12:00:00 AM,10/21/2016 12:00:00 AM,,2016-10-26T00:00:00.000,2016-10-25T00:00:00.000,2016-10-21T00:00:00.000,Done
2017OPA-0463,Done,OPA Close Case,11/01/2017 12:00:00 AM,11/07/2017 12:00:00 AM,10/31/2017 12:00:00 AM,2017-155291,2017-11-01T00:00:00.000,2017-11-07T00:00:00.000,2017-10-31T00:00:00.000,Done
2017OPA-0768,Done,OPA Close Case,03/18/2020 12:00:00 AM,04/15/2020 12:00:00 AM,03/04/2020 12:00:00 AM,2017-208215,2020-03-18T00:00:00.000,2020-04-15T00:00:00.000,2020-03-04T00:00:00.000,Done
2017OPA-1296,Done,OPA Close Case,07/08/2018 12:00:00 AM,09/25/2018 12:00:00 AM,06/28/2018 12:00:00 AM,2017-467245,2018-07-08T00:00:00.000,2018-09-25T00:00:00.000,2018-06-28T00:00:00.000,Done
2018OPA-0235,Done,OPA Close Case,03/31/2019 12:00:00 AM,03/22/2019 12:00:00 AM,03/21/2019 12:00:00 AM,2018-085885,2019-03-31T00:00:00.000,2019-03-22T00:00:00.000,2019-03-21T00:00:00.000,Done
2018OPA-0715,Done,OPA Close SA,,09/20/2018 12:00:00 AM,09/20/2018 12:00:00 AM,2018-278442,,2018-09-20T00:00:00.000,2018-09-20T00:00:00.000,Done
2015OPA-0279,Done,OPA Close CL,,03/23/2015 12:00:00 AM,10/21/2015 12:00:00 AM,,,2015-03-23T00:00:00.000,2015-10-21T00:00:00.000,Done
2015OPA-0867,Done,OPA Close CL,,06/26/2015 12:00:00 AM,10/19/2015 12:00:00 AM,,,2015-06-26T00:00:00.000,2015-10-19T00:00:00.000,Done
2019OPA-0823,Done,OPA Close SA,,01/13/2020 12:00:00 AM,01/13/2020 12:00:00 AM,,,2020-01-13T00:00:00.000,2020-01-13T00:00:00.000,Done
2015OPA-1418,Done,OPA Close SA,11/14/2015 12:00:00 AM,11/10/2015 12:00:00 AM,11/09/2015 12:00:00 AM,2015-324979,2015-11-14T00:00:00.000,2015-11-10T00:00:00.000,2015-11-09T00:00:00.000,Done
2016OPA-1357,Done,OPA Classification,12/15/2016 12:00:00 AM,12/01/2016 12:00:00 AM,11/16/2016 12:00:00 AM,,2016-12-15T00:00:00.000,2016-12-01T00:00:00.000,2016-11-16T00:00:00.000,Done
2017OPA-1153,Done,OPA Close SA,,01/16/2018 12:00:00 AM,01/16/2018 12:00:00 AM,2017-410405,,2018-01-16T00:00:00.000,2018-01-16T00:00:00.000,Done
2018OPA-0193,Done,OPA Close CL,03/18/2018 12:00:00 AM,04/06/2018 12:00:00 AM,03/13/2018 12:00:00 AM,,2018-03-18T00:00:00.000,2018-04-06T00:00:00.000,2018-03-13T00:00:00.000,Done
2018OPA-0625,Done,OPA Training Referral,12/28/2018 12:00:00 AM,01/25/2019 12:00:00 AM,12/18/2018 12:00:00 AM,,2018-12-28T00:00:00.000,2019-01-25T00:00:00.000,2018-12-18T00:00:00.000,Done
2018OPA-1050,Done,OPA Close Case,03/31/2019 12:00:00 AM,04/01/2019 12:00:00 AM,03/21/2019 12:00:00 AM,2018-398484,2019-03-31T00:00:00.000,2019-04-01T00:00:00.000,2019-03-21T00:00:00.000,Done
2015OPA-0288,Done,OPA Monitor SA,04/26/2015 12:00:00 AM,05/20/2015 12:00:00 AM,03/27/2015 12:00:00 AM,2014-014632,2015-04-26T00:00:00.000,2015-05-20T00:00:00.000,2015-03-27T00:00:00.000,Done
2015OPA-0542,Done,OPA Close Case,10/29/2015 12:00:00 AM,10/29/2015 12:00:00 AM,10/15/2015 12:00:00 AM,2015-118243,2015-10-29T00:00:00.000,2015-10-29T00:00:00.000,2015-10-15T00:00:00.000,Done
2015OPA-1055,Done,OPA Close SA,12/15/2015 12:00:00 AM,12/11/2015 12:00:00 AM,12/10/2015 12:00:00 AM,,2015-12-15T00:00:00.000,2015-12-11T00:00:00.000,2015-12-10T00:00:00.000,Done
2015OPA-1409,Done,OPA Close CL,,10/01/2015 12:00:00 AM,10/13/2015 12:00:00 AM,,,2015-10-01T00:00:00.000,2015-10-13T00:00:00.000,Done
2019OPA-0540,Done,OPA Close Case,01/29/2020 12:00:00 AM,03/25/2020 12:00:00 AM,01/15/2020 12:00:00 AM,2019-282953,2020-01-29T00:00:00.000,2020-03-25T00:00:00.000,2020-01-15T00:00:00.000,Done
2020OPA-0113,Done,OPA 180 Extension Request,08/17/2020 12:00:00 AM,09/16/2020 12:00:00 AM,04/04/2020 12:00:00 AM,2020-62693,2020-08-17T00:00:00.000,2020-09-16T00:00:00.000,2020-04-04T00:00:00.000,Done
2016OPA-1344,Done,OPA Close CL,12/05/2016 12:00:00 AM,12/07/2016 12:00:00 AM,11/30/2016 12:00:00 AM,,2016-12-05T00:00:00.000,2016-12-07T00:00:00.000,2016-11-30T00:00:00.000,Done
2018OPA-0689,Done,OPA Close CL,08/26/2018 12:00:00 AM,08/21/2018 12:00:00 AM,08/21/2018 12:00:00 AM,,2018-08-26T00:00:00.000,2018-08-21T00:00:00.000,2018-08-21T00:00:00.000,Done
2019OPA-0241,Done,OPA Close CL,05/16/2019 12:00:00 AM,05/16/2019 12:00:00 AM,05/16/2019 12:00:00 AM,,2019-05-16T00:00:00.000,2019-05-16T00:00:00.000,2019-05-16T00:00:00.000,Done
2019OPA-0387,Done,OPA Close CL,07/08/2019 12:00:00 AM,07/09/2019 12:00:00 AM,07/03/2019 12:00:00 AM,,2019-07-08T00:00:00.000,2019-07-09T00:00:00.000,2019-07-03T00:00:00.000,Done
2015OPA-0296,Done,OPA Close CL,,03/23/2015 12:00:00 AM,10/21/2015 12:00:00 AM,,,2015-03-23T00:00:00.000,2015-10-21T00:00:00.000,Done
2015OPA-0848,Done,OPA Close Case,12/09/2015 12:00:00 AM,12/14/2015 12:00:00 AM,11/25/2015 12:00:00 AM,,2015-12-09T00:00:00.000,2015-12-14T00:00:00.000,2015-11-25T00:00:00.000,Done
2015OPA-1780,Done,OPA Close CL,11/28/2015 12:00:00 AM,11/30/2015 12:00:00 AM,11/23/2015 12:00:00 AM,,2015-11-28T00:00:00.000,2015-11-30T00:00:00.000,2015-11-23T00:00:00.000,Done
2016OPA-1039,Done,OPA Close Case,07/01/2017 12:00:00 AM,07/18/2017 12:00:00 AM,06/21/2017 12:00:00 AM,,2017-07-01T00:00:00.000,2017-07-18T00:00:00.000,2017-06-21T00:00:00.000,Done
2018OPA-0150,Done,OPA Close CL,03/14/2018 12:00:00 AM,03/13/2018 12:00:00 AM,02/13/2018 12:00:00 AM,,2018-03-14T00:00:00.000,2018-03-13T00:00:00.000,2018-02-13T00:00:00.000,Done
2018OPA-0220,Done,OPA Close Case,09/17/2018 12:00:00 AM,10/16/2018 12:00:00 AM,10/16/2018 12:00:00 AM,,2018-09-17T00:00:00.000,2018-10-16T00:00:00.000,2018-10-16T00:00:00.000,Done
2018OPA-0451,Done,OPA Close CL,06/03/2018 12:00:00 AM,05/31/2018 12:00:00 AM,05/29/2018 12:00:00 AM,2018-142411,2018-06-03T00:00:00.000,2018-05-31T00:00:00.000,2018-05-29T00:00:00.000,Done
2019OPA-0235,Done,OPA Close CL,08/20/2019 12:00:00 AM,09/12/2019 12:00:00 AM,08/15/2019 12:00:00 AM,,2019-08-20T00:00:00.000,2019-09-12T00:00:00.000,2019-08-15T00:00:00.000,Done
2015OPA-1589,Done,OPA Close SA,02/27/2016 12:00:00 AM,02/23/2016 12:00:00 AM,02/22/2016 12:00:00 AM,2015-371018,2016-02-27T00:00:00.000,2016-02-23T00:00:00.000,2016-02-22T00:00:00.000,Done
2016OPA-0396,Done,OPA Close Case,10/24/2016 12:00:00 AM,10/24/2016 12:00:00 AM,10/11/2016 12:00:00 AM,2016-020154,2016-10-24T00:00:00.000,2016-10-24T00:00:00.000,2016-10-11T00:00:00.000,Done
2016OPA-1056,Done,OPA Close SA,,10/04/2016 12:00:00 AM,10/04/2016 12:00:00 AM,,,2016-10-04T00:00:00.000,2016-10-04T00:00:00.000,Done
2017OPA-0986,Done,OPA Close CL,10/22/2017 12:00:00 AM,10/23/2017 12:00:00 AM,09/22/2017 12:00:00 AM,,2017-10-22T00:00:00.000,2017-10-23T00:00:00.000,2017-09-22T00:00:00.000,Done
2015OPA-1574,Done,OPA Close CL,,11/02/2015 12:00:00 AM,11/02/2015 12:00:00 AM,,,2015-11-02T00:00:00.000,2015-11-02T00:00:00.000,Done
2015OPA-1675,Done,OPA Close Case,04/07/2016 12:00:00 AM,04/07/2016 12:00:00 AM,03/16/2016 12:00:00 AM,,2016-04-07T00:00:00.000,2016-04-07T00:00:00.000,2016-03-16T00:00:00.000,Done
2016OPA-0746,Done,OPA Close Case,01/28/2017 12:00:00 AM,01/28/2017 12:00:00 AM,01/18/2017 12:00:00 AM,2013-262559,2017-01-28T00:00:00.000,2017-01-28T00:00:00.000,2017-01-18T00:00:00.000,Done
2017OPA-0848,Done,OPA Close Case,02/22/2018 12:00:00 AM,06/15/2018 12:00:00 AM,05/29/2018 12:00:00 AM,2017-305098,2018-02-22T00:00:00.000,2018-06-15T00:00:00.000,2018-05-29T00:00:00.000,Done
2019OPA-0931,Done,OPA Close CL,01/31/2020 12:00:00 AM,01/28/2020 12:00:00 AM,01/21/2020 12:00:00 AM,,2020-01-31T00:00:00.000,2020-01-28T00:00:00.000,2020-01-21T00:00:00.000,Done
2017OPA-1003,Done,OPA Captain Investigation Review,07/07/2019 12:00:00 AM,07/07/2019 12:00:00 AM,07/07/2019 12:00:00 AM,2017-154790,2019-07-07T00:00:00.000,2019-07-07T00:00:00.000,2019-07-07T00:00:00.000,Done
2018OPA-0653,Done,OPA Close Case,01/25/2019 12:00:00 AM,02/13/2019 12:00:00 AM,01/15/2019 12:00:00 AM,2018-259175,2019-01-25T00:00:00.000,2019-02-13T00:00:00.000,2019-01-15T00:00:00.000,Done
2019OPA-0332,Done,OPA Close SA,,07/16/2019 12:00:00 AM,07/16/2019 12:00:00 AM,2019-175886,,2019-07-16T00:00:00.000,2019-07-16T00:00:00.000,Done
2019OPA-0755,Done,OPA OIG Certification,12/21/2019 12:00:00 AM,12/12/2019 12:00:00 AM,12/11/2019 12:00:00 AM,2019-237453,2019-12-21T00:00:00.000,2019-12-12T00:00:00.000,2019-12-11T00:00:00.000,Done
2019OPA-0820,Done,OPA Close Case,02/08/2020 12:00:00 AM,01/30/2020 12:00:00 AM,01/29/2020 12:00:00 AM,2019-397458,2020-02-08T00:00:00.000,2020-01-30T00:00:00.000,2020-01-29T00:00:00.000,Done
2015OPA-1088,Done,OPA Close CL,,09/03/2015 12:00:00 AM,10/15/2015 12:00:00 AM,2015-218467,,2015-09-03T00:00:00.000,2015-10-15T00:00:00.000,Done
2015OPA-1434,Done,OPA Close CL,,10/06/2015 12:00:00 AM,10/13/2015 12:00:00 AM,,,2015-10-06T00:00:00.000,2015-10-13T00:00:00.000,Done
2015OPA-1582,Done,OPA Training Referral,,04/26/2016 12:00:00 AM,04/27/2016 12:00:00 AM,2015-373522,,2016-04-26T00:00:00.000,2016-04-27T00:00:00.000,Done
2015OPA-1725,Done,OPA Close CL,11/30/2015 12:00:00 AM,11/30/2015 12:00:00 AM,11/25/2015 12:00:00 AM,,2015-11-30T00:00:00.000,2015-11-30T00:00:00.000,2015-11-25T00:00:00.000,Done
2015OPA-1901,Done,OPA Close SA,02/29/2016 12:00:00 AM,02/26/2016 12:00:00 AM,02/24/2016 12:00:00 AM,2014-383554,2016-02-29T00:00:00.000,2016-02-26T00:00:00.000,2016-02-24T00:00:00.000,Done
2019OPA-0774,Done,OPA Close Case,02/17/2020 12:00:00 AM,02/27/2020 12:00:00 AM,02/03/2020 12:00:00 AM,2019-390658,2020-02-17T00:00:00.000,2020-02-27T00:00:00.000,2020-02-03T00:00:00.000,Done
2020OPA-0175,Done,OPA Close CL,03/31/2020 12:00:00 AM,03/31/2020 12:00:00 AM,03/24/2020 12:00:00 AM,2020-094213,2020-03-31T00:00:00.000,2020-03-31T00:00:00.000,2020-03-24T00:00:00.000,Done
2016OPA-0547,Done,OPA Close CL,07/16/2016 12:00:00 AM,07/13/2016 12:00:00 AM,07/11/2016 12:00:00 AM,,2016-07-16T00:00:00.000,2016-07-13T00:00:00.000,2016-07-11T00:00:00.000,Done
2016OPA-0738,Done,OPA Send Complainant Closing Letter,08/06/2016 12:00:00 AM,08/05/2016 12:00:00 AM,08/01/2016 12:00:00 AM,,2016-08-06T00:00:00.000,2016-08-05T00:00:00.000,2016-08-01T00:00:00.000,Done
2017OPA-0296,Done,OPA Close SA,,05/15/2017 12:00:00 AM,05/15/2017 12:00:00 AM,2017-037593,,2017-05-15T00:00:00.000,2017-05-15T00:00:00.000,Done
2019OPA-0724,Done,OPA Close CL,11/04/2019 12:00:00 AM,11/01/2019 12:00:00 AM,10/28/2019 12:00:00 AM,,2019-11-04T00:00:00.000,2019-11-01T00:00:00.000,2019-10-28T00:00:00.000,Done
2015OPA-0441,Done,OPA Close Case,,09/11/2015 12:00:00 AM,08/31/2015 12:00:00 AM,,,2015-09-11T00:00:00.000,2015-08-31T00:00:00.000,Done
2015OPA-0666,Done,OPA Close CL,,06/15/2015 12:00:00 AM,10/19/2015 12:00:00 AM,,,2015-06-15T00:00:00.000,2015-10-19T00:00:00.000,Done
2015OPA-1098,Done,OPA Close CL,,08/27/2015 12:00:00 AM,10/15/2015 12:00:00 AM,,,2015-08-27T00:00:00.000,2015-10-15T00:00:00.000,Done
2015OPA-1328,Done,OPA Close SA,11/07/2015 12:00:00 AM,11/02/2015 12:00:00 AM,11/02/2015 12:00:00 AM,,2015-11-07T00:00:00.000,2015-11-02T00:00:00.000,2015-11-02T00:00:00.000,Done
2015OPA-1424,Done,OPA Close SA,10/13/2015 12:00:00 AM,10/09/2015 12:00:00 AM,10/08/2015 12:00:00 AM,2015-256265,2015-10-13T00:00:00.000,2015-10-09T00:00:00.000,2015-10-08T00:00:00.000,Done
2015OPA-1610,Done,OPA Training Referral,04/14/2016 12:00:00 AM,04/05/2016 12:00:00 AM,03/17/2016 12:00:00 AM,2015-374958,2016-04-14T00:00:00.000,2016-04-05T00:00:00.000,2016-03-17T00:00:00.000,Done
2019OPA-0809,Done,OPA Close SA,,01/17/2020 12:00:00 AM,01/17/2020 12:00:00 AM,,,2020-01-17T00:00:00.000,2020-01-17T00:00:00.000,Done
2017OPA-0861,Done,OPA Close CL,09/18/2017 12:00:00 AM,09/18/2017 12:00:00 AM,09/13/2017 12:00:00 AM,,2017-09-18T00:00:00.000,2017-09-18T00:00:00.000,2017-09-13T00:00:00.000,Done
2017OPA-1014,Done,OPA Director Certification/Finding,03/28/2018 12:00:00 AM,01/09/2018 12:00:00 AM,02/27/2019 12:00:00 AM,2017-326742,2018-03-28T00:00:00.000,2018-01-09T00:00:00.000,2019-02-27T00:00:00.000,Done
2018OPA-0116,Done,OPA Training Referral,,07/03/2018 12:00:00 AM,03/06/2019 12:00:00 AM,2017-470636,,2018-07-03T00:00:00.000,2019-03-06T00:00:00.000,Done
2018OPA-0654,Done,OPA Close CL,08/20/2018 12:00:00 AM,08/21/2018 12:00:00 AM,08/15/2018 12:00:00 AM,,2018-08-20T00:00:00.000,2018-08-21T00:00:00.000,2018-08-15T00:00:00.000,Done
2019OPA-0196,Done,OPA Close SA,,05/29/2019 12:00:00 AM,05/29/2019 12:00:00 AM,2019-085412,,2019-05-29T00:00:00.000,2019-05-29T00:00:00.000,Done
2019OPA-0739,Done,OPA OIG Certification,02/23/2020 12:00:00 AM,02/18/2020 12:00:00 AM,02/13/2020 12:00:00 AM,,2020-02-23T00:00:00.000,2020-02-18T00:00:00.000,2020-02-13T00:00:00.000,Done
2015OPA-0880,Done,OPA Close CL,,06/26/2015 12:00:00 AM,10/19/2015 12:00:00 AM,,,2015-06-26T00:00:00.000,2015-10-19T00:00:00.000,Done
2015OPA-1926,Done,OPA Referal to EEO,01/30/2016 12:00:00 AM,01/26/2016 12:00:00 AM,01/25/2016 12:00:00 AM,,2016-01-30T00:00:00.000,2016-01-26T00:00:00.000,2016-01-25T00:00:00.000,Done
2016OPA-0113,Done,OPA Close CL,02/09/2016 12:00:00 AM,02/05/2016 12:00:00 AM,02/04/2016 12:00:00 AM,,2016-02-09T00:00:00.000,2016-02-05T00:00:00.000,2016-02-04T00:00:00.000,Done
2018OPA-0018,Done,OPA Close SA,,07/10/2018 12:00:00 AM,07/10/2018 12:00:00 AM,2018-002985,,2018-07-10T00:00:00.000,2018-07-10T00:00:00.000,Done
2018OPA-0153,Done,OPA Close Case,08/23/2018 12:00:00 AM,10/09/2018 12:00:00 AM,08/13/2018 12:00:00 AM,2017-470105,2018-08-23T00:00:00.000,2018-10-09T00:00:00.000,2018-08-13T00:00:00.000,Done
2018OPA-0609,Done,OPA Close CL,08/04/2018 12:00:00 AM,08/10/2018 12:00:00 AM,07/30/2018 12:00:00 AM,,2018-08-04T00:00:00.000,2018-08-10T00:00:00.000,2018-07-30T00:00:00.000,Done
2019OPA-0879,Done,OPA Close CL,01/04/2020 12:00:00 AM,01/09/2020 12:00:00 AM,12/27/2019 12:00:00 AM,,2020-01-04T00:00:00.000,2020-01-09T00:00:00.000,2019-12-27T00:00:00.000,Done
2015OPA-0648,Done,OPA Close CL,,06/08/2015 12:00:00 AM,10/19/2015 12:00:00 AM,,,2015-06-08T00:00:00.000,2015-10-19T00:00:00.000,Done
2015OPA-1440,Done,OPA Close CL,,10/01/2015 12:00:00 AM,10/13/2015 12:00:00 AM,,,2015-10-01T00:00:00.000,2015-10-13T00:00:00.000,Done
2015OPA-1515,Done,OPA Close CL,,10/27/2015 12:00:00 AM,10/27/2015 12:00:00 AM,,,2015-10-27T00:00:00.000,2015-10-27T00:00:00.000,Done
2016OPA-0429,Done,OPA Close CL,05/16/2016 12:00:00 AM,05/16/2016 12:00:00 AM,05/11/2016 12:00:00 AM,,2016-05-16T00:00:00.000,2016-05-16T00:00:00.000,2016-05-11T00:00:00.000,Done
2017OPA-0695,Done,OPA Missed 180 Day Deadline,01/10/2018 12:00:00 AM,09/28/2018 12:00:00 AM,02/26/2019 12:00:00 AM,,2018-01-10T00:00:00.000,2018-09-28T00:00:00.000,2019-02-26T00:00:00.000,Done
2017OPA-1129,Done,OPA Close SA,,02/06/2018 12:00:00 AM,02/06/2018 12:00:00 AM,2017-331295,,2018-02-06T00:00:00.000,2018-02-06T00:00:00.000,Done
2018OPA-0105,Done,OPA Close Case,07/29/2018 12:00:00 AM,09/25/2018 12:00:00 AM,07/19/2018 12:00:00 AM,2018-031555,2018-07-29T00:00:00.000,2018-09-25T00:00:00.000,2018-07-19T00:00:00.000,Done
2018OPA-0719,Done,OPA Training Referral,03/07/2019 12:00:00 AM,03/21/2019 12:00:00 AM,02/25/2019 12:00:00 AM,,2019-03-07T00:00:00.000,2019-03-21T00:00:00.000,2019-02-25T00:00:00.000,Done
2018OPA-0998,To do,OPA Director Certification/Finding,04/27/2019 12:00:00 AM,04/27/2019 12:00:00 AM,06/04/2019 12:00:00 AM,2018-278972,2019-04-27T00:00:00.000,2019-04-27T00:00:00.000,2019-06-04T00:00:00.000,To do
2015OPA-1016,Done,OPA Close SA,09/06/2015 12:00:00 AM,09/02/2015 12:00:00 AM,09/01/2015 12:00:00 AM,2015-222893,2015-09-06T00:00:00.000,2015-09-02T00:00:00.000,2015-09-01T00:00:00.000,Done
2015OPA-1394,Done,OPA Close CL,,10/01/2015 12:00:00 AM,10/13/2015 12:00:00 AM,,,2015-10-01T00:00:00.000,2015-10-13T00:00:00.000,Done
2016OPA-0197,Done,OPA Close CL,03/28/2016 12:00:00 AM,03/28/2016 12:00:00 AM,03/23/2016 12:00:00 AM,2016-062644,2016-03-28T00:00:00.000,2016-03-28T00:00:00.000,2016-03-23T00:00:00.000,Done
2016OPA-0713,Done,OPA Close CL,07/21/2016 12:00:00 AM,07/23/2016 12:00:00 AM,07/21/2016 12:00:00 AM,,2016-07-21T00:00:00.000,2016-07-23T00:00:00.000,2016-07-21T00:00:00.000,Done
2017OPA-0135,Done,OPA Close CL,02/28/2017 12:00:00 AM,03/10/2017 12:00:00 AM,02/23/2017 12:00:00 AM,,2017-02-28T00:00:00.000,2017-03-10T00:00:00.000,2017-02-23T00:00:00.000,Done
2017OPA-0618,Done,OPA Director Certification/Finding,12/12/2017 12:00:00 AM,01/02/2018 12:00:00 AM,01/30/2019 12:00:00 AM,2017-216067,2017-12-12T00:00:00.000,2018-01-02T00:00:00.000,2019-01-30T00:00:00.000,Done
2018OPA-0136,Done,OPA Close SA,,03/26/2018 12:00:00 AM,03/26/2018 12:00:00 AM,,,2018-03-26T00:00:00.000,2018-03-26T00:00:00.000,Done
2018OPA-1122,Done,OPA Close CL,12/22/2018 12:00:00 AM,12/27/2018 12:00:00 AM,12/17/2018 12:00:00 AM,2018-432782,2018-12-22T00:00:00.000,2018-12-27T00:00:00.000,2018-12-17T00:00:00.000,Done
2019OPA-0411,Done,OPA Close Case,12/01/2019 12:00:00 AM,12/12/2019 12:00:00 AM,11/21/2019 12:00:00 AM,2019-185877,2019-12-01T00:00:00.000,2019-12-12T00:00:00.000,2019-11-21T00:00:00.000,Done
2016OPA-0039,Done,OPA Close Case,08/01/2016 12:00:00 AM,08/01/2016 12:00:00 AM,07/26/2016 12:00:00 AM,2015-156205,2016-08-01T00:00:00.000,2016-08-01T00:00:00.000,2016-07-26T00:00:00.000,Done
2016OPA-0094,Done,OPA Close CL,02/07/2016 12:00:00 AM,02/03/2016 12:00:00 AM,02/02/2016 12:00:00 AM,,2016-02-07T00:00:00.000,2016-02-03T00:00:00.000,2016-02-02T00:00:00.000,Done
2016OPA-0952,Done,OPA Close CL,09/06/2016 12:00:00 AM,09/16/2016 12:00:00 AM,09/01/2016 12:00:00 AM,,2016-09-06T00:00:00.000,2016-09-16T00:00:00.000,2016-09-01T00:00:00.000,Done
2017OPA-0012,Done,OPA Close Case,06/10/2017 12:00:00 AM,06/16/2017 12:00:00 AM,05/31/2017 12:00:00 AM,2016-301906,2017-06-10T00:00:00.000,2017-06-16T00:00:00.000,2017-05-31T00:00:00.000,Done
2017OPA-0675,Done,OPA Close SA,08/23/2017 12:00:00 AM,09/19/2017 12:00:00 AM,08/08/2017 12:00:00 AM,2017-248435,2017-08-23T00:00:00.000,2017-09-19T00:00:00.000,2017-08-08T00:00:00.000,Done
2015OPA-0905,Done,OPA Close SA,,04/21/2016 12:00:00 AM,04/21/2016 12:00:00 AM,2015-196568,,2016-04-21T00:00:00.000,2016-04-21T00:00:00.000,Done
2016OPA-0567,Done,OPA Close SA,07/07/2016 12:00:00 AM,07/18/2016 12:00:00 AM,06/22/2016 12:00:00 AM,,2016-07-07T00:00:00.000,2016-07-18T00:00:00.000,2016-06-22T00:00:00.000,Done
2018OPA-0664,Done,OPA Close Case,,01/22/2019 12:00:00 AM,01/13/2019 12:00:00 AM,2017-463425,,2019-01-22T00:00:00.000,2019-01-13T00:00:00.000,Done
2016OPA-1445,Done,OPA Close Case,06/09/2017 12:00:00 AM,06/21/2017 12:00:00 AM,06/02/2017 12:00:00 AM,,2017-06-09T00:00:00.000,2017-06-21T00:00:00.000,2017-06-02T00:00:00.000,Done
2017OPA-0089,Done,OPA Training Referral,05/04/2020 12:00:00 AM,04/23/2020 12:00:00 AM,04/15/2020 12:00:00 AM,2017-013110,2020-05-04T00:00:00.000,2020-04-23T00:00:00.000,2020-04-15T00:00:00.000,Done
2017OPA-0113,Done,OPA Send Complainant Closing Letter,03/06/2017 12:00:00 AM,02/17/2017 12:00:00 AM,02/06/2017 12:00:00 AM,,2017-03-06T00:00:00.000,2017-02-17T00:00:00.000,2017-02-06T00:00:00.000,Done
2017OPA-0288,Done,OPA Close CL,04/09/2017 12:00:00 AM,04/13/2017 12:00:00 AM,04/04/2017 12:00:00 AM,,2017-04-09T00:00:00.000,2017-04-13T00:00:00.000,2017-04-04T00:00:00.000,Done
2018OPA-0545,Done,OPA Director Certification/Finding,11/09/2018 12:00:00 AM,10/24/2018 12:00:00 AM,01/29/2019 12:00:00 AM,2018-170393,2018-11-09T00:00:00.000,2018-10-24T00:00:00.000,2019-01-29T00:00:00.000,Done
2018OPA-0648,Done,OPA Training Referral,01/19/2019 12:00:00 AM,01/15/2019 12:00:00 AM,01/09/2019 12:00:00 AM,2018-237170,2019-01-19T00:00:00.000,2019-01-15T00:00:00.000,2019-01-09T00:00:00.000,Done
2015OPA-0815,Done,OPA Close Case,12/16/2015 12:00:00 AM,12/22/2015 12:00:00 AM,12/03/2015 12:00:00 AM,,2015-12-16T00:00:00.000,2015-12-22T00:00:00.000,2015-12-03T00:00:00.000,Done
2016OPA-0709,Done,OPA Close SA,,08/23/2016 12:00:00 AM,08/23/2016 12:00:00 AM,2016-221091,,2016-08-23T00:00:00.000,2016-08-23T00:00:00.000,Done
2020OPA-0210,Done,OPA Case Assignment,04/26/2020 12:00:00 AM,04/21/2020 12:00:00 AM,04/21/2020 12:00:00 AM,,2020-04-26T00:00:00.000,2020-04-21T00:00:00.000,2020-04-21T00:00:00.000,Done
2017OPA-0175,Done,OPA Close SA,,05/09/2017 12:00:00 AM,05/09/2017 12:00:00 AM,2017-049140,,2017-05-09T00:00:00.000,2017-05-09T00:00:00.000,Done
2017OPA-0665,Done,OPA Close CL,08/10/2017 12:00:00 AM,08/03/2017 12:00:00 AM,07/31/2017 12:00:00 AM,,2017-08-10T00:00:00.000,2017-08-03T00:00:00.000,2017-07-31T00:00:00.000,Done
2017OPA-0756,Done,OPA Close CL,08/24/2017 12:00:00 AM,08/15/2017 12:00:00 AM,07/26/2017 12:00:00 AM,,2017-08-24T00:00:00.000,2017-08-15T00:00:00.000,2017-07-26T00:00:00.000,Done
2017OPA-0912,Done,OPA Final Discipline Action Report,,01/30/2018 12:00:00 AM,01/22/2019 12:00:00 AM,2017-307288,,2018-01-30T00:00:00.000,2019-01-22T00:00:00.000,Done
2016OPA-1231,Done,OPA Close CL,11/09/2016 12:00:00 AM,11/10/2016 12:00:00 AM,11/04/2016 12:00:00 AM,,2016-11-09T00:00:00.000,2016-11-10T00:00:00.000,2016-11-04T00:00:00.000,Done
2016OPA-1373,Done,OPA Close Case,05/11/2017 12:00:00 AM,05/16/2017 12:00:00 AM,05/01/2017 12:00:00 AM,2016-414889,2017-05-11T00:00:00.000,2017-05-16T00:00:00.000,2017-05-01T00:00:00.000,Done
2017OPA-0208,Done,OPA Close CL,03/28/2017 12:00:00 AM,03/14/2017 12:00:00 AM,02/27/2017 12:00:00 AM,,2017-03-28T00:00:00.000,2017-03-14T00:00:00.000,2017-02-27T00:00:00.000,Done
2017OPA-0572,Done,OPA Close SA,,08/23/2017 12:00:00 AM,08/23/2017 12:00:00 AM,,,2017-08-23T00:00:00.000,2017-08-23T00:00:00.000,Done
2018OPA-0476,Done,OPA Close CL,06/29/2018 12:00:00 AM,06/26/2018 12:00:00 AM,06/25/2018 12:00:00 AM,,2018-06-29T00:00:00.000,2018-06-26T00:00:00.000,2018-06-25T00:00:00.000,Done
2020OPA-0234,Done,OPA Create SAN,05/06/2020 12:00:00 AM,05/05/2020 12:00:00 AM,05/05/2020 12:00:00 AM,2020-115720,2020-05-06T00:00:00.000,2020-05-05T00:00:00.000,2020-05-05T00:00:00.000,Done
2015OPA-0703,Done,OPA Close CL,,09/25/2015 12:00:00 AM,10/14/2015 12:00:00 AM,,,2015-09-25T00:00:00.000,2015-10-14T00:00:00.000,Done
2015OPA-1783,Done,OPA Close Case,05/31/2016 12:00:00 AM,06/06/2016 12:00:00 AM,05/04/2016 12:00:00 AM,,2016-05-31T00:00:00.000,2016-06-06T00:00:00.000,2016-05-04T00:00:00.000,Done
2016OPA-1043,Done,OPA Close CL,09/26/2016 12:00:00 AM,10/16/2016 12:00:00 AM,09/21/2016 12:00:00 AM,,2016-09-26T00:00:00.000,2016-10-16T00:00:00.000,2016-09-21T00:00:00.000,Done
2017OPA-0129,Done,OPA Close CL,02/27/2017 12:00:00 AM,02/27/2017 12:00:00 AM,02/22/2017 12:00:00 AM,2016-451209,2017-02-27T00:00:00.000,2017-02-27T00:00:00.000,2017-02-22T00:00:00.000,Done
2019OPA-0261,Done,OPA Close SA,,06/24/2019 12:00:00 AM,06/24/2019 12:00:00 AM,2019-119495,,2019-06-24T00:00:00.000,2019-06-24T00:00:00.000,Done
2015OPA-0499,Done,OPA Close CL,,04/14/2015 12:00:00 AM,10/20/2015 12:00:00 AM,2015-109770,,2015-04-14T00:00:00.000,2015-10-20T00:00:00.000,Done
2015OPA-1007,Done,OPA Close SA,,12/28/2015 12:00:00 AM,12/28/2015 12:00:00 AM,2015-218049,,2015-12-28T00:00:00.000,2015-12-28T00:00:00.000,Done
2019OPA-0610,Done,OPA Close Case,02/17/2020 12:00:00 AM,02/18/2020 12:00:00 AM,02/03/2020 12:00:00 AM,2018-444804,2020-02-17T00:00:00.000,2020-02-18T00:00:00.000,2020-02-03T00:00:00.000,Done
2019OPA-0760,Done,OPA Close SA,,12/05/2019 12:00:00 AM,12/05/2019 12:00:00 AM,2019-205742,,2019-12-05T00:00:00.000,2019-12-05T00:00:00.000,Done
2020OPA-0028,Done,OPA 180 Extension Request,07/27/2020 12:00:00 AM,08/26/2020 12:00:00 AM,04/02/2020 12:00:00 AM,,2020-07-27T00:00:00.000,2020-08-26T00:00:00.000,2020-04-02T00:00:00.000,Done
2015OPA-1263,Done,OPA Close Case,12/09/2015 12:00:00 AM,12/11/2015 12:00:00 AM,11/19/2015 12:00:00 AM,2015-114274,2015-12-09T00:00:00.000,2015-12-11T00:00:00.000,2015-11-19T00:00:00.000,Done
2016OPA-1005,Done,OPA Close CL,09/22/2016 12:00:00 AM,09/21/2016 12:00:00 AM,09/17/2016 12:00:00 AM,,2016-09-22T00:00:00.000,2016-09-21T00:00:00.000,2016-09-17T00:00:00.000,Done
2017OPA-0670,Done,OPA Close CL,08/08/2017 12:00:00 AM,07/24/2017 12:00:00 AM,07/10/2017 12:00:00 AM,,2017-08-08T00:00:00.000,2017-07-24T00:00:00.000,2017-07-10T00:00:00.000,Done
2019OPA-0072,Done,OPA Close CL,03/02/2019 12:00:00 AM,03/01/2019 12:00:00 AM,02/25/2019 12:00:00 AM,2019-039369,2019-03-02T00:00:00.000,2019-03-01T00:00:00.000,2019-02-25T00:00:00.000,Done
2015OPA-1240,Done,OPA Close CL,,08/27/2015 12:00:00 AM,10/15/2015 12:00:00 AM,,,2015-08-27T00:00:00.000,2015-10-15T00:00:00.000,Done
2016OPA-1172,Done,OPA Close Case,06/05/2017 12:00:00 AM,06/12/2017 12:00:00 AM,05/26/2017 12:00:00 AM,,2017-06-05T00:00:00.000,2017-06-12T00:00:00.000,2017-05-26T00:00:00.000,Done
2017OPA-1224,Done,OPA Close Case,12/27/2017 12:00:00 AM,12/26/2017 12:00:00 AM,11/27/2017 12:00:00 AM,,2017-12-27T00:00:00.000,2017-12-26T00:00:00.000,2017-11-27T00:00:00.000,Done
2018OPA-0988,Done,OPA Close CL,11/10/2018 12:00:00 AM,11/19/2018 12:00:00 AM,11/05/2018 12:00:00 AM,,2018-11-10T00:00:00.000,2018-11-19T00:00:00.000,2018-11-05T00:00:00.000,Done
2019OPA-0534,Done,OPA Close Case,03/08/2020 12:00:00 AM,04/20/2020 12:00:00 AM,02/23/2020 12:00:00 AM,2019-281887,2020-03-08T00:00:00.000,2020-04-20T00:00:00.000,2020-02-23T00:00:00.000,Done
2020OPA-0100,Done,OPA Close CL,03/05/2020 12:00:00 AM,03/04/2020 12:00:00 AM,02/27/2020 12:00:00 AM,,2020-03-05T00:00:00.000,2020-03-04T00:00:00.000,2020-02-27T00:00:00.000,Done
2016OPA-1368,Done,OPA Close SA,,12/28/2016 12:00:00 AM,12/28/2016 12:00:00 AM,,,2016-12-28T00:00:00.000,2016-12-28T00:00:00.000,Done
2016OPA-1512,Done,OPA Close SA,,02/15/2017 12:00:00 AM,02/15/2017 12:00:00 AM,,,2017-02-15T00:00:00.000,2017-02-15T00:00:00.000,Done
2018OPA-1190,Done,OPA Close CL,01/27/2019 12:00:00 AM,01/29/2019 12:00:00 AM,01/22/2019 12:00:00 AM,2018-480459,2019-01-27T00:00:00.000,2019-01-29T00:00:00.000,2019-01-22T00:00:00.000,Done
2019OPA-0460,Done,OPA Close CL,07/30/2019 12:00:00 AM,08/05/2019 12:00:00 AM,07/25/2019 12:00:00 AM,,2019-07-30T00:00:00.000,2019-08-05T00:00:00.000,2019-07-25T00:00:00.000,Done
2017OPA-1091,Done,OPA Final Discipline Action Report,,04/13/2018 12:00:00 AM,01/22/2019 12:00:00 AM,2017-387058,,2018-04-13T00:00:00.000,2019-01-22T00:00:00.000,Done
2018OPA-1093,Done,OPA Close Case,05/12/2019 12:00:00 AM,05/16/2019 12:00:00 AM,05/02/2019 12:00:00 AM,2018-419166,2019-05-12T00:00:00.000,2019-05-16T00:00:00.000,2019-05-02T00:00:00.000,Done
2019OPA-0606,Done,OPA Close Case,02/15/2020 12:00:00 AM,02/17/2020 12:00:00 AM,01/06/2020 12:00:00 AM,2019-250391,2020-02-15T00:00:00.000,2020-02-17T00:00:00.000,2020-01-06T00:00:00.000,Done
2016OPA-0504,Done,OPA Close CL,06/01/2016 12:00:00 AM,06/01/2016 12:00:00 AM,05/27/2016 12:00:00 AM,,2016-06-01T00:00:00.000,2016-06-01T00:00:00.000,2016-05-27T00:00:00.000,Done
2016OPA-1184,Done,OPA Close Case,03/10/2017 12:00:00 AM,03/21/2017 12:00:00 AM,02/28/2017 12:00:00 AM,2016-185319,2017-03-10T00:00:00.000,2017-03-21T00:00:00.000,2017-02-28T00:00:00.000,Done
2016OPA-1301,Done,OPA Close CL,12/06/2016 12:00:00 AM,12/06/2016 12:00:00 AM,12/01/2016 12:00:00 AM,2016-388325,2016-12-06T00:00:00.000,2016-12-06T00:00:00.000,2016-12-01T00:00:00.000,Done
2017OPA-0455,Done,OPA Close CL,05/30/2017 12:00:00 AM,06/01/2017 12:00:00 AM,05/25/2017 12:00:00 AM,2017-127755,2017-05-30T00:00:00.000,2017-06-01T00:00:00.000,2017-05-25T00:00:00.000,Done
2015OPA-0103,Done,OPA Process SA,03/19/2015 12:00:00 AM,02/17/2015 12:00:00 AM,02/17/2015 12:00:00 AM,,2015-03-19T00:00:00.000,2015-02-17T00:00:00.000,2015-02-17T00:00:00.000,Done
2016OPA-0341,Done,OPA Close Case,07/02/2018 12:00:00 AM,09/12/2018 12:00:00 AM,08/28/2018 12:00:00 AM,,2018-07-02T00:00:00.000,2018-09-12T00:00:00.000,2018-08-28T00:00:00.000,Done
2016OPA-0705,Done,OPA Close CL,12/31/2016 12:00:00 AM,10/18/2016 12:00:00 AM,07/22/2016 12:00:00 AM,,2016-12-31T00:00:00.000,2016-10-18T00:00:00.000,2016-07-22T00:00:00.000,Done
2016OPA-1217,Done,OPA Close CL,11/02/2016 12:00:00 AM,11/02/2016 12:00:00 AM,10/28/2016 12:00:00 AM,,2016-11-02T00:00:00.000,2016-11-02T00:00:00.000,2016-10-28T00:00:00.000,Done
2019OPA-0670,Done,OPA Close SA,,10/25/2019 12:00:00 AM,10/25/2019 12:00:00 AM,2019-332656,,2019-10-25T00:00:00.000,2019-10-25T00:00:00.000,Done
2016OPA-1501,Done,OPA Close Case,06/23/2017 12:00:00 AM,07/06/2017 12:00:00 AM,06/13/2017 12:00:00 AM,2015-142729,2017-06-23T00:00:00.000,2017-07-06T00:00:00.000,2017-06-13T00:00:00.000,Done
2017OPA-0548,Done,OPA Close Case,11/06/2017 12:00:00 AM,11/14/2017 12:00:00 AM,11/09/2017 12:00:00 AM,,2017-11-06T00:00:00.000,2017-11-14T00:00:00.000,2017-11-09T00:00:00.000,Done
2018OPA-0419,Done,OPA Classification,,06/08/2018 12:00:00 AM,06/08/2018 12:00:00 AM,,,2018-06-08T00:00:00.000,2018-06-08T00:00:00.000,Done
2018OPA-0927,Done,OPA Close CL,10/09/2018 12:00:00 AM,10/19/2018 12:00:00 AM,10/04/2018 12:00:00 AM,2018-349425,2018-10-09T00:00:00.000,2018-10-19T00:00:00.000,2018-10-04T00:00:00.000,Done
2018OPA-0995,Done,OPA Close SA,,11/29/2018 12:00:00 AM,11/29/2018 12:00:00 AM,,,2018-11-29T00:00:00.000,2018-11-29T00:00:00.000,Done
2016OPA-1494,Done,OPA Close CL,01/22/2017 12:00:00 AM,01/17/2017 12:00:00 AM,01/11/2017 12:00:00 AM,,2017-01-22T00:00:00.000,2017-01-17T00:00:00.000,2017-01-11T00:00:00.000,Done
2018OPA-1074,Done,OPA Close Case,05/19/2019 12:00:00 AM,05/21/2019 12:00:00 AM,05/09/2019 12:00:00 AM,2018-415454,2019-05-19T00:00:00.000,2019-05-21T00:00:00.000,2019-05-09T00:00:00.000,Done
2020OPA-0242,Done,OPA 5 Day Notice,04/30/2020 12:00:00 AM,04/24/2020 12:00:00 AM,04/23/2020 12:00:00 AM,2020-120432,2020-04-30T00:00:00.000,2020-04-24T00:00:00.000,2020-04-23T00:00:00.000,Done
2015OPA-0640,Done,OPA Director SA Review,06/13/2015 12:00:00 AM,06/17/2015 12:00:00 AM,06/08/2015 12:00:00 AM,2015-149577,2015-06-13T00:00:00.000,2015-06-17T00:00:00.000,2015-06-08T00:00:00.000,Done
2016OPA-1206,Done,OPA Close SA,,11/22/2016 12:00:00 AM,11/22/2016 12:00:00 AM,,,2016-11-22T00:00:00.000,2016-11-22T00:00:00.000,Done
2016OPA-1227,Done,OPA Close SA,,11/09/2016 12:00:00 AM,11/09/2016 12:00:00 AM,2016-327015,,2016-11-09T00:00:00.000,2016-11-09T00:00:00.000,Done
2019OPA-0665,Done,OPA Close CL,09/26/2019 12:00:00 AM,09/26/2019 12:00:00 AM,09/19/2019 12:00:00 AM,,2019-09-26T00:00:00.000,2019-09-26T00:00:00.000,2019-09-19T00:00:00.000,Done
2015OPA-0444,Done,OPA Close Case,,09/11/2015 12:00:00 AM,08/31/2015 12:00:00 AM,,,2015-09-11T00:00:00.000,2015-08-31T00:00:00.000,Done
2016OPA-1198,Done,OPA Close Case,07/03/2017 12:00:00 AM,07/19/2017 12:00:00 AM,07/03/2017 12:00:00 AM,,2017-07-03T00:00:00.000,2017-07-19T00:00:00.000,2017-07-03T00:00:00.000,Done
2018OPA-0868,Done,OPA Close CL,10/10/2018 12:00:00 AM,10/19/2018 12:00:00 AM,10/05/2018 12:00:00 AM,2018-322899,2018-10-10T00:00:00.000,2018-10-19T00:00:00.000,2018-10-05T00:00:00.000,Done
2015OPA-0259,Done,OPA Close CL,,03/23/2015 12:00:00 AM,10/21/2015 12:00:00 AM,2014-182476,,2015-03-23T00:00:00.000,2015-10-21T00:00:00.000,Done
2015OPA-1211,Done,OPA Close Case,02/29/2016 12:00:00 AM,03/14/2016 12:00:00 AM,02/03/2016 12:00:00 AM,2015-089918,2016-02-29T00:00:00.000,2016-03-14T00:00:00.000,2016-02-03T00:00:00.000,Done
2016OPA-1478,Done,OPA Close CL,01/16/2017 12:00:00 AM,01/11/2017 12:00:00 AM,01/06/2017 12:00:00 AM,,2017-01-16T00:00:00.000,2017-01-11T00:00:00.000,2017-01-06T00:00:00.000,Done
2017OPA-1092,Done,OPA Close SA,,03/26/2018 12:00:00 AM,02/13/2018 12:00:00 AM,,,2018-03-26T00:00:00.000,2018-02-13T00:00:00.000,Done
2018OPA-0493,Done,OPA Director Certification/Finding,11/18/2018 12:00:00 AM,10/24/2018 12:00:00 AM,01/30/2019 12:00:00 AM,2018-184261,2018-11-18T00:00:00.000,2018-10-24T00:00:00.000,2019-01-30T00:00:00.000,Done
2019OPA-0698,Done,OPA Close CL,10/24/2019 12:00:00 AM,10/29/2019 12:00:00 AM,10/19/2019 12:00:00 AM,,2019-10-24T00:00:00.000,2019-10-29T00:00:00.000,2019-10-19T00:00:00.000,Done
2015OPA-0130,Done,OPA SA Review,04/11/2015 12:00:00 AM,04/13/2015 12:00:00 AM,04/06/2015 12:00:00 AM,2015-031319,2015-04-11T00:00:00.000,2015-04-13T00:00:00.000,2015-04-06T00:00:00.000,Done
2015OPA-1667,Done,OPA Close Case,05/05/2016 12:00:00 AM,05/05/2016 12:00:00 AM,04/26/2016 12:00:00 AM,,2016-05-05T00:00:00.000,2016-05-05T00:00:00.000,2016-04-26T00:00:00.000,Done
2016OPA-0787,Done,OPA Close Case,06/30/2017 12:00:00 AM,07/06/2017 12:00:00 AM,06/20/2017 12:00:00 AM,2016-243409,2017-06-30T00:00:00.000,2017-07-06T00:00:00.000,2017-06-20T00:00:00.000,Done
2016OPA-1336,Done,OPA Close CL,11/21/2016 12:00:00 AM,11/17/2016 12:00:00 AM,11/16/2016 12:00:00 AM,,2016-11-21T00:00:00.000,2016-11-17T00:00:00.000,2016-11-16T00:00:00.000,Done
2015OPA-1536,Done,OPA Close CL,10/31/2015 12:00:00 AM,10/28/2015 12:00:00 AM,10/26/2015 12:00:00 AM,,2015-10-31T00:00:00.000,2015-10-28T00:00:00.000,2015-10-26T00:00:00.000,Done
2015OPA-1655,Done,OPA Training Referral,02/03/2016 12:00:00 AM,01/29/2016 12:00:00 AM,01/25/2016 12:00:00 AM,,2016-02-03T00:00:00.000,2016-01-29T00:00:00.000,2016-01-25T00:00:00.000,Done
2016OPA-0140,Done,OPA Close SA,03/30/2016 12:00:00 AM,03/23/2016 12:00:00 AM,03/15/2016 12:00:00 AM,2015-359427,2016-03-30T00:00:00.000,2016-03-23T00:00:00.000,2016-03-15T00:00:00.000,Done
2016OPA-1011,Done,OPA Intake,08/21/2016 12:00:00 AM,08/23/2016 12:00:00 AM,08/23/2016 12:00:00 AM,,2016-08-21T00:00:00.000,2016-08-23T00:00:00.000,2016-08-23T00:00:00.000,Done
2017OPA-0407,Done,OPA Investigation Review,08/07/2018 12:00:00 AM,10/16/2018 12:00:00 AM,06/04/2018 12:00:00 AM,,2018-08-07T00:00:00.000,2018-10-16T00:00:00.000,2018-06-04T00:00:00.000,Done
2017OPA-0868,Done,OPA Final Discipline Action Report,04/06/2018 12:00:00 AM,04/06/2018 12:00:00 AM,10/01/2018 12:00:00 AM,2014-280952,2018-04-06T00:00:00.000,2018-04-06T00:00:00.000,2018-10-01T00:00:00.000,Done
2018OPA-0581,Done,OPA Director Certification/Finding,12/26/2018 12:00:00 AM,12/26/2018 12:00:00 AM,01/13/2019 12:00:00 AM,2018-227255,2018-12-26T00:00:00.000,2018-12-26T00:00:00.000,2019-01-13T00:00:00.000,Done
2020OPA-0059,Done,OPA Close Case,02/19/2020 12:00:00 AM,02/19/2020 12:00:00 AM,02/12/2020 12:00:00 AM,,2020-02-19T00:00:00.000,2020-02-19T00:00:00.000,2020-02-12T00:00:00.000,Done
2020OPA-0131,Done,OPA Close CL,03/25/2020 12:00:00 AM,03/24/2020 12:00:00 AM,03/18/2020 12:00:00 AM,,2020-03-25T00:00:00.000,2020-03-24T00:00:00.000,2020-03-18T00:00:00.000,Done
2015OPA-0051,Done,OPA Close Case,07/24/2015 12:00:00 AM,07/28/2015 12:00:00 AM,07/10/2015 12:00:00 AM,2014-405875,2015-07-24T00:00:00.000,2015-07-28T00:00:00.000,2015-07-10T00:00:00.000,Done
2015OPA-1040,Done,OPA Close CL,,07/29/2015 12:00:00 AM,10/16/2015 12:00:00 AM,,,2015-07-29T00:00:00.000,2015-10-16T00:00:00.000,Done
2019OPA-0306,Done,OPA Close CL,06/04/2019 12:00:00 AM,06/06/2019 12:00:00 AM,05/30/2019 12:00:00 AM,,2019-06-04T00:00:00.000,2019-06-06T00:00:00.000,2019-05-30T00:00:00.000,Done
2019OPA-0501,Done,OPA Close Case,01/22/2020 12:00:00 AM,02/05/2020 12:00:00 AM,01/08/2020 12:00:00 AM,,2020-01-22T00:00:00.000,2020-02-05T00:00:00.000,2020-01-08T00:00:00.000,Done
2016OPA-0524,Done,OPA Close Case,11/23/2017 12:00:00 AM,01/19/2018 12:00:00 AM,12/19/2017 12:00:00 AM,2016-175055,2017-11-23T00:00:00.000,2018-01-19T00:00:00.000,2017-12-19T00:00:00.000,Done
2017OPA-0233,Done,OPA Close CL,03/29/2017 12:00:00 AM,03/28/2017 12:00:00 AM,03/24/2017 12:00:00 AM,2017-042217,2017-03-29T00:00:00.000,2017-03-28T00:00:00.000,2017-03-24T00:00:00.000,Done
2017OPA-0958,Done,OPA Training Referral,03/08/2018 12:00:00 AM,03/08/2018 12:00:00 AM,02/26/2018 12:00:00 AM,2017-318581,2018-03-08T00:00:00.000,2018-03-08T00:00:00.000,2018-02-26T00:00:00.000,Done
2015OPA-0868,Done,OPA Close CL,,07/23/2015 12:00:00 AM,10/16/2015 12:00:00 AM,2015-195876,,2015-07-23T00:00:00.000,2015-10-16T00:00:00.000,Done
2015OPA-1553,Done,OPA Close SA,12/20/2015 12:00:00 AM,12/15/2015 12:00:00 AM,12/15/2015 12:00:00 AM,2015-201305,2015-12-20T00:00:00.000,2015-12-15T00:00:00.000,2015-12-15T00:00:00.000,Done
2015OPA-1685,Done,OPA Close SA,05/04/2016 12:00:00 AM,04/29/2016 12:00:00 AM,04/29/2016 12:00:00 AM,,2016-05-04T00:00:00.000,2016-04-29T00:00:00.000,2016-04-29T00:00:00.000,Done
2017OPA-0720,Done,OPA Close Case,03/01/2019 12:00:00 AM,03/19/2019 12:00:00 AM,03/19/2019 12:00:00 AM,,2019-03-01T00:00:00.000,2019-03-19T00:00:00.000,2019-03-19T00:00:00.000,Done
2017OPA-1073,Done,OPA Close CL,11/12/2017 12:00:00 AM,11/10/2017 12:00:00 AM,10/13/2017 12:00:00 AM,,2017-11-12T00:00:00.000,2017-11-10T00:00:00.000,2017-10-13T00:00:00.000,Done
2015OPA-1277,Done,OPA Close SA,08/06/2016 12:00:00 AM,07/22/2016 12:00:00 AM,07/22/2016 12:00:00 AM,,2016-08-06T00:00:00.000,2016-07-22T00:00:00.000,2016-07-22T00:00:00.000,Done
2015OPA-1530,Done,OPA Close CL,10/31/2015 12:00:00 AM,10/28/2015 12:00:00 AM,10/26/2015 12:00:00 AM,,2015-10-31T00:00:00.000,2015-10-28T00:00:00.000,2015-10-26T00:00:00.000,Done
2016OPA-0386,Done,OPA Close CL,04/25/2016 12:00:00 AM,04/25/2016 12:00:00 AM,04/20/2016 12:00:00 AM,2016-108573,2016-04-25T00:00:00.000,2016-04-25T00:00:00.000,2016-04-20T00:00:00.000,Done
2016OPA-0864,Done,OPA Close SA,,09/06/2016 12:00:00 AM,09/06/2016 12:00:00 AM,2016-205107,,2016-09-06T00:00:00.000,2016-09-06T00:00:00.000,Done
2017OPA-0840,Done,OPA Close CL,09/07/2017 12:00:00 AM,09/14/2017 12:00:00 AM,09/02/2017 12:00:00 AM,2017-292094,2017-09-07T00:00:00.000,2017-09-14T00:00:00.000,2017-09-02T00:00:00.000,Done
2017OPA-1192,Done,OPA Close Case,05/17/2018 12:00:00 AM,08/22/2018 12:00:00 AM,05/07/2018 12:00:00 AM,2017-414395,2018-05-17T00:00:00.000,2018-08-22T00:00:00.000,2018-05-07T00:00:00.000,Done
2017OPA-1242,Done,OPA Close CL,01/30/2018 12:00:00 AM,12/28/2017 12:00:00 AM,12/04/2017 12:00:00 AM,2017-407884,2018-01-30T00:00:00.000,2017-12-28T00:00:00.000,2017-12-04T00:00:00.000,Done
2018OPA-0260,Done,OPA Close Case,10/18/2018 12:00:00 AM,10/24/2018 12:00:00 AM,10/08/2018 12:00:00 AM,2018-081739,2018-10-18T00:00:00.000,2018-10-24T00:00:00.000,2018-10-08T00:00:00.000,Done
2019OPA-0080,Done,OPA Close CL,03/02/2019 12:00:00 AM,02/26/2019 12:00:00 AM,02/25/2019 12:00:00 AM,,2019-03-02T00:00:00.000,2019-02-26T00:00:00.000,2019-02-25T00:00:00.000,Done
2015OPA-0598,Done,OPA Close CL,,05/11/2015 12:00:00 AM,10/20/2015 12:00:00 AM,,,2015-05-11T00:00:00.000,2015-10-20T00:00:00.000,Done
2015OPA-1706,Done,OPA Close SA,03/29/2016 12:00:00 AM,03/24/2016 12:00:00 AM,03/24/2016 12:00:00 AM,,2016-03-29T00:00:00.000,2016-03-24T00:00:00.000,2016-03-24T00:00:00.000,Done
2015OPA-1803,Done,OPA Close CL,12/19/2015 12:00:00 AM,12/16/2015 12:00:00 AM,12/14/2015 12:00:00 AM,2015-406523,2015-12-19T00:00:00.000,2015-12-16T00:00:00.000,2015-12-14T00:00:00.000,Done
2016OPA-0192,Done,OPA Director Certification/Finding,10/17/2016 12:00:00 AM,10/18/2016 12:00:00 AM,01/30/2019 12:00:00 AM,2016-062788,2016-10-17T00:00:00.000,2016-10-18T00:00:00.000,2019-01-30T00:00:00.000,Done
2016OPA-0388,Done,OPA Close CL,04/25/2016 12:00:00 AM,04/25/2016 12:00:00 AM,04/20/2016 12:00:00 AM,,2016-04-25T00:00:00.000,2016-04-25T00:00:00.000,2016-04-20T00:00:00.000,Done
2017OPA-0642,Done,OPA Close CL,07/28/2017 12:00:00 AM,07/21/2017 12:00:00 AM,06/28/2017 12:00:00 AM,,2017-07-28T00:00:00.000,2017-07-21T00:00:00.000,2017-06-28T00:00:00.000,Done
2017OPA-0948,Done,OPA Close SA,,10/25/2017 12:00:00 AM,10/25/2017 12:00:00 AM,,,2017-10-25T00:00:00.000,2017-10-25T00:00:00.000,Done
2018OPA-0112,Done,OPA Close Case,03/06/2018 12:00:00 AM,03/01/2018 12:00:00 AM,03/01/2018 12:00:00 AM,2018-027165,2018-03-06T00:00:00.000,2018-03-01T00:00:00.000,2018-03-01T00:00:00.000,Done
2019OPA-0108,Done,OPA Close Case,09/15/2019 12:00:00 AM,09/25/2019 12:00:00 AM,09/05/2019 12:00:00 AM,,2019-09-15T00:00:00.000,2019-09-25T00:00:00.000,2019-09-05T00:00:00.000,Done
2015OPA-1512,Done,OPA Close CL,,10/19/2015 12:00:00 AM,10/19/2015 12:00:00 AM,,,2015-10-19T00:00:00.000,2015-10-19T00:00:00.000,Done
2015OPA-1896,Done,OPA Close CL,01/04/2016 12:00:00 AM,01/04/2016 12:00:00 AM,12/30/2015 12:00:00 AM,,2016-01-04T00:00:00.000,2016-01-04T00:00:00.000,2015-12-30T00:00:00.000,Done
2015OPA-1908,Done,OPA Close Case,08/14/2016 12:00:00 AM,08/15/2016 12:00:00 AM,08/04/2016 12:00:00 AM,2015-441469,2016-08-14T00:00:00.000,2016-08-15T00:00:00.000,2016-08-04T00:00:00.000,Done
2016OPA-0078,Done,OPA Close Case,08/04/2016 12:00:00 AM,08/05/2016 12:00:00 AM,07/26/2016 12:00:00 AM,2016-030641,2016-08-04T00:00:00.000,2016-08-05T00:00:00.000,2016-07-26T00:00:00.000,Done
2016OPA-0590,Done,OPA Close CL,07/05/2016 12:00:00 AM,07/07/2016 12:00:00 AM,06/30/2016 12:00:00 AM,,2016-07-05T00:00:00.000,2016-07-07T00:00:00.000,2016-06-30T00:00:00.000,Done
2017OPA-1181,Done,OPA Send Complaint Receipt,11/18/2017 12:00:00 AM,11/13/2017 12:00:00 AM,11/13/2017 12:00:00 AM,,2017-11-18T00:00:00.000,2017-11-13T00:00:00.000,2017-11-13T00:00:00.000,Done
2019OPA-0690,Done,OPA Close CL,10/03/2019 12:00:00 AM,10/08/2019 12:00:00 AM,09/26/2019 12:00:00 AM,,2019-10-03T00:00:00.000,2019-10-08T00:00:00.000,2019-09-26T00:00:00.000,Done
2020OPA-0089,Done,OPA Close CL,03/13/2020 12:00:00 AM,03/16/2020 12:00:00 AM,03/06/2020 12:00:00 AM,,2020-03-13T00:00:00.000,2020-03-16T00:00:00.000,2020-03-06T00:00:00.000,Done
2015OPA-0015,Done,OPA Close CL,,01/13/2015 12:00:00 AM,10/23/2015 12:00:00 AM,,,2015-01-13T00:00:00.000,2015-10-23T00:00:00.000,Done
2015OPA-0370,Done,OPA Management Action,,05/29/2019 12:00:00 AM,05/09/2019 12:00:00 AM,,,2019-05-29T00:00:00.000,2019-05-09T00:00:00.000,Done
2015OPA-1160,Done,OPA Close CL,,11/10/2015 12:00:00 AM,11/10/2015 12:00:00 AM,,,2015-11-10T00:00:00.000,2015-11-10T00:00:00.000,Done
2016OPA-0012,Done,OPA Close CL,01/20/2016 12:00:00 AM,01/20/2016 12:00:00 AM,01/15/2016 12:00:00 AM,,2016-01-20T00:00:00.000,2016-01-20T00:00:00.000,2016-01-15T00:00:00.000,Done
2016OPA-1155,Done,OPA Close CL,10/12/2016 12:00:00 AM,10/10/2016 12:00:00 AM,10/07/2016 12:00:00 AM,,2016-10-12T00:00:00.000,2016-10-10T00:00:00.000,2016-10-07T00:00:00.000,Done
2018OPA-0666,Done,OPA Close Case,,02/13/2019 12:00:00 AM,01/21/2019 12:00:00 AM,2018-260560,,2019-02-13T00:00:00.000,2019-01-21T00:00:00.000,Done
2018OPA-0971,Done,OPA Close CL,10/20/2018 12:00:00 AM,10/19/2018 12:00:00 AM,10/15/2018 12:00:00 AM,,2018-10-20T00:00:00.000,2018-10-19T00:00:00.000,2018-10-15T00:00:00.000,Done
2015OPA-0029,Done,OPA SA Review,04/04/2015 12:00:00 AM,04/21/2015 12:00:00 AM,03/30/2015 12:00:00 AM,2014-354808,2015-04-04T00:00:00.000,2015-04-21T00:00:00.000,2015-03-30T00:00:00.000,Done
2015OPA-0620,Done,OPA Close CL,,05/19/2015 12:00:00 AM,10/20/2015 12:00:00 AM,,,2015-05-19T00:00:00.000,2015-10-20T00:00:00.000,Done
2015OPA-0697,Done,OPA Close CL,,06/08/2015 12:00:00 AM,10/19/2015 12:00:00 AM,,,2015-06-08T00:00:00.000,2015-10-19T00:00:00.000,Done
2019OPA-0495,Done,OPA Close SA,,08/28/2019 12:00:00 AM,08/28/2019 12:00:00 AM,2019-251078,,2019-08-28T00:00:00.000,2019-08-28T00:00:00.000,Done
2015OPA-1919,Done,OPA Close CL,04/16/2016 12:00:00 AM,04/11/2016 12:00:00 AM,04/11/2016 12:00:00 AM,,2016-04-16T00:00:00.000,2016-04-11T00:00:00.000,2016-04-11T00:00:00.000,Done
2016OPA-0021,Done,OPA Close CL,02/21/2016 12:00:00 AM,02/18/2016 12:00:00 AM,02/18/2016 12:00:00 AM,,2016-02-21T00:00:00.000,2016-02-18T00:00:00.000,2016-02-18T00:00:00.000,Done
2016OPA-0849,Done,OPA Close SA,,11/03/2016 12:00:00 AM,11/03/2016 12:00:00 AM,,,2016-11-03T00:00:00.000,2016-11-03T00:00:00.000,Done
2016OPA-0860,Done,OPA Close CL,08/24/2016 12:00:00 AM,08/24/2016 12:00:00 AM,08/19/2016 12:00:00 AM,,2016-08-24T00:00:00.000,2016-08-24T00:00:00.000,2016-08-19T00:00:00.000,Done
2017OPA-0201,Done,OPA Close Case,11/06/2017 12:00:00 AM,11/06/2017 12:00:00 AM,08/08/2017 12:00:00 AM,,2017-11-06T00:00:00.000,2017-11-06T00:00:00.000,2017-08-08T00:00:00.000,Done
2015OPA-0810,Done,OPA Close Case,12/15/2015 12:00:00 AM,12/22/2015 12:00:00 AM,12/02/2015 12:00:00 AM,,2015-12-15T00:00:00.000,2015-12-22T00:00:00.000,2015-12-02T00:00:00.000,Done
2015OPA-1487,Done,OPA Close CL,,10/20/2015 12:00:00 AM,10/20/2015 12:00:00 AM,,,2015-10-20T00:00:00.000,2015-10-20T00:00:00.000,Done
2015OPA-1600,Done,OPA Close CL,,11/10/2015 12:00:00 AM,11/10/2015 12:00:00 AM,,,2015-11-10T00:00:00.000,2015-11-10T00:00:00.000,Done
2017OPA-1062,Done,OPA Intake,10/22/2017 12:00:00 AM,10/17/2017 12:00:00 AM,10/17/2017 12:00:00 AM,,2017-10-22T00:00:00.000,2017-10-17T00:00:00.000,2017-10-17T00:00:00.000,Done
2019OPA-0345,Done,OPA Training Referral,12/27/2019 12:00:00 AM,01/02/2020 12:00:00 AM,12/17/2019 12:00:00 AM,2019-003770,2019-12-27T00:00:00.000,2020-01-02T00:00:00.000,2019-12-17T00:00:00.000,Done
2015OPA-0318,Done,OPA Close CL,,03/13/2015 12:00:00 AM,10/21/2015 12:00:00 AM,,,2015-03-13T00:00:00.000,2015-10-21T00:00:00.000,Done
2016OPA-0183,Done,OPA Close SA,04/02/2016 12:00:00 AM,03/29/2016 12:00:00 AM,03/18/2016 12:00:00 AM,2016-047681,2016-04-02T00:00:00.000,2016-03-29T00:00:00.000,2016-03-18T00:00:00.000,Done
2016OPA-0417,Done,OPA Close CL,04/25/2016 12:00:00 AM,04/25/2016 12:00:00 AM,04/20/2016 12:00:00 AM,,2016-04-25T00:00:00.000,2016-04-25T00:00:00.000,2016-04-20T00:00:00.000,Done
2016OPA-1098,Done,OPA Mediation,12/01/2016 12:00:00 AM,12/08/2016 12:00:00 AM,10/05/2016 12:00:00 AM,2016-317545,2016-12-01T00:00:00.000,2016-12-08T00:00:00.000,2016-10-05T00:00:00.000,Done
2020OPA-0076,Done,OPA Close SA,,03/31/2020 12:00:00 AM,03/31/2020 12:00:00 AM,2019-333130,,2020-03-31T00:00:00.000,2020-03-31T00:00:00.000,Done
2020OPA-0130,Done,OPA Close CL,03/30/2020 12:00:00 AM,03/31/2020 12:00:00 AM,03/23/2020 12:00:00 AM,,2020-03-30T00:00:00.000,2020-03-31T00:00:00.000,2020-03-23T00:00:00.000,Done
2016OPA-1257,Done,OPA Close SA,,01/05/2017 12:00:00 AM,01/05/2017 12:00:00 AM,2016-354231,,2017-01-05T00:00:00.000,2017-01-05T00:00:00.000,Done
2017OPA-1283,Done,OPA Close Case,,02/07/2019 12:00:00 AM,02/07/2019 12:00:00 AM,2017-451414,,2019-02-07T00:00:00.000,2019-02-07T00:00:00.000,Done
2018OPA-0243,Done,OPA Chief of Police Disagreed Findings,,11/20/2018 12:00:00 AM,05/23/2019 12:00:00 AM,,,2018-11-20T00:00:00.000,2019-05-23T00:00:00.000,Done
2018OPA-0897,Done,OPA Close CL,10/07/2018 12:00:00 AM,10/19/2018 12:00:00 AM,10/02/2018 12:00:00 AM,,2018-10-07T00:00:00.000,2018-10-19T00:00:00.000,2018-10-02T00:00:00.000,Done
2016OPA-1025,Done,OPA Close CL,09/21/2016 12:00:00 AM,09/21/2016 12:00:00 AM,09/16/2016 12:00:00 AM,,2016-09-21T00:00:00.000,2016-09-21T00:00:00.000,2016-09-16T00:00:00.000,Done
2016OPA-1149,Done,OPA Close Case,03/17/2017 12:00:00 AM,03/29/2017 12:00:00 AM,03/07/2017 12:00:00 AM,2016-326110,2017-03-17T00:00:00.000,2017-03-29T00:00:00.000,2017-03-07T00:00:00.000,Done
2016OPA-1269,Done,OPA Close Case,12/28/2017 12:00:00 AM,03/13/2018 12:00:00 AM,12/18/2017 12:00:00 AM,2016-224740,2017-12-28T00:00:00.000,2018-03-13T00:00:00.000,2017-12-18T00:00:00.000,Done
2016OPA-1348,Done,OPA Close Case,06/26/2017 12:00:00 AM,07/18/2017 12:00:00 AM,06/16/2017 12:00:00 AM,2016-403852,2017-06-26T00:00:00.000,2017-07-18T00:00:00.000,2017-06-16T00:00:00.000,Done
2017OPA-0345,Done,OPA Close CL,05/20/2017 12:00:00 AM,05/15/2017 12:00:00 AM,05/15/2017 12:00:00 AM,2017-118172,2017-05-20T00:00:00.000,2017-05-15T00:00:00.000,2017-05-15T00:00:00.000,Done
2017OPA-0389,Done,OPA Send Complaint Receipt,04/21/2017 12:00:00 AM,04/17/2017 12:00:00 AM,04/17/2017 12:00:00 AM,,2017-04-21T00:00:00.000,2017-04-17T00:00:00.000,2017-04-17T00:00:00.000,Done
2018OPA-0050,Done,OPA Close SA,,03/26/2018 12:00:00 AM,03/26/2018 12:00:00 AM,,,2018-03-26T00:00:00.000,2018-03-26T00:00:00.000,Done
2016OPA-0662,Done,OPA Close SA,,09/22/2016 12:00:00 AM,09/22/2016 12:00:00 AM,2016-207894,,2016-09-22T00:00:00.000,2016-09-22T00:00:00.000,Done
2017OPA-0150,Done,OPA Close CL,03/17/2017 12:00:00 AM,03/13/2017 12:00:00 AM,03/07/2017 12:00:00 AM,,2017-03-17T00:00:00.000,2017-03-13T00:00:00.000,2017-03-07T00:00:00.000,Done
2018OPA-0395,Done,OPA Close Case,05/05/2020 12:00:00 AM,04/22/2020 12:00:00 AM,04/21/2020 12:00:00 AM,,2020-05-05T00:00:00.000,2020-04-22T00:00:00.000,2020-04-21T00:00:00.000,Done
2018OPA-0933,Done,OPA Close CL,10/20/2018 12:00:00 AM,10/19/2018 12:00:00 AM,10/15/2018 12:00:00 AM,,2018-10-20T00:00:00.000,2018-10-19T00:00:00.000,2018-10-15T00:00:00.000,Done
2015OPA-0241,Done,OPA Close CL,,03/23/2015 12:00:00 AM,10/21/2015 12:00:00 AM,,,2015-03-23T00:00:00.000,2015-10-21T00:00:00.000,Done
2016OPA-1293,Done,OPA Send Complainant Closing Letter,11/27/2016 12:00:00 AM,11/23/2016 12:00:00 AM,10/28/2016 12:00:00 AM,,2016-11-27T00:00:00.000,2016-11-23T00:00:00.000,2016-10-28T00:00:00.000,Done
2016OPA-1518,Done,OPA Close CL,01/28/2017 12:00:00 AM,01/23/2017 12:00:00 AM,01/23/2017 12:00:00 AM,2016-448998,2017-01-28T00:00:00.000,2017-01-23T00:00:00.000,2017-01-23T00:00:00.000,Done
2017OPA-0427,Done,OPA Classification,04/30/2017 12:00:00 AM,05/01/2017 12:00:00 AM,04/25/2017 12:00:00 AM,,2017-04-30T00:00:00.000,2017-05-01T00:00:00.000,2017-04-25T00:00:00.000,Done
2017OPA-1277,Done,OPA Final Discipline Action Report,,06/04/2018 12:00:00 AM,01/22/2019 12:00:00 AM,2017-452583,,2018-06-04T00:00:00.000,2019-01-22T00:00:00.000,Done
2015OPA-0404,Done,OPA Close CL,,03/27/2015 12:00:00 AM,10/20/2015 12:00:00 AM,,,2015-03-27T00:00:00.000,2015-10-20T00:00:00.000,Done
2019OPA-0301,Done,OPA Close SA,,06/20/2019 12:00:00 AM,06/20/2019 12:00:00 AM,2019-162641,,2019-06-20T00:00:00.000,2019-06-20T00:00:00.000,Done
2019OPA-0757,Done,OPA Close CL,11/05/2019 12:00:00 AM,11/07/2019 12:00:00 AM,10/29/2019 12:00:00 AM,2019-279474,2019-11-05T00:00:00.000,2019-11-07T00:00:00.000,2019-10-29T00:00:00.000,Done
2020OPA-0151,Done,OPA Close CL,03/11/2020 12:00:00 AM,03/09/2020 12:00:00 AM,03/09/2020 12:00:00 AM,,2020-03-11T00:00:00.000,2020-03-09T00:00:00.000,2020-03-09T00:00:00.000,Done
2016OPA-1416,Done,OPA Close CL,12/29/2016 12:00:00 AM,12/24/2016 12:00:00 AM,12/24/2016 12:00:00 AM,2016-431330,2016-12-29T00:00:00.000,2016-12-24T00:00:00.000,2016-12-24T00:00:00.000,Done
2017OPA-0223,Done,OPA Close Case,09/05/2017 12:00:00 AM,09/06/2017 12:00:00 AM,08/25/2017 12:00:00 AM,2017-072230,2017-09-05T00:00:00.000,2017-09-06T00:00:00.000,2017-08-25T00:00:00.000,Done
2018OPA-0031,Done,OPA Close SA,,05/10/2018 12:00:00 AM,05/10/2018 12:00:00 AM,2018-008038,,2018-05-10T00:00:00.000,2018-05-10T00:00:00.000,Done
2018OPA-0177,Done,OPA Close Case,08/06/2018 12:00:00 AM,10/03/2018 12:00:00 AM,07/27/2018 12:00:00 AM,2018-049309,2018-08-06T00:00:00.000,2018-10-03T00:00:00.000,2018-07-27T00:00:00.000,Done
2018OPA-0784,Done,OPA Close CL,08/28/2018 12:00:00 AM,08/24/2018 12:00:00 AM,08/23/2018 12:00:00 AM,,2018-08-28T00:00:00.000,2018-08-24T00:00:00.000,2018-08-23T00:00:00.000,Done
2015OPA-0735,Done,OPA Close Case,12/09/2015 12:00:00 AM,12/14/2015 12:00:00 AM,11/25/2015 12:00:00 AM,,2015-12-09T00:00:00.000,2015-12-14T00:00:00.000,2015-11-25T00:00:00.000,Done
2015OPA-1385,Done,OPA Close CL,,10/01/2015 12:00:00 AM,10/13/2015 12:00:00 AM,,,2015-10-01T00:00:00.000,2015-10-13T00:00:00.000,Done
2017OPA-0869,Done,OPA Close CL,09/24/2017 12:00:00 AM,09/20/2017 12:00:00 AM,09/19/2017 12:00:00 AM,,2017-09-24T00:00:00.000,2017-09-20T00:00:00.000,2017-09-19T00:00:00.000,Done
2018OPA-0925,Done,OPA Close Case,06/03/2019 12:00:00 AM,06/06/2019 12:00:00 AM,05/24/2019 12:00:00 AM,,2019-06-03T00:00:00.000,2019-06-06T00:00:00.000,2019-05-24T00:00:00.000,Done
2018OPA-1025,Done,OPA Close CL,11/26/2018 12:00:00 AM,12/03/2018 12:00:00 AM,11/21/2018 12:00:00 AM,2018-019098,2018-11-26T00:00:00.000,2018-12-03T00:00:00.000,2018-11-21T00:00:00.000,Done
2016OPA-0262,Done,OPA Close CL,,03/18/2016 12:00:00 AM,03/18/2016 12:00:00 AM,,,2016-03-18T00:00:00.000,2016-03-18T00:00:00.000,Done
2017OPA-0052,Done,OPA Close Case,06/04/2017 12:00:00 AM,06/13/2017 12:00:00 AM,06/13/2017 12:00:00 AM,2016-426969,2017-06-04T00:00:00.000,2017-06-13T00:00:00.000,2017-06-13T00:00:00.000,Done
2017OPA-0909,Done,OPA Training Referral,03/29/2018 12:00:00 AM,04/10/2018 12:00:00 AM,03/19/2018 12:00:00 AM,2017-327540,2018-03-29T00:00:00.000,2018-04-10T00:00:00.000,2018-03-19T00:00:00.000,Done
2018OPA-0926,Done,OPA Close CL,10/22/2018 12:00:00 AM,10/19/2018 12:00:00 AM,10/17/2018 12:00:00 AM,2018-341691,2018-10-22T00:00:00.000,2018-10-19T00:00:00.000,2018-10-17T00:00:00.000,Done
2016OPA-1460,Done,OPA Close Case,03/30/2018 12:00:00 AM,08/13/2018 12:00:00 AM,03/20/2018 12:00:00 AM,,2018-03-30T00:00:00.000,2018-08-13T00:00:00.000,2018-03-20T00:00:00.000,Done
2017OPA-0196,Done,OPA Close CL,03/25/2017 12:00:00 AM,03/21/2017 12:00:00 AM,02/23/2017 12:00:00 AM,,2017-03-25T00:00:00.000,2017-03-21T00:00:00.000,2017-02-23T00:00:00.000,Done
2019OPA-0558,Done,OPA Close CL,08/25/2019 12:00:00 AM,08/27/2019 12:00:00 AM,08/20/2019 12:00:00 AM,,2019-08-25T00:00:00.000,2019-08-27T00:00:00.000,2019-08-20T00:00:00.000,Done
2019OPA-0588,Done,OPA Close CL,09/10/2019 12:00:00 AM,09/11/2019 12:00:00 AM,09/03/2019 12:00:00 AM,2019-302290,2019-09-10T00:00:00.000,2019-09-11T00:00:00.000,2019-09-03T00:00:00.000,Done
2019OPA-0681,Done,OPA Process SA,,10/18/2019 12:00:00 AM,10/18/2019 12:00:00 AM,2019-344921,,2019-10-18T00:00:00.000,2019-10-18T00:00:00.000,Done
2017OPA-0501,Done,OPA Close Case,11/08/2017 12:00:00 AM,11/27/2017 12:00:00 AM,11/27/2017 12:00:00 AM,,2017-11-08T00:00:00.000,2017-11-27T00:00:00.000,2017-11-27T00:00:00.000,Done
2018OPA-0737,Done,OPA Close SA,,10/08/2018 12:00:00 AM,10/08/2018 12:00:00 AM,2018-262367,,2018-10-08T00:00:00.000,2018-10-08T00:00:00.000,Done
2018OPA-0810,Done,OPA Close CL,09/23/2018 12:00:00 AM,09/20/2018 12:00:00 AM,09/18/2018 12:00:00 AM,2018-277064,2018-09-23T00:00:00.000,2018-09-20T00:00:00.000,2018-09-18T00:00:00.000,Done
2018OPA-1038,Done,OPA Close SA,,12/27/2018 12:00:00 AM,12/27/2018 12:00:00 AM,2018-345822,,2018-12-27T00:00:00.000,2018-12-27T00:00:00.000,Done
2015OPA-0704,Done,OPA Close CL,,07/29/2015 12:00:00 AM,10/16/2015 12:00:00 AM,,,2015-07-29T00:00:00.000,2015-10-16T00:00:00.000,Done
2015OPA-1005,Done,OPA Close SA,09/19/2015 12:00:00 AM,09/14/2015 12:00:00 AM,09/14/2015 12:00:00 AM,2015-044517,2015-09-19T00:00:00.000,2015-09-14T00:00:00.000,2015-09-14T00:00:00.000,Done
2019OPA-0148,Done,OPA Close Case,08/17/2019 12:00:00 AM,08/27/2019 12:00:00 AM,08/07/2019 12:00:00 AM,2019-054353,2019-08-17T00:00:00.000,2019-08-27T00:00:00.000,2019-08-07T00:00:00.000,Done
2019OPA-0383,Done,OPA Close Case,02/05/2020 12:00:00 AM,01/31/2020 12:00:00 AM,01/17/2020 12:00:00 AM,,2020-02-05T00:00:00.000,2020-01-31T00:00:00.000,2020-01-17T00:00:00.000,Done
2019OPA-0601,Done,OPA Close Case,03/08/2020 12:00:00 AM,04/20/2020 12:00:00 AM,02/23/2020 12:00:00 AM,2019-305272,2020-03-08T00:00:00.000,2020-04-20T00:00:00.000,2020-02-23T00:00:00.000,Done
2016OPA-0247,Done,OPA Close CL,03/15/2016 12:00:00 AM,03/15/2016 12:00:00 AM,03/15/2016 12:00:00 AM,,2016-03-15T00:00:00.000,2016-03-15T00:00:00.000,2016-03-15T00:00:00.000,Done
2016OPA-0442,Done,OPA Close CL,05/09/2016 12:00:00 AM,05/04/2016 12:00:00 AM,05/04/2016 12:00:00 AM,,2016-05-09T00:00:00.000,2016-05-04T00:00:00.000,2016-05-04T00:00:00.000,Done
2017OPA-0299,Done,OPA Close SA,,04/20/2017 12:00:00 AM,04/20/2017 12:00:00 AM,,,2017-04-20T00:00:00.000,2017-04-20T00:00:00.000,Done
2017OPA-0456,Done,OPA Close CL,05/23/2017 12:00:00 AM,05/23/2017 12:00:00 AM,05/18/2017 12:00:00 AM,2017-153442,2017-05-23T00:00:00.000,2017-05-23T00:00:00.000,2017-05-18T00:00:00.000,Done
2018OPA-0567,Done,OPA Close Case,,06/17/2019 12:00:00 AM,01/13/2019 12:00:00 AM,,,2019-06-17T00:00:00.000,2019-01-13T00:00:00.000,Done
2019OPA-0023,Done,OPA Close CL,02/02/2019 12:00:00 AM,02/01/2019 12:00:00 AM,01/28/2019 12:00:00 AM,2019-000846,2019-02-02T00:00:00.000,2019-02-01T00:00:00.000,2019-01-28T00:00:00.000,Done
2015OPA-0332,Done,OPA Director SA Review,05/07/2015 12:00:00 AM,04/30/2015 12:00:00 AM,04/27/2015 12:00:00 AM,2015-084602,2015-05-07T00:00:00.000,2015-04-30T00:00:00.000,2015-04-27T00:00:00.000,Done
2015OPA-1080,Done,OPA Close CL,,07/29/2015 12:00:00 AM,10/16/2015 12:00:00 AM,,,2015-07-29T00:00:00.000,2015-10-16T00:00:00.000,Done
2015OPA-1587,Done,OPA Close Case,05/05/2016 12:00:00 AM,05/05/2016 12:00:00 AM,04/15/2016 12:00:00 AM,2015-366482,2016-05-05T00:00:00.000,2016-05-05T00:00:00.000,2016-04-15T00:00:00.000,Done
2016OPA-0563,Done,OPA Close CL,06/28/2016 12:00:00 AM,06/27/2016 12:00:00 AM,06/23/2016 12:00:00 AM,,2016-06-28T00:00:00.000,2016-06-27T00:00:00.000,2016-06-23T00:00:00.000,Done
2017OPA-0793,Done,OPA Close SA,,09/19/2017 12:00:00 AM,09/19/2017 12:00:00 AM,,,2017-09-19T00:00:00.000,2017-09-19T00:00:00.000,Done
2018OPA-0378,Done,OPA Close Case,09/27/2018 12:00:00 AM,10/17/2018 12:00:00 AM,09/17/2018 12:00:00 AM,2018-097165,2018-09-27T00:00:00.000,2018-10-17T00:00:00.000,2018-09-17T00:00:00.000,Done
2015OPA-0305,Done,OPA Director SA Review,04/26/2015 12:00:00 AM,04/30/2015 12:00:00 AM,04/21/2015 12:00:00 AM,,2015-04-26T00:00:00.000,2015-04-30T00:00:00.000,2015-04-21T00:00:00.000,Done
2015OPA-1076,Done,OPA Close CL,,09/03/2015 12:00:00 AM,10/15/2015 12:00:00 AM,,,2015-09-03T00:00:00.000,2015-10-15T00:00:00.000,Done
2015OPA-1340,Done,OPA Close CL,,09/22/2015 12:00:00 AM,10/14/2015 12:00:00 AM,,,2015-09-22T00:00:00.000,2015-10-14T00:00:00.000,Done
2016OPA-1472,Done,OPA Close SA,,02/01/2017 12:00:00 AM,02/01/2017 12:00:00 AM,2016-447922,,2017-02-01T00:00:00.000,2017-02-01T00:00:00.000,Done
2018OPA-0584,Done,OPA Close CL,08/28/2018 12:00:00 AM,07/18/2018 12:00:00 AM,06/29/2018 12:00:00 AM,2018-227255,2018-08-28T00:00:00.000,2018-07-18T00:00:00.000,2018-06-29T00:00:00.000,Done
2018OPA-1092,Done,OPA Training Referral,05/06/2019 12:00:00 AM,06/05/2019 12:00:00 AM,04/26/2019 12:00:00 AM,2018-394737,2019-05-06T00:00:00.000,2019-06-05T00:00:00.000,2019-04-26T00:00:00.000,Done
2015OPA-1854,Done,OPA Close Case,06/13/2016 12:00:00 AM,06/27/2016 12:00:00 AM,05/26/2016 12:00:00 AM,,2016-06-13T00:00:00.000,2016-06-27T00:00:00.000,2016-05-26T00:00:00.000,Done
2016OPA-0175,Done,OPA Close SA,04/12/2016 12:00:00 AM,04/21/2016 12:00:00 AM,04/05/2016 12:00:00 AM,2016-053645,2016-04-12T00:00:00.000,2016-04-21T00:00:00.000,2016-04-05T00:00:00.000,Done
2016OPA-0497,Done,OPA Close Case,12/09/2016 12:00:00 AM,12/09/2016 12:00:00 AM,10/21/2016 12:00:00 AM,2015-436311,2016-12-09T00:00:00.000,2016-12-09T00:00:00.000,2016-10-21T00:00:00.000,Done
2016OPA-0961,Done,OPA Close CL,09/18/2016 12:00:00 AM,09/15/2016 12:00:00 AM,09/13/2016 12:00:00 AM,2016-277782,2016-09-18T00:00:00.000,2016-09-15T00:00:00.000,2016-09-13T00:00:00.000,Done
2017OPA-0035,Done,OPA Close CL,01/28/2017 12:00:00 AM,01/25/2017 12:00:00 AM,01/18/2017 12:00:00 AM,,2017-01-28T00:00:00.000,2017-01-25T00:00:00.000,2017-01-18T00:00:00.000,Done
2016OPA-0823,Done,OPA Send Complainant Closing Letter,08/10/2016 12:00:00 AM,08/12/2016 12:00:00 AM,08/05/2016 12:00:00 AM,,2016-08-10T00:00:00.000,2016-08-12T00:00:00.000,2016-08-05T00:00:00.000,Done
2017OPA-0481,Done,OPA Missed 180 Day Deadline,08/20/2017 12:00:00 AM,03/30/2020 12:00:00 AM,01/14/2019 12:00:00 AM,2016-062644,2017-08-20T00:00:00.000,2020-03-30T00:00:00.000,2019-01-14T00:00:00.000,Done
2017OPA-0332,Done,OPA Training Referral,10/08/2017 12:00:00 AM,10/10/2017 12:00:00 AM,10/02/2017 12:00:00 AM,2017-111662,2017-10-08T00:00:00.000,2017-10-10T00:00:00.000,2017-10-02T00:00:00.000,Done
2016OPA-0648,Done,OPA Close SA,,08/30/2016 12:00:00 AM,08/30/2016 12:00:00 AM,2016-206773,,2016-08-30T00:00:00.000,2016-08-30T00:00:00.000,Done
2016OPA-0711,Done,OPA Close Case,01/20/2017 12:00:00 AM,01/24/2017 12:00:00 AM,01/10/2017 12:00:00 AM,2016-067996,2017-01-20T00:00:00.000,2017-01-24T00:00:00.000,2017-01-10T00:00:00.000,Done
2017OPA-0436,Done,OPA Close CL,05/24/2017 12:00:00 AM,05/26/2017 12:00:00 AM,05/19/2017 12:00:00 AM,,2017-05-24T00:00:00.000,2017-05-26T00:00:00.000,2017-05-19T00:00:00.000,Done
2017OPA-1137,Done,OPA Director Certification/Finding,04/26/2018 12:00:00 AM,04/06/2018 12:00:00 AM,01/29/2019 12:00:00 AM,,2018-04-26T00:00:00.000,2018-04-06T00:00:00.000,2019-01-29T00:00:00.000,Done
2019OPA-0614,Done,OPA Close Case,03/08/2020 12:00:00 AM,04/20/2020 12:00:00 AM,02/23/2020 12:00:00 AM,2019-253196,2020-03-08T00:00:00.000,2020-04-20T00:00:00.000,2020-02-23T00:00:00.000,Done
2016OPA-0703,Done,OPA Send Complainant Closing Letter,08/01/2016 12:00:00 AM,07/28/2016 12:00:00 AM,07/27/2016 12:00:00 AM,,2016-08-01T00:00:00.000,2016-07-28T00:00:00.000,2016-07-27T00:00:00.000,Done
2016OPA-1314,Done,OPA Close CL,12/05/2016 12:00:00 AM,12/07/2016 12:00:00 AM,11/30/2016 12:00:00 AM,,2016-12-05T00:00:00.000,2016-12-07T00:00:00.000,2016-11-30T00:00:00.000,Done
2018OPA-1091,Done,OPA Close Case,05/19/2019 12:00:00 AM,06/11/2019 12:00:00 AM,05/09/2019 12:00:00 AM,,2019-05-19T00:00:00.000,2019-06-11T00:00:00.000,2019-05-09T00:00:00.000,Done
2019OPA-0152,Done,OPA Close CL,03/26/2019 12:00:00 AM,03/25/2019 12:00:00 AM,03/21/2019 12:00:00 AM,,2019-03-26T00:00:00.000,2019-03-25T00:00:00.000,2019-03-21T00:00:00.000,Done
2019OPA-0315,Done,OPA Close CL,06/08/2019 12:00:00 AM,06/11/2019 12:00:00 AM,06/03/2019 12:00:00 AM,2019-169294,2019-06-08T00:00:00.000,2019-06-11T00:00:00.000,2019-06-03T00:00:00.000,Done
2019OPA-0555,Done,OPA Close Case,03/08/2020 12:00:00 AM,04/20/2020 12:00:00 AM,02/23/2020 12:00:00 AM,2019-286505,2020-03-08T00:00:00.000,2020-04-20T00:00:00.000,2020-02-23T00:00:00.000,Done
2015OPA-0757,Done,OPA Close SA,07/25/2015 12:00:00 AM,07/21/2015 12:00:00 AM,07/20/2015 12:00:00 AM,2015-173870,2015-07-25T00:00:00.000,2015-07-21T00:00:00.000,2015-07-20T00:00:00.000,Done
2015OPA-1368,Done,OPA Close SA,10/20/2015 12:00:00 AM,06/02/2016 12:00:00 AM,04/29/2016 12:00:00 AM,,2015-10-20T00:00:00.000,2016-06-02T00:00:00.000,2016-04-29T00:00:00.000,Done
2016OPA-1054,Done,OPA Close CL,09/19/2016 12:00:00 AM,09/16/2016 12:00:00 AM,09/14/2016 12:00:00 AM,,2016-09-19T00:00:00.000,2016-09-16T00:00:00.000,2016-09-14T00:00:00.000,Done
2018OPA-0879,Done,OPA Close SA,,11/02/2018 12:00:00 AM,11/02/2018 12:00:00 AM,2018-311985,,2018-11-02T00:00:00.000,2018-11-02T00:00:00.000,Done
2019OPA-0296,Done,OPA Close SA,,07/16/2019 12:00:00 AM,07/16/2019 12:00:00 AM,,,2019-07-16T00:00:00.000,2019-07-16T00:00:00.000,Done
2019OPA-0675,Done,OPA Close Case,,02/27/2020 12:00:00 AM,01/30/2020 12:00:00 AM,2019-340163,,2020-02-27T00:00:00.000,2020-01-30T00:00:00.000,Done
2017OPA-0017,Done,OPA Close CL,01/23/2017 12:00:00 AM,01/23/2017 12:00:00 AM,01/18/2017 12:00:00 AM,,2017-01-23T00:00:00.000,2017-01-23T00:00:00.000,2017-01-18T00:00:00.000,Done
2017OPA-0242,Done,OPA Close Case,08/23/2017 12:00:00 AM,08/31/2017 12:00:00 AM,08/22/2017 12:00:00 AM,2017-075226,2017-08-23T00:00:00.000,2017-08-31T00:00:00.000,2017-08-22T00:00:00.000,Done
2018OPA-0078,Done,OPA Close Case,07/29/2018 12:00:00 AM,10/02/2018 12:00:00 AM,07/19/2018 12:00:00 AM,2018-023766,2018-07-29T00:00:00.000,2018-10-02T00:00:00.000,2018-07-19T00:00:00.000,Done
2018OPA-0102,Done,OPA Close CL,02/28/2018 12:00:00 AM,02/01/2018 12:00:00 AM,01/30/2018 12:00:00 AM,,2018-02-28T00:00:00.000,2018-02-01T00:00:00.000,2018-01-30T00:00:00.000,Done
2018OPA-0202,Done,OPA Close SA,,11/07/2018 12:00:00 AM,11/07/2018 12:00:00 AM,,,2018-11-07T00:00:00.000,2018-11-07T00:00:00.000,Done
2018OPA-0635,Done,OPA Close Case,01/23/2019 12:00:00 AM,01/22/2019 12:00:00 AM,01/13/2019 12:00:00 AM,2018-238520,2019-01-23T00:00:00.000,2019-01-22T00:00:00.000,2019-01-13T00:00:00.000,Done
2015OPA-0576,Done,OPA Close Case,12/22/2015 12:00:00 AM,12/23/2015 12:00:00 AM,12/16/2015 12:00:00 AM,,2015-12-22T00:00:00.000,2015-12-23T00:00:00.000,2015-12-16T00:00:00.000,Done
2015OPA-0986,Done,OPA Close CL,,07/10/2015 12:00:00 AM,10/16/2015 12:00:00 AM,,,2015-07-10T00:00:00.000,2015-10-16T00:00:00.000,Done
2016OPA-0467,Done,OPA Close CL,05/22/2016 12:00:00 AM,05/24/2016 12:00:00 AM,05/17/2016 12:00:00 AM,,2016-05-22T00:00:00.000,2016-05-24T00:00:00.000,2016-05-17T00:00:00.000,Done
2016OPA-0631,Done,OPA Close CL,07/11/2016 12:00:00 AM,07/08/2016 12:00:00 AM,07/06/2016 12:00:00 AM,,2016-07-11T00:00:00.000,2016-07-08T00:00:00.000,2016-07-06T00:00:00.000,Done
2018OPA-0284,Done,OPA Close SA,,05/22/2018 12:00:00 AM,05/22/2018 12:00:00 AM,,,2018-05-22T00:00:00.000,2018-05-22T00:00:00.000,Done
2018OPA-0871,Done,OPA Close CL,10/09/2018 12:00:00 AM,10/04/2018 12:00:00 AM,10/04/2018 12:00:00 AM,2018-332650,2018-10-09T00:00:00.000,2018-10-04T00:00:00.000,2018-10-04T00:00:00.000,Done
2018OPA-1077,Done,OPA Close CL,12/15/2018 12:00:00 AM,12/10/2018 12:00:00 AM,12/10/2018 12:00:00 AM,,2018-12-15T00:00:00.000,2018-12-10T00:00:00.000,2018-12-10T00:00:00.000,Done
2019OPA-0107,Done,OPA Close Case,08/19/2019 12:00:00 AM,09/19/2019 12:00:00 AM,08/09/2019 12:00:00 AM,2019-040130,2019-08-19T00:00:00.000,2019-09-19T00:00:00.000,2019-08-09T00:00:00.000,Done
2019OPA-0299,Done,OPA Close CL,06/04/2019 12:00:00 AM,06/06/2019 12:00:00 AM,05/30/2019 12:00:00 AM,,2019-06-04T00:00:00.000,2019-06-06T00:00:00.000,2019-05-30T00:00:00.000,Done
2015OPA-1027,Done,OPA Close SA,09/14/2015 12:00:00 AM,09/09/2015 12:00:00 AM,09/09/2015 12:00:00 AM,,2015-09-14T00:00:00.000,2015-09-09T00:00:00.000,2015-09-09T00:00:00.000,Done
2016OPA-0617,Done,OPA Close SA,08/11/2016 12:00:00 AM,07/27/2016 12:00:00 AM,07/27/2016 12:00:00 AM,,2016-08-11T00:00:00.000,2016-07-27T00:00:00.000,2016-07-27T00:00:00.000,Done
2016OPA-0946,Done,OPA Classification,09/14/2016 12:00:00 AM,09/12/2016 12:00:00 AM,09/09/2016 12:00:00 AM,,2016-09-14T00:00:00.000,2016-09-12T00:00:00.000,2016-09-09T00:00:00.000,Done
2016OPA-1410,Done,OPA Close SA,,02/02/2017 12:00:00 AM,02/02/2017 12:00:00 AM,,,2017-02-02T00:00:00.000,2017-02-02T00:00:00.000,Done
2018OPA-0369,Done,OPA Close CL,05/20/2018 12:00:00 AM,05/31/2018 12:00:00 AM,05/15/2018 12:00:00 AM,,2018-05-20T00:00:00.000,2018-05-31T00:00:00.000,2018-05-15T00:00:00.000,Done
2015OPA-0250,Done,OPA Close CL,,03/12/2015 12:00:00 AM,10/22/2015 12:00:00 AM,,,2015-03-12T00:00:00.000,2015-10-22T00:00:00.000,Done
2015OPA-0495,Done,OPA Close CL,,04/14/2015 12:00:00 AM,10/20/2015 12:00:00 AM,,,2015-04-14T00:00:00.000,2015-10-20T00:00:00.000,Done
2015OPA-0840,Done,OPA Close Case,12/09/2015 12:00:00 AM,12/14/2015 12:00:00 AM,11/25/2015 12:00:00 AM,,2015-12-09T00:00:00.000,2015-12-14T00:00:00.000,2015-11-25T00:00:00.000,Done
2015OPA-1867,Done,OPA Close SA,01/31/2016 12:00:00 AM,01/26/2016 12:00:00 AM,01/26/2016 12:00:00 AM,2015-242410,2016-01-31T00:00:00.000,2016-01-26T00:00:00.000,2016-01-26T00:00:00.000,Done
2017OPA-0565,Done,OPA Close Case,01/05/2018 12:00:00 AM,04/09/2018 12:00:00 AM,12/26/2017 12:00:00 AM,2017-190956,2018-01-05T00:00:00.000,2018-04-09T00:00:00.000,2017-12-26T00:00:00.000,Done
2019OPA-0221,Done,OPA Close CL,05/14/2019 12:00:00 AM,05/14/2019 12:00:00 AM,05/09/2019 12:00:00 AM,,2019-05-14T00:00:00.000,2019-05-14T00:00:00.000,2019-05-09T00:00:00.000,Done
2019OPA-0280,Done,OPA Management Action,09/13/2019 12:00:00 AM,11/01/2019 12:00:00 AM,10/08/2019 12:00:00 AM,2019-068888,2019-09-13T00:00:00.000,2019-11-01T00:00:00.000,2019-10-08T00:00:00.000,Done
2020OPA-0163,Done,OPA Close SA,,03/31/2020 12:00:00 AM,03/31/2020 12:00:00 AM,2020-057295,,2020-03-31T00:00:00.000,2020-03-31T00:00:00.000,Done
2015OPA-0385,Done,OPA Director SA Review,05/31/2015 12:00:00 AM,06/17/2015 12:00:00 AM,05/26/2015 12:00:00 AM,2015-093350,2015-05-31T00:00:00.000,2015-06-17T00:00:00.000,2015-05-26T00:00:00.000,Done
2016OPA-0511,Done,OPA Close Case,03/17/2017 12:00:00 AM,03/14/2017 12:00:00 AM,03/07/2017 12:00:00 AM,2016-168830,2017-03-17T00:00:00.000,2017-03-14T00:00:00.000,2017-03-07T00:00:00.000,Done
2016OPA-0870,Done,OPA Close Case,01/21/2017 12:00:00 AM,01/23/2017 12:00:00 AM,01/11/2017 12:00:00 AM,,2017-01-21T00:00:00.000,2017-01-23T00:00:00.000,2017-01-11T00:00:00.000,Done
2016OPA-1226,Done,OPA Send Complainant Closing Letter,11/05/2016 12:00:00 AM,10/10/2016 12:00:00 AM,10/06/2016 12:00:00 AM,,2016-11-05T00:00:00.000,2016-10-10T00:00:00.000,2016-10-06T00:00:00.000,Done
2017OPA-0379,Done,OPA Close CL,05/13/2017 12:00:00 AM,05/01/2017 12:00:00 AM,04/14/2017 12:00:00 AM,,2017-05-13T00:00:00.000,2017-05-01T00:00:00.000,2017-04-14T00:00:00.000,Done
2015OPA-1818,Done,OPA Close Case,06/13/2016 12:00:00 AM,06/24/2016 12:00:00 AM,05/13/2016 12:00:00 AM,2015-408554,2016-06-13T00:00:00.000,2016-06-24T00:00:00.000,2016-05-13T00:00:00.000,Done
2015OPA-0234,Done,OPA SA Review,04/11/2015 12:00:00 AM,04/13/2015 12:00:00 AM,04/06/2015 12:00:00 AM,,2015-04-11T00:00:00.000,2015-04-13T00:00:00.000,2015-04-06T00:00:00.000,Done
2015OPA-0965,Done,OPA Close SA,08/22/2015 12:00:00 AM,08/19/2015 12:00:00 AM,08/17/2015 12:00:00 AM,2015-160968,2015-08-22T00:00:00.000,2015-08-19T00:00:00.000,2015-08-17T00:00:00.000,Done
2015OPA-1619,Done,OPA Close Case,05/13/2016 12:00:00 AM,05/13/2016 12:00:00 AM,04/15/2016 12:00:00 AM,2015-382669,2016-05-13T00:00:00.000,2016-05-13T00:00:00.000,2016-04-15T00:00:00.000,Done
2016OPA-0984,Done,OPA Close CL,08/31/2016 12:00:00 AM,08/29/2016 12:00:00 AM,08/26/2016 12:00:00 AM,,2016-08-31T00:00:00.000,2016-08-29T00:00:00.000,2016-08-26T00:00:00.000,Done
2016OPA-1061,Done,OPA Close SA,,10/27/2016 12:00:00 AM,10/27/2016 12:00:00 AM,,,2016-10-27T00:00:00.000,2016-10-27T00:00:00.000,Done
2018OPA-0760,Done,OPA Close Case,02/02/2019 12:00:00 AM,02/07/2019 12:00:00 AM,01/23/2019 12:00:00 AM,2018-289419,2019-02-02T00:00:00.000,2019-02-07T00:00:00.000,2019-01-23T00:00:00.000,Done
2018OPA-0918,Done,OPA Close SA,,10/29/2018 12:00:00 AM,10/29/2018 12:00:00 AM,2018-308701,,2018-10-29T00:00:00.000,2018-10-29T00:00:00.000,Done
2019OPA-0062,Done,OPA Close SA,,02/27/2019 12:00:00 AM,02/27/2019 12:00:00 AM,,,2019-02-27T00:00:00.000,2019-02-27T00:00:00.000,Done
2019OPA-0351,Done,OPA Close Case,12/01/2019 12:00:00 AM,12/10/2019 12:00:00 AM,11/21/2019 12:00:00 AM,2019-098802,2019-12-01T00:00:00.000,2019-12-10T00:00:00.000,2019-11-21T00:00:00.000,Done
2015OPA-0888,Done,OPA Close Case,12/09/2015 12:00:00 AM,12/14/2015 12:00:00 AM,11/25/2015 12:00:00 AM,,2015-12-09T00:00:00.000,2015-12-14T00:00:00.000,2015-11-25T00:00:00.000,Done
2015OPA-1113,Done,OPA Close SA,09/16/2015 12:00:00 AM,09/14/2015 12:00:00 AM,09/11/2015 12:00:00 AM,,2015-09-16T00:00:00.000,2015-09-14T00:00:00.000,2015-09-11T00:00:00.000,Done
2015OPA-1768,Done,OPA Close SA,01/16/2016 12:00:00 AM,01/12/2016 12:00:00 AM,01/11/2016 12:00:00 AM,,2016-01-16T00:00:00.000,2016-01-12T00:00:00.000,2016-01-11T00:00:00.000,Done
2016OPA-0402,Done,OPA Close CL,05/16/2016 12:00:00 AM,05/16/2016 12:00:00 AM,05/11/2016 12:00:00 AM,,2016-05-16T00:00:00.000,2016-05-16T00:00:00.000,2016-05-11T00:00:00.000,Done
2017OPA-0269,Done,OPA Close CL,03/20/2017 12:00:00 AM,03/16/2017 12:00:00 AM,03/15/2017 12:00:00 AM,,2017-03-20T00:00:00.000,2017-03-16T00:00:00.000,2017-03-15T00:00:00.000,Done
2018OPA-0364,Done,OPA Close SA,,06/26/2018 12:00:00 AM,06/26/2018 12:00:00 AM,,,2018-06-26T00:00:00.000,2018-06-26T00:00:00.000,Done
2019OPA-0077,Done,OPA Director Certification/Finding,,01/21/2020 12:00:00 AM,01/28/2020 12:00:00 AM,,,2020-01-21T00:00:00.000,2020-01-28T00:00:00.000,Done
2015OPA-0715,Done,OPA Close CL,,09/25/2015 12:00:00 AM,10/14/2015 12:00:00 AM,,,2015-09-25T00:00:00.000,2015-10-14T00:00:00.000,Done
2016OPA-0793,Done,OPA Close Case,01/25/2019 12:00:00 AM,02/06/2019 12:00:00 AM,01/15/2019 12:00:00 AM,2016-246766,2019-01-25T00:00:00.000,2019-02-06T00:00:00.000,2019-01-15T00:00:00.000,Done
2016OPA-1524,Done,OPA Close CL,01/14/2017 12:00:00 AM,01/10/2017 12:00:00 AM,01/04/2017 12:00:00 AM,,2017-01-14T00:00:00.000,2017-01-10T00:00:00.000,2017-01-04T00:00:00.000,Done
2020OPA-0054,Done,OPA Close CL,02/12/2020 12:00:00 AM,02/13/2020 12:00:00 AM,02/05/2020 12:00:00 AM,,2020-02-12T00:00:00.000,2020-02-13T00:00:00.000,2020-02-05T00:00:00.000,Done
2018OPA-0714,Done,OPA Close CL,08/27/2018 12:00:00 AM,08/24/2018 12:00:00 AM,08/22/2018 12:00:00 AM,2018-280928,2018-08-27T00:00:00.000,2018-08-24T00:00:00.000,2018-08-22T00:00:00.000,Done
2019OPA-0035,Done,OPA Close SA,,03/11/2019 12:00:00 AM,03/11/2019 12:00:00 AM,,,2019-03-11T00:00:00.000,2019-03-11T00:00:00.000,Done
2019OPA-0377,Done,OPA Close Case,12/12/2019 12:00:00 AM,12/19/2019 12:00:00 AM,12/02/2019 12:00:00 AM,,2019-12-12T00:00:00.000,2019-12-19T00:00:00.000,2019-12-02T00:00:00.000,Done
2015OPA-0033,Done,OPA Close CL,,01/26/2015 12:00:00 AM,10/23/2015 12:00:00 AM,,,2015-01-26T00:00:00.000,2015-10-23T00:00:00.000,Done
2015OPA-0380,Done,OPA Director SA Review,05/07/2015 12:00:00 AM,04/29/2015 12:00:00 AM,04/27/2015 12:00:00 AM,,2015-05-07T00:00:00.000,2015-04-29T00:00:00.000,2015-04-27T00:00:00.000,Done
2015OPA-1218,Done,OPA Close CL,,08/27/2015 12:00:00 AM,10/15/2015 12:00:00 AM,,,2015-08-27T00:00:00.000,2015-10-15T00:00:00.000,Done
2015OPA-1324,Done,OPA SA Review,10/30/2015 12:00:00 AM,04/27/2016 12:00:00 AM,10/15/2015 12:00:00 AM,,2015-10-30T00:00:00.000,2016-04-27T00:00:00.000,2015-10-15T00:00:00.000,Done
2019OPA-0454,Done,OPA Intake Review,07/23/2019 12:00:00 AM,07/24/2019 12:00:00 AM,07/02/2019 12:00:00 AM,,2019-07-23T00:00:00.000,2019-07-24T00:00:00.000,2019-07-02T00:00:00.000,Done
2018OPA-1056,Done,OPA Close Case,05/16/2019 12:00:00 AM,02/13/2020 12:00:00 AM,05/06/2019 12:00:00 AM,2018-143566,2019-05-16T00:00:00.000,2020-02-13T00:00:00.000,2019-05-06T00:00:00.000,Done
2019OPA-0137,Done,OPA Close CL,03/13/2019 12:00:00 AM,03/14/2019 12:00:00 AM,03/08/2019 12:00:00 AM,,2019-03-13T00:00:00.000,2019-03-14T00:00:00.000,2019-03-08T00:00:00.000,Done
2019OPA-0294,Done,OPA Close Case,12/19/2019 12:00:00 AM,12/19/2019 12:00:00 AM,12/09/2019 12:00:00 AM,,2019-12-19T00:00:00.000,2019-12-19T00:00:00.000,2019-12-09T00:00:00.000,Done
2018OPA-0514,Done,OPA Training Referral,,03/13/2019 12:00:00 AM,03/13/2019 12:00:00 AM,2018-209659,,2019-03-13T00:00:00.000,2019-03-13T00:00:00.000,Done
2018OPA-0685,Done,OPA Close SA,,09/26/2018 12:00:00 AM,09/26/2018 12:00:00 AM,2018-273589,,2018-09-26T00:00:00.000,2018-09-26T00:00:00.000,Done
2018OPA-0742,Done,OPA Close Case,04/04/2020 12:00:00 AM,04/15/2020 12:00:00 AM,03/25/2020 12:00:00 AM,2018-108882,2020-04-04T00:00:00.000,2020-04-15T00:00:00.000,2020-03-25T00:00:00.000,Done
2018OPA-0917,Done,OPA Send Complainant Closing Letter,10/06/2018 12:00:00 AM,10/02/2018 12:00:00 AM,10/01/2018 12:00:00 AM,2018-335270,2018-10-06T00:00:00.000,2018-10-02T00:00:00.000,2018-10-01T00:00:00.000,Done
2018OPA-1021,Done,OPA Close SA,,12/18/2018 12:00:00 AM,12/18/2018 12:00:00 AM,2018-399208,,2018-12-18T00:00:00.000,2018-12-18T00:00:00.000,Done
2016OPA-0324,Done,OPA Close CL,05/03/2016 12:00:00 AM,05/02/2016 12:00:00 AM,04/28/2016 12:00:00 AM,,2016-05-03T00:00:00.000,2016-05-02T00:00:00.000,2016-04-28T00:00:00.000,Done
2017OPA-0033,Done,OPA Close SA,,03/27/2017 12:00:00 AM,03/27/2017 12:00:00 AM,,,2017-03-27T00:00:00.000,2017-03-27T00:00:00.000,Done
2017OPA-0635,Done,OPA Close Case,12/22/2017 12:00:00 AM,03/12/2018 12:00:00 AM,12/12/2017 12:00:00 AM,2017-196897,2017-12-22T00:00:00.000,2018-03-12T00:00:00.000,2017-12-12T00:00:00.000,Done
2018OPA-0180,Done,OPA Close Case,08/30/2018 12:00:00 AM,10/10/2018 12:00:00 AM,08/20/2018 12:00:00 AM,2018-069218,2018-08-30T00:00:00.000,2018-10-10T00:00:00.000,2018-08-20T00:00:00.000,Done
2018OPA-0231,Done,OPA Director Certification/Finding,06/30/2018 12:00:00 AM,06/30/2018 12:00:00 AM,01/17/2019 12:00:00 AM,2018-000098,2018-06-30T00:00:00.000,2018-06-30T00:00:00.000,2019-01-17T00:00:00.000,Done
2017OPA-1116,Done,OPA Close CL,11/26/2017 12:00:00 AM,11/09/2017 12:00:00 AM,10/30/2017 12:00:00 AM,,2017-11-26T00:00:00.000,2017-11-09T00:00:00.000,2017-10-30T00:00:00.000,Done
2019OPA-0633,Done,OPA SA Review,10/16/2019 12:00:00 AM,10/29/2019 12:00:00 AM,10/01/2019 12:00:00 AM,2019-315016,2019-10-16T00:00:00.000,2019-10-29T00:00:00.000,2019-10-01T00:00:00.000,Done
2015OPA-0068,Done,OPA Close Case,07/28/2015 12:00:00 AM,07/28/2015 12:00:00 AM,07/14/2015 12:00:00 AM,2014-334095,2015-07-28T00:00:00.000,2015-07-28T00:00:00.000,2015-07-14T00:00:00.000,Done
2015OPA-0291,Done,OPA Send Closing Letter,04/12/2016 12:00:00 AM,04/08/2016 12:00:00 AM,04/07/2016 12:00:00 AM,,2016-04-12T00:00:00.000,2016-04-08T00:00:00.000,2016-04-07T00:00:00.000,Done
2015OPA-1064,Done,OPA Close CL,,07/23/2015 12:00:00 AM,10/16/2015 12:00:00 AM,,,2015-07-23T00:00:00.000,2015-10-16T00:00:00.000,Done
2017OPA-0577,Done,OPA Close SA,,07/25/2017 12:00:00 AM,07/25/2017 12:00:00 AM,,,2017-07-25T00:00:00.000,2017-07-25T00:00:00.000,Done
2018OPA-0326,Done,OPA Training Referral,,10/25/2018 12:00:00 AM,03/11/2019 12:00:00 AM,2018-126813,,2018-10-25T00:00:00.000,2019-03-11T00:00:00.000,Done
2018OPA-1008,Done,OPA Close CL,11/21/2018 12:00:00 AM,11/20/2018 12:00:00 AM,11/16/2018 12:00:00 AM,,2018-11-21T00:00:00.000,2018-11-20T00:00:00.000,2018-11-16T00:00:00.000,Done
2015OPA-0004,Done,OPA Director SA Review,03/07/2015 12:00:00 AM,03/11/2015 12:00:00 AM,03/02/2015 12:00:00 AM,2014-429696,2015-03-07T00:00:00.000,2015-03-11T00:00:00.000,2015-03-02T00:00:00.000,Done
2016OPA-0114,Done,OPA Close Case,01/28/2017 12:00:00 AM,02/06/2017 12:00:00 AM,01/18/2017 12:00:00 AM,2016-041056,2017-01-28T00:00:00.000,2017-02-06T00:00:00.000,2017-01-18T00:00:00.000,Done
2016OPA-0880,Done,OPA Close CL,08/31/2016 12:00:00 AM,08/29/2016 12:00:00 AM,08/26/2016 12:00:00 AM,,2016-08-31T00:00:00.000,2016-08-29T00:00:00.000,2016-08-26T00:00:00.000,Done
2017OPA-1198,Done,OPA Send Complainant Closing Letter,12/17/2017 12:00:00 AM,12/13/2017 12:00:00 AM,11/17/2017 12:00:00 AM,,2017-12-17T00:00:00.000,2017-12-13T00:00:00.000,2017-11-17T00:00:00.000,Done
2018OPA-0237,Done,OPA Close Case,01/20/2019 12:00:00 AM,01/22/2019 12:00:00 AM,01/10/2019 12:00:00 AM,2017-098117,2019-01-20T00:00:00.000,2019-01-22T00:00:00.000,2019-01-10T00:00:00.000,Done
2019OPA-0327,Done,OPA Close Case,11/11/2019 12:00:00 AM,11/18/2019 12:00:00 AM,10/28/2019 12:00:00 AM,2019-157636,2019-11-11T00:00:00.000,2019-11-18T00:00:00.000,2019-10-28T00:00:00.000,Done
2019OPA-0544,Done,OPA Close Case,03/08/2020 12:00:00 AM,04/20/2020 12:00:00 AM,02/23/2020 12:00:00 AM,,2020-03-08T00:00:00.000,2020-04-20T00:00:00.000,2020-02-23T00:00:00.000,Done
2015OPA-0185,Done,OPA Close CL,,03/05/2015 12:00:00 AM,10/22/2015 12:00:00 AM,2015-045074,,2015-03-05T00:00:00.000,2015-10-22T00:00:00.000,Done
2016OPA-1014,Done,OPA Close CL,09/28/2016 12:00:00 AM,09/20/2016 12:00:00 AM,08/24/2016 12:00:00 AM,,2016-09-28T00:00:00.000,2016-09-20T00:00:00.000,2016-08-24T00:00:00.000,Done
2017OPA-1074,Done,OPA Final Discipline Action Report,,04/05/2018 12:00:00 AM,01/22/2019 12:00:00 AM,2017-373961,,2018-04-05T00:00:00.000,2019-01-22T00:00:00.000,Done
2019OPA-0034,Done,OPA Close Case,04/23/2020 12:00:00 AM,04/21/2020 12:00:00 AM,04/13/2020 12:00:00 AM,,2020-04-23T00:00:00.000,2020-04-21T00:00:00.000,2020-04-13T00:00:00.000,Done
2019OPA-0583,Done,OPA Close CL,09/06/2019 12:00:00 AM,09/04/2019 12:00:00 AM,08/30/2019 12:00:00 AM,,2019-09-06T00:00:00.000,2019-09-04T00:00:00.000,2019-08-30T00:00:00.000,Done
2015OPA-0058,Done,OPA Close CL,,01/26/2015 12:00:00 AM,10/23/2015 12:00:00 AM,,,2015-01-26T00:00:00.000,2015-10-23T00:00:00.000,Done
2015OPA-1332,Done,OPA Close SA,01/12/2016 12:00:00 AM,01/08/2016 12:00:00 AM,01/07/2016 12:00:00 AM,2015-259046,2016-01-12T00:00:00.000,2016-01-08T00:00:00.000,2016-01-07T00:00:00.000,Done
2016OPA-0976,Done,OPA Close CL,09/18/2016 12:00:00 AM,09/18/2016 12:00:00 AM,09/13/2016 12:00:00 AM,,2016-09-18T00:00:00.000,2016-09-18T00:00:00.000,2016-09-13T00:00:00.000,Done
2019OPA-0433,Done,OPA Close SA,,09/13/2019 12:00:00 AM,09/13/2019 12:00:00 AM,2019-133464,,2019-09-13T00:00:00.000,2019-09-13T00:00:00.000,Done
2019OPA-0651,Done,OPA Close Case,03/18/2020 12:00:00 AM,04/21/2020 12:00:00 AM,03/04/2020 12:00:00 AM,2019-330100,2020-03-18T00:00:00.000,2020-04-21T00:00:00.000,2020-03-04T00:00:00.000,Done
2017OPA-0679,Done,OPA Close Case,01/14/2018 12:00:00 AM,04/13/2018 12:00:00 AM,01/04/2018 12:00:00 AM,2017-244999,2018-01-14T00:00:00.000,2018-04-13T00:00:00.000,2018-01-04T00:00:00.000,Done
2017OPA-0780,Done,OPA Close CL,08/07/2017 12:00:00 AM,08/22/2017 12:00:00 AM,08/02/2017 12:00:00 AM,,2017-08-07T00:00:00.000,2017-08-22T00:00:00.000,2017-08-02T00:00:00.000,Done
2018OPA-0020,Done,OPA Close Case,06/01/2018 12:00:00 AM,09/10/2018 12:00:00 AM,05/22/2018 12:00:00 AM,2017-374877,2018-06-01T00:00:00.000,2018-09-10T00:00:00.000,2018-05-22T00:00:00.000,Done
2015OPA-1364,Done,OPA Close SA,10/26/2015 12:00:00 AM,10/21/2015 12:00:00 AM,10/21/2015 12:00:00 AM,,2015-10-26T00:00:00.000,2015-10-21T00:00:00.000,2015-10-21T00:00:00.000,Done
2015OPA-1640,Done,OPA Close CL,11/30/2015 12:00:00 AM,11/30/2015 12:00:00 AM,11/25/2015 12:00:00 AM,2015-208523,2015-11-30T00:00:00.000,2015-11-30T00:00:00.000,2015-11-25T00:00:00.000,Done
2015OPA-1891,Done,OPA Close SA,04/12/2016 12:00:00 AM,04/08/2016 12:00:00 AM,04/07/2016 12:00:00 AM,2015-435909,2016-04-12T00:00:00.000,2016-04-08T00:00:00.000,2016-04-07T00:00:00.000,Done
2017OPA-0087,Done,OPA Close Case,07/31/2017 12:00:00 AM,08/08/2017 12:00:00 AM,07/21/2017 12:00:00 AM,2016-273284,2017-07-31T00:00:00.000,2017-08-08T00:00:00.000,2017-07-21T00:00:00.000,Done
2020OPA-0228,Done,OPA Investigation Planning,05/08/2020 12:00:00 AM,05/04/2020 12:00:00 AM,05/02/2020 12:00:00 AM,2020-124550,2020-05-08T00:00:00.000,2020-05-04T00:00:00.000,2020-05-02T00:00:00.000,Done
2017OPA-1144,Done,OPA Close SA,,03/26/2018 12:00:00 AM,03/26/2018 12:00:00 AM,2017-402392,,2018-03-26T00:00:00.000,2018-03-26T00:00:00.000,Done
2017OPA-1280,Done,OPA Close Case,06/17/2018 12:00:00 AM,08/24/2018 12:00:00 AM,06/07/2018 12:00:00 AM,2017-454386,2018-06-17T00:00:00.000,2018-08-24T00:00:00.000,2018-06-07T00:00:00.000,Done
2018OPA-1156,Done,OPA Training Referral,07/23/2019 12:00:00 AM,07/17/2019 12:00:00 AM,07/08/2019 12:00:00 AM,,2019-07-23T00:00:00.000,2019-07-17T00:00:00.000,2019-07-08T00:00:00.000,Done
2019OPA-0658,Done,OPA Close CL,10/08/2019 12:00:00 AM,10/11/2019 12:00:00 AM,10/01/2019 12:00:00 AM,,2019-10-08T00:00:00.000,2019-10-11T00:00:00.000,2019-10-01T00:00:00.000,Done
2020OPA-0079,Done,OPA Close CL,02/25/2020 12:00:00 AM,02/25/2020 12:00:00 AM,02/18/2020 12:00:00 AM,,2020-02-25T00:00:00.000,2020-02-25T00:00:00.000,2020-02-18T00:00:00.000,Done
2015OPA-0629,Done,OPA SA Review,07/18/2015 12:00:00 AM,07/21/2015 12:00:00 AM,07/08/2015 12:00:00 AM,,2015-07-18T00:00:00.000,2015-07-21T00:00:00.000,2015-07-08T00:00:00.000,Done
2015OPA-1436,Done,OPA Close Case,10/21/2016 12:00:00 AM,10/21/2016 12:00:00 AM,10/17/2016 12:00:00 AM,,2016-10-21T00:00:00.000,2016-10-21T00:00:00.000,2016-10-17T00:00:00.000,Done
2015OPA-1790,Done,OPA Close CL,11/28/2015 12:00:00 AM,11/30/2015 12:00:00 AM,11/23/2015 12:00:00 AM,,2015-11-28T00:00:00.000,2015-11-30T00:00:00.000,2015-11-23T00:00:00.000,Done
2016OPA-1412,Done,OPA Training Referral,05/20/2017 12:00:00 AM,05/21/2017 12:00:00 AM,05/26/2017 12:00:00 AM,2016-404746,2017-05-20T00:00:00.000,2017-05-21T00:00:00.000,2017-05-26T00:00:00.000,Done
2017OPA-0533,Done,OPA Close SA,,07/17/2017 12:00:00 AM,07/17/2017 12:00:00 AM,,,2017-07-17T00:00:00.000,2017-07-17T00:00:00.000,Done
2017OPA-1234,Done,OPA Close SA,,03/06/2018 12:00:00 AM,03/06/2018 12:00:00 AM,2017-254396,,2018-03-06T00:00:00.000,2018-03-06T00:00:00.000,Done
2018OPA-0735,Done,OPA Close Case,06/27/2019 12:00:00 AM,07/01/2019 12:00:00 AM,06/17/2019 12:00:00 AM,,2019-06-27T00:00:00.000,2019-07-01T00:00:00.000,2019-06-17T00:00:00.000,Done
2015OPA-0981,Done,OPA Close CL,,07/10/2015 12:00:00 AM,10/16/2015 12:00:00 AM,,,2015-07-10T00:00:00.000,2015-10-16T00:00:00.000,Done
2015OPA-1546,Done,OPA Close CL,,10/27/2015 12:00:00 AM,10/27/2015 12:00:00 AM,,,2015-10-27T00:00:00.000,2015-10-27T00:00:00.000,Done
2018OPA-0131,Done,OPA Close SA,,04/12/2018 12:00:00 AM,04/12/2018 12:00:00 AM,,,2018-04-12T00:00:00.000,2018-04-12T00:00:00.000,Done
2018OPA-0154,Done,OPA Close Case,08/23/2018 12:00:00 AM,10/10/2018 12:00:00 AM,08/13/2018 12:00:00 AM,2018-055275,2018-08-23T00:00:00.000,2018-10-10T00:00:00.000,2018-08-13T00:00:00.000,Done
2018OPA-0727,Done,OPA Close CL,08/26/2018 12:00:00 AM,08/24/2018 12:00:00 AM,08/21/2018 12:00:00 AM,,2018-08-26T00:00:00.000,2018-08-24T00:00:00.000,2018-08-21T00:00:00.000,Done
2018OPA-1179,Done,OPA Close CL,01/15/2019 12:00:00 AM,01/14/2019 12:00:00 AM,01/10/2019 12:00:00 AM,2018-079708,2019-01-15T00:00:00.000,2019-01-14T00:00:00.000,2019-01-10T00:00:00.000,Done
2017OPA-0758,Done,OPA Close CL,08/26/2017 12:00:00 AM,08/02/2017 12:00:00 AM,07/27/2017 12:00:00 AM,2017-249229,2017-08-26T00:00:00.000,2017-08-02T00:00:00.000,2017-07-27T00:00:00.000,Done
2017OPA-1034,Done,OPA Close Case,11/03/2017 12:00:00 AM,10/30/2017 12:00:00 AM,10/24/2017 12:00:00 AM,2017-296735,2017-11-03T00:00:00.000,2017-10-30T00:00:00.000,2017-10-24T00:00:00.000,Done
2015OPA-1740,Done,OPA Close SA,02/02/2016 12:00:00 AM,01/28/2016 12:00:00 AM,01/28/2016 12:00:00 AM,,2016-02-02T00:00:00.000,2016-01-28T00:00:00.000,2016-01-28T00:00:00.000,Done
2015OPA-1858,Done,OPA Close CL,12/23/2015 12:00:00 AM,12/21/2015 12:00:00 AM,12/18/2015 12:00:00 AM,,2015-12-23T00:00:00.000,2015-12-21T00:00:00.000,2015-12-18T00:00:00.000,Done
2016OPA-0205,Done,OPA Close CL,03/23/2016 12:00:00 AM,03/23/2016 12:00:00 AM,03/23/2016 12:00:00 AM,2016-065191,2016-03-23T00:00:00.000,2016-03-23T00:00:00.000,2016-03-23T00:00:00.000,Done
2018OPA-0767,Done,OPA Close CL,08/26/2018 12:00:00 AM,08/22/2018 12:00:00 AM,08/21/2018 12:00:00 AM,,2018-08-26T00:00:00.000,2018-08-22T00:00:00.000,2018-08-21T00:00:00.000,Done
2015OPA-1816,Done,OPA Close CL,12/23/2015 12:00:00 AM,12/21/2015 12:00:00 AM,12/18/2015 12:00:00 AM,,2015-12-23T00:00:00.000,2015-12-21T00:00:00.000,2015-12-18T00:00:00.000,Done
2017OPA-0384,Done,OPA Close Case,10/04/2017 12:00:00 AM,10/13/2017 12:00:00 AM,09/28/2017 12:00:00 AM,2017-122549,2017-10-04T00:00:00.000,2017-10-13T00:00:00.000,2017-09-28T00:00:00.000,Done
2018OPA-0316,Done,OPA Close Case,03/30/2019 12:00:00 AM,05/06/2019 12:00:00 AM,03/20/2019 12:00:00 AM,2018-105488,2019-03-30T00:00:00.000,2019-05-06T00:00:00.000,2019-03-20T00:00:00.000,Done
2019OPA-0326,Done,OPA Close SA,,06/19/2019 12:00:00 AM,06/19/2019 12:00:00 AM,2019-173521,,2019-06-19T00:00:00.000,2019-06-19T00:00:00.000,Done
2020OPA-0114,Done,OPA Close CL,03/18/2020 12:00:00 AM,03/23/2020 12:00:00 AM,03/13/2020 12:00:00 AM,,2020-03-18T00:00:00.000,2020-03-23T00:00:00.000,2020-03-13T00:00:00.000,Done
2015OPA-0198,Done,OPA SA Review,03/29/2015 12:00:00 AM,04/03/2015 12:00:00 AM,03/24/2015 12:00:00 AM,,2015-03-29T00:00:00.000,2015-04-03T00:00:00.000,2015-03-24T00:00:00.000,Done
2015OPA-0935,Done,OPA Close SA,09/06/2015 12:00:00 AM,09/02/2015 12:00:00 AM,09/01/2015 12:00:00 AM,2014-178069,2015-09-06T00:00:00.000,2015-09-02T00:00:00.000,2015-09-01T00:00:00.000,Done
2015OPA-1420,Done,OPA Close CL,,10/06/2015 12:00:00 AM,10/13/2015 12:00:00 AM,,,2015-10-06T00:00:00.000,2015-10-13T00:00:00.000,Done
2019OPA-0082,Done,OPA Close CL,02/20/2019 12:00:00 AM,02/20/2019 12:00:00 AM,02/15/2019 12:00:00 AM,,2019-02-20T00:00:00.000,2019-02-20T00:00:00.000,2019-02-15T00:00:00.000,Done
2019OPA-0895,Done,OPA Close CL,12/28/2019 12:00:00 AM,12/26/2019 12:00:00 AM,12/18/2019 12:00:00 AM,,2019-12-28T00:00:00.000,2019-12-26T00:00:00.000,2019-12-18T00:00:00.000,Done
2016OPA-0627,Done,OPA Close CL,07/13/2016 12:00:00 AM,07/08/2016 12:00:00 AM,07/08/2016 12:00:00 AM,2016-152746,2016-07-13T00:00:00.000,2016-07-08T00:00:00.000,2016-07-08T00:00:00.000,Done
2016OPA-1089,Done,OPA Close CL,10/09/2016 12:00:00 AM,10/10/2016 12:00:00 AM,10/04/2016 12:00:00 AM,2016-252396,2016-10-09T00:00:00.000,2016-10-10T00:00:00.000,2016-10-04T00:00:00.000,Done
2016OPA-1392,Done,OPA Close CL,12/12/2016 12:00:00 AM,12/16/2016 12:00:00 AM,12/07/2016 12:00:00 AM,,2016-12-12T00:00:00.000,2016-12-16T00:00:00.000,2016-12-07T00:00:00.000,Done
2017OPA-0885,Done,OPA Close CL,09/28/2017 12:00:00 AM,08/31/2017 12:00:00 AM,08/29/2017 12:00:00 AM,,2017-09-28T00:00:00.000,2017-08-31T00:00:00.000,2017-08-29T00:00:00.000,Done
2017OPA-1154,Done,OPA Close Case,04/13/2018 12:00:00 AM,08/08/2018 12:00:00 AM,04/03/2018 12:00:00 AM,,2018-04-13T00:00:00.000,2018-08-08T00:00:00.000,2018-04-03T00:00:00.000,Done
2015OPA-0217,Done,OPA Close CL,,03/20/2015 12:00:00 AM,10/22/2015 12:00:00 AM,,,2015-03-20T00:00:00.000,2015-10-22T00:00:00.000,Done
2015OPA-0944,Done,OPA Close SA,09/21/2015 12:00:00 AM,09/17/2015 12:00:00 AM,09/16/2015 12:00:00 AM,,2015-09-21T00:00:00.000,2015-09-17T00:00:00.000,2015-09-16T00:00:00.000,Done
2016OPA-0605,Done,OPA Close CL,07/04/2016 12:00:00 AM,06/29/2016 12:00:00 AM,06/29/2016 12:00:00 AM,,2016-07-04T00:00:00.000,2016-06-29T00:00:00.000,2016-06-29T00:00:00.000,Done
2016OPA-0923,Done,OPA Close SA,,10/17/2016 12:00:00 AM,10/14/2016 12:00:00 AM,,,2016-10-17T00:00:00.000,2016-10-14T00:00:00.000,Done
2017OPA-0363,Done,OPA Close SA,,06/05/2017 12:00:00 AM,06/05/2017 12:00:00 AM,2017-035102,,2017-06-05T00:00:00.000,2017-06-05T00:00:00.000,Done
2016OPA-0171,Done,OPA Close CL,04/02/2016 12:00:00 AM,03/29/2016 12:00:00 AM,03/28/2016 12:00:00 AM,2016-051171,2016-04-02T00:00:00.000,2016-03-29T00:00:00.000,2016-03-28T00:00:00.000,Done
2016OPA-0295,Done,OPA Close SA,04/15/2016 12:00:00 AM,05/16/2016 12:00:00 AM,03/31/2016 12:00:00 AM,,2016-04-15T00:00:00.000,2016-05-16T00:00:00.000,2016-03-31T00:00:00.000,Done
2016OPA-0496,Done,OPA Close Case,02/06/2017 12:00:00 AM,02/06/2017 12:00:00 AM,01/27/2017 12:00:00 AM,2016-154987,2017-02-06T00:00:00.000,2017-02-06T00:00:00.000,2017-01-27T00:00:00.000,Done
2016OPA-1275,Done,OPA Close SA,,03/13/2017 12:00:00 AM,03/13/2017 12:00:00 AM,,,2017-03-13T00:00:00.000,2017-03-13T00:00:00.000,Done
2018OPA-1134,Done,OPA Close Case,06/22/2019 12:00:00 AM,06/12/2019 12:00:00 AM,06/12/2019 12:00:00 AM,2018-307950,2019-06-22T00:00:00.000,2019-06-12T00:00:00.000,2019-06-12T00:00:00.000,Done
2019OPA-0318,Done,OPA Close Case,11/29/2019 12:00:00 AM,12/12/2020 12:00:00 AM,11/19/2019 12:00:00 AM,,2019-11-29T00:00:00.000,2020-12-12T00:00:00.000,2019-11-19T00:00:00.000,Done
2020OPA-0202,Done,OPA Process SA,,04/23/2020 12:00:00 AM,04/23/2020 12:00:00 AM,,,2020-04-23T00:00:00.000,2020-04-23T00:00:00.000,Done
2015OPA-0363,Done,OPA Director SA Review,04/27/2015 12:00:00 AM,05/13/2015 12:00:00 AM,04/22/2015 12:00:00 AM,,2015-04-27T00:00:00.000,2015-05-13T00:00:00.000,2015-04-22T00:00:00.000,Done
2016OPA-0485,Done,OPA Director Certification/Finding,10/25/2016 12:00:00 AM,10/24/2016 12:00:00 AM,01/30/2019 12:00:00 AM,,2016-10-25T00:00:00.000,2016-10-24T00:00:00.000,2019-01-30T00:00:00.000,Done
2016OPA-0586,Done,OPA Close SA,,09/13/2016 12:00:00 AM,09/12/2016 12:00:00 AM,2016-190708,,2016-09-13T00:00:00.000,2016-09-12T00:00:00.000,Done
2016OPA-0754,Done,OPA Director Certification/Finding,12/06/2016 12:00:00 AM,12/05/2016 12:00:00 AM,01/30/2019 12:00:00 AM,,2016-12-06T00:00:00.000,2016-12-05T00:00:00.000,2019-01-30T00:00:00.000,Done
2019OPA-0029,Done,OPA Close SA,,04/04/2019 12:00:00 AM,04/04/2019 12:00:00 AM,,,2019-04-04T00:00:00.000,2019-04-04T00:00:00.000,Done
2020OPA-0154,Done,OPA 180 Extension Request,08/27/2020 12:00:00 AM,09/26/2020 12:00:00 AM,04/04/2020 12:00:00 AM,2020-075579,2020-08-27T00:00:00.000,2020-09-26T00:00:00.000,2020-04-04T00:00:00.000,Done
2016OPA-1245,Done,OPA Send Complainant Closing Letter,11/10/2016 12:00:00 AM,10/21/2016 12:00:00 AM,10/11/2016 12:00:00 AM,,2016-11-10T00:00:00.000,2016-10-21T00:00:00.000,2016-10-11T00:00:00.000,Done
2016OPA-1446,Done,OPA Close SA,,02/17/2017 12:00:00 AM,02/17/2017 12:00:00 AM,,,2017-02-17T00:00:00.000,2017-02-17T00:00:00.000,Done
2017OPA-0317,Done,OPA Close Case,09/15/2017 12:00:00 AM,09/28/2017 12:00:00 AM,09/15/2017 12:00:00 AM,2017-099772,2017-09-15T00:00:00.000,2017-09-28T00:00:00.000,2017-09-15T00:00:00.000,Done
2018OPA-0119,Done,OPA Close Case,08/12/2018 12:00:00 AM,10/08/2018 12:00:00 AM,08/02/2018 12:00:00 AM,,2018-08-12T00:00:00.000,2018-10-08T00:00:00.000,2018-08-02T00:00:00.000,Done
2015OPA-0376,Done,OPA Director SA Review,05/05/2015 12:00:00 AM,05/20/2015 12:00:00 AM,04/30/2015 12:00:00 AM,2015-068407,2015-05-05T00:00:00.000,2015-05-20T00:00:00.000,2015-04-30T00:00:00.000,Done
2015OPA-1159,Done,OPA Close CL,10/24/2015 12:00:00 AM,10/19/2015 12:00:00 AM,10/19/2015 12:00:00 AM,2015-267145,2015-10-24T00:00:00.000,2015-10-19T00:00:00.000,2015-10-19T00:00:00.000,Done
2016OPA-0778,Done,OPA Close Case,12/12/2016 12:00:00 AM,12/12/2016 12:00:00 AM,12/02/2016 12:00:00 AM,2016-201855,2016-12-12T00:00:00.000,2016-12-12T00:00:00.000,2016-12-02T00:00:00.000,Done
2018OPA-0765,Done,OPA Close Case,01/18/2019 12:00:00 AM,02/05/2019 12:00:00 AM,01/08/2019 12:00:00 AM,2018-261888,2019-01-18T00:00:00.000,2019-02-05T00:00:00.000,2019-01-08T00:00:00.000,Done
2018OPA-0955,Done,OPA Close CL,10/28/2018 12:00:00 AM,10/25/2018 12:00:00 AM,10/23/2018 12:00:00 AM,2016-259516,2018-10-28T00:00:00.000,2018-10-25T00:00:00.000,2018-10-23T00:00:00.000,Done
2015OPA-0353,Done,OPA Close CL,,03/25/2015 12:00:00 AM,10/21/2015 12:00:00 AM,,,2015-03-25T00:00:00.000,2015-10-21T00:00:00.000,Done
2015OPA-1623,Done,OPA Close CL,11/15/2015 12:00:00 AM,11/12/2015 12:00:00 AM,11/10/2015 12:00:00 AM,2015-321585,2015-11-15T00:00:00.000,2015-11-12T00:00:00.000,2015-11-10T00:00:00.000,Done
2016OPA-1405,Done,OPA Missed 180 Day Deadline,05/07/2017 12:00:00 AM,03/27/2020 12:00:00 AM,10/16/2019 12:00:00 AM,2016-404602,2017-05-07T00:00:00.000,2020-03-27T00:00:00.000,2019-10-16T00:00:00.000,Done
2018OPA-0039,Done,OPA SA Review,10/30/2018 12:00:00 AM,12/13/2018 12:00:00 AM,02/13/2018 12:00:00 AM,2017-440493,2018-10-30T00:00:00.000,2018-12-13T00:00:00.000,2018-02-13T00:00:00.000,Done
2018OPA-0333,Done,OPA Close CL,05/14/2018 12:00:00 AM,05/14/2018 12:00:00 AM,05/09/2018 12:00:00 AM,,2018-05-14T00:00:00.000,2018-05-14T00:00:00.000,2018-05-09T00:00:00.000,Done
2018OPA-0565,Done,OPA Close SA,,09/10/2018 12:00:00 AM,09/10/2018 12:00:00 AM,2018-227164,,2018-09-10T00:00:00.000,2018-09-10T00:00:00.000,Done
2018OPA-1169,Done,OPA Close CL,01/21/2019 12:00:00 AM,01/28/2019 12:00:00 AM,01/16/2019 12:00:00 AM,,2019-01-21T00:00:00.000,2019-01-28T00:00:00.000,2019-01-16T00:00:00.000,Done
2015OPA-0345,Done,OPA Close Case,09/29/2015 12:00:00 AM,09/30/2015 12:00:00 AM,09/15/2015 12:00:00 AM,2015-086654,2015-09-29T00:00:00.000,2015-09-30T00:00:00.000,2015-09-15T00:00:00.000,Done
2015OPA-0918,Done,OPA Close SA,07/25/2015 12:00:00 AM,07/21/2015 12:00:00 AM,07/20/2015 12:00:00 AM,2015-064245,2015-07-25T00:00:00.000,2015-07-21T00:00:00.000,2015-07-20T00:00:00.000,Done
2015OPA-1117,Done,OPA Close CL,,08/09/2015 12:00:00 AM,10/15/2015 12:00:00 AM,,,2015-08-09T00:00:00.000,2015-10-15T00:00:00.000,Done
2016OPA-0292,Done,OPA Close Case,12/07/2016 12:00:00 AM,12/07/2016 12:00:00 AM,11/22/2016 12:00:00 AM,2015-345377,2016-12-07T00:00:00.000,2016-12-07T00:00:00.000,2016-11-22T00:00:00.000,Done
2016OPA-0934,Done,OPA Close SA,,09/15/2016 12:00:00 AM,09/15/2016 12:00:00 AM,2016-118147,,2016-09-15T00:00:00.000,2016-09-15T00:00:00.000,Done
2018OPA-0590,Done,OPA Close SA,,10/05/2018 12:00:00 AM,10/05/2018 12:00:00 AM,2018-238228,,2018-10-05T00:00:00.000,2018-10-05T00:00:00.000,Done
2018OPA-0960,Done,OPA Close Case,,01/11/2019 12:00:00 AM,01/11/2019 12:00:00 AM,2018-366739,,2019-01-11T00:00:00.000,2019-01-11T00:00:00.000,Done
2018OPA-1161,Done,OPA Close SA,,02/28/2019 12:00:00 AM,02/28/2019 12:00:00 AM,2018-450576,,2019-02-28T00:00:00.000,2019-02-28T00:00:00.000,Done
2019OPA-0591,Done,OPA Close CL,09/16/2019 12:00:00 AM,09/12/2019 12:00:00 AM,09/09/2019 12:00:00 AM,2018-221195,2019-09-16T00:00:00.000,2019-09-12T00:00:00.000,2019-09-09T00:00:00.000,Done
2015OPA-0769,Done,OPA Training Referral,05/27/2016 12:00:00 AM,05/26/2016 12:00:00 AM,05/05/2016 12:00:00 AM,2015-178671,2016-05-27T00:00:00.000,2016-05-26T00:00:00.000,2016-05-05T00:00:00.000,Done
2015OPA-1172,Done,OPA Close CL,,08/27/2015 12:00:00 AM,10/15/2015 12:00:00 AM,,,2015-08-27T00:00:00.000,2015-10-15T00:00:00.000,Done
2015OPA-1723,Done,OPA Close SA,12/19/2015 12:00:00 AM,12/15/2015 12:00:00 AM,12/14/2015 12:00:00 AM,,2015-12-19T00:00:00.000,2015-12-15T00:00:00.000,2015-12-14T00:00:00.000,Done
2016OPA-0134,Done,OPA Close Case,08/15/2016 12:00:00 AM,08/15/2016 12:00:00 AM,08/05/2016 12:00:00 AM,,2016-08-15T00:00:00.000,2016-08-15T00:00:00.000,2016-08-05T00:00:00.000,Done
2020OPA-0145,Done,OPA Close Case,04/10/2020 12:00:00 AM,04/22/2020 12:00:00 AM,03/25/2020 12:00:00 AM,2020-072307,2020-04-10T00:00:00.000,2020-04-22T00:00:00.000,2020-03-25T00:00:00.000,Done
2017OPA-0047,Done,OPA Close SA,,03/21/2017 12:00:00 AM,03/21/2017 12:00:00 AM,,,2017-03-21T00:00:00.000,2017-03-21T00:00:00.000,Done
2017OPA-1260,Done,OPA Close SA,,03/06/2018 12:00:00 AM,03/06/2018 12:00:00 AM,2017-437174,,2018-03-06T00:00:00.000,2018-03-06T00:00:00.000,Done
2018OPA-0356,Done,OPA Training Referral,,10/27/2018 12:00:00 AM,03/11/2019 12:00:00 AM,2018-130285,,2018-10-27T00:00:00.000,2019-03-11T00:00:00.000,Done
2018OPA-0470,Done,OPA Close SA,08/02/2018 12:00:00 AM,07/23/2018 12:00:00 AM,07/23/2018 12:00:00 AM,2018-162575,2018-08-02T00:00:00.000,2018-07-23T00:00:00.000,2018-07-23T00:00:00.000,Done
2018OPA-0557,Done,OPA Close SA,,11/19/2018 12:00:00 AM,11/19/2018 12:00:00 AM,,,2018-11-19T00:00:00.000,2018-11-19T00:00:00.000,Done
2018OPA-0958,Done,OPA Send Complaint Receipt,10/03/2018 12:00:00 AM,10/02/2018 12:00:00 AM,10/02/2018 12:00:00 AM,2018-365483,2018-10-03T00:00:00.000,2018-10-02T00:00:00.000,2018-10-02T00:00:00.000,Done
2015OPA-0024,Done,OPA Director SA Review,02/16/2015 12:00:00 AM,02/18/2015 12:00:00 AM,02/11/2015 12:00:00 AM,2014-241242,2015-02-16T00:00:00.000,2015-02-18T00:00:00.000,2015-02-11T00:00:00.000,Done
2015OPA-0952,Done,OPA Close SA,09/21/2015 12:00:00 AM,09/17/2015 12:00:00 AM,09/16/2015 12:00:00 AM,,2015-09-21T00:00:00.000,2015-09-17T00:00:00.000,2015-09-16T00:00:00.000,Done
2015OPA-1171,Done,OPA Close Case,02/11/2016 12:00:00 AM,02/23/2016 12:00:00 AM,01/22/2016 12:00:00 AM,2015-260211,2016-02-11T00:00:00.000,2016-02-23T00:00:00.000,2016-01-22T00:00:00.000,Done
2016OPA-0026,Done,OPA Close Case,08/05/2016 12:00:00 AM,08/08/2016 12:00:00 AM,07/29/2016 12:00:00 AM,,2016-08-05T00:00:00.000,2016-08-08T00:00:00.000,2016-07-29T00:00:00.000,Done
2016OPA-0953,Done,OPA Close CL,08/31/2016 12:00:00 AM,08/29/2016 12:00:00 AM,08/26/2016 12:00:00 AM,,2016-08-31T00:00:00.000,2016-08-29T00:00:00.000,2016-08-26T00:00:00.000,Done
2020OPA-0116,Done,OPA 180 Extension Request,09/16/2020 12:00:00 AM,10/16/2020 12:00:00 AM,04/04/2020 12:00:00 AM,,2020-09-16T00:00:00.000,2020-10-16T00:00:00.000,2020-04-04T00:00:00.000,Done
2017OPA-0470,Done,OPA Close CL,05/30/2017 12:00:00 AM,06/01/2017 12:00:00 AM,05/25/2017 12:00:00 AM,2015-262466,2017-05-30T00:00:00.000,2017-06-01T00:00:00.000,2017-05-25T00:00:00.000,Done
2018OPA-0460,Done,OPA Close Case,08/16/2018 12:00:00 AM,10/10/2018 12:00:00 AM,08/06/2018 12:00:00 AM,2018-051198,2018-08-16T00:00:00.000,2018-10-10T00:00:00.000,2018-08-06T00:00:00.000,Done
2019OPA-0058,Done,OPA Close Case,07/15/2019 12:00:00 AM,07/10/2019 12:00:00 AM,07/05/2019 12:00:00 AM,2019-013647,2019-07-15T00:00:00.000,2019-07-10T00:00:00.000,2019-07-05T00:00:00.000,Done
2019OPA-0510,Done,OPA Close SA,,10/01/2019 12:00:00 AM,10/01/2019 12:00:00 AM,2019-265755,,2019-10-01T00:00:00.000,2019-10-01T00:00:00.000,Done
2019OPA-0876,Done,OPA Close CL,12/14/2019 12:00:00 AM,12/12/2019 12:00:00 AM,12/09/2019 12:00:00 AM,,2019-12-14T00:00:00.000,2019-12-12T00:00:00.000,2019-12-09T00:00:00.000,Done
2015OPA-0906,Done,OPA Close SA,08/19/2015 12:00:00 AM,08/14/2015 12:00:00 AM,08/14/2015 12:00:00 AM,2015-198928,2015-08-19T00:00:00.000,2015-08-14T00:00:00.000,2015-08-14T00:00:00.000,Done
2015OPA-0787,Done,OPA Close CL,,07/21/2015 12:00:00 AM,07/28/2015 12:00:00 AM,2014-307258,,2015-07-21T00:00:00.000,2015-07-28T00:00:00.000,Done
2016OPA-1496,Done,OPA Close SA,,02/15/2017 12:00:00 AM,02/15/2017 12:00:00 AM,2016-457367,,2017-02-15T00:00:00.000,2017-02-15T00:00:00.000,Done
2017OPA-0599,Done,OPA Close CL,07/18/2017 12:00:00 AM,07/06/2017 12:00:00 AM,06/19/2017 12:00:00 AM,,2017-07-18T00:00:00.000,2017-07-06T00:00:00.000,2017-06-19T00:00:00.000,Done
2017OPA-1083,Done,OPA Close SA,,05/10/2018 12:00:00 AM,05/10/2018 12:00:00 AM,2017-359704,,2018-05-10T00:00:00.000,2018-05-10T00:00:00.000,Done
2019OPA-0282,Done,OPA Close Case,11/11/2019 12:00:00 AM,11/21/2019 12:00:00 AM,10/28/2019 12:00:00 AM,2018-319870,2019-11-11T00:00:00.000,2019-11-21T00:00:00.000,2019-10-28T00:00:00.000,Done
2015OPA-0106,Done,OPA Director SA Review,03/16/2015 12:00:00 AM,03/20/2015 12:00:00 AM,03/11/2015 12:00:00 AM,2014-263589,2015-03-16T00:00:00.000,2015-03-20T00:00:00.000,2015-03-11T00:00:00.000,Done
2015OPA-0263,Done,OPA Close SA,,12/29/2015 12:00:00 AM,12/29/2015 12:00:00 AM,,,2015-12-29T00:00:00.000,2015-12-29T00:00:00.000,Done
2016OPA-0038,Done,OPA Close CL,02/07/2016 12:00:00 AM,02/03/2016 12:00:00 AM,02/02/2016 12:00:00 AM,,2016-02-07T00:00:00.000,2016-02-03T00:00:00.000,2016-02-02T00:00:00.000,Done
2017OPA-1115,Done,OPA Close CL,11/04/2017 12:00:00 AM,10/31/2017 12:00:00 AM,10/27/2017 12:00:00 AM,,2017-11-04T00:00:00.000,2017-10-31T00:00:00.000,2017-10-27T00:00:00.000,Done
2018OPA-0241,Done,OPA Close Case,03/02/2018 12:00:00 AM,03/19/2018 12:00:00 AM,03/19/2018 12:00:00 AM,,2018-03-02T00:00:00.000,2018-03-19T00:00:00.000,2018-03-19T00:00:00.000,Done
2018OPA-0448,Done,OPA Close CL,06/25/2018 12:00:00 AM,06/21/2018 12:00:00 AM,06/20/2018 12:00:00 AM,,2018-06-25T00:00:00.000,2018-06-21T00:00:00.000,2018-06-20T00:00:00.000,Done
2015OPA-0090,Done,OPA Close CL,,01/26/2015 12:00:00 AM,10/23/2015 12:00:00 AM,,,2015-01-26T00:00:00.000,2015-10-23T00:00:00.000,Done
2019OPA-0615,Done,OPA Close CL,09/20/2019 12:00:00 AM,09/18/2019 12:00:00 AM,09/13/2019 12:00:00 AM,2019-312349,2019-09-20T00:00:00.000,2019-09-18T00:00:00.000,2019-09-13T00:00:00.000,Done
2020OPA-0191,Done,OPA OIG Certification,04/08/2020 12:00:00 AM,04/10/2020 12:00:00 AM,04/01/2020 12:00:00 AM,,2020-04-08T00:00:00.000,2020-04-10T00:00:00.000,2020-04-01T00:00:00.000,Done
2016OPA-0669,Done,OPA Close Case,01/28/2017 12:00:00 AM,01/28/2017 12:00:00 AM,01/18/2017 12:00:00 AM,,2017-01-28T00:00:00.000,2017-01-28T00:00:00.000,2017-01-18T00:00:00.000,Done
2016OPA-1023,Done,OPA Close CL,09/12/2016 12:00:00 AM,09/12/2016 12:00:00 AM,09/07/2016 12:00:00 AM,,2016-09-12T00:00:00.000,2016-09-12T00:00:00.000,2016-09-07T00:00:00.000,Done
2017OPA-0024,Done,OPA Close CL,02/01/2017 12:00:00 AM,01/27/2017 12:00:00 AM,01/27/2017 12:00:00 AM,2017-008762,2017-02-01T00:00:00.000,2017-01-27T00:00:00.000,2017-01-27T00:00:00.000,Done
2018OPA-0338,Done,OPA Close CL,05/12/2018 12:00:00 AM,05/09/2018 12:00:00 AM,05/07/2018 12:00:00 AM,,2018-05-12T00:00:00.000,2018-05-09T00:00:00.000,2018-05-07T00:00:00.000,Done
2018OPA-1117,Done,OPA Close Case,03/09/2019 12:00:00 AM,02/27/2019 12:00:00 AM,02/27/2019 12:00:00 AM,,2019-03-09T00:00:00.000,2019-02-27T00:00:00.000,2019-02-27T00:00:00.000,Done
2019OPA-0599,Done,OPA Close CL,09/01/2019 12:00:00 AM,09/06/2019 12:00:00 AM,08/27/2019 12:00:00 AM,,2019-09-01T00:00:00.000,2019-09-06T00:00:00.000,2019-08-27T00:00:00.000,Done
2016OPA-0671,Done,OPA Close SA,,10/24/2016 12:00:00 AM,10/24/2016 12:00:00 AM,,,2016-10-24T00:00:00.000,2016-10-24T00:00:00.000,Done
2016OPA-0847,Done,OPA Close CL,09/13/2016 12:00:00 AM,09/12/2016 12:00:00 AM,09/08/2016 12:00:00 AM,,2016-09-13T00:00:00.000,2016-09-12T00:00:00.000,2016-09-08T00:00:00.000,Done
2020OPA-0206,To do,OPA 180 Timeline Calculation,03/16/2020 12:00:00 AM,09/12/2020 12:00:00 AM,04/27/2020 12:00:00 AM,2020-094360,2020-03-16T00:00:00.000,2020-09-12T00:00:00.000,2020-04-27T00:00:00.000,To do
2016OPA-1529,Done,OPA Close CL,01/09/2017 12:00:00 AM,01/10/2017 12:00:00 AM,01/04/2017 12:00:00 AM,,2017-01-09T00:00:00.000,2017-01-10T00:00:00.000,2017-01-04T00:00:00.000,Done
2017OPA-0029,Done,OPA Close CL,01/23/2017 12:00:00 AM,01/25/2017 12:00:00 AM,01/18/2017 12:00:00 AM,,2017-01-23T00:00:00.000,2017-01-25T00:00:00.000,2017-01-18T00:00:00.000,Done
2018OPA-1146,Done,OPA Close Case,05/09/2019 12:00:00 AM,05/03/2019 12:00:00 AM,04/29/2019 12:00:00 AM,2018-435623,2019-05-09T00:00:00.000,2019-05-03T00:00:00.000,2019-04-29T00:00:00.000,Done
2019OPA-0245,Done,OPA Close Case,09/20/2019 12:00:00 AM,09/24/2019 12:00:00 AM,09/10/2019 12:00:00 AM,2019-067015,2019-09-20T00:00:00.000,2019-09-24T00:00:00.000,2019-09-10T00:00:00.000,Done
2019OPA-0444,Done,OPA Close CL,07/20/2019 12:00:00 AM,07/18/2019 12:00:00 AM,07/15/2019 12:00:00 AM,2019-233286,2019-07-20T00:00:00.000,2019-07-18T00:00:00.000,2019-07-15T00:00:00.000,Done
2015OPA-0037,Done,OPA Close CL,,01/26/2015 12:00:00 AM,10/23/2015 12:00:00 AM,,,2015-01-26T00:00:00.000,2015-10-23T00:00:00.000,Done
2016OPA-0144,Done,OPA Close SA,04/07/2016 12:00:00 AM,07/28/2016 12:00:00 AM,03/23/2016 12:00:00 AM,2016-047797,2016-04-07T00:00:00.000,2016-07-28T00:00:00.000,2016-03-23T00:00:00.000,Done
2016OPA-0512,Done,OPA Close CL,06/08/2016 12:00:00 AM,06/07/2016 12:00:00 AM,06/03/2016 12:00:00 AM,,2016-06-08T00:00:00.000,2016-06-07T00:00:00.000,2016-06-03T00:00:00.000,Done
2016OPA-1495,Done,OPA Close CL,01/02/2017 12:00:00 AM,12/28/2016 12:00:00 AM,12/21/2016 12:00:00 AM,,2017-01-02T00:00:00.000,2016-12-28T00:00:00.000,2016-12-21T00:00:00.000,Done
2019OPA-0640,Done,OPA Close CL,09/26/2019 12:00:00 AM,09/26/2019 12:00:00 AM,09/19/2019 12:00:00 AM,,2019-09-26T00:00:00.000,2019-09-26T00:00:00.000,2019-09-19T00:00:00.000,Done
2019OPA-0851,Done,OPA Close Case,02/18/2020 12:00:00 AM,04/14/2020 12:00:00 AM,02/08/2020 12:00:00 AM,2019-428283,2020-02-18T00:00:00.000,2020-04-14T00:00:00.000,2020-02-08T00:00:00.000,Done
2016OPA-1114,Done,OPA Close Case,03/04/2017 12:00:00 AM,03/16/2017 12:00:00 AM,02/22/2017 12:00:00 AM,,2017-03-04T00:00:00.000,2017-03-16T00:00:00.000,2017-02-22T00:00:00.000,Done
2017OPA-0076,Done,OPA Close CL,02/18/2017 12:00:00 AM,08/17/2017 12:00:00 AM,02/07/2017 12:00:00 AM,,2017-02-18T00:00:00.000,2017-08-17T00:00:00.000,2017-02-07T00:00:00.000,Done
2017OPA-0830,Done,OPA Close SA,,10/06/2017 12:00:00 AM,10/06/2017 12:00:00 AM,,,2017-10-06T00:00:00.000,2017-10-06T00:00:00.000,Done
2015OPA-0520,Done,OPA Director SA Review,05/07/2015 12:00:00 AM,04/30/2015 12:00:00 AM,04/27/2015 12:00:00 AM,,2015-05-07T00:00:00.000,2015-04-30T00:00:00.000,2015-04-27T00:00:00.000,Done
2015OPA-1633,Done,OPA Close CL,11/17/2015 12:00:00 AM,11/16/2015 12:00:00 AM,11/12/2015 12:00:00 AM,,2015-11-17T00:00:00.000,2015-11-16T00:00:00.000,2015-11-12T00:00:00.000,Done
2015OPA-1917,Done,OPA Close CL,01/25/2016 12:00:00 AM,01/25/2016 12:00:00 AM,01/20/2016 12:00:00 AM,,2016-01-25T00:00:00.000,2016-01-25T00:00:00.000,2016-01-20T00:00:00.000,Done
2016OPA-0433,Done,OPA Close CL,05/16/2016 12:00:00 AM,05/16/2016 12:00:00 AM,05/11/2016 12:00:00 AM,,2016-05-16T00:00:00.000,2016-05-16T00:00:00.000,2016-05-11T00:00:00.000,Done
2016OPA-0751,Done,OPA Close CL,08/08/2016 12:00:00 AM,08/10/2016 12:00:00 AM,08/03/2016 12:00:00 AM,2016-239029,2016-08-08T00:00:00.000,2016-08-10T00:00:00.000,2016-08-03T00:00:00.000,Done
2017OPA-1097,Done,OPA Close Case,03/12/2018 12:00:00 AM,08/01/2018 12:00:00 AM,03/12/2018 12:00:00 AM,2017-381465,2018-03-12T00:00:00.000,2018-08-01T00:00:00.000,2018-03-12T00:00:00.000,Done
2018OPA-0185,Done,OPA Close SA,,05/10/2018 12:00:00 AM,05/10/2018 12:00:00 AM,,,2018-05-10T00:00:00.000,2018-05-10T00:00:00.000,Done
2018OPA-0804,Done,OPA Close CL,09/18/2018 12:00:00 AM,09/14/2018 12:00:00 AM,09/13/2018 12:00:00 AM,,2018-09-18T00:00:00.000,2018-09-14T00:00:00.000,2018-09-13T00:00:00.000,Done
2019OPA-0483,Done,OPA Close CL,08/07/2019 12:00:00 AM,08/09/2019 12:00:00 AM,08/02/2019 12:00:00 AM,2019-250421,2019-08-07T00:00:00.000,2019-08-09T00:00:00.000,2019-08-02T00:00:00.000,Done
2015OPA-0157,Done,OPA Director SA Review,04/07/2015 12:00:00 AM,04/13/2015 12:00:00 AM,04/02/2015 12:00:00 AM,,2015-04-07T00:00:00.000,2015-04-13T00:00:00.000,2015-04-02T00:00:00.000,Done
2015OPA-0358,Done,OPA Appeal Findings Upheld,,11/16/2016 12:00:00 AM,11/28/2016 12:00:00 AM,2015-086445,,2016-11-16T00:00:00.000,2016-11-28T00:00:00.000,Done
2015OPA-1292,Done,OPA Close CL,,09/03/2015 12:00:00 AM,10/15/2015 12:00:00 AM,,,2015-09-03T00:00:00.000,2015-10-15T00:00:00.000,Done
2018OPA-0462,Done,OPA Close CL,06/20/2018 12:00:00 AM,06/18/2018 12:00:00 AM,06/15/2018 12:00:00 AM,,2018-06-20T00:00:00.000,2018-06-18T00:00:00.000,2018-06-15T00:00:00.000,Done
2015OPA-1427,Done,OPA Close Case,02/18/2016 12:00:00 AM,03/14/2016 12:00:00 AM,02/05/2016 12:00:00 AM,2015-300647,2016-02-18T00:00:00.000,2016-03-14T00:00:00.000,2016-02-05T00:00:00.000,Done
2015OPA-1526,Done,OPA Close CL,10/31/2015 12:00:00 AM,10/28/2015 12:00:00 AM,10/26/2015 12:00:00 AM,,2015-10-31T00:00:00.000,2015-10-28T00:00:00.000,2015-10-26T00:00:00.000,Done
2016OPA-0296,Done,OPA Close CL,04/18/2016 12:00:00 AM,04/15/2016 12:00:00 AM,04/13/2016 12:00:00 AM,,2016-04-18T00:00:00.000,2016-04-15T00:00:00.000,2016-04-13T00:00:00.000,Done
2016OPA-0652,Done,OPA Close Case,12/24/2017 12:00:00 AM,02/21/2018 12:00:00 AM,12/14/2017 12:00:00 AM,2016-205544,2017-12-24T00:00:00.000,2018-02-21T00:00:00.000,2017-12-14T00:00:00.000,Done
2017OPA-0309,Done,OPA Training Referral,09/20/2018 12:00:00 AM,03/30/2020 12:00:00 AM,09/10/2018 12:00:00 AM,,2018-09-20T00:00:00.000,2020-03-30T00:00:00.000,2018-09-10T00:00:00.000,Done
2017OPA-0785,Done,OPA Send Complainant Closing Letter,11/05/2017 12:00:00 AM,11/08/2017 12:00:00 AM,10/31/2017 12:00:00 AM,2017-279251,2017-11-05T00:00:00.000,2017-11-08T00:00:00.000,2017-10-31T00:00:00.000,Done
2015OPA-1221,Done,OPA Close CL,,08/27/2015 12:00:00 AM,10/15/2015 12:00:00 AM,,,2015-08-27T00:00:00.000,2015-10-15T00:00:00.000,Done
2015OPA-1598,Done,OPA Close CL,11/18/2015 12:00:00 AM,11/16/2015 12:00:00 AM,11/13/2015 12:00:00 AM,,2015-11-18T00:00:00.000,2015-11-16T00:00:00.000,2015-11-13T00:00:00.000,Done
2016OPA-0974,Done,OPA Close Case,01/27/2017 12:00:00 AM,01/27/2017 12:00:00 AM,01/13/2017 12:00:00 AM,,2017-01-27T00:00:00.000,2017-01-27T00:00:00.000,2017-01-13T00:00:00.000,Done
2017OPA-0763,Done,OPA Close CL,08/26/2017 12:00:00 AM,08/02/2017 12:00:00 AM,07/27/2017 12:00:00 AM,2017-249229,2017-08-26T00:00:00.000,2017-08-02T00:00:00.000,2017-07-27T00:00:00.000,Done
2017OPA-0876,Done,OPA Close SA,,11/20/2017 12:00:00 AM,11/20/2017 12:00:00 AM,,,2017-11-20T00:00:00.000,2017-11-20T00:00:00.000,Done
2015OPA-0669,Done,OPA Close SA,07/25/2015 12:00:00 AM,07/21/2015 12:00:00 AM,07/20/2015 12:00:00 AM,2015-109387,2015-07-25T00:00:00.000,2015-07-21T00:00:00.000,2015-07-20T00:00:00.000,Done
2015OPA-1075,Done,OPA Close SA,12/05/2015 12:00:00 AM,12/01/2015 12:00:00 AM,11/30/2015 12:00:00 AM,,2015-12-05T00:00:00.000,2015-12-01T00:00:00.000,2015-11-30T00:00:00.000,Done
2016OPA-0062,Done,OPA Close CL,02/22/2016 12:00:00 AM,02/18/2016 12:00:00 AM,02/18/2016 12:00:00 AM,,2016-02-22T00:00:00.000,2016-02-18T00:00:00.000,2016-02-18T00:00:00.000,Done
2017OPA-0718,Done,OPA Schedule Discipline Meeting,01/09/2018 12:00:00 AM,01/08/2018 12:00:00 AM,10/05/2017 12:00:00 AM,2017-250775,2018-01-09T00:00:00.000,2018-01-08T00:00:00.000,2017-10-05T00:00:00.000,Done
2017OPA-1276,Done,OPA Intake Review,01/02/2018 12:00:00 AM,12/14/2017 12:00:00 AM,12/14/2017 12:00:00 AM,,2018-01-02T00:00:00.000,2017-12-14T00:00:00.000,2017-12-14T00:00:00.000,Done
2018OPA-0627,Done,OPA Close SA,,08/27/2018 12:00:00 AM,08/27/2018 12:00:00 AM,,,2018-08-27T00:00:00.000,2018-08-27T00:00:00.000,Done
2019OPA-0078,Done,OPA Close SA,,03/14/2019 12:00:00 AM,03/14/2019 12:00:00 AM,,,2019-03-14T00:00:00.000,2019-03-14T00:00:00.000,Done
2015OPA-0695,Done,OPA Close SA,07/13/2015 12:00:00 AM,07/10/2015 12:00:00 AM,07/08/2015 12:00:00 AM,,2015-07-13T00:00:00.000,2015-07-10T00:00:00.000,2015-07-08T00:00:00.000,Done
2015OPA-1144,Done,OPA Close SA,09/02/2015 12:00:00 AM,09/01/2015 12:00:00 AM,08/28/2015 12:00:00 AM,,2015-09-02T00:00:00.000,2015-09-01T00:00:00.000,2015-08-28T00:00:00.000,Done
2015OPA-1498,Done,OPA Close CL,,10/19/2015 12:00:00 AM,10/19/2015 12:00:00 AM,2015-327307,,2015-10-19T00:00:00.000,2015-10-19T00:00:00.000,Done
2015OPA-1688,Done,OPA Close CL,11/30/2015 12:00:00 AM,11/30/2015 12:00:00 AM,11/25/2015 12:00:00 AM,,2015-11-30T00:00:00.000,2015-11-30T00:00:00.000,2015-11-25T00:00:00.000,Done
2016OPA-0978,Done,OPA Close SA,,10/10/2016 12:00:00 AM,10/10/2016 12:00:00 AM,,,2016-10-10T00:00:00.000,2016-10-10T00:00:00.000,Done
2017OPA-0387,Done,OPA Management Action,03/31/2018 12:00:00 AM,12/05/2017 12:00:00 AM,12/07/2017 12:00:00 AM,2017-122549,2018-03-31T00:00:00.000,2017-12-05T00:00:00.000,2017-12-07T00:00:00.000,Done
2018OPA-0619,Done,OPA Close Case,,01/22/2019 12:00:00 AM,01/13/2019 12:00:00 AM,2018-242515,,2019-01-22T00:00:00.000,2019-01-13T00:00:00.000,Done
2019OPA-0100,Done,OPA Close Case,10/10/2019 12:00:00 AM,10/10/2019 12:00:00 AM,09/26/2019 12:00:00 AM,,2019-10-10T00:00:00.000,2019-10-10T00:00:00.000,2019-09-26T00:00:00.000,Done
2015OPA-0183,Done,OPA Close CL,,03/05/2015 12:00:00 AM,10/22/2015 12:00:00 AM,,,2015-03-05T00:00:00.000,2015-10-22T00:00:00.000,Done
2015OPA-1560,Done,OPA Close SA,11/24/2015 12:00:00 AM,11/20/2015 12:00:00 AM,11/19/2015 12:00:00 AM,2015-368182,2015-11-24T00:00:00.000,2015-11-20T00:00:00.000,2015-11-19T00:00:00.000,Done
2016OPA-0117,Done,OPA Close CL,02/10/2016 12:00:00 AM,02/10/2016 12:00:00 AM,02/05/2016 12:00:00 AM,2016-040589,2016-02-10T00:00:00.000,2016-02-10T00:00:00.000,2016-02-05T00:00:00.000,Done
2017OPA-0334,Done,OPA Send Complaint Receipt,04/08/2017 12:00:00 AM,04/03/2017 12:00:00 AM,04/03/2017 12:00:00 AM,,2017-04-08T00:00:00.000,2017-04-03T00:00:00.000,2017-04-03T00:00:00.000,Done
2017OPA-0623,Done,OPA Close SA,,09/21/2017 12:00:00 AM,09/21/2017 12:00:00 AM,,,2017-09-21T00:00:00.000,2017-09-21T00:00:00.000,Done
2017OPA-1211,Done,OPA Close CL,12/20/2017 12:00:00 AM,12/18/2017 12:00:00 AM,11/20/2017 12:00:00 AM,2017-418674,2017-12-20T00:00:00.000,2017-12-18T00:00:00.000,2017-11-20T00:00:00.000,Done
2018OPA-0539,Done,OPA Close CL,07/23/2018 12:00:00 AM,07/24/2018 12:00:00 AM,07/18/2018 12:00:00 AM,,2018-07-23T00:00:00.000,2018-07-24T00:00:00.000,2018-07-18T00:00:00.000,Done
2019OPA-0749,Done,OPA Close CL,11/14/2019 12:00:00 AM,11/15/2019 12:00:00 AM,11/07/2019 12:00:00 AM,,2019-11-14T00:00:00.000,2019-11-15T00:00:00.000,2019-11-07T00:00:00.000,Done
2015OPA-0274,Done,OPA Close SA,05/24/2016 12:00:00 AM,08/03/2016 12:00:00 AM,05/03/2016 12:00:00 AM,2014-417946,2016-05-24T00:00:00.000,2016-08-03T00:00:00.000,2016-05-03T00:00:00.000,Done
2016OPA-0529,Done,OPA Close Case,11/18/2016 12:00:00 AM,11/07/2016 12:00:00 AM,11/08/2016 12:00:00 AM,2016-170581,2016-11-18T00:00:00.000,2016-11-07T00:00:00.000,2016-11-08T00:00:00.000,Done
2016OPA-0921,Done,OPA Close SA,,09/27/2016 12:00:00 AM,09/27/2016 12:00:00 AM,2015-001089,,2016-09-27T00:00:00.000,2016-09-27T00:00:00.000,Done
2020OPA-0244,Done,OPA Close CL,05/06/2020 12:00:00 AM,04/29/2020 12:00:00 AM,04/29/2020 12:00:00 AM,2020-126460,2020-05-06T00:00:00.000,2020-04-29T00:00:00.000,2020-04-29T00:00:00.000,Done
2016OPA-0960,Done,OPA Close Case,01/27/2017 12:00:00 AM,01/27/2017 12:00:00 AM,01/17/2017 12:00:00 AM,,2017-01-27T00:00:00.000,2017-01-27T00:00:00.000,2017-01-17T00:00:00.000,Done
2017OPA-0355,Done,OPA Close CL,04/22/2017 12:00:00 AM,04/20/2017 12:00:00 AM,04/17/2017 12:00:00 AM,,2017-04-22T00:00:00.000,2017-04-20T00:00:00.000,2017-04-17T00:00:00.000,Done
2018OPA-0100,Done,OPA Close CL,02/28/2018 12:00:00 AM,02/27/2018 12:00:00 AM,01/29/2018 12:00:00 AM,,2018-02-28T00:00:00.000,2018-02-27T00:00:00.000,2018-01-29T00:00:00.000,Done
2018OPA-0866,Done,OPA Close SA,,10/25/2018 12:00:00 AM,10/25/2018 12:00:00 AM,,,2018-10-25T00:00:00.000,2018-10-25T00:00:00.000,Done
2019OPA-0339,Done,OPA Close SA,,07/05/2019 12:00:00 AM,07/05/2019 12:00:00 AM,,,2019-07-05T00:00:00.000,2019-07-05T00:00:00.000,Done
2015OPA-1296,Done,OPA Management Action,,02/01/2016 12:00:00 AM,12/16/2016 12:00:00 AM,,,2016-02-01T00:00:00.000,2016-12-16T00:00:00.000,Done
2016OPA-0019,Done,OPA Close CL,02/09/2016 12:00:00 AM,02/05/2016 12:00:00 AM,02/04/2016 12:00:00 AM,,2016-02-09T00:00:00.000,2016-02-05T00:00:00.000,2016-02-04T00:00:00.000,Done
2017OPA-0619,Done,OPA Close CL,07/21/2017 12:00:00 AM,07/21/2017 12:00:00 AM,06/22/2017 12:00:00 AM,,2017-07-21T00:00:00.000,2017-07-21T00:00:00.000,2017-06-22T00:00:00.000,Done
2017OPA-0671,Done,OPA Close CL,07/24/2017 12:00:00 AM,07/21/2017 12:00:00 AM,07/19/2017 12:00:00 AM,,2017-07-24T00:00:00.000,2017-07-21T00:00:00.000,2017-07-19T00:00:00.000,Done
2017OPA-1141,Done,OPA Close CL,12/02/2017 12:00:00 AM,12/01/2017 12:00:00 AM,11/02/2017 12:00:00 AM,,2017-12-02T00:00:00.000,2017-12-01T00:00:00.000,2017-11-02T00:00:00.000,Done
2019OPA-0922,Done,OPA Close Case,,04/15/2020 12:00:00 AM,03/21/2020 12:00:00 AM,2019-462045,,2020-04-15T00:00:00.000,2020-03-21T00:00:00.000,Done
2015OPA-0677,Done,OPA Close CL,,06/08/2015 12:00:00 AM,10/19/2015 12:00:00 AM,,,2015-06-08T00:00:00.000,2015-10-19T00:00:00.000,Done
2016OPA-0593,Done,OPA Close CL,07/02/2016 12:00:00 AM,06/30/2016 12:00:00 AM,06/27/2016 12:00:00 AM,2016-173731,2016-07-02T00:00:00.000,2016-06-30T00:00:00.000,2016-06-27T00:00:00.000,Done
2016OPA-0906,Done,OPA Close SA,,10/31/2016 12:00:00 AM,10/31/2016 12:00:00 AM,2016-279116,,2016-10-31T00:00:00.000,2016-10-31T00:00:00.000,Done
2016OPA-1358,Done,OPA Close SA,,12/28/2016 12:00:00 AM,12/28/2016 12:00:00 AM,2016-185319,,2016-12-28T00:00:00.000,2016-12-28T00:00:00.000,Done
2018OPA-0405,Done,OPA Close CL,05/20/2018 12:00:00 AM,05/31/2018 12:00:00 AM,05/15/2018 12:00:00 AM,,2018-05-20T00:00:00.000,2018-05-31T00:00:00.000,2018-05-15T00:00:00.000,Done
2019OPA-0899,Done,OPA Close SA,,03/10/2020 12:00:00 AM,03/10/2020 12:00:00 AM,,,2020-03-10T00:00:00.000,2020-03-10T00:00:00.000,Done
2020OPA-0193,Done,OPA SA Review,05/09/2020 12:00:00 AM,05/06/2020 12:00:00 AM,04/24/2020 12:00:00 AM,2020-100133,2020-05-09T00:00:00.000,2020-05-06T00:00:00.000,2020-04-24T00:00:00.000,Done
2015OPA-0197,Done,OPA Close SA,,12/29/2015 12:00:00 AM,12/29/2015 12:00:00 AM,2014-336528,,2015-12-29T00:00:00.000,2015-12-29T00:00:00.000,Done
2015OPA-0776,Done,OPA Close SA,07/25/2015 12:00:00 AM,07/21/2015 12:00:00 AM,07/20/2015 12:00:00 AM,2015-093682,2015-07-25T00:00:00.000,2015-07-21T00:00:00.000,2015-07-20T00:00:00.000,Done
2015OPA-1461,Done,OPA Close CL,,10/15/2015 12:00:00 AM,10/15/2015 12:00:00 AM,2015-295115,,2015-10-15T00:00:00.000,2015-10-15T00:00:00.000,Done
2017OPA-0344,Done,OPA Close CL,04/22/2017 12:00:00 AM,04/19/2017 12:00:00 AM,04/17/2017 12:00:00 AM,,2017-04-22T00:00:00.000,2017-04-19T00:00:00.000,2017-04-17T00:00:00.000,Done
2020OPA-0208,Done,OPA Close CL,04/27/2020 12:00:00 AM,04/17/2020 12:00:00 AM,04/09/2020 12:00:00 AM,,2020-04-27T00:00:00.000,2020-04-17T00:00:00.000,2020-04-09T00:00:00.000,Done
2015OPA-0591,Done,OPA Close CL,,05/11/2015 12:00:00 AM,10/20/2015 12:00:00 AM,,,2015-05-11T00:00:00.000,2015-10-20T00:00:00.000,Done
2015OPA-1225,Done,OPA Management Action,,02/01/2016 12:00:00 AM,12/16/2016 12:00:00 AM,,,2016-02-01T00:00:00.000,2016-12-16T00:00:00.000,Done
2015OPA-1652,Done,OPA Close SA,02/02/2016 12:00:00 AM,01/28/2016 12:00:00 AM,01/28/2016 12:00:00 AM,,2016-02-02T00:00:00.000,2016-01-28T00:00:00.000,2016-01-28T00:00:00.000,Done
2016OPA-0471,Done,OPA Close CL,05/16/2016 12:00:00 AM,05/16/2016 12:00:00 AM,05/16/2016 12:00:00 AM,,2016-05-16T00:00:00.000,2016-05-16T00:00:00.000,2016-05-16T00:00:00.000,Done
2016OPA-1007,Done,OPA Close CL,09/24/2016 12:00:00 AM,09/20/2016 12:00:00 AM,09/19/2016 12:00:00 AM,2016-195346,2016-09-24T00:00:00.000,2016-09-20T00:00:00.000,2016-09-19T00:00:00.000,Done
2018OPA-0646,Done,OPA Training Referral,02/05/2019 12:00:00 AM,02/22/2019 12:00:00 AM,02/14/2019 12:00:00 AM,2018-228707,2019-02-05T00:00:00.000,2019-02-22T00:00:00.000,2019-02-14T00:00:00.000,Done
2018OPA-0793,Done,OPA Close CL,09/16/2018 12:00:00 AM,09/13/2018 12:00:00 AM,09/11/2018 12:00:00 AM,2018-302895,2018-09-16T00:00:00.000,2018-09-13T00:00:00.000,2018-09-11T00:00:00.000,Done
2015OPA-0104,Done,OPA SA Review,03/29/2015 12:00:00 AM,04/03/2015 12:00:00 AM,03/24/2015 12:00:00 AM,,2015-03-29T00:00:00.000,2015-04-03T00:00:00.000,2015-03-24T00:00:00.000,Done
2015OPA-0138,Done,OPA Director SA Review,04/27/2015 12:00:00 AM,05/11/2015 12:00:00 AM,04/22/2015 12:00:00 AM,2014-276279,2015-04-27T00:00:00.000,2015-05-11T00:00:00.000,2015-04-22T00:00:00.000,Done
2015OPA-0584,Done,OPA Director SA Review,06/24/2015 12:00:00 AM,08/13/2015 12:00:00 AM,06/19/2015 12:00:00 AM,2015-085969,2015-06-24T00:00:00.000,2015-08-13T00:00:00.000,2015-06-19T00:00:00.000,Done
2015OPA-1213,Done,OPA Close Case,04/07/2016 12:00:00 AM,04/06/2016 12:00:00 AM,03/11/2016 12:00:00 AM,,2016-04-07T00:00:00.000,2016-04-06T00:00:00.000,2016-03-11T00:00:00.000,Done
2016OPA-0476,Done,OPA Close CL,06/01/2016 12:00:00 AM,06/01/2016 12:00:00 AM,05/27/2016 12:00:00 AM,,2016-06-01T00:00:00.000,2016-06-01T00:00:00.000,2016-05-27T00:00:00.000,Done
2018OPA-0953,Done,OPA Close CL,10/20/2018 12:00:00 AM,10/19/2018 12:00:00 AM,10/15/2018 12:00:00 AM,,2018-10-20T00:00:00.000,2018-10-19T00:00:00.000,2018-10-15T00:00:00.000,Done
2017OPA-0628,Done,OPA Close Case,12/16/2017 12:00:00 AM,02/21/2018 12:00:00 AM,12/06/2017 12:00:00 AM,2017-214702,2017-12-16T00:00:00.000,2018-02-21T00:00:00.000,2017-12-06T00:00:00.000,Done
2017OPA-1197,Done,OPA Close CL,12/16/2017 12:00:00 AM,12/12/2017 12:00:00 AM,12/11/2017 12:00:00 AM,,2017-12-16T00:00:00.000,2017-12-12T00:00:00.000,2017-12-11T00:00:00.000,Done
2019OPA-0580,Done,OPA Close CL,09/06/2019 12:00:00 AM,09/04/2019 12:00:00 AM,08/30/2019 12:00:00 AM,,2019-09-06T00:00:00.000,2019-09-04T00:00:00.000,2019-08-30T00:00:00.000,Done
2019OPA-0704,Done,OPA SA Review,01/08/2020 12:00:00 AM,01/30/2020 12:00:00 AM,10/24/2019 12:00:00 AM,,2020-01-08T00:00:00.000,2020-01-30T00:00:00.000,2019-10-24T00:00:00.000,Done
2015OPA-1693,Done,OPA Disregard Notice,02/26/2016 12:00:00 AM,03/18/2016 12:00:00 AM,02/22/2016 12:00:00 AM,,2016-02-26T00:00:00.000,2016-03-18T00:00:00.000,2016-02-22T00:00:00.000,Done
2016OPA-0064,Done,OPA Close SA,03/07/2016 12:00:00 AM,03/02/2016 12:00:00 AM,03/02/2016 12:00:00 AM,,2016-03-07T00:00:00.000,2016-03-02T00:00:00.000,2016-03-02T00:00:00.000,Done
2016OPA-0484,Done,OPA Close CL,06/01/2016 12:00:00 AM,05/27/2016 12:00:00 AM,05/27/2016 12:00:00 AM,,2016-06-01T00:00:00.000,2016-05-27T00:00:00.000,2016-05-27T00:00:00.000,Done
2016OPA-0534,Done,OPA Close CL,06/12/2016 12:00:00 AM,06/09/2016 12:00:00 AM,06/07/2016 12:00:00 AM,,2016-06-12T00:00:00.000,2016-06-09T00:00:00.000,2016-06-07T00:00:00.000,Done
2017OPA-0319,Done,OPA Close CL,04/09/2017 12:00:00 AM,04/11/2017 12:00:00 AM,04/04/2017 12:00:00 AM,2017-092155,2017-04-09T00:00:00.000,2017-04-11T00:00:00.000,2017-04-04T00:00:00.000,Done
2016OPA-0995,Done,OPA Close CL,09/27/2016 12:00:00 AM,08/29/2016 12:00:00 AM,08/23/2016 12:00:00 AM,,2016-09-27T00:00:00.000,2016-08-29T00:00:00.000,2016-08-23T00:00:00.000,Done
2016OPA-1390,Done,OPA Close CL,12/12/2016 12:00:00 AM,12/16/2016 12:00:00 AM,12/07/2016 12:00:00 AM,,2016-12-12T00:00:00.000,2016-12-16T00:00:00.000,2016-12-07T00:00:00.000,Done
2017OPA-1036,Done,OPA Final Discipline Action Report,,05/04/2018 12:00:00 AM,01/22/2019 12:00:00 AM,,,2018-05-04T00:00:00.000,2019-01-22T00:00:00.000,Done
2018OPA-1013,Done,OPA Close Case,05/09/2019 12:00:00 AM,07/08/2019 12:00:00 AM,04/29/2019 12:00:00 AM,,2019-05-09T00:00:00.000,2019-07-08T00:00:00.000,2019-04-29T00:00:00.000,Done
2019OPA-0054,Done,OPA Close Case,08/02/2019 12:00:00 AM,09/18/2019 12:00:00 AM,07/23/2019 12:00:00 AM,,2019-08-02T00:00:00.000,2019-09-18T00:00:00.000,2019-07-23T00:00:00.000,Done
2015OPA-0754,Done,OPA Close Case,02/16/2016 12:00:00 AM,03/10/2016 12:00:00 AM,12/10/2015 12:00:00 AM,,2016-02-16T00:00:00.000,2016-03-10T00:00:00.000,2015-12-10T00:00:00.000,Done
2015OPA-0904,Done,OPA Close Case,,12/23/2015 12:00:00 AM,11/25/2015 12:00:00 AM,,,2015-12-23T00:00:00.000,2015-11-25T00:00:00.000,Done
2016OPA-0119,Done,OPA Close CL,02/21/2016 12:00:00 AM,02/18/2016 12:00:00 AM,02/16/2016 12:00:00 AM,,2016-02-21T00:00:00.000,2016-02-18T00:00:00.000,2016-02-16T00:00:00.000,Done
2016OPA-1080,Done,OPA Close Case,03/06/2017 12:00:00 AM,03/17/2017 12:00:00 AM,02/24/2017 12:00:00 AM,2016-141086,2017-03-06T00:00:00.000,2017-03-17T00:00:00.000,2017-02-24T00:00:00.000,Done
2016OPA-1514,Done,OPA Close Case,08/04/2017 12:00:00 AM,08/08/2017 12:00:00 AM,07/25/2017 12:00:00 AM,2016-363886,2017-08-04T00:00:00.000,2017-08-08T00:00:00.000,2017-07-25T00:00:00.000,Done
2018OPA-0946,Done,OPA Close Case,03/28/2019 12:00:00 AM,04/05/2019 12:00:00 AM,03/18/2019 12:00:00 AM,2018-351446,2019-03-28T00:00:00.000,2019-04-05T00:00:00.000,2019-03-18T00:00:00.000,Done
2015OPA-0062,Done,OPA Director SA Review,03/01/2015 12:00:00 AM,03/11/2015 12:00:00 AM,02/24/2015 12:00:00 AM,2014-402660,2015-03-01T00:00:00.000,2015-03-11T00:00:00.000,2015-02-24T00:00:00.000,Done
2015OPA-1244,Done,OPA Close CL,,08/27/2015 12:00:00 AM,10/15/2015 12:00:00 AM,,,2015-08-27T00:00:00.000,2015-10-15T00:00:00.000,Done
2015OPA-1396,Done,OPA Close CL,,10/01/2015 12:00:00 AM,10/13/2015 12:00:00 AM,,,2015-10-01T00:00:00.000,2015-10-13T00:00:00.000,Done
2016OPA-0093,Done,OPA Close Case,10/15/2016 12:00:00 AM,10/17/2016 12:00:00 AM,10/04/2016 12:00:00 AM,2015-368075,2016-10-15T00:00:00.000,2016-10-17T00:00:00.000,2016-10-04T00:00:00.000,Done
2016OPA-1337,Done,OPA Close CL,12/10/2016 12:00:00 AM,11/28/2016 12:00:00 AM,11/10/2016 12:00:00 AM,,2016-12-10T00:00:00.000,2016-11-28T00:00:00.000,2016-11-10T00:00:00.000,Done
2017OPA-0245,Done,OPA Close CL,04/06/2017 12:00:00 AM,03/27/2017 12:00:00 AM,03/07/2017 12:00:00 AM,,2017-04-06T00:00:00.000,2017-03-27T00:00:00.000,2017-03-07T00:00:00.000,Done
2017OPA-0738,Done,OPA Close CL,09/18/2017 12:00:00 AM,08/02/2017 12:00:00 AM,07/20/2017 12:00:00 AM,2017-255321,2017-09-18T00:00:00.000,2017-08-02T00:00:00.000,2017-07-20T00:00:00.000,Done
2017OPA-0823,Done,OPA Close CL,09/06/2017 12:00:00 AM,09/18/2017 12:00:00 AM,09/01/2017 12:00:00 AM,,2017-09-06T00:00:00.000,2017-09-18T00:00:00.000,2017-09-01T00:00:00.000,Done
2018OPA-0671,Done,OPA Close CL,08/21/2018 12:00:00 AM,08/21/2018 12:00:00 AM,08/16/2018 12:00:00 AM,,2018-08-21T00:00:00.000,2018-08-21T00:00:00.000,2018-08-16T00:00:00.000,Done
2015OPA-1313,Done,OPA Close SA,10/11/2015 12:00:00 AM,10/07/2015 12:00:00 AM,10/06/2015 12:00:00 AM,2015-119112,2015-10-11T00:00:00.000,2015-10-07T00:00:00.000,2015-10-06T00:00:00.000,Done
2016OPA-0639,Done,OPA Close CL,07/13/2016 12:00:00 AM,07/15/2016 12:00:00 AM,07/08/2016 12:00:00 AM,,2016-07-13T00:00:00.000,2016-07-15T00:00:00.000,2016-07-08T00:00:00.000,Done
2019OPA-0474,Done,OPA Close SA,,09/27/2019 12:00:00 AM,09/27/2019 12:00:00 AM,2019-249665,,2019-09-27T00:00:00.000,2019-09-27T00:00:00.000,Done
2019OPA-0635,Done,OPA Close CL,09/24/2019 12:00:00 AM,09/20/2019 12:00:00 AM,09/16/2019 12:00:00 AM,,2019-09-24T00:00:00.000,2019-09-20T00:00:00.000,2019-09-16T00:00:00.000,Done
2016OPA-1444,Done,OPA Close Case,06/01/2017 12:00:00 AM,06/12/2017 12:00:00 AM,05/30/2017 12:00:00 AM,,2017-06-01T00:00:00.000,2017-06-12T00:00:00.000,2017-05-30T00:00:00.000,Done
2017OPA-0176,Done,OPA Close CL,03/21/2017 12:00:00 AM,03/13/2017 12:00:00 AM,02/21/2017 12:00:00 AM,,2017-03-21T00:00:00.000,2017-03-13T00:00:00.000,2017-02-21T00:00:00.000,Done
2017OPA-0791,Done,OPA Close SA,,06/04/2018 12:00:00 AM,01/22/2018 12:00:00 AM,,,2018-06-04T00:00:00.000,2018-01-22T00:00:00.000,Done
2017OPA-1135,Done,OPA Close CL,12/04/2017 12:00:00 AM,12/01/2017 12:00:00 AM,11/29/2017 12:00:00 AM,,2017-12-04T00:00:00.000,2017-12-01T00:00:00.000,2017-11-29T00:00:00.000,Done
2016OPA-0024,Done,OPA Close CL,01/23/2016 12:00:00 AM,01/21/2016 12:00:00 AM,01/15/2016 12:00:00 AM,2015-406463,2016-01-23T00:00:00.000,2016-01-21T00:00:00.000,2016-01-15T00:00:00.000,Done
2016OPA-0314,Done,OPA Close CL,04/01/2016 12:00:00 AM,03/29/2016 12:00:00 AM,03/27/2016 12:00:00 AM,,2016-04-01T00:00:00.000,2016-03-29T00:00:00.000,2016-03-27T00:00:00.000,Done
2016OPA-0951,Done,OPA Close CL,08/31/2016 12:00:00 AM,08/29/2016 12:00:00 AM,08/26/2016 12:00:00 AM,,2016-08-31T00:00:00.000,2016-08-29T00:00:00.000,2016-08-26T00:00:00.000,Done
2017OPA-0289,Done,OPA Investigation Review,08/14/2017 12:00:00 AM,10/04/2018 12:00:00 AM,04/19/2017 12:00:00 AM,2017-094165,2017-08-14T00:00:00.000,2018-10-04T00:00:00.000,2017-04-19T00:00:00.000,Done
2017OPA-0582,Done,OPA Close Case,12/09/2017 12:00:00 AM,01/30/2018 12:00:00 AM,11/29/2017 12:00:00 AM,2017-208548,2017-12-09T00:00:00.000,2018-01-30T00:00:00.000,2017-11-29T00:00:00.000,Done
2017OPA-0748,Done,OPA Close SA,,09/21/2017 12:00:00 AM,09/21/2017 12:00:00 AM,,,2017-09-21T00:00:00.000,2017-09-21T00:00:00.000,Done
2015OPA-0667,Done,OPA Close Case,11/19/2015 12:00:00 AM,11/25/2015 12:00:00 AM,11/06/2015 12:00:00 AM,,2015-11-19T00:00:00.000,2015-11-25T00:00:00.000,2015-11-06T00:00:00.000,Done
2015OPA-1464,Done,OPA Close Case,02/16/2016 12:00:00 AM,03/10/2016 12:00:00 AM,01/29/2016 12:00:00 AM,2015-295240,2016-02-16T00:00:00.000,2016-03-10T00:00:00.000,2016-01-29T00:00:00.000,Done
2017OPA-0441,Done,OPA Send Complainant Closing Letter,05/28/2017 12:00:00 AM,05/26/2017 12:00:00 AM,05/23/2017 12:00:00 AM,2017-135741,2017-05-28T00:00:00.000,2017-05-26T00:00:00.000,2017-05-23T00:00:00.000,Done
2019OPA-0692,Done,OPA Close CL,10/20/2019 12:00:00 AM,01/06/2020 12:00:00 AM,10/15/2019 12:00:00 AM,2019-353777,2019-10-20T00:00:00.000,2020-01-06T00:00:00.000,2019-10-15T00:00:00.000,Done
2019OPA-0813,Done,OPA 180 Extension Request,05/30/2020 12:00:00 AM,06/29/2020 12:00:00 AM,04/02/2020 12:00:00 AM,2019-408077,2020-05-30T00:00:00.000,2020-06-29T00:00:00.000,2020-04-02T00:00:00.000,Done
2015OPA-0798,Done,OPA Close SA,11/08/2015 12:00:00 AM,11/04/2015 12:00:00 AM,11/03/2015 12:00:00 AM,,2015-11-08T00:00:00.000,2015-11-04T00:00:00.000,2015-11-03T00:00:00.000,Done
2016OPA-0440,Done,OPA Close Case,01/14/2017 12:00:00 AM,01/14/2017 12:00:00 AM,01/03/2017 12:00:00 AM,2016-123125,2017-01-14T00:00:00.000,2017-01-14T00:00:00.000,2017-01-03T00:00:00.000,Done
2017OPA-0755,Done,OPA Close Case,10/05/2018 12:00:00 AM,09/25/2018 12:00:00 AM,09/25/2018 12:00:00 AM,,2018-10-05T00:00:00.000,2018-09-25T00:00:00.000,2018-09-25T00:00:00.000,Done
2018OPA-0275,Done,OPA Close Case,09/08/2018 12:00:00 AM,10/16/2018 12:00:00 AM,08/29/2018 12:00:00 AM,2018-076860,2018-09-08T00:00:00.000,2018-10-16T00:00:00.000,2018-08-29T00:00:00.000,Done
2019OPA-0382,Done,OPA Close Case,01/22/2020 12:00:00 AM,03/25/2020 12:00:00 AM,01/08/2020 12:00:00 AM,,2020-01-22T00:00:00.000,2020-03-25T00:00:00.000,2020-01-08T00:00:00.000,Done
2015OPA-0331,Done,OPA Process SA,03/31/2015 12:00:00 AM,03/26/2015 12:00:00 AM,03/26/2015 12:00:00 AM,2015-081744,2015-03-31T00:00:00.000,2015-03-26T00:00:00.000,2015-03-26T00:00:00.000,Done
2015OPA-0656,Done,OPA Close CL,,06/08/2015 12:00:00 AM,10/19/2015 12:00:00 AM,,,2015-06-08T00:00:00.000,2015-10-19T00:00:00.000,Done
2015OPA-0733,Done,OPA Close CL,,08/09/2015 12:00:00 AM,10/15/2015 12:00:00 AM,,,2015-08-09T00:00:00.000,2015-10-15T00:00:00.000,Done
2019OPA-0811,Done,OPA OIG Certification,03/21/2020 12:00:00 AM,03/17/2020 12:00:00 AM,03/11/2020 12:00:00 AM,,2020-03-21T00:00:00.000,2020-03-17T00:00:00.000,2020-03-11T00:00:00.000,Done
2016OPA-0794,Done,OPA Close Case,01/08/2017 12:00:00 AM,01/08/2017 12:00:00 AM,12/27/2016 12:00:00 AM,2016-249499,2017-01-08T00:00:00.000,2017-01-08T00:00:00.000,2016-12-27T00:00:00.000,Done
2016OPA-1214,Done,OPA Send Complainant Closing Letter,11/02/2016 12:00:00 AM,10/04/2016 12:00:00 AM,10/04/2016 12:00:00 AM,,2016-11-02T00:00:00.000,2016-10-04T00:00:00.000,2016-10-04T00:00:00.000,Done
2017OPA-0094,Done,OPA Close CL,03/01/2017 12:00:00 AM,08/17/2017 12:00:00 AM,02/24/2017 12:00:00 AM,2017-031071,2017-03-01T00:00:00.000,2017-08-17T00:00:00.000,2017-02-24T00:00:00.000,Done
2017OPA-0700,Done,OPA Final Discipline Action Report,,12/21/2017 12:00:00 AM,01/22/2019 12:00:00 AM,,,2017-12-21T00:00:00.000,2019-01-22T00:00:00.000,Done
2015OPA-1493,Done,OPA Close CL,,10/19/2015 12:00:00 AM,10/19/2015 12:00:00 AM,,,2015-10-19T00:00:00.000,2015-10-19T00:00:00.000,Done
2015OPA-1513,Done,OPA Close SA,03/23/2016 12:00:00 AM,03/18/2016 12:00:00 AM,03/18/2016 12:00:00 AM,2015-317683,2016-03-23T00:00:00.000,2016-03-18T00:00:00.000,2016-03-18T00:00:00.000,Done
2015OPA-1909,Done,OPA Close SA,04/27/2016 12:00:00 AM,05/31/2016 12:00:00 AM,04/12/2016 12:00:00 AM,,2016-04-27T00:00:00.000,2016-05-31T00:00:00.000,2016-04-12T00:00:00.000,Done
2016OPA-1237,Done,OPA Close Case,04/13/2017 12:00:00 AM,04/14/2017 12:00:00 AM,04/03/2017 12:00:00 AM,2016-363648,2017-04-13T00:00:00.000,2017-04-14T00:00:00.000,2017-04-03T00:00:00.000,Done
2017OPA-0300,Done,OPA Close CL,04/14/2017 12:00:00 AM,04/11/2017 12:00:00 AM,04/04/2017 12:00:00 AM,2017-044664,2017-04-14T00:00:00.000,2017-04-11T00:00:00.000,2017-04-04T00:00:00.000,Done
2017OPA-1094,Done,OPA Close SA,,02/27/2018 12:00:00 AM,02/27/2018 12:00:00 AM,2017-358049,,2018-02-27T00:00:00.000,2018-02-27T00:00:00.000,Done
2017OPA-1182,Done,OPA Close CL,12/13/2017 12:00:00 AM,11/22/2017 12:00:00 AM,11/13/2017 12:00:00 AM,,2017-12-13T00:00:00.000,2017-11-22T00:00:00.000,2017-11-13T00:00:00.000,Done
2015OPA-0155,Done,OPA Close Case,12/29/2015 12:00:00 AM,12/29/2015 12:00:00 AM,12/16/2015 12:00:00 AM,2015-032903,2015-12-29T00:00:00.000,2015-12-29T00:00:00.000,2015-12-16T00:00:00.000,Done
2015OPA-1853,Done,OPA Close Case,06/27/2016 12:00:00 AM,06/30/2016 12:00:00 AM,06/14/2016 12:00:00 AM,2015-415202,2016-06-27T00:00:00.000,2016-06-30T00:00:00.000,2016-06-14T00:00:00.000,Done
2016OPA-0832,Done,OPA Close SA,,09/02/2016 12:00:00 AM,09/02/2016 12:00:00 AM,2016-233529,,2016-09-02T00:00:00.000,2016-09-02T00:00:00.000,Done
2019OPA-0566,Done,OPA Close CL,09/01/2019 12:00:00 AM,09/06/2019 12:00:00 AM,08/27/2019 12:00:00 AM,2019-287041,2019-09-01T00:00:00.000,2019-09-06T00:00:00.000,2019-08-27T00:00:00.000,Done
2019OPA-0751,Done,OPA Close CL,11/14/2019 12:00:00 AM,11/15/2019 12:00:00 AM,11/07/2019 12:00:00 AM,2019-382671,2019-11-14T00:00:00.000,2019-11-15T00:00:00.000,2019-11-07T00:00:00.000,Done
2016OPA-0657,Done,OPA Close SA,08/11/2016 12:00:00 AM,07/27/2016 12:00:00 AM,07/27/2016 12:00:00 AM,,2016-08-11T00:00:00.000,2016-07-27T00:00:00.000,2016-07-27T00:00:00.000,Done
2016OPA-0768,Done,OPA Close CL,08/02/2016 12:00:00 AM,08/05/2016 12:00:00 AM,07/28/2016 12:00:00 AM,,2016-08-02T00:00:00.000,2016-08-05T00:00:00.000,2016-07-28T00:00:00.000,Done
2016OPA-0821,Done,OPA Close CL,08/17/2016 12:00:00 AM,08/15/2016 12:00:00 AM,08/12/2016 12:00:00 AM,,2016-08-17T00:00:00.000,2016-08-15T00:00:00.000,2016-08-12T00:00:00.000,Done
2016OPA-1177,Done,OPA Close CL,09/28/2016 12:00:00 AM,09/25/2016 12:00:00 AM,09/23/2016 12:00:00 AM,2016-330527,2016-09-28T00:00:00.000,2016-09-25T00:00:00.000,2016-09-23T00:00:00.000,Done
2017OPA-1320,Done,OPA Close CL,01/27/2018 12:00:00 AM,01/16/2018 12:00:00 AM,12/28/2017 12:00:00 AM,,2018-01-27T00:00:00.000,2018-01-16T00:00:00.000,2017-12-28T00:00:00.000,Done
2018OPA-0349,Done,OPA Send Complainant Closing Letter,10/24/2018 12:00:00 AM,10/24/2018 12:00:00 AM,10/24/2018 12:00:00 AM,2018-138634,2018-10-24T00:00:00.000,2018-10-24T00:00:00.000,2018-10-24T00:00:00.000,Done
2018OPA-1000,Done,OPA Close CL,11/10/2018 12:00:00 AM,11/16/2018 12:00:00 AM,11/05/2018 12:00:00 AM,,2018-11-10T00:00:00.000,2018-11-16T00:00:00.000,2018-11-05T00:00:00.000,Done
2015OPA-0541,Done,OPA Director SA Review,06/20/2015 12:00:00 AM,06/17/2015 12:00:00 AM,06/15/2015 12:00:00 AM,2015-098840,2015-06-20T00:00:00.000,2015-06-17T00:00:00.000,2015-06-15T00:00:00.000,Done
2015OPA-0989,Done,OPA Close SA,10/17/2015 12:00:00 AM,10/15/2015 12:00:00 AM,10/12/2015 12:00:00 AM,,2015-10-17T00:00:00.000,2015-10-15T00:00:00.000,2015-10-12T00:00:00.000,Done
2016OPA-0561,Done,OPA Close CL,06/20/2016 12:00:00 AM,06/21/2016 12:00:00 AM,06/15/2016 12:00:00 AM,,2016-06-20T00:00:00.000,2016-06-21T00:00:00.000,2016-06-15T00:00:00.000,Done
2016OPA-1060,Done,OPA Close SA,,10/25/2016 12:00:00 AM,10/25/2016 12:00:00 AM,2015-319153,,2016-10-25T00:00:00.000,2016-10-25T00:00:00.000,Done
2017OPA-0529,Done,OPA Close SA,,07/13/2017 12:00:00 AM,07/13/2017 12:00:00 AM,2017-149694,,2017-07-13T00:00:00.000,2017-07-13T00:00:00.000,Done
2018OPA-0279,Done,OPA Close SA,,04/04/2019 12:00:00 AM,04/04/2019 12:00:00 AM,,,2019-04-04T00:00:00.000,2019-04-04T00:00:00.000,Done
2015OPA-0303,Done,OPA Close CL,,03/23/2015 12:00:00 AM,10/21/2015 12:00:00 AM,,,2015-03-23T00:00:00.000,2015-10-21T00:00:00.000,Done
2015OPA-1338,Done,OPA Close SA,01/04/2016 12:00:00 AM,12/30/2015 12:00:00 AM,12/30/2015 12:00:00 AM,2015-277223,2016-01-04T00:00:00.000,2015-12-30T00:00:00.000,2015-12-30T00:00:00.000,Done
2015OPA-1843,Done,OPA Close SA,02/13/2016 12:00:00 AM,02/09/2016 12:00:00 AM,02/08/2016 12:00:00 AM,,2016-02-13T00:00:00.000,2016-02-09T00:00:00.000,2016-02-08T00:00:00.000,Done
2017OPA-0525,Done,OPA Close SA,,07/07/2017 12:00:00 AM,07/07/2017 12:00:00 AM,2017-178750,,2017-07-07T00:00:00.000,2017-07-07T00:00:00.000,Done
2017OPA-1239,Done,OPA Close CL,12/31/2017 12:00:00 AM,12/28/2017 12:00:00 AM,12/01/2017 12:00:00 AM,2017-441567,2017-12-31T00:00:00.000,2017-12-28T00:00:00.000,2017-12-01T00:00:00.000,Done
2018OPA-0582,Done,OPA Training Referral,02/10/2019 12:00:00 AM,02/15/2019 12:00:00 AM,02/15/2019 12:00:00 AM,2018-231040,2019-02-10T00:00:00.000,2019-02-15T00:00:00.000,2019-02-15T00:00:00.000,Done
2018OPA-0851,Done,OPA Close SA,,11/26/2018 12:00:00 AM,11/26/2018 12:00:00 AM,,,2018-11-26T00:00:00.000,2018-11-26T00:00:00.000,Done
2020OPA-0120,Done,OPA 180 Extension Request,07/29/2020 12:00:00 AM,08/28/2020 12:00:00 AM,04/04/2020 12:00:00 AM,2020-038657,2020-07-29T00:00:00.000,2020-08-28T00:00:00.000,2020-04-04T00:00:00.000,Done
2015OPA-0242,Done,OPA Close CL,,03/13/2015 12:00:00 AM,10/22/2015 12:00:00 AM,,,2015-03-13T00:00:00.000,2015-10-22T00:00:00.000,Done
2016OPA-0598,Done,OPA Close CL,07/03/2016 12:00:00 AM,06/30/2016 12:00:00 AM,06/28/2016 12:00:00 AM,,2016-07-03T00:00:00.000,2016-06-30T00:00:00.000,2016-06-28T00:00:00.000,Done
2015OPA-1042,Done,OPA Close CL,,10/16/2015 12:00:00 AM,10/16/2015 12:00:00 AM,2015-216757,,2015-10-16T00:00:00.000,2015-10-16T00:00:00.000,Done
2015OPA-1533,Done,OPA Close Case,01/08/2016 12:00:00 AM,12/30/2015 12:00:00 AM,12/15/2015 12:00:00 AM,2015-180378,2016-01-08T00:00:00.000,2015-12-30T00:00:00.000,2015-12-15T00:00:00.000,Done
2017OPA-0018,Done,OPA Close Case,07/13/2017 12:00:00 AM,08/03/2017 12:00:00 AM,07/03/2017 12:00:00 AM,2017-002007,2017-07-13T00:00:00.000,2017-08-03T00:00:00.000,2017-07-03T00:00:00.000,Done
2020OPA-0067,Done,OPA Close CL,02/25/2020 12:00:00 AM,02/21/2020 12:00:00 AM,02/18/2020 12:00:00 AM,,2020-02-25T00:00:00.000,2020-02-21T00:00:00.000,2020-02-18T00:00:00.000,Done
2017OPA-0151,Done,OPA Close SA,,04/13/2017 12:00:00 AM,04/13/2017 12:00:00 AM,2017-013404,,2017-04-13T00:00:00.000,2017-04-13T00:00:00.000,Done
2017OPA-0199,Done,OPA Close Case,06/29/2017 12:00:00 AM,07/18/2017 12:00:00 AM,06/26/2017 12:00:00 AM,,2017-06-29T00:00:00.000,2017-07-18T00:00:00.000,2017-06-26T00:00:00.000,Done
2017OPA-0330,Done,OPA Send Complainant Closing Letter,05/01/2017 12:00:00 AM,04/04/2017 12:00:00 AM,04/03/2017 12:00:00 AM,,2017-05-01T00:00:00.000,2017-04-04T00:00:00.000,2017-04-03T00:00:00.000,Done
2017OPA-0613,Done,OPA Send Complaint Receipt,06/26/2017 12:00:00 AM,06/21/2017 12:00:00 AM,06/21/2017 12:00:00 AM,,2017-06-26T00:00:00.000,2017-06-21T00:00:00.000,2017-06-21T00:00:00.000,Done
2017OPA-0801,Done,OPA Close CL,08/23/2017 12:00:00 AM,08/22/2017 12:00:00 AM,08/18/2017 12:00:00 AM,2017-282860,2017-08-23T00:00:00.000,2017-08-22T00:00:00.000,2017-08-18T00:00:00.000,Done
2018OPA-0535,Done,OPA Close CL,07/15/2018 12:00:00 AM,07/11/2018 12:00:00 AM,07/10/2018 12:00:00 AM,2018-064107,2018-07-15T00:00:00.000,2018-07-11T00:00:00.000,2018-07-10T00:00:00.000,Done
2015OPA-0762,Done,OPA Close SA,07/13/2015 12:00:00 AM,07/10/2015 12:00:00 AM,07/08/2015 12:00:00 AM,,2015-07-13T00:00:00.000,2015-07-10T00:00:00.000,2015-07-08T00:00:00.000,Done
2015OPA-1679,Done,OPA Close SA,,01/05/2016 12:00:00 AM,01/05/2016 12:00:00 AM,2015-395542,,2016-01-05T00:00:00.000,2016-01-05T00:00:00.000,Done
2015OPA-1811,Done,OPA Close CL,12/19/2015 12:00:00 AM,12/17/2015 12:00:00 AM,12/14/2015 12:00:00 AM,,2015-12-19T00:00:00.000,2015-12-17T00:00:00.000,2015-12-14T00:00:00.000,Done
2016OPA-0405,Done,OPA Close CL,04/30/2016 12:00:00 AM,04/28/2016 12:00:00 AM,04/25/2016 12:00:00 AM,,2016-04-30T00:00:00.000,2016-04-28T00:00:00.000,2016-04-25T00:00:00.000,Done
2016OPA-1479,Done,OPA Close Case,06/01/2018 12:00:00 AM,08/20/2018 12:00:00 AM,05/22/2018 12:00:00 AM,,2018-06-01T00:00:00.000,2018-08-20T00:00:00.000,2018-05-22T00:00:00.000,Done
2017OPA-0390,Done,OPA Send Complaint Receipt,04/21/2017 12:00:00 AM,04/17/2017 12:00:00 AM,04/17/2017 12:00:00 AM,,2017-04-21T00:00:00.000,2017-04-17T00:00:00.000,2017-04-17T00:00:00.000,Done
2017OPA-0571,Done,OPA Management Action,,03/31/2018 12:00:00 AM,12/19/2017 12:00:00 AM,2016-151119,,2018-03-31T00:00:00.000,2017-12-19T00:00:00.000,Done
2017OPA-0920,Done,OPA Close Case,03/15/2018 12:00:00 AM,08/23/2018 12:00:00 AM,03/05/2018 12:00:00 AM,2017-226012,2018-03-15T00:00:00.000,2018-08-23T00:00:00.000,2018-03-05T00:00:00.000,Done
2018OPA-0418,Done,OPA Close Case,11/25/2018 12:00:00 AM,01/15/2019 12:00:00 AM,11/15/2018 12:00:00 AM,2018-158903,2018-11-25T00:00:00.000,2019-01-15T00:00:00.000,2018-11-15T00:00:00.000,Done
2018OPA-0712,Done,OPA Close CL,09/04/2018 12:00:00 AM,08/30/2018 12:00:00 AM,08/29/2018 12:00:00 AM,2018-231040,2018-09-04T00:00:00.000,2018-08-30T00:00:00.000,2018-08-29T00:00:00.000,Done
2016OPA-1130,Done,OPA Close CL,09/23/2016 12:00:00 AM,09/21/2016 12:00:00 AM,09/18/2016 12:00:00 AM,,2016-09-23T00:00:00.000,2016-09-21T00:00:00.000,2016-09-18T00:00:00.000,Done
2016OPA-1487,Done,OPA Close CL,01/22/2017 12:00:00 AM,01/18/2017 12:00:00 AM,01/12/2017 12:00:00 AM,,2017-01-22T00:00:00.000,2017-01-18T00:00:00.000,2017-01-12T00:00:00.000,Done
2017OPA-0383,Done,OPA Close CL,05/15/2017 12:00:00 AM,05/10/2017 12:00:00 AM,05/10/2017 12:00:00 AM,2016-392886,2017-05-15T00:00:00.000,2017-05-10T00:00:00.000,2017-05-10T00:00:00.000,Done
2019OPA-0545,Done,OPA Close CL,08/26/2019 12:00:00 AM,08/27/2019 12:00:00 AM,08/21/2019 12:00:00 AM,,2019-08-26T00:00:00.000,2019-08-27T00:00:00.000,2019-08-21T00:00:00.000,Done
2015OPA-0713,Done,OPA Close CL,,09/25/2015 12:00:00 AM,10/14/2015 12:00:00 AM,,,2015-09-25T00:00:00.000,2015-10-14T00:00:00.000,Done
2015OPA-1126,Done,OPA Close CL,,08/09/2015 12:00:00 AM,10/15/2015 12:00:00 AM,,,2015-08-09T00:00:00.000,2015-10-15T00:00:00.000,Done
2016OPA-0111,Done,OPA Close SA,03/27/2016 12:00:00 AM,03/22/2016 12:00:00 AM,03/22/2016 12:00:00 AM,2016-020154,2016-03-27T00:00:00.000,2016-03-22T00:00:00.000,2016-03-22T00:00:00.000,Done
2016OPA-0248,Done,OPA Close CL,04/08/2016 12:00:00 AM,04/06/2016 12:00:00 AM,04/03/2016 12:00:00 AM,2016-061412,2016-04-08T00:00:00.000,2016-04-06T00:00:00.000,2016-04-03T00:00:00.000,Done
2016OPA-1224,Done,OPA Close SA,,12/28/2016 12:00:00 AM,12/28/2016 12:00:00 AM,,,2016-12-28T00:00:00.000,2016-12-28T00:00:00.000,Done
2017OPA-0124,Done,OPA Close Case,06/05/2017 12:00:00 AM,06/12/2017 12:00:00 AM,05/26/2017 12:00:00 AM,,2017-06-05T00:00:00.000,2017-06-12T00:00:00.000,2017-05-26T00:00:00.000,Done
2018OPA-0758,Done,OPA Close Case,02/15/2019 12:00:00 AM,02/20/2019 12:00:00 AM,02/05/2019 12:00:00 AM,2017-310989,2019-02-15T00:00:00.000,2019-02-20T00:00:00.000,2019-02-05T00:00:00.000,Done
2019OPA-0406,Done,OPA OIG Certification,10/24/2019 12:00:00 AM,10/19/2019 12:00:00 AM,10/12/2019 12:00:00 AM,2019-208616,2019-10-24T00:00:00.000,2019-10-19T00:00:00.000,2019-10-12T00:00:00.000,Done
2020OPA-0014,Done,OPA Close CL,01/18/2020 12:00:00 AM,01/14/2020 12:00:00 AM,01/11/2020 12:00:00 AM,,2020-01-18T00:00:00.000,2020-01-14T00:00:00.000,2020-01-11T00:00:00.000,Done
2015OPA-0984,Done,OPA Close CL,,07/15/2015 12:00:00 AM,10/16/2015 12:00:00 AM,,,2015-07-15T00:00:00.000,2015-10-16T00:00:00.000,Done
2015OPA-1280,Done,OPA Close CL,,09/03/2015 12:00:00 AM,10/15/2015 12:00:00 AM,,,2015-09-03T00:00:00.000,2015-10-15T00:00:00.000,Done
2015OPA-1801,Done,OPA Close CL,11/30/2015 12:00:00 AM,11/30/2015 12:00:00 AM,11/25/2015 12:00:00 AM,,2015-11-30T00:00:00.000,2015-11-30T00:00:00.000,2015-11-25T00:00:00.000,Done
2017OPA-1309,Done,OPA Director Certification/Finding,06/24/2018 12:00:00 AM,05/05/2020 12:00:00 AM,01/30/2019 12:00:00 AM,2017-418367,2018-06-24T00:00:00.000,2020-05-05T00:00:00.000,2019-01-30T00:00:00.000,Done
2018OPA-0611,Done,OPA Close CL,08/04/2018 12:00:00 AM,08/01/2018 12:00:00 AM,07/30/2018 12:00:00 AM,,2018-08-04T00:00:00.000,2018-08-01T00:00:00.000,2018-07-30T00:00:00.000,Done
2018OPA-0722,Done,OPA Close CL,09/22/2018 12:00:00 AM,09/18/2018 12:00:00 AM,09/17/2018 12:00:00 AM,2018-228327,2018-09-22T00:00:00.000,2018-09-18T00:00:00.000,2018-09-17T00:00:00.000,Done
2018OPA-0741,Done,OPA Close Case,,02/13/2019 12:00:00 AM,01/23/2019 12:00:00 AM,2018-283033,,2019-02-13T00:00:00.000,2019-01-23T00:00:00.000,Done
2016OPA-0130,Done,OPA Close CL,02/19/2016 12:00:00 AM,02/18/2016 12:00:00 AM,02/18/2016 12:00:00 AM,,2016-02-19T00:00:00.000,2016-02-18T00:00:00.000,2016-02-18T00:00:00.000,Done
2016OPA-0276,Done,Running sheet entry,08/18/2016 12:00:00 AM,08/18/2016 12:00:00 AM,08/18/2016 12:00:00 AM,,2016-08-18T00:00:00.000,2016-08-18T00:00:00.000,2016-08-18T00:00:00.000,Done
2016OPA-0454,Done,OPA Close CL,05/04/2016 12:00:00 AM,05/04/2016 12:00:00 AM,05/04/2016 12:00:00 AM,,2016-05-04T00:00:00.000,2016-05-04T00:00:00.000,2016-05-04T00:00:00.000,Done
2017OPA-0165,Done,OPA Close SA,,04/04/2017 12:00:00 AM,04/04/2017 12:00:00 AM,2017-053375,,2017-04-04T00:00:00.000,2017-04-04T00:00:00.000,Done
2017OPA-0795,Done,OPA Close CL,09/02/2017 12:00:00 AM,08/31/2017 12:00:00 AM,08/04/2017 12:00:00 AM,2017-259472,2017-09-02T00:00:00.000,2017-08-31T00:00:00.000,2017-08-04T00:00:00.000,Done
2017OPA-1215,Done,OPA Close CL,12/11/2017 12:00:00 AM,12/08/2017 12:00:00 AM,12/06/2017 12:00:00 AM,2017-417824,2017-12-11T00:00:00.000,2017-12-08T00:00:00.000,2017-12-06T00:00:00.000,Done
2015OPA-0112,Done,OPA Close CL,,02/13/2015 12:00:00 AM,10/22/2015 12:00:00 AM,2014-222942,,2015-02-13T00:00:00.000,2015-10-22T00:00:00.000,Done
2015OPA-0518,Done,OPA Close Case,12/14/2015 12:00:00 AM,12/14/2015 12:00:00 AM,11/18/2015 12:00:00 AM,,2015-12-14T00:00:00.000,2015-12-14T00:00:00.000,2015-11-18T00:00:00.000,Done
2015OPA-1025,Done,OPA Close CL,,07/15/2015 12:00:00 AM,10/16/2015 12:00:00 AM,,,2015-07-15T00:00:00.000,2015-10-16T00:00:00.000,Done
2016OPA-1309,Done,OPA Close CL,12/01/2016 12:00:00 AM,11/22/2016 12:00:00 AM,11/02/2016 12:00:00 AM,,2016-12-01T00:00:00.000,2016-11-22T00:00:00.000,2016-11-02T00:00:00.000,Done
2016OPA-1409,Done,OPA Close SA,,01/30/2017 12:00:00 AM,01/30/2017 12:00:00 AM,,,2017-01-30T00:00:00.000,2017-01-30T00:00:00.000,Done
2017OPA-0461,Done,OPA Close CL,05/09/2017 12:00:00 AM,06/02/2017 12:00:00 AM,05/04/2017 12:00:00 AM,,2017-05-09T00:00:00.000,2017-06-02T00:00:00.000,2017-05-04T00:00:00.000,Done
2017OPA-0740,Done,OPA Close SA,,08/23/2017 12:00:00 AM,08/23/2017 12:00:00 AM,2017-103381,,2017-08-23T00:00:00.000,2017-08-23T00:00:00.000,Done
2017OPA-0814,Done,OPA Close CL,08/28/2017 12:00:00 AM,08/22/2017 12:00:00 AM,08/18/2017 12:00:00 AM,2017-275915,2017-08-28T00:00:00.000,2017-08-22T00:00:00.000,2017-08-18T00:00:00.000,Done
2017OPA-1025,Done,OPA Close CL,03/13/2018 12:00:00 AM,03/14/2018 12:00:00 AM,03/08/2018 12:00:00 AM,2017-334206,2018-03-13T00:00:00.000,2018-03-14T00:00:00.000,2018-03-08T00:00:00.000,Done
2018OPA-0708,Done,OPA Close CL,08/26/2018 12:00:00 AM,08/23/2018 12:00:00 AM,08/21/2018 12:00:00 AM,2018-275903,2018-08-26T00:00:00.000,2018-08-23T00:00:00.000,2018-08-21T00:00:00.000,Done
2015OPA-0838,Done,OPA Close CL,07/07/2015 12:00:00 AM,07/07/2015 12:00:00 AM,07/02/2015 12:00:00 AM,,2015-07-07T00:00:00.000,2015-07-07T00:00:00.000,2015-07-02T00:00:00.000,Done
2015OPA-0886,Done,OPA Close Case,12/09/2015 12:00:00 AM,12/14/2015 12:00:00 AM,11/25/2015 12:00:00 AM,,2015-12-09T00:00:00.000,2015-12-14T00:00:00.000,2015-11-25T00:00:00.000,Done
2015OPA-1864,Done,OPA Close CL,12/23/2015 12:00:00 AM,12/21/2015 12:00:00 AM,12/18/2015 12:00:00 AM,,2015-12-23T00:00:00.000,2015-12-21T00:00:00.000,2015-12-18T00:00:00.000,Done
2016OPA-1091,Done,OPA Close CL,09/21/2016 12:00:00 AM,09/21/2016 12:00:00 AM,09/16/2016 12:00:00 AM,,2016-09-21T00:00:00.000,2016-09-21T00:00:00.000,2016-09-16T00:00:00.000,Done
2017OPA-0563,Done,OPA Close CL,06/20/2017 12:00:00 AM,06/21/2017 12:00:00 AM,06/15/2017 12:00:00 AM,,2017-06-20T00:00:00.000,2017-06-21T00:00:00.000,2017-06-15T00:00:00.000,Done
2018OPA-1153,Done,OPA Close CL,12/24/2018 12:00:00 AM,01/02/2019 12:00:00 AM,12/19/2018 12:00:00 AM,2018-305146,2018-12-24T00:00:00.000,2019-01-02T00:00:00.000,2018-12-19T00:00:00.000,Done
2015OPA-0322,Done,OPA Close CL,,03/30/2015 12:00:00 AM,10/20/2015 12:00:00 AM,2014-222942,,2015-03-30T00:00:00.000,2015-10-20T00:00:00.000,Done
2017OPA-1221,Done,OPA Close CL,12/22/2017 12:00:00 AM,12/22/2017 12:00:00 AM,11/27/2017 12:00:00 AM,2017-432415,2017-12-22T00:00:00.000,2017-12-22T00:00:00.000,2017-11-27T00:00:00.000,Done
2019OPA-0033,Done,OPA Close Case,07/20/2019 12:00:00 AM,08/05/2019 12:00:00 AM,07/10/2019 12:00:00 AM,,2019-07-20T00:00:00.000,2019-08-05T00:00:00.000,2019-07-10T00:00:00.000,Done
2016OPA-0102,Done,OPA Close CL,02/07/2016 12:00:00 AM,02/03/2016 12:00:00 AM,02/02/2016 12:00:00 AM,,2016-02-07T00:00:00.000,2016-02-03T00:00:00.000,2016-02-02T00:00:00.000,Done
2016OPA-0623,Done,OPA Send Complainant Closing Letter,07/12/2016 12:00:00 AM,07/08/2016 12:00:00 AM,07/07/2016 12:00:00 AM,,2016-07-12T00:00:00.000,2016-07-08T00:00:00.000,2016-07-07T00:00:00.000,Done
2016OPA-0774,Done,OPA Close CL,08/08/2016 12:00:00 AM,08/08/2016 12:00:00 AM,08/03/2016 12:00:00 AM,,2016-08-08T00:00:00.000,2016-08-08T00:00:00.000,2016-08-03T00:00:00.000,Done
2018OPA-1176,Done,OPA Close SA,,01/31/2019 12:00:00 AM,01/31/2019 12:00:00 AM,2018-335990,,2019-01-31T00:00:00.000,2019-01-31T00:00:00.000,Done
2019OPA-0146,Done,OPA Close Case,,02/17/2020 12:00:00 AM,01/29/2020 12:00:00 AM,,,2020-02-17T00:00:00.000,2020-01-29T00:00:00.000,Done
2016OPA-1345,Done,OPA Close CL,12/05/2016 12:00:00 AM,12/07/2016 12:00:00 AM,11/30/2016 12:00:00 AM,,2016-12-05T00:00:00.000,2016-12-07T00:00:00.000,2016-11-30T00:00:00.000,Done
2017OPA-0004,Done,OPA Close Case,01/14/2018 12:00:00 AM,04/13/2018 12:00:00 AM,01/04/2018 12:00:00 AM,2016-465796,2018-01-14T00:00:00.000,2018-04-13T00:00:00.000,2018-01-04T00:00:00.000,Done
2017OPA-0144,Done,OPA Close Case,11/15/2017 12:00:00 AM,11/29/2017 12:00:00 AM,11/01/2017 12:00:00 AM,2016-347060,2017-11-15T00:00:00.000,2017-11-29T00:00:00.000,2017-11-01T00:00:00.000,Done
2017OPA-0480,Done,OPA Close SA,,06/01/2017 12:00:00 AM,06/01/2017 12:00:00 AM,2017-162715,,2017-06-01T00:00:00.000,2017-06-01T00:00:00.000,Done
2017OPA-1200,Done,OPA Close Case,05/27/2018 12:00:00 AM,08/23/2018 12:00:00 AM,05/17/2018 12:00:00 AM,2016-009445,2018-05-27T00:00:00.000,2018-08-23T00:00:00.000,2018-05-17T00:00:00.000,Done
2018OPA-1055,Done,OPA Close Case,05/19/2019 12:00:00 AM,05/14/2019 12:00:00 AM,05/09/2019 12:00:00 AM,2018-362496,2019-05-19T00:00:00.000,2019-05-14T00:00:00.000,2019-05-09T00:00:00.000,Done
2015OPA-0421,Done,OPA Close CL,,03/27/2015 12:00:00 AM,10/21/2015 12:00:00 AM,,,2015-03-27T00:00:00.000,2015-10-21T00:00:00.000,Done
2015OPA-1829,Done,OPA Close CL,01/04/2016 12:00:00 AM,01/04/2016 12:00:00 AM,12/30/2015 12:00:00 AM,2014-107627,2016-01-04T00:00:00.000,2016-01-04T00:00:00.000,2015-12-30T00:00:00.000,Done
2016OPA-0862,Done,OPA Close Case,02/27/2017 12:00:00 AM,03/15/2017 12:00:00 AM,02/17/2017 12:00:00 AM,2016-228053,2017-02-27T00:00:00.000,2017-03-15T00:00:00.000,2017-02-17T00:00:00.000,Done
2016OPA-1508,Done,OPA Close Case,06/12/2017 12:00:00 AM,06/22/2017 12:00:00 AM,06/02/2017 12:00:00 AM,2016-459120,2017-06-12T00:00:00.000,2017-06-22T00:00:00.000,2017-06-02T00:00:00.000,Done
2017OPA-0054,Done,OPA Close SA,,03/27/2017 12:00:00 AM,03/27/2017 12:00:00 AM,2016-466670,,2017-03-27T00:00:00.000,2017-03-27T00:00:00.000,Done
2017OPA-0892,Done,OPA Close CL,09/29/2017 12:00:00 AM,09/11/2017 12:00:00 AM,08/30/2017 12:00:00 AM,,2017-09-29T00:00:00.000,2017-09-11T00:00:00.000,2017-08-30T00:00:00.000,Done
2018OPA-0733,Done,OPA Close CL,08/29/2018 12:00:00 AM,08/27/2018 12:00:00 AM,08/24/2018 12:00:00 AM,,2018-08-29T00:00:00.000,2018-08-27T00:00:00.000,2018-08-24T00:00:00.000,Done
2015OPA-0265,Done,OPA Close CL,,03/12/2015 12:00:00 AM,10/22/2015 12:00:00 AM,,,2015-03-12T00:00:00.000,2015-10-22T00:00:00.000,Done
2015OPA-1739,Done,OPA Close SA,12/08/2015 12:00:00 AM,12/04/2015 12:00:00 AM,12/03/2015 12:00:00 AM,,2015-12-08T00:00:00.000,2015-12-04T00:00:00.000,2015-12-03T00:00:00.000,Done
2017OPA-1270,Done,OPA Close Case,06/10/2018 12:00:00 AM,08/24/2018 12:00:00 AM,05/31/2018 12:00:00 AM,2017-453662,2018-06-10T00:00:00.000,2018-08-24T00:00:00.000,2018-05-31T00:00:00.000,Done
2018OPA-0978,Done,OPA Close CL,10/30/2018 12:00:00 AM,11/16/2018 12:00:00 AM,10/24/2018 12:00:00 AM,,2018-10-30T00:00:00.000,2018-11-16T00:00:00.000,2018-10-24T00:00:00.000,Done
2019OPA-0149,Done,OPA Close CL,03/19/2019 12:00:00 AM,03/18/2019 12:00:00 AM,03/14/2019 12:00:00 AM,,2019-03-19T00:00:00.000,2019-03-18T00:00:00.000,2019-03-14T00:00:00.000,Done
2015OPA-0814,Done,OPA Close Case,12/15/2015 12:00:00 AM,12/23/2015 12:00:00 AM,12/02/2015 12:00:00 AM,2015-191643,2015-12-15T00:00:00.000,2015-12-23T00:00:00.000,2015-12-02T00:00:00.000,Done
2015OPA-1100,Done,OPA Close CL,,08/09/2015 12:00:00 AM,10/15/2015 12:00:00 AM,,,2015-08-09T00:00:00.000,2015-10-15T00:00:00.000,Done
2016OPA-0873,Done,OPA Close CL,08/24/2016 12:00:00 AM,08/24/2016 12:00:00 AM,08/19/2016 12:00:00 AM,,2016-08-24T00:00:00.000,2016-08-24T00:00:00.000,2016-08-19T00:00:00.000,Done
2017OPA-0015,Done,OPA Close CL,01/31/2017 12:00:00 AM,01/30/2017 12:00:00 AM,01/26/2017 12:00:00 AM,,2017-01-31T00:00:00.000,2017-01-30T00:00:00.000,2017-01-26T00:00:00.000,Done
2017OPA-1321,Done,OPA Close Case,09/09/2019 12:00:00 AM,09/13/2019 12:00:00 AM,08/30/2019 12:00:00 AM,,2019-09-09T00:00:00.000,2019-09-13T00:00:00.000,2019-08-30T00:00:00.000,Done
2015OPA-1108,Done,OPA Close SA,10/03/2015 12:00:00 AM,10/06/2015 12:00:00 AM,09/28/2015 12:00:00 AM,2015-250762,2015-10-03T00:00:00.000,2015-10-06T00:00:00.000,2015-09-28T00:00:00.000,Done
2017OPA-0833,Done,OPA Close CL,09/19/2017 12:00:00 AM,09/15/2017 12:00:00 AM,09/14/2017 12:00:00 AM,2017-302146,2017-09-19T00:00:00.000,2017-09-15T00:00:00.000,2017-09-14T00:00:00.000,Done
2019OPA-0056,Done,OPA Close CL,02/05/2019 12:00:00 AM,02/07/2019 12:00:00 AM,01/31/2019 12:00:00 AM,,2019-02-05T00:00:00.000,2019-02-07T00:00:00.000,2019-01-31T00:00:00.000,Done
2019OPA-0697,Done,OPA Close Case,,04/10/2020 12:00:00 AM,04/10/2020 12:00:00 AM,2019-343751,,2020-04-10T00:00:00.000,2020-04-10T00:00:00.000,Done
2020OPA-0168,Done,OPA Close CL,04/03/2020 12:00:00 AM,04/03/2020 12:00:00 AM,03/27/2020 12:00:00 AM,,2020-04-03T00:00:00.000,2020-04-03T00:00:00.000,2020-03-27T00:00:00.000,Done
2016OPA-0583,Done,OPA Send Complainant Closing Letter,07/04/2016 12:00:00 AM,06/29/2016 12:00:00 AM,06/29/2016 12:00:00 AM,,2016-07-04T00:00:00.000,2016-06-29T00:00:00.000,2016-06-29T00:00:00.000,Done
2017OPA-0592,Done,OPA Send Complaint Receipt,06/19/2017 12:00:00 AM,06/14/2017 12:00:00 AM,06/14/2017 12:00:00 AM,,2017-06-19T00:00:00.000,2017-06-14T00:00:00.000,2017-06-14T00:00:00.000,Done
2018OPA-0803,Done,OPA Close CL,09/18/2018 12:00:00 AM,09/14/2018 12:00:00 AM,09/13/2018 12:00:00 AM,,2018-09-18T00:00:00.000,2018-09-14T00:00:00.000,2018-09-13T00:00:00.000,Done
2018OPA-0872,Done,OPA Training Referral,02/07/2019 12:00:00 AM,02/20/2019 12:00:00 AM,04/12/2019 12:00:00 AM,2018-283585,2019-02-07T00:00:00.000,2019-02-20T00:00:00.000,2019-04-12T00:00:00.000,Done
2019OPA-0448,Done,OPA Close SA,,09/27/2019 12:00:00 AM,09/27/2019 12:00:00 AM,,,2019-09-27T00:00:00.000,2019-09-27T00:00:00.000,Done
2019OPA-0536,Done,OPA Close Case,03/08/2020 12:00:00 AM,04/16/2020 12:00:00 AM,02/23/2020 12:00:00 AM,2019-269547,2020-03-08T00:00:00.000,2020-04-16T00:00:00.000,2020-02-23T00:00:00.000,Done
2020OPA-0239,Done,OPA 5 Day Notice,04/27/2020 12:00:00 AM,04/22/2020 12:00:00 AM,04/21/2020 12:00:00 AM,2020-125532,2020-04-27T00:00:00.000,2020-04-22T00:00:00.000,2020-04-21T00:00:00.000,Done
2015OPA-0315,Done,OPA Close Case,09/10/2015 12:00:00 AM,09/16/2015 12:00:00 AM,09/01/2015 12:00:00 AM,,2015-09-10T00:00:00.000,2015-09-16T00:00:00.000,2015-09-01T00:00:00.000,Done
2015OPA-1671,Done,OPA Close Case,03/01/2016 12:00:00 AM,03/16/2016 12:00:00 AM,02/23/2016 12:00:00 AM,,2016-03-01T00:00:00.000,2016-03-16T00:00:00.000,2016-02-23T00:00:00.000,Done
2017OPA-0268,Done,OPA Missed 180 Day Deadline,08/29/2017 12:00:00 AM,07/10/2018 12:00:00 AM,10/03/2018 12:00:00 AM,2017-062970,2017-08-29T00:00:00.000,2018-07-10T00:00:00.000,2018-10-03T00:00:00.000,Done
2017OPA-0996,Done,OPA Close CL,10/26/2017 12:00:00 AM,10/27/2017 12:00:00 AM,09/26/2017 12:00:00 AM,,2017-10-26T00:00:00.000,2017-10-27T00:00:00.000,2017-09-26T00:00:00.000,Done
2017OPA-1184,Done,OPA Close Case,04/08/2018 12:00:00 AM,08/01/2018 12:00:00 AM,03/29/2018 12:00:00 AM,,2018-04-08T00:00:00.000,2018-08-01T00:00:00.000,2018-03-29T00:00:00.000,Done
2019OPA-0630,Done,OPA Close CL,09/08/2019 12:00:00 AM,09/11/2019 12:00:00 AM,08/30/2019 12:00:00 AM,,2019-09-08T00:00:00.000,2019-09-11T00:00:00.000,2019-08-30T00:00:00.000,Done
2015OPA-0642,Done,OPA Close SA,08/29/2015 12:00:00 AM,08/25/2015 12:00:00 AM,08/24/2015 12:00:00 AM,2015-147712,2015-08-29T00:00:00.000,2015-08-25T00:00:00.000,2015-08-24T00:00:00.000,Done
2015OPA-0901,Done,OPA Close Case,,12/23/2015 12:00:00 AM,11/25/2015 12:00:00 AM,,,2015-12-23T00:00:00.000,2015-11-25T00:00:00.000,Done
2015OPA-1406,Done,OPA Close CL,,10/01/2015 12:00:00 AM,10/13/2015 12:00:00 AM,,,2015-10-01T00:00:00.000,2015-10-13T00:00:00.000,Done
2016OPA-0099,Done,OPA Close CL,02/28/2016 12:00:00 AM,02/29/2016 12:00:00 AM,02/23/2016 12:00:00 AM,,2016-02-28T00:00:00.000,2016-02-29T00:00:00.000,2016-02-23T00:00:00.000,Done
2016OPA-0306,Done,OPA Close CL,04/25/2016 12:00:00 AM,04/25/2016 12:00:00 AM,04/20/2016 12:00:00 AM,,2016-04-25T00:00:00.000,2016-04-25T00:00:00.000,2016-04-20T00:00:00.000,Done
2017OPA-0429,Done,OPA TAC Notification,03/11/2019 12:00:00 AM,03/11/2019 12:00:00 AM,03/05/2019 12:00:00 AM,,2019-03-11T00:00:00.000,2019-03-11T00:00:00.000,2019-03-05T00:00:00.000,Done
2017OPA-0751,Done,OPA Final Discipline Action Report,,01/04/2018 12:00:00 AM,01/22/2019 12:00:00 AM,2017-249229,,2018-01-04T00:00:00.000,2019-01-22T00:00:00.000,Done
2017OPA-0970,Done,OPA Close CL,10/16/2017 12:00:00 AM,10/17/2017 12:00:00 AM,10/11/2017 12:00:00 AM,,2017-10-16T00:00:00.000,2017-10-17T00:00:00.000,2017-10-11T00:00:00.000,Done
2017OPA-1159,Done,OPA Training Referral,,04/24/2018 12:00:00 AM,04/24/2018 12:00:00 AM,2017-408893,,2018-04-24T00:00:00.000,2018-04-24T00:00:00.000,Done
2018OPA-0616,Done,OPA Training Referral,,02/07/2019 12:00:00 AM,01/17/2019 12:00:00 AM,2018-240931,,2019-02-07T00:00:00.000,2019-01-17T00:00:00.000,Done
2015OPA-0883,Done,OPA Close Case,,12/23/2015 12:00:00 AM,11/25/2015 12:00:00 AM,,,2015-12-23T00:00:00.000,2015-11-25T00:00:00.000,Done
2019OPA-0821,Done,OPA OIG Certification,03/05/2020 12:00:00 AM,03/09/2020 12:00:00 AM,02/24/2020 12:00:00 AM,,2020-03-05T00:00:00.000,2020-03-09T00:00:00.000,2020-02-24T00:00:00.000,Done
2020OPA-0070,To do,OPA 180 Timeline Calculation,01/10/2020 12:00:00 AM,07/08/2020 12:00:00 AM,02/15/2020 12:00:00 AM,2020-012145,2020-01-10T00:00:00.000,2020-07-08T00:00:00.000,2020-02-15T00:00:00.000,To do
2015OPA-1606,Done,OPA Close SA,01/04/2016 12:00:00 AM,12/30/2015 12:00:00 AM,12/30/2015 12:00:00 AM,2012-290250,2016-01-04T00:00:00.000,2015-12-30T00:00:00.000,2015-12-30T00:00:00.000,Done
2015OPA-1915,Done,OPA Close CL,01/04/2016 12:00:00 AM,01/04/2016 12:00:00 AM,12/30/2015 12:00:00 AM,,2016-01-04T00:00:00.000,2016-01-04T00:00:00.000,2015-12-30T00:00:00.000,Done
2018OPA-0005,Done,OPA Close SA,,03/28/2018 12:00:00 AM,03/28/2018 12:00:00 AM,2017-476901,,2018-03-28T00:00:00.000,2018-03-28T00:00:00.000,Done
2019OPA-0705,Done,OPA Send Complaint Classification Letter,10/20/2019 12:00:00 AM,10/21/2019 12:00:00 AM,10/21/2019 12:00:00 AM,2019-358589,2019-10-20T00:00:00.000,2019-10-21T00:00:00.000,2019-10-21T00:00:00.000,Done
2015OPA-0646,Done,OPA Director SA Review,07/06/2015 12:00:00 AM,07/21/2015 12:00:00 AM,07/01/2015 12:00:00 AM,2015-153187,2015-07-06T00:00:00.000,2015-07-21T00:00:00.000,2015-07-01T00:00:00.000,Done
2015OPA-0844,Done,OPA Close CL,,06/26/2015 12:00:00 AM,10/19/2015 12:00:00 AM,,,2015-06-26T00:00:00.000,2015-10-19T00:00:00.000,Done
2015OPA-1617,Done,OPA Close SA,12/12/2015 12:00:00 AM,12/07/2015 12:00:00 AM,12/07/2015 12:00:00 AM,,2015-12-12T00:00:00.000,2015-12-07T00:00:00.000,2015-12-07T00:00:00.000,Done
2019OPA-0867,Done,OPA OIG Certification,04/17/2020 12:00:00 AM,04/09/2020 12:00:00 AM,04/07/2020 12:00:00 AM,2019-430629,2020-04-17T00:00:00.000,2020-04-09T00:00:00.000,2020-04-07T00:00:00.000,Done
2020OPA-0199,To do,OPA 180 Timeline Calculation,02/10/2020 12:00:00 AM,08/08/2020 12:00:00 AM,04/22/2020 12:00:00 AM,2020-052063,2020-02-10T00:00:00.000,2020-08-08T00:00:00.000,2020-04-22T00:00:00.000,To do
2015OPA-0852,Done,OPA Close Case,,12/23/2015 12:00:00 AM,11/25/2015 12:00:00 AM,,,2015-12-23T00:00:00.000,2015-11-25T00:00:00.000,Done
2016OPA-0543,Done,OPA Send Complainant Closing Letter,06/26/2016 12:00:00 AM,06/29/2016 12:00:00 AM,06/21/2016 12:00:00 AM,,2016-06-26T00:00:00.000,2016-06-29T00:00:00.000,2016-06-21T00:00:00.000,Done
2017OPA-1047,Done,OPA Close SA,,01/09/2018 12:00:00 AM,01/09/2018 12:00:00 AM,,,2018-01-09T00:00:00.000,2018-01-09T00:00:00.000,Done
2018OPA-0636,Done,OPA Close Case,,02/15/2019 12:00:00 AM,01/21/2019 12:00:00 AM,2018-239381,,2019-02-15T00:00:00.000,2019-01-21T00:00:00.000,Done
2018OPA-0726,Done,OPA Case Assignment,08/28/2018 12:00:00 AM,08/30/2018 12:00:00 AM,08/23/2018 12:00:00 AM,2018-166614,2018-08-28T00:00:00.000,2018-08-30T00:00:00.000,2018-08-23T00:00:00.000,Done
2019OPA-0423,Done,OPA Close CL,06/30/2019 12:00:00 AM,07/01/2019 12:00:00 AM,06/25/2019 12:00:00 AM,,2019-06-30T00:00:00.000,2019-07-01T00:00:00.000,2019-06-25T00:00:00.000,Done
2019OPA-0913,Done,OPA Close CL,01/14/2020 12:00:00 AM,01/16/2020 12:00:00 AM,01/06/2020 12:00:00 AM,2019-456133,2020-01-14T00:00:00.000,2020-01-16T00:00:00.000,2020-01-06T00:00:00.000,Done
2015OPA-0120,Done,OPA Close CL,,02/20/2015 12:00:00 AM,10/22/2015 12:00:00 AM,2014-222942,,2015-02-20T00:00:00.000,2015-10-22T00:00:00.000,Done
2015OPA-0557,Done,OPA Director SA Review,05/25/2015 12:00:00 AM,06/17/2015 12:00:00 AM,05/20/2015 12:00:00 AM,2015-130033,2015-05-25T00:00:00.000,2015-06-17T00:00:00.000,2015-05-20T00:00:00.000,Done
2015OPA-1066,Done,OPA Close SA,09/14/2015 12:00:00 AM,09/09/2015 12:00:00 AM,09/09/2015 12:00:00 AM,2015-233763,2015-09-14T00:00:00.000,2015-09-09T00:00:00.000,2015-09-09T00:00:00.000,Done
2015OPA-1231,Done,OPA Close SA,11/09/2015 12:00:00 AM,11/05/2015 12:00:00 AM,11/04/2015 12:00:00 AM,2015-281686,2015-11-09T00:00:00.000,2015-11-05T00:00:00.000,2015-11-04T00:00:00.000,Done
2018OPA-0019,Done,OPA Final Discipline Action Report,11/08/2018 12:00:00 AM,11/08/2018 12:00:00 AM,01/29/2019 12:00:00 AM,,2018-11-08T00:00:00.000,2018-11-08T00:00:00.000,2019-01-29T00:00:00.000,Done
2019OPA-0007,Done,OPA Close CL,01/23/2019 12:00:00 AM,01/29/2019 12:00:00 AM,01/18/2019 12:00:00 AM,2018-403697,2019-01-23T00:00:00.000,2019-01-29T00:00:00.000,2019-01-18T00:00:00.000,Done
2015OPA-0287,Done,OPA Close Case,11/16/2015 12:00:00 AM,11/13/2015 12:00:00 AM,11/09/2015 12:00:00 AM,,2015-11-16T00:00:00.000,2015-11-13T00:00:00.000,2015-11-09T00:00:00.000,Done
2015OPA-1571,Done,OPA Close Case,03/04/2016 12:00:00 AM,03/16/2016 12:00:00 AM,02/23/2016 12:00:00 AM,2015-352272,2016-03-04T00:00:00.000,2016-03-16T00:00:00.000,2016-02-23T00:00:00.000,Done
2016OPA-0930,Done,OPA Close Case,04/20/2017 12:00:00 AM,04/25/2017 12:00:00 AM,04/14/2017 12:00:00 AM,2016-273804,2017-04-20T00:00:00.000,2017-04-25T00:00:00.000,2017-04-14T00:00:00.000,Done
2017OPA-0857,Done,OPA Close CL,09/04/2017 12:00:00 AM,09/11/2017 12:00:00 AM,08/30/2017 12:00:00 AM,2017-305098,2017-09-04T00:00:00.000,2017-09-11T00:00:00.000,2017-08-30T00:00:00.000,Done
2017OPA-1278,Done,OPA Close Case,06/08/2018 12:00:00 AM,08/24/2018 12:00:00 AM,05/29/2018 12:00:00 AM,2017-433927,2018-06-08T00:00:00.000,2018-08-24T00:00:00.000,2018-05-29T00:00:00.000,Done
2018OPA-0194,Done,OPA Close CL,04/01/2018 12:00:00 AM,04/11/2018 12:00:00 AM,03/27/2018 12:00:00 AM,,2018-04-01T00:00:00.000,2018-04-11T00:00:00.000,2018-03-27T00:00:00.000,Done
2018OPA-0749,Done,OPA Close Case,,02/26/2019 12:00:00 AM,01/21/2019 12:00:00 AM,2018-282990,,2019-02-26T00:00:00.000,2019-01-21T00:00:00.000,Done
2019OPA-0920,Done,OPA Close SA,,02/28/2020 12:00:00 AM,02/28/2020 12:00:00 AM,2109-454915,,2020-02-28T00:00:00.000,2020-02-28T00:00:00.000,Done
2015OPA-0144,Done,OPA Director SA Review,05/12/2015 12:00:00 AM,05/20/2015 12:00:00 AM,05/07/2015 12:00:00 AM,,2015-05-12T00:00:00.000,2015-05-20T00:00:00.000,2015-05-07T00:00:00.000,Done
2015OPA-0539,Done,OPA Close CL,,05/11/2015 12:00:00 AM,10/20/2015 12:00:00 AM,2015-122147,,2015-05-11T00:00:00.000,2015-10-20T00:00:00.000,Done
2015OPA-0700,Done,OPA Close CL,,06/08/2015 12:00:00 AM,10/19/2015 12:00:00 AM,2015-156882,,2015-06-08T00:00:00.000,2015-10-19T00:00:00.000,Done
2015OPA-1378,Done,OPA Close CL,,10/01/2015 12:00:00 AM,10/13/2015 12:00:00 AM,,,2015-10-01T00:00:00.000,2015-10-13T00:00:00.000,Done
2017OPA-0753,Done,OPA Close Case,01/25/2018 12:00:00 AM,05/18/2018 12:00:00 AM,01/19/2018 12:00:00 AM,2017-269600,2018-01-25T00:00:00.000,2018-05-18T00:00:00.000,2018-01-19T00:00:00.000,Done
2018OPA-0457,Done,OPA Close CL,06/20/2018 12:00:00 AM,06/20/2018 12:00:00 AM,06/15/2018 12:00:00 AM,2018-182843,2018-06-20T00:00:00.000,2018-06-20T00:00:00.000,2018-06-15T00:00:00.000,Done
2015OPA-0561,Done,OPA Close CL,,05/11/2015 12:00:00 AM,10/20/2015 12:00:00 AM,2015-026409,,2015-05-11T00:00:00.000,2015-10-20T00:00:00.000,Done
2019OPA-0871,Done,OPA Close CL,01/04/2020 12:00:00 AM,01/06/2020 12:00:00 AM,12/27/2019 12:00:00 AM,,2020-01-04T00:00:00.000,2020-01-06T00:00:00.000,2019-12-27T00:00:00.000,Done
2016OPA-0196,Done,OPA Close CL,03/28/2016 12:00:00 AM,03/23/2016 12:00:00 AM,03/23/2016 12:00:00 AM,2015-061853,2016-03-28T00:00:00.000,2016-03-23T00:00:00.000,2016-03-23T00:00:00.000,Done
2016OPA-1200,Done,OPA Close SA,,01/19/2017 12:00:00 AM,01/18/2017 12:00:00 AM,2016-225065,,2017-01-19T00:00:00.000,2017-01-18T00:00:00.000,Done
2016OPA-1372,Done,OPA Close SA,,02/17/2017 12:00:00 AM,02/17/2017 12:00:00 AM,,,2017-02-17T00:00:00.000,2017-02-17T00:00:00.000,Done
2015OPA-0371,Done,OPA Director SA Review,04/21/2015 12:00:00 AM,04/21/2015 12:00:00 AM,04/16/2015 12:00:00 AM,2015-088024,2015-04-21T00:00:00.000,2015-04-21T00:00:00.000,2015-04-16T00:00:00.000,Done
2016OPA-0427,Done,OPA Close CL,05/04/2016 12:00:00 AM,05/04/2016 12:00:00 AM,05/04/2016 12:00:00 AM,,2016-05-04T00:00:00.000,2016-05-04T00:00:00.000,2016-05-04T00:00:00.000,Done
2019OPA-0234,Done,OPA Close SA,,05/23/2019 12:00:00 AM,05/23/2019 12:00:00 AM,2019-133543,,2019-05-23T00:00:00.000,2019-05-23T00:00:00.000,Done
2016OPA-0695,Done,OPA Close SA,,08/08/2016 12:00:00 AM,08/08/2016 12:00:00 AM,2016-106373,,2016-08-08T00:00:00.000,2016-08-08T00:00:00.000,Done
2016OPA-1037,Done,OPA Close CL,09/26/2016 12:00:00 AM,09/26/2016 12:00:00 AM,09/21/2016 12:00:00 AM,,2016-09-26T00:00:00.000,2016-09-26T00:00:00.000,2016-09-21T00:00:00.000,Done
2018OPA-0297,Done,OPA Close CL,04/25/2018 12:00:00 AM,05/14/2018 12:00:00 AM,04/20/2018 12:00:00 AM,2018-101563,2018-04-25T00:00:00.000,2018-05-14T00:00:00.000,2018-04-20T00:00:00.000,Done
2018OPA-0510,Done,OPA Close CL,06/17/2018 12:00:00 AM,06/15/2018 12:00:00 AM,06/12/2018 12:00:00 AM,,2018-06-17T00:00:00.000,2018-06-15T00:00:00.000,2018-06-12T00:00:00.000,Done
2018OPA-1027,Done,OPA Close CL,11/20/2018 12:00:00 AM,11/20/2018 12:00:00 AM,11/15/2018 12:00:00 AM,,2018-11-20T00:00:00.000,2018-11-20T00:00:00.000,2018-11-15T00:00:00.000,Done
2015OPA-0330,Done,OPA Close CL,,03/23/2015 12:00:00 AM,10/21/2015 12:00:00 AM,,,2015-03-23T00:00:00.000,2015-10-21T00:00:00.000,Done
2015OPA-0730,Done,OPA Close CL,,07/20/2015 12:00:00 AM,10/16/2015 12:00:00 AM,,,2015-07-20T00:00:00.000,2015-10-16T00:00:00.000,Done
2016OPA-1441,Done,OPA Close Case,05/31/2017 12:00:00 AM,06/06/2017 12:00:00 AM,06/01/2017 12:00:00 AM,,2017-05-31T00:00:00.000,2017-06-06T00:00:00.000,2017-06-01T00:00:00.000,Done
2017OPA-0180,Done,OPA Send Complaint Receipt,02/24/2017 12:00:00 AM,02/21/2017 12:00:00 AM,02/21/2017 12:00:00 AM,,2017-02-24T00:00:00.000,2017-02-21T00:00:00.000,2017-02-21T00:00:00.000,Done
2015OPA-0399,Done,OPA Director SA Review,06/01/2015 12:00:00 AM,06/17/2015 12:00:00 AM,05/27/2015 12:00:00 AM,,2015-06-01T00:00:00.000,2015-06-17T00:00:00.000,2015-05-27T00:00:00.000,Done
2016OPA-1250,Done,OPA Close CL,11/13/2016 12:00:00 AM,11/10/2016 12:00:00 AM,10/12/2016 12:00:00 AM,,2016-11-13T00:00:00.000,2016-11-10T00:00:00.000,2016-10-12T00:00:00.000,Done
2017OPA-0042,Done,OPA Close CL,02/05/2017 12:00:00 AM,02/06/2017 12:00:00 AM,01/31/2017 12:00:00 AM,,2017-02-05T00:00:00.000,2017-02-06T00:00:00.000,2017-01-31T00:00:00.000,Done
2015OPA-0191,Done,OPA Close CL,,03/02/2015 12:00:00 AM,10/22/2015 12:00:00 AM,,,2015-03-02T00:00:00.000,2015-10-22T00:00:00.000,Done
2016OPA-0082,Done,OPA Close Case,08/05/2016 12:00:00 AM,08/05/2016 12:00:00 AM,07/26/2016 12:00:00 AM,2016-028952,2016-08-05T00:00:00.000,2016-08-05T00:00:00.000,2016-07-26T00:00:00.000,Done
2016OPA-0447,Done,OPA Close CL,05/09/2016 12:00:00 AM,05/09/2016 12:00:00 AM,05/04/2016 12:00:00 AM,,2016-05-09T00:00:00.000,2016-05-09T00:00:00.000,2016-05-04T00:00:00.000,Done
2016OPA-0737,Done,OPA Close CL,08/15/2016 12:00:00 AM,08/10/2016 12:00:00 AM,08/01/2016 12:00:00 AM,2016-234537,2016-08-15T00:00:00.000,2016-08-10T00:00:00.000,2016-08-01T00:00:00.000,Done
2017OPA-0726,Done,OPA Close CL,08/18/2017 12:00:00 AM,08/15/2017 12:00:00 AM,07/26/2017 12:00:00 AM,,2017-08-18T00:00:00.000,2017-08-15T00:00:00.000,2017-07-26T00:00:00.000,Done
2018OPA-0156,Done,OPA Close Case,08/16/2018 12:00:00 AM,10/09/2018 12:00:00 AM,08/06/2018 12:00:00 AM,2018-051922,2018-08-16T00:00:00.000,2018-10-09T00:00:00.000,2018-08-06T00:00:00.000,Done
2019OPA-0157,Done,OPA Training Referral,09/22/2019 12:00:00 AM,10/15/2019 12:00:00 AM,09/12/2019 12:00:00 AM,,2019-09-22T00:00:00.000,2019-10-15T00:00:00.000,2019-09-12T00:00:00.000,Done
2015OPA-0507,Done,OPA Training Referral,10/25/2015 12:00:00 AM,10/13/2015 12:00:00 AM,10/15/2015 12:00:00 AM,2015-102443,2015-10-25T00:00:00.000,2015-10-13T00:00:00.000,2015-10-15T00:00:00.000,Done
2015OPA-1868,Done,OPA Close Case,06/20/2016 12:00:00 AM,06/30/2016 12:00:00 AM,06/06/2016 12:00:00 AM,2015-428574,2016-06-20T00:00:00.000,2016-06-30T00:00:00.000,2016-06-06T00:00:00.000,Done
2016OPA-0722,Done,OPA Close CL,07/29/2016 12:00:00 AM,07/28/2016 12:00:00 AM,07/22/2016 12:00:00 AM,,2016-07-29T00:00:00.000,2016-07-28T00:00:00.000,2016-07-22T00:00:00.000,Done
2018OPA-0111,Done,OPA Close Case,03/06/2018 12:00:00 AM,03/01/2018 12:00:00 AM,03/01/2018 12:00:00 AM,,2018-03-06T00:00:00.000,2018-03-01T00:00:00.000,2018-03-01T00:00:00.000,Done
2018OPA-0663,Done,OPA Close SA,,09/04/2018 12:00:00 AM,09/04/2018 12:00:00 AM,2018-216222,,2018-09-04T00:00:00.000,2018-09-04T00:00:00.000,Done
2020OPA-0049,Done,OPA Close SA,,03/03/2020 12:00:00 AM,03/03/2020 12:00:00 AM,2020-025863,,2020-03-03T00:00:00.000,2020-03-03T00:00:00.000,Done
2015OPA-0961,Done,OPA Close Case,12/28/2015 12:00:00 AM,12/28/2015 12:00:00 AM,12/11/2015 12:00:00 AM,2015-135942,2015-12-28T00:00:00.000,2015-12-28T00:00:00.000,2015-12-11T00:00:00.000,Done
2015OPA-1472,Done,OPA Close CL,,10/20/2015 12:00:00 AM,10/20/2015 12:00:00 AM,,,2015-10-20T00:00:00.000,2015-10-20T00:00:00.000,Done
2017OPA-0742,Done,OPA Close Case,01/22/2018 12:00:00 AM,04/19/2018 12:00:00 AM,01/12/2018 12:00:00 AM,2017-233780,2018-01-22T00:00:00.000,2018-04-19T00:00:00.000,2018-01-12T00:00:00.000,Done
2018OPA-0680,Done,OPA Close CL,08/11/2018 12:00:00 AM,08/09/2018 12:00:00 AM,08/06/2018 12:00:00 AM,,2018-08-11T00:00:00.000,2018-08-09T00:00:00.000,2018-08-06T00:00:00.000,Done
2018OPA-0828,Done,OPA Close SA,,09/24/2018 12:00:00 AM,09/24/2018 12:00:00 AM,,,2018-09-24T00:00:00.000,2018-09-24T00:00:00.000,Done
2015OPA-0237,Done,OPA Close Case,08/20/2015 12:00:00 AM,09/09/2015 12:00:00 AM,08/31/2015 12:00:00 AM,,2015-08-20T00:00:00.000,2015-09-09T00:00:00.000,2015-08-31T00:00:00.000,Done
2015OPA-0954,Done,OPA Close SA,08/22/2015 12:00:00 AM,08/19/2015 12:00:00 AM,08/17/2015 12:00:00 AM,,2015-08-22T00:00:00.000,2015-08-19T00:00:00.000,2015-08-17T00:00:00.000,Done
2017OPA-0350,Done,OPA Close Case,07/11/2017 12:00:00 AM,07/26/2017 12:00:00 AM,07/11/2017 12:00:00 AM,2017-119979,2017-07-11T00:00:00.000,2017-07-26T00:00:00.000,2017-07-11T00:00:00.000,Done
2017OPA-1307,Done,OPA Close CL,01/23/2018 12:00:00 AM,01/18/2018 12:00:00 AM,12/26/2017 12:00:00 AM,2017-458182,2018-01-23T00:00:00.000,2018-01-18T00:00:00.000,2017-12-26T00:00:00.000,Done
2018OPA-0967,Done,OPA Close Case,04/15/2019 12:00:00 AM,04/19/2019 12:00:00 AM,04/19/2019 12:00:00 AM,,2019-04-15T00:00:00.000,2019-04-19T00:00:00.000,2019-04-19T00:00:00.000,Done
2019OPA-0868,Done,OPA Close CL,01/03/2020 12:00:00 AM,01/06/2020 12:00:00 AM,12/26/2019 12:00:00 AM,2019-447182,2020-01-03T00:00:00.000,2020-01-06T00:00:00.000,2019-12-26T00:00:00.000,Done
2015OPA-0711,Done,OPA Close Case,03/24/2016 12:00:00 AM,03/25/2016 12:00:00 AM,03/14/2016 12:00:00 AM,2015-147712,2016-03-24T00:00:00.000,2016-03-25T00:00:00.000,2016-03-14T00:00:00.000,Done
2016OPA-0173,Done,OPA Close SA,03/30/2016 12:00:00 AM,03/24/2016 12:00:00 AM,03/15/2016 12:00:00 AM,2015-386468,2016-03-30T00:00:00.000,2016-03-24T00:00:00.000,2016-03-15T00:00:00.000,Done
2017OPA-0818,Done,OPA Director Certification/Finding,02/05/2018 12:00:00 AM,03/31/2020 12:00:00 AM,01/25/2018 12:00:00 AM,,2018-02-05T00:00:00.000,2020-03-31T00:00:00.000,2018-01-25T00:00:00.000,Done
2017OPA-1075,Done,OPA Close SA,,12/20/2017 12:00:00 AM,12/20/2017 12:00:00 AM,,,2017-12-20T00:00:00.000,2017-12-20T00:00:00.000,Done
2017OPA-1120,Done,OPA Close CL,11/28/2017 12:00:00 AM,11/27/2017 12:00:00 AM,10/30/2017 12:00:00 AM,,2017-11-28T00:00:00.000,2017-11-27T00:00:00.000,2017-10-30T00:00:00.000,Done
2017OPA-1257,Done,OPA Close Case,08/12/2018 12:00:00 AM,09/24/2018 12:00:00 AM,08/02/2018 12:00:00 AM,2017-445691,2018-08-12T00:00:00.000,2018-09-24T00:00:00.000,2018-08-02T00:00:00.000,Done
2018OPA-1075,Done,OPA Close Case,05/24/2019 12:00:00 AM,05/21/2019 12:00:00 AM,05/14/2019 12:00:00 AM,2017-437943,2019-05-24T00:00:00.000,2019-05-21T00:00:00.000,2019-05-14T00:00:00.000,Done
2015OPA-0448,Done,OPA Close Case,08/24/2015 12:00:00 AM,08/24/2015 12:00:00 AM,08/10/2015 12:00:00 AM,,2015-08-24T00:00:00.000,2015-08-24T00:00:00.000,2015-08-10T00:00:00.000,Done
2015OPA-1337,Done,OPA Close SA,11/07/2015 12:00:00 AM,11/02/2015 12:00:00 AM,11/02/2015 12:00:00 AM,,2015-11-07T00:00:00.000,2015-11-02T00:00:00.000,2015-11-02T00:00:00.000,Done
2015OPA-1370,Done,OPA Close SA,03/16/2016 12:00:00 AM,03/11/2016 12:00:00 AM,03/11/2016 12:00:00 AM,2015-305468,2016-03-16T00:00:00.000,2016-03-11T00:00:00.000,2016-03-11T00:00:00.000,Done
2016OPA-1298,Done,OPA Close SA,,12/22/2016 12:00:00 AM,12/22/2016 12:00:00 AM,2016-372829,,2016-12-22T00:00:00.000,2016-12-22T00:00:00.000,Done
2017OPA-1123,Done,OPA Final Discipline Action Report,,06/08/2018 12:00:00 AM,01/22/2019 12:00:00 AM,2017-386552,,2018-06-08T00:00:00.000,2019-01-22T00:00:00.000,Done
2017OPA-1238,Done,OPA Close SA,,02/15/2018 12:00:00 AM,02/15/2018 12:00:00 AM,2017-262532,,2018-02-15T00:00:00.000,2018-02-15T00:00:00.000,Done
2018OPA-0453,Done,OPA Close CL,06/22/2018 12:00:00 AM,05/24/2018 12:00:00 AM,05/22/2018 12:00:00 AM,,2018-06-22T00:00:00.000,2018-05-24T00:00:00.000,2018-05-22T00:00:00.000,Done
2019OPA-0756,Done,OPA 180 Extension Request,05/05/2020 12:00:00 AM,06/04/2020 12:00:00 AM,04/02/2020 12:00:00 AM,2019-375610,2020-05-05T00:00:00.000,2020-06-04T00:00:00.000,2020-04-02T00:00:00.000,Done
2015OPA-0765,Done,OPA Close Case,12/15/2015 12:00:00 AM,12/22/2015 12:00:00 AM,11/25/2015 12:00:00 AM,2015-178683,2015-12-15T00:00:00.000,2015-12-22T00:00:00.000,2015-11-25T00:00:00.000,Done
2015OPA-1198,Done,OPA Close SA,12/19/2015 12:00:00 AM,12/15/2015 12:00:00 AM,12/14/2015 12:00:00 AM,,2015-12-19T00:00:00.000,2015-12-15T00:00:00.000,2015-12-14T00:00:00.000,Done
2019OPA-0246,Done,OPA Training Referral,10/17/2019 12:00:00 AM,11/19/2019 12:00:00 AM,10/23/2019 12:00:00 AM,2018-194193,2019-10-17T00:00:00.000,2019-11-19T00:00:00.000,2019-10-23T00:00:00.000,Done
2015OPA-1517,Done,OPA Close CL,,10/19/2015 12:00:00 AM,10/19/2015 12:00:00 AM,2015-351287,,2015-10-19T00:00:00.000,2015-10-19T00:00:00.000,Done
2015OPA-1814,Done,OPA Close Case,09/08/2016 12:00:00 AM,09/08/2016 12:00:00 AM,09/01/2016 12:00:00 AM,,2016-09-08T00:00:00.000,2016-09-08T00:00:00.000,2016-09-01T00:00:00.000,Done
2016OPA-0610,Done,OPA Close SA,08/09/2016 12:00:00 AM,07/25/2016 12:00:00 AM,07/25/2016 12:00:00 AM,,2016-08-09T00:00:00.000,2016-07-25T00:00:00.000,2016-07-25T00:00:00.000,Done
2017OPA-1300,Done,OPA Close CL,01/26/2018 12:00:00 AM,01/17/2018 12:00:00 AM,01/11/2018 12:00:00 AM,2017-459182,2018-01-26T00:00:00.000,2018-01-17T00:00:00.000,2018-01-11T00:00:00.000,Done
2018OPA-0159,Done,OPA Close SA,,05/10/2018 12:00:00 AM,05/10/2018 12:00:00 AM,,,2018-05-10T00:00:00.000,2018-05-10T00:00:00.000,Done
2015OPA-1215,Done,OPA Close CL,,09/03/2015 12:00:00 AM,10/15/2015 12:00:00 AM,,,2015-09-03T00:00:00.000,2015-10-15T00:00:00.000,Done
2015OPA-1555,Done,OPA Close SA,12/08/2015 12:00:00 AM,12/04/2015 12:00:00 AM,12/03/2015 12:00:00 AM,2015-368262,2015-12-08T00:00:00.000,2015-12-04T00:00:00.000,2015-12-03T00:00:00.000,Done
2015OPA-1936,Done,OPA Close CL,01/20/2016 12:00:00 AM,01/20/2016 12:00:00 AM,01/15/2016 12:00:00 AM,,2016-01-20T00:00:00.000,2016-01-20T00:00:00.000,2016-01-15T00:00:00.000,Done
2016OPA-0438,Done,OPA Close Case,10/23/2016 12:00:00 AM,10/21/2016 12:00:00 AM,10/13/2016 12:00:00 AM,2016-093801,2016-10-23T00:00:00.000,2016-10-21T00:00:00.000,2016-10-13T00:00:00.000,Done
2016OPA-0818,Done,OPA Close CL,08/17/2016 12:00:00 AM,08/15/2016 12:00:00 AM,08/12/2016 12:00:00 AM,,2016-08-17T00:00:00.000,2016-08-15T00:00:00.000,2016-08-12T00:00:00.000,Done
2017OPA-1289,Done,OPA Training Referral,03/31/2019 12:00:00 AM,06/11/2019 12:00:00 AM,03/21/2019 12:00:00 AM,2017-459182,2019-03-31T00:00:00.000,2019-06-11T00:00:00.000,2019-03-21T00:00:00.000,Done
2019OPA-0872,Done,OPA 180 Extension Request,06/12/2020 12:00:00 AM,07/12/2020 12:00:00 AM,04/02/2020 12:00:00 AM,,2020-06-12T00:00:00.000,2020-07-12T00:00:00.000,2020-04-02T00:00:00.000,Done
2015OPA-0680,Done,OPA Close CL,,06/08/2015 12:00:00 AM,10/19/2015 12:00:00 AM,2012-086349,,2015-06-08T00:00:00.000,2015-10-19T00:00:00.000,Done
2016OPA-1492,Done,OPA Close CL,12/25/2016 12:00:00 AM,12/22/2016 12:00:00 AM,12/20/2016 12:00:00 AM,,2016-12-25T00:00:00.000,2016-12-22T00:00:00.000,2016-12-20T00:00:00.000,Done
2019OPA-0456,Done,OPA Close Case,01/14/2020 12:00:00 AM,02/14/2020 12:00:00 AM,01/02/2020 12:00:00 AM,2019-148676,2020-01-14T00:00:00.000,2020-02-14T00:00:00.000,2020-01-02T00:00:00.000,Done
2019OPA-0520,Done,OPA Close SA,,09/13/2019 12:00:00 AM,09/13/2019 12:00:00 AM,2019-275463,,2019-09-13T00:00:00.000,2019-09-13T00:00:00.000,Done
2018OPA-0148,Done,OPA Close SA,,05/10/2018 12:00:00 AM,05/10/2018 12:00:00 AM,,,2018-05-10T00:00:00.000,2018-05-10T00:00:00.000,Done
2018OPA-0332,Done,OPA Send Complaint Receipt,04/13/2018 12:00:00 AM,04/17/2018 12:00:00 AM,04/17/2018 12:00:00 AM,,2018-04-13T00:00:00.000,2018-04-17T00:00:00.000,2018-04-17T00:00:00.000,Done
2018OPA-0849,Done,OPA Close SA,,11/30/2018 12:00:00 AM,11/30/2018 12:00:00 AM,2018-234092,,2018-11-30T00:00:00.000,2018-11-30T00:00:00.000,Done
2019OPA-0145,Done,OPA Close Case,10/23/2019 12:00:00 AM,10/16/2019 12:00:00 AM,10/09/2019 12:00:00 AM,2019-060757,2019-10-23T00:00:00.000,2019-10-16T00:00:00.000,2019-10-09T00:00:00.000,Done
2015OPA-0276,Done,OPA Close CL,,03/19/2015 12:00:00 AM,10/22/2015 12:00:00 AM,,,2015-03-19T00:00:00.000,2015-10-22T00:00:00.000,Done
2015OPA-1712,Done,OPA Close SA,05/29/2016 12:00:00 AM,05/25/2016 12:00:00 AM,05/24/2016 12:00:00 AM,,2016-05-29T00:00:00.000,2016-05-25T00:00:00.000,2016-05-24T00:00:00.000,Done
2016OPA-0055,Done,OPA Close CL,01/26/2016 12:00:00 AM,01/25/2016 12:00:00 AM,01/21/2016 12:00:00 AM,,2016-01-26T00:00:00.000,2016-01-25T00:00:00.000,2016-01-21T00:00:00.000,Done
2016OPA-0891,Done,OPA Close Case,03/12/2017 12:00:00 AM,03/29/2017 12:00:00 AM,03/02/2017 12:00:00 AM,,2017-03-12T00:00:00.000,2017-03-29T00:00:00.000,2017-03-02T00:00:00.000,Done
2018OPA-0240,Done,OPA Training Referral,10/21/2018 12:00:00 AM,10/11/2018 12:00:00 AM,10/11/2018 12:00:00 AM,,2018-10-21T00:00:00.000,2018-10-11T00:00:00.000,2018-10-11T00:00:00.000,Done
2018OPA-0408,Done,OPA Close Case,11/17/2018 12:00:00 AM,12/03/2018 12:00:00 AM,11/07/2018 12:00:00 AM,2018-159742,2018-11-17T00:00:00.000,2018-12-03T00:00:00.000,2018-11-07T00:00:00.000,Done
2018OPA-1191,Done,OPA Close CL,01/27/2019 12:00:00 AM,01/29/2019 12:00:00 AM,01/22/2019 12:00:00 AM,2018-475322,2019-01-27T00:00:00.000,2019-01-29T00:00:00.000,2019-01-22T00:00:00.000,Done
2015OPA-0154,Done,OPA Close Case,08/14/2015 12:00:00 AM,08/14/2015 12:00:00 AM,08/05/2015 12:00:00 AM,2015-017817,2015-08-14T00:00:00.000,2015-08-14T00:00:00.000,2015-08-05T00:00:00.000,Done
2015OPA-1237,Done,OPA Close CL,10/06/2015 12:00:00 AM,10/06/2015 12:00:00 AM,10/13/2015 12:00:00 AM,,2015-10-06T00:00:00.000,2015-10-06T00:00:00.000,2015-10-13T00:00:00.000,Done
2016OPA-1307,Done,OPA Close CL,11/21/2016 12:00:00 AM,12/07/2016 12:00:00 AM,11/16/2016 12:00:00 AM,,2016-11-21T00:00:00.000,2016-12-07T00:00:00.000,2016-11-16T00:00:00.000,Done
2016OPA-1328,Done,OPA Send Complaint Receipt,11/13/2016 12:00:00 AM,11/09/2016 12:00:00 AM,11/08/2016 12:00:00 AM,,2016-11-13T00:00:00.000,2016-11-09T00:00:00.000,2016-11-08T00:00:00.000,Done
2017OPA-0653,Done,OPA Close CL,08/01/2017 12:00:00 AM,07/24/2017 12:00:00 AM,07/03/2017 12:00:00 AM,,2017-08-01T00:00:00.000,2017-07-24T00:00:00.000,2017-07-03T00:00:00.000,Done
2019OPA-0194,Done,OPA Close CL,04/19/2019 12:00:00 AM,04/16/2019 12:00:00 AM,04/14/2019 12:00:00 AM,,2019-04-19T00:00:00.000,2019-04-16T00:00:00.000,2019-04-14T00:00:00.000,Done
2020OPA-0235,To do,OPA 180 Timeline Calculation,04/14/2020 12:00:00 AM,10/11/2020 12:00:00 AM,05/06/2020 12:00:00 AM,,2020-04-14T00:00:00.000,2020-10-11T00:00:00.000,2020-05-06T00:00:00.000,To do
2015OPA-1806,Done,OPA Close Case,05/31/2016 12:00:00 AM,06/08/2016 12:00:00 AM,05/11/2016 12:00:00 AM,2015-339442,2016-05-31T00:00:00.000,2016-06-08T00:00:00.000,2016-05-11T00:00:00.000,Done
2016OPA-1220,Done,OPA Close Case,04/08/2017 12:00:00 AM,04/12/2017 12:00:00 AM,03/29/2017 12:00:00 AM,2016-360044,2017-04-08T00:00:00.000,2017-04-12T00:00:00.000,2017-03-29T00:00:00.000,Done
2019OPA-0243,Done,OPA Close Case,10/17/2019 12:00:00 AM,10/29/2019 12:00:00 AM,10/07/2019 12:00:00 AM,,2019-10-17T00:00:00.000,2019-10-29T00:00:00.000,2019-10-07T00:00:00.000,Done
2019OPA-0362,Done,OPA Close Case,11/30/2019 12:00:00 AM,12/17/2019 12:00:00 AM,11/20/2019 12:00:00 AM,2019-174725,2019-11-30T00:00:00.000,2019-12-17T00:00:00.000,2019-11-20T00:00:00.000,Done
2019OPA-0445,Done,OPA Close CL,07/28/2019 12:00:00 AM,07/26/2019 12:00:00 AM,07/23/2019 12:00:00 AM,2019-226547,2019-07-28T00:00:00.000,2019-07-26T00:00:00.000,2019-07-23T00:00:00.000,Done
2019OPA-0793,Done,OPA Close CL,12/02/2019 12:00:00 AM,11/27/2019 12:00:00 AM,11/25/2019 12:00:00 AM,,2019-12-02T00:00:00.000,2019-11-27T00:00:00.000,2019-11-25T00:00:00.000,Done
2019OPA-0824,Done,OPA Case Assignment,04/22/2020 12:00:00 AM,04/22/2020 12:00:00 AM,04/22/2020 12:00:00 AM,,2020-04-22T00:00:00.000,2020-04-22T00:00:00.000,2020-04-22T00:00:00.000,Done
2020OPA-0212,Done,OPA Case Assignment,04/22/2020 12:00:00 AM,04/21/2020 12:00:00 AM,04/17/2020 12:00:00 AM,,2020-04-22T00:00:00.000,2020-04-21T00:00:00.000,2020-04-17T00:00:00.000,Done
2016OPA-1045,Done,OPA Close CL,11/14/2016 12:00:00 AM,10/16/2016 12:00:00 AM,09/21/2016 12:00:00 AM,,2016-11-14T00:00:00.000,2016-10-16T00:00:00.000,2016-09-21T00:00:00.000,Done
2016OPA-1222,Done,OPA Close Case,04/07/2017 12:00:00 AM,04/07/2017 12:00:00 AM,03/28/2017 12:00:00 AM,2016-300931,2017-04-07T00:00:00.000,2017-04-07T00:00:00.000,2017-03-28T00:00:00.000,Done
2017OPA-0353,Done,OPA Close CL,04/25/2017 12:00:00 AM,04/24/2017 12:00:00 AM,04/20/2017 12:00:00 AM,2017-096956,2017-04-25T00:00:00.000,2017-04-24T00:00:00.000,2017-04-20T00:00:00.000,Done
2018OPA-0294,Done,OPA Close SA,,05/10/2018 12:00:00 AM,05/10/2018 12:00:00 AM,2018-033744,,2018-05-10T00:00:00.000,2018-05-10T00:00:00.000,Done
2018OPA-0781,Done,OPA Final Discipline Action Report,,05/16/2019 12:00:00 AM,02/15/2019 12:00:00 AM,2018-294360,,2019-05-16T00:00:00.000,2019-02-15T00:00:00.000,Done
2018OPA-0940,Done,OPA Close Case,03/31/2019 12:00:00 AM,04/24/2019 12:00:00 AM,03/21/2019 12:00:00 AM,2018-349646,2019-03-31T00:00:00.000,2019-04-24T00:00:00.000,2019-03-21T00:00:00.000,Done
2015OPA-1736,Done,OPA Close SA,08/09/2016 12:00:00 AM,07/25/2016 12:00:00 AM,07/25/2016 12:00:00 AM,,2016-08-09T00:00:00.000,2016-07-25T00:00:00.000,2016-07-25T00:00:00.000,Done
2016OPA-0218,Done,OPA Training Referral,01/24/2017 12:00:00 AM,01/28/2017 12:00:00 AM,08/24/2016 12:00:00 AM,2015-390361,2017-01-24T00:00:00.000,2017-01-28T00:00:00.000,2016-08-24T00:00:00.000,Done
2016OPA-0556,Done,OPA Close Case,02/09/2017 12:00:00 AM,02/09/2017 12:00:00 AM,01/30/2017 12:00:00 AM,2016-168971,2017-02-09T00:00:00.000,2017-02-09T00:00:00.000,2017-01-30T00:00:00.000,Done
2017OPA-0253,Done,OPA Close Case,03/18/2018 12:00:00 AM,08/01/2018 12:00:00 AM,03/08/2018 12:00:00 AM,2017-084955,2018-03-18T00:00:00.000,2018-08-01T00:00:00.000,2018-03-08T00:00:00.000,Done
2017OPA-0398,Done,OPA Close Case,10/17/2019 12:00:00 AM,10/16/2019 12:00:00 AM,10/07/2019 12:00:00 AM,2014-199378,2019-10-17T00:00:00.000,2019-10-16T00:00:00.000,2019-10-07T00:00:00.000,Done
2018OPA-0386,Done,OPA Close CL,05/28/2018 12:00:00 AM,06/14/2018 12:00:00 AM,05/23/2018 12:00:00 AM,,2018-05-28T00:00:00.000,2018-06-14T00:00:00.000,2018-05-23T00:00:00.000,Done
2019OPA-0378,Done,OPA Close CL,07/02/2019 12:00:00 AM,07/02/2019 12:00:00 AM,06/27/2019 12:00:00 AM,2019-199742,2019-07-02T00:00:00.000,2019-07-02T00:00:00.000,2019-06-27T00:00:00.000,Done
OPA2014-0913,Done,OPA Director SA Review,,03/12/2015 12:00:00 AM,02/27/2015 12:00:00 AM,2014-215300,,2015-03-12T00:00:00.000,2015-02-27T00:00:00.000,Done
2017OPA-0434,Done,OPA Close CL,05/27/2017 12:00:00 AM,05/18/2017 12:00:00 AM,05/17/2017 12:00:00 AM,,2017-05-27T00:00:00.000,2017-05-18T00:00:00.000,2017-05-17T00:00:00.000,Done
2017OPA-0732,Done,OPA Missed 180 Day Deadline,12/08/2017 12:00:00 AM,02/13/2018 12:00:00 AM,02/26/2019 12:00:00 AM,2017-209380,2017-12-08T00:00:00.000,2018-02-13T00:00:00.000,2019-02-26T00:00:00.000,Done
2017OPA-1019,Done,OPA Close CL,10/29/2017 12:00:00 AM,10/06/2017 12:00:00 AM,10/02/2017 12:00:00 AM,,2017-10-29T00:00:00.000,2017-10-06T00:00:00.000,2017-10-02T00:00:00.000,Done
2018OPA-0362,Done,OPA Close Case,10/26/2018 12:00:00 AM,01/23/2019 12:00:00 AM,10/16/2018 12:00:00 AM,2018-143261,2018-10-26T00:00:00.000,2019-01-23T00:00:00.000,2018-10-16T00:00:00.000,Done
2018OPA-1123,Done,OPA Close CL,12/15/2018 12:00:00 AM,12/11/2018 12:00:00 AM,12/10/2018 12:00:00 AM,,2018-12-15T00:00:00.000,2018-12-11T00:00:00.000,2018-12-10T00:00:00.000,Done
2015OPA-0923,Done,OPA Close Case,12/29/2015 12:00:00 AM,12/29/2015 12:00:00 AM,12/16/2015 12:00:00 AM,2015-168936,2015-12-29T00:00:00.000,2015-12-29T00:00:00.000,2015-12-16T00:00:00.000,Done
2015OPA-1023,Done,OPA Close SA,08/22/2015 12:00:00 AM,08/19/2015 12:00:00 AM,08/17/2015 12:00:00 AM,,2015-08-22T00:00:00.000,2015-08-19T00:00:00.000,2015-08-17T00:00:00.000,Done
2015OPA-1265,Done,OPA Close CL,,09/14/2015 12:00:00 AM,10/14/2015 12:00:00 AM,2015-158888,,2015-09-14T00:00:00.000,2015-10-14T00:00:00.000,Done
2016OPA-1017,Done,OPA Close CL,09/07/2016 12:00:00 AM,09/08/2016 12:00:00 AM,09/02/2016 12:00:00 AM,,2016-09-07T00:00:00.000,2016-09-08T00:00:00.000,2016-09-02T00:00:00.000,Done
2016OPA-1306,Done,OPA Close Case,05/15/2017 12:00:00 AM,05/23/2017 12:00:00 AM,05/05/2017 12:00:00 AM,2016-388802,2017-05-15T00:00:00.000,2017-05-23T00:00:00.000,2017-05-05T00:00:00.000,Done
2017OPA-0117,Done,OPA Close SA,,03/17/2017 12:00:00 AM,03/17/2017 12:00:00 AM,2017-037283,,2017-03-17T00:00:00.000,2017-03-17T00:00:00.000,Done
2019OPA-0038,Done,OPA Close Case,03/21/2019 12:00:00 AM,03/07/2019 12:00:00 AM,03/11/2019 12:00:00 AM,,2019-03-21T00:00:00.000,2019-03-07T00:00:00.000,2019-03-11T00:00:00.000,Done
2019OPA-0508,Done,OPA Close CL,07/30/2019 12:00:00 AM,07/30/2019 12:00:00 AM,07/30/2019 12:00:00 AM,2019-254958,2019-07-30T00:00:00.000,2019-07-30T00:00:00.000,2019-07-30T00:00:00.000,Done
2015OPA-0168,Done,OPA SA Review,04/11/2015 12:00:00 AM,04/13/2015 12:00:00 AM,04/06/2015 12:00:00 AM,2014-196402,2015-04-11T00:00:00.000,2015-04-13T00:00:00.000,2015-04-06T00:00:00.000,Done
2015OPA-0571,Done,OPA Training Referral Review,10/26/2015 12:00:00 AM,10/21/2015 12:00:00 AM,10/21/2015 12:00:00 AM,2015-131925,2015-10-26T00:00:00.000,2015-10-21T00:00:00.000,2015-10-21T00:00:00.000,Done
2015OPA-0749,Done,OPA Close Case,12/09/2015 12:00:00 AM,12/14/2015 12:00:00 AM,11/16/2015 12:00:00 AM,,2015-12-09T00:00:00.000,2015-12-14T00:00:00.000,2015-11-16T00:00:00.000,Done
2016OPA-0625,Done,OPA Send Complainant Closing Letter,06/24/2016 12:00:00 AM,06/19/2016 12:00:00 AM,06/19/2016 12:00:00 AM,,2016-06-24T00:00:00.000,2016-06-19T00:00:00.000,2016-06-19T00:00:00.000,Done
2017OPA-0492,Done,OPA Close Case,11/16/2017 12:00:00 AM,11/21/2017 12:00:00 AM,11/06/2017 12:00:00 AM,2017-163559,2017-11-16T00:00:00.000,2017-11-21T00:00:00.000,2017-11-06T00:00:00.000,Done
2015OPA-0054,Done,OPA Director SA Review,04/15/2015 12:00:00 AM,04/13/2015 12:00:00 AM,04/10/2015 12:00:00 AM,,2015-04-15T00:00:00.000,2015-04-13T00:00:00.000,2015-04-10T00:00:00.000,Done
2015OPA-0075,Done,OPA Close CL,,01/26/2015 12:00:00 AM,10/23/2015 12:00:00 AM,2014-343355,,2015-01-26T00:00:00.000,2015-10-23T00:00:00.000,Done
2015OPA-1347,Done,OPA Close CL,,09/22/2015 12:00:00 AM,10/14/2015 12:00:00 AM,2015-304051,,2015-09-22T00:00:00.000,2015-10-14T00:00:00.000,Done
2017OPA-0265,Done,OPA Close SA,,06/05/2017 12:00:00 AM,06/05/2017 12:00:00 AM,2015-227326,,2017-06-05T00:00:00.000,2017-06-05T00:00:00.000,Done
2018OPA-0299,Done,OPA Classification,05/05/2018 12:00:00 AM,04/30/2018 12:00:00 AM,04/05/2018 12:00:00 AM,2018-071629,2018-05-05T00:00:00.000,2018-04-30T00:00:00.000,2018-04-05T00:00:00.000,Done
2018OPA-1066,Done,OPA Close Case,05/18/2019 12:00:00 AM,05/20/2019 12:00:00 AM,05/08/2019 12:00:00 AM,,2019-05-18T00:00:00.000,2019-05-20T00:00:00.000,2019-05-08T00:00:00.000,Done
2015OPA-0407,Done,OPA Close CL,,03/27/2015 12:00:00 AM,10/20/2015 12:00:00 AM,,,2015-03-27T00:00:00.000,2015-10-20T00:00:00.000,Done
2015OPA-1161,Done,OPA Close SA,10/11/2015 12:00:00 AM,10/08/2015 12:00:00 AM,10/06/2015 12:00:00 AM,,2015-10-11T00:00:00.000,2015-10-08T00:00:00.000,2015-10-06T00:00:00.000,Done
2015OPA-1718,Done,OPA Close SA,01/04/2016 12:00:00 AM,12/30/2015 12:00:00 AM,12/30/2015 12:00:00 AM,,2016-01-04T00:00:00.000,2015-12-30T00:00:00.000,2015-12-30T00:00:00.000,Done
2019OPA-0431,Done,OPA Close SA,,07/31/2019 12:00:00 AM,07/31/2019 12:00:00 AM,,,2019-07-31T00:00:00.000,2019-07-31T00:00:00.000,Done
2016OPA-0938,Done,OPA Close CL,09/14/2016 12:00:00 AM,08/15/2016 12:00:00 AM,08/10/2016 12:00:00 AM,,2016-09-14T00:00:00.000,2016-08-15T00:00:00.000,2016-08-10T00:00:00.000,Done
2017OPA-0545,Done,OPA Close SA,,07/13/2017 12:00:00 AM,07/13/2017 12:00:00 AM,,,2017-07-13T00:00:00.000,2017-07-13T00:00:00.000,Done
2015OPA-1029,Done,OPA Close CL,,07/23/2015 12:00:00 AM,10/16/2015 12:00:00 AM,,,2015-07-23T00:00:00.000,2015-10-16T00:00:00.000,Done
2015OPA-1226,Done,OPA Close CL,,10/01/2015 12:00:00 AM,10/13/2015 12:00:00 AM,,,2015-10-01T00:00:00.000,2015-10-13T00:00:00.000,Done
2016OPA-1024,Done,OPA Classification,09/24/2016 12:00:00 AM,09/20/2016 12:00:00 AM,08/25/2016 12:00:00 AM,2016-253670,2016-09-24T00:00:00.000,2016-09-20T00:00:00.000,2016-08-25T00:00:00.000,Done
2019OPA-0309,Done,OPA Training Referral,11/28/2019 12:00:00 AM,11/27/2019 12:00:00 AM,11/18/2019 12:00:00 AM,2018-486972,2019-11-28T00:00:00.000,2019-11-27T00:00:00.000,2019-11-18T00:00:00.000,Done
2020OPA-0034,Done,OPA Close CL,02/13/2020 12:00:00 AM,02/13/2020 12:00:00 AM,02/06/2020 12:00:00 AM,,2020-02-13T00:00:00.000,2020-02-13T00:00:00.000,2020-02-06T00:00:00.000,Done
2015OPA-1360,Done,OPA Close CL,,09/18/2015 12:00:00 AM,10/14/2015 12:00:00 AM,,,2015-09-18T00:00:00.000,2015-10-14T00:00:00.000,Done
2016OPA-1044,Done,OPA Close SA,,10/27/2016 12:00:00 AM,10/27/2016 12:00:00 AM,2016-301216,,2016-10-27T00:00:00.000,2016-10-27T00:00:00.000,Done
2017OPA-0149,Done,OPA Close CL,02/28/2017 12:00:00 AM,02/27/2017 12:00:00 AM,02/18/2017 12:00:00 AM,,2017-02-28T00:00:00.000,2017-02-27T00:00:00.000,2017-02-18T00:00:00.000,Done
2015OPA-1795,Done,OPA Close SA,04/27/2016 12:00:00 AM,07/28/2016 12:00:00 AM,04/22/2016 12:00:00 AM,,2016-04-27T00:00:00.000,2016-07-28T00:00:00.000,2016-04-22T00:00:00.000,Done
2017OPA-0609,Done,OPA Close Case,02/09/2018 12:00:00 AM,05/18/2018 12:00:00 AM,02/09/2018 12:00:00 AM,2017-219301,2018-02-09T00:00:00.000,2018-05-18T00:00:00.000,2018-02-09T00:00:00.000,Done
2017OPA-0774,Done,OPA Close CL,08/07/2017 12:00:00 AM,08/22/2017 12:00:00 AM,08/02/2017 12:00:00 AM,,2017-08-07T00:00:00.000,2017-08-22T00:00:00.000,2017-08-02T00:00:00.000,Done
2017OPA-0918,Done,OPA Close CL,10/06/2017 12:00:00 AM,10/02/2017 12:00:00 AM,10/02/2017 12:00:00 AM,,2017-10-06T00:00:00.000,2017-10-02T00:00:00.000,2017-10-02T00:00:00.000,Done
2018OPA-0253,Done,OPA Close CL,03/26/2018 12:00:00 AM,03/21/2018 12:00:00 AM,03/21/2018 12:00:00 AM,,2018-03-26T00:00:00.000,2018-03-21T00:00:00.000,2018-03-21T00:00:00.000,Done
2018OPA-0676,Done,OPA Close CL,08/21/2018 12:00:00 AM,08/21/2018 12:00:00 AM,08/16/2018 12:00:00 AM,,2018-08-21T00:00:00.000,2018-08-21T00:00:00.000,2018-08-16T00:00:00.000,Done
2015OPA-1760,Done,OPA Close SA,12/19/2015 12:00:00 AM,12/15/2015 12:00:00 AM,12/14/2015 12:00:00 AM,,2015-12-19T00:00:00.000,2015-12-15T00:00:00.000,2015-12-14T00:00:00.000,Done
2016OPA-0151,Done,OPA Close CL,02/28/2016 12:00:00 AM,02/25/2016 12:00:00 AM,02/23/2016 12:00:00 AM,,2016-02-28T00:00:00.000,2016-02-25T00:00:00.000,2016-02-23T00:00:00.000,Done
2016OPA-1117,Done,OPA Close Case,03/11/2017 12:00:00 AM,03/28/2017 12:00:00 AM,03/01/2017 12:00:00 AM,,2017-03-11T00:00:00.000,2017-03-28T00:00:00.000,2017-03-01T00:00:00.000,Done
2017OPA-0864,Done,OPA Close SA,12/11/2017 12:00:00 AM,06/28/2018 12:00:00 AM,12/01/2017 12:00:00 AM,,2017-12-11T00:00:00.000,2018-06-28T00:00:00.000,2017-12-01T00:00:00.000,Done
2018OPA-0730,Done,OPA Close CL,09/01/2018 12:00:00 AM,08/28/2018 12:00:00 AM,08/27/2018 12:00:00 AM,,2018-09-01T00:00:00.000,2018-08-28T00:00:00.000,2018-08-27T00:00:00.000,Done
2018OPA-0795,Done,OPA Close Case,02/14/2019 12:00:00 AM,02/20/2019 12:00:00 AM,02/12/2019 12:00:00 AM,2018-297118,2019-02-14T00:00:00.000,2019-02-20T00:00:00.000,2019-02-12T00:00:00.000,Done
2015OPA-1469,Done,OPA Close CL,,10/20/2015 12:00:00 AM,10/20/2015 12:00:00 AM,,,2015-10-20T00:00:00.000,2015-10-20T00:00:00.000,Done
2015OPA-1840,Done,OPA Close Case,05/31/2016 12:00:00 AM,06/08/2016 12:00:00 AM,05/10/2016 12:00:00 AM,2015-413562,2016-05-31T00:00:00.000,2016-06-08T00:00:00.000,2016-05-10T00:00:00.000,Done
2016OPA-0358,Done,OPA TAC Notification,03/11/2019 12:00:00 AM,03/11/2019 12:00:00 AM,03/05/2019 12:00:00 AM,,2019-03-11T00:00:00.000,2019-03-11T00:00:00.000,2019-03-05T00:00:00.000,Done
2016OPA-1450,Done,OPA Classification,01/08/2017 12:00:00 AM,12/22/2016 12:00:00 AM,12/09/2016 12:00:00 AM,,2017-01-08T00:00:00.000,2016-12-22T00:00:00.000,2016-12-09T00:00:00.000,Done
2017OPA-1167,Done,OPA Close Case,03/14/2018 12:00:00 AM,07/25/2018 12:00:00 AM,03/06/2018 12:00:00 AM,2017-406586,2018-03-14T00:00:00.000,2018-07-25T00:00:00.000,2018-03-06T00:00:00.000,Done
2018OPA-0980,Done,OPA Training Referral,03/31/2019 12:00:00 AM,12/09/2019 12:00:00 AM,02/21/2019 12:00:00 AM,2018-316306,2019-03-31T00:00:00.000,2019-12-09T00:00:00.000,2019-02-21T00:00:00.000,Done
2015OPA-0526,Done,OPA Close CL,,04/16/2015 12:00:00 AM,10/20/2015 12:00:00 AM,,,2015-04-16T00:00:00.000,2015-10-20T00:00:00.000,Done
2015OPA-0896,Done,OPA Close CL,,10/14/2015 12:00:00 AM,10/13/2015 12:00:00 AM,,,2015-10-14T00:00:00.000,2015-10-13T00:00:00.000,Done
2015OPA-0937,Done,OPA Close CL,,06/30/2015 12:00:00 AM,10/19/2015 12:00:00 AM,,,2015-06-30T00:00:00.000,2015-10-19T00:00:00.000,Done
2016OPA-0222,Done,OPA Close SA,04/15/2016 12:00:00 AM,04/14/2016 12:00:00 AM,03/31/2016 12:00:00 AM,,2016-04-15T00:00:00.000,2016-04-14T00:00:00.000,2016-03-31T00:00:00.000,Done
2017OPA-0126,Done,OPA Close Case,05/31/2017 12:00:00 AM,06/06/2017 12:00:00 AM,05/30/2017 12:00:00 AM,,2017-05-31T00:00:00.000,2017-06-06T00:00:00.000,2017-05-30T00:00:00.000,Done
2017OPA-1031,Done,OPA Director Certification/Finding,04/01/2018 12:00:00 AM,03/30/2018 12:00:00 AM,01/30/2019 12:00:00 AM,,2018-04-01T00:00:00.000,2018-03-30T00:00:00.000,2019-01-30T00:00:00.000,Done
2019OPA-0139,Done,OPA Close SA,,03/27/2019 12:00:00 AM,03/27/2019 12:00:00 AM,,,2019-03-27T00:00:00.000,2019-03-27T00:00:00.000,Done
2020OPA-0249,Done,OPA 5 Day Notice,04/30/2020 12:00:00 AM,04/28/2020 12:00:00 AM,04/27/2020 12:00:00 AM,,2020-04-30T00:00:00.000,2020-04-28T00:00:00.000,2020-04-27T00:00:00.000,Done
2015OPA-0156,Done,OPA Training Referral,08/24/2015 12:00:00 AM,08/10/2015 12:00:00 AM,08/05/2015 12:00:00 AM,2015-024741,2015-08-24T00:00:00.000,2015-08-10T00:00:00.000,2015-08-05T00:00:00.000,Done
2015OPA-0552,Done,OPA Close CL,,04/27/2015 12:00:00 AM,10/20/2015 12:00:00 AM,,,2015-04-27T00:00:00.000,2015-10-20T00:00:00.000,Done
2015OPA-0719,Done,OPA Close CL,,09/25/2015 12:00:00 AM,10/14/2015 12:00:00 AM,,,2015-09-25T00:00:00.000,2015-10-14T00:00:00.000,Done
2017OPA-1205,Done,OPA Close CL,12/18/2017 12:00:00 AM,12/15/2017 12:00:00 AM,11/20/2017 12:00:00 AM,,2017-12-18T00:00:00.000,2017-12-15T00:00:00.000,2017-11-20T00:00:00.000,Done
2018OPA-0091,Done,OPA Close SA,,04/11/2018 12:00:00 AM,03/28/2018 12:00:00 AM,2018-029227,,2018-04-11T00:00:00.000,2018-03-28T00:00:00.000,Done
2019OPA-0003,Done,OPA Close CL,12/31/2019 12:00:00 AM,12/31/2019 12:00:00 AM,01/02/2019 12:00:00 AM,,2019-12-31T00:00:00.000,2019-12-31T00:00:00.000,2019-01-02T00:00:00.000,Done
2019OPA-0044,Done,OPA Close CL,02/20/2019 12:00:00 AM,02/19/2019 12:00:00 AM,02/15/2019 12:00:00 AM,,2019-02-20T00:00:00.000,2019-02-19T00:00:00.000,2019-02-15T00:00:00.000,Done
2015OPA-1525,Done,OPA Close SA,11/28/2015 12:00:00 AM,11/24/2015 12:00:00 AM,11/23/2015 12:00:00 AM,2015-107122,2015-11-28T00:00:00.000,2015-11-24T00:00:00.000,2015-11-23T00:00:00.000,Done
2015OPA-1918,Done,OPA Close CL,01/20/2016 12:00:00 AM,01/20/2016 12:00:00 AM,01/15/2016 12:00:00 AM,2008-405392,2016-01-20T00:00:00.000,2016-01-20T00:00:00.000,2016-01-15T00:00:00.000,Done
2017OPA-0308,Done,OPA Close SA,,05/15/2017 12:00:00 AM,05/15/2017 12:00:00 AM,2017-103653,,2017-05-15T00:00:00.000,2017-05-15T00:00:00.000,Done
2017OPA-0772,Done,OPA Send Complainant Closing Letter,08/27/2017 12:00:00 AM,08/02/2017 12:00:00 AM,07/28/2017 12:00:00 AM,,2017-08-27T00:00:00.000,2017-08-02T00:00:00.000,2017-07-28T00:00:00.000,Done
2017OPA-1046,Done,OPA Close SA,,12/27/2017 12:00:00 AM,12/27/2017 12:00:00 AM,,,2017-12-27T00:00:00.000,2017-12-27T00:00:00.000,Done
2017OPA-1189,Done,OPA Close Case,04/20/2018 12:00:00 AM,08/13/2018 12:00:00 AM,04/10/2018 12:00:00 AM,2017-201527,2018-04-20T00:00:00.000,2018-08-13T00:00:00.000,2018-04-10T00:00:00.000,Done
2016OPA-0146,Done,OPA Close Case,08/22/2016 12:00:00 AM,08/22/2016 12:00:00 AM,08/11/2016 12:00:00 AM,2016-045948,2016-08-22T00:00:00.000,2016-08-22T00:00:00.000,2016-08-11T00:00:00.000,Done
2016OPA-0825,Done,OPA Close CL,08/17/2016 12:00:00 AM,08/16/2016 12:00:00 AM,08/12/2016 12:00:00 AM,,2016-08-17T00:00:00.000,2016-08-16T00:00:00.000,2016-08-12T00:00:00.000,Done
2017OPA-1212,Done,OPA Close SA,,03/28/2018 12:00:00 AM,12/19/2017 12:00:00 AM,,,2018-03-28T00:00:00.000,2017-12-19T00:00:00.000,Done
2015OPA-0628,Done,OPA Director SA Review,07/06/2015 12:00:00 AM,07/08/2015 12:00:00 AM,07/01/2015 12:00:00 AM,2015-146575,2015-07-06T00:00:00.000,2015-07-08T00:00:00.000,2015-07-01T00:00:00.000,Done
2015OPA-0809,Done,OPA Close CL,,07/10/2015 12:00:00 AM,10/16/2015 12:00:00 AM,,,2015-07-10T00:00:00.000,2015-10-16T00:00:00.000,Done
2015OPA-1431,Done,OPA Close CL,,10/06/2015 12:00:00 AM,10/13/2015 12:00:00 AM,,,2015-10-06T00:00:00.000,2015-10-13T00:00:00.000,Done
2016OPA-0034,Done,OPA Close CL,01/20/2016 12:00:00 AM,01/20/2016 12:00:00 AM,01/15/2016 12:00:00 AM,,2016-01-20T00:00:00.000,2016-01-20T00:00:00.000,2016-01-15T00:00:00.000,Done
2016OPA-0877,Done,OPA Classification,08/24/2016 12:00:00 AM,08/24/2016 12:00:00 AM,08/19/2016 12:00:00 AM,,2016-08-24T00:00:00.000,2016-08-24T00:00:00.000,2016-08-19T00:00:00.000,Done
2016OPA-1418,Done,OPA Close CL,12/29/2016 12:00:00 AM,12/24/2016 12:00:00 AM,12/24/2016 12:00:00 AM,2016-431741,2016-12-29T00:00:00.000,2016-12-24T00:00:00.000,2016-12-24T00:00:00.000,Done
2017OPA-1248,Done,OPA Close Case,04/29/2018 12:00:00 AM,08/03/2018 12:00:00 AM,04/19/2018 12:00:00 AM,2017-418869,2018-04-29T00:00:00.000,2018-08-03T00:00:00.000,2018-04-19T00:00:00.000,Done
2018OPA-0250,Done,OPA Training Referral,04/10/2019 12:00:00 AM,04/23/2019 12:00:00 AM,02/20/2019 12:00:00 AM,2018-060390,2019-04-10T00:00:00.000,2019-04-23T00:00:00.000,2019-02-20T00:00:00.000,Done
2018OPA-0699,Done,OPA Close CL,08/27/2018 12:00:00 AM,08/24/2018 12:00:00 AM,08/22/2018 12:00:00 AM,,2018-08-27T00:00:00.000,2018-08-24T00:00:00.000,2018-08-22T00:00:00.000,Done
2015OPA-0184,Done,OPA Close CL,,03/02/2015 12:00:00 AM,10/22/2015 12:00:00 AM,,,2015-03-02T00:00:00.000,2015-10-22T00:00:00.000,Done
2015OPA-1006,Done,OPA Close CL,,08/09/2015 12:00:00 AM,10/15/2015 12:00:00 AM,,,2015-08-09T00:00:00.000,2015-10-15T00:00:00.000,Done
2015OPA-1319,Done,OPA Close CL,,09/18/2015 12:00:00 AM,10/14/2015 12:00:00 AM,,,2015-09-18T00:00:00.000,2015-10-14T00:00:00.000,Done
2018OPA-0614,Done,OPA Close CL,08/04/2018 12:00:00 AM,08/01/2018 12:00:00 AM,07/30/2018 12:00:00 AM,,2018-08-04T00:00:00.000,2018-08-01T00:00:00.000,2018-07-30T00:00:00.000,Done
2018OPA-0913,Done,OPA Close CL,10/20/2018 12:00:00 AM,10/19/2018 12:00:00 AM,10/15/2018 12:00:00 AM,2018-346207,2018-10-20T00:00:00.000,2018-10-19T00:00:00.000,2018-10-15T00:00:00.000,Done
2016OPA-0301,Done,OPA Close SA,05/05/2016 12:00:00 AM,05/27/2016 12:00:00 AM,04/20/2016 12:00:00 AM,2016-096054,2016-05-05T00:00:00.000,2016-05-27T00:00:00.000,2016-04-20T00:00:00.000,Done
2016OPA-0643,Done,OPA Close CL,07/13/2016 12:00:00 AM,07/13/2016 12:00:00 AM,07/08/2016 12:00:00 AM,,2016-07-13T00:00:00.000,2016-07-13T00:00:00.000,2016-07-08T00:00:00.000,Done
2016OPA-1000,Done,OPA Close CL,09/27/2016 12:00:00 AM,08/29/2016 12:00:00 AM,08/23/2016 12:00:00 AM,,2016-09-27T00:00:00.000,2016-08-29T00:00:00.000,2016-08-23T00:00:00.000,Done
2016OPA-1374,Done,OPA Close Case,05/22/2017 12:00:00 AM,06/06/2017 12:00:00 AM,05/17/2017 12:00:00 AM,2016-417639,2017-05-22T00:00:00.000,2017-06-06T00:00:00.000,2017-05-17T00:00:00.000,Done
2017OPA-1318,Done,OPA Close Case,08/23/2018 12:00:00 AM,10/10/2018 12:00:00 AM,08/13/2018 12:00:00 AM,2017-470780,2018-08-23T00:00:00.000,2018-10-10T00:00:00.000,2018-08-13T00:00:00.000,Done
2015OPA-0134,Done,OPA Classification,,03/05/2015 12:00:00 AM,10/22/2015 12:00:00 AM,,,2015-03-05T00:00:00.000,2015-10-22T00:00:00.000,Done
2016OPA-0249,Done,OPA Close Case,10/20/2016 12:00:00 AM,10/21/2016 12:00:00 AM,10/10/2016 12:00:00 AM,2015-359625,2016-10-20T00:00:00.000,2016-10-21T00:00:00.000,2016-10-10T00:00:00.000,Done
2015OPA-0256,Done,OPA Close CL,,03/23/2015 12:00:00 AM,10/21/2015 12:00:00 AM,,,2015-03-23T00:00:00.000,2015-10-21T00:00:00.000,Done
2015OPA-0335,Done,OPA Close Case,,09/11/2015 12:00:00 AM,08/31/2015 12:00:00 AM,,,2015-09-11T00:00:00.000,2015-08-31T00:00:00.000,Done
2015OPA-0875,Done,OPA Close SA,09/14/2015 12:00:00 AM,09/09/2015 12:00:00 AM,09/09/2015 12:00:00 AM,2015-195931,2015-09-14T00:00:00.000,2015-09-09T00:00:00.000,2015-09-09T00:00:00.000,Done
2016OPA-0585,Done,OPA Close CL,06/27/2016 12:00:00 AM,06/27/2016 12:00:00 AM,06/22/2016 12:00:00 AM,,2016-06-27T00:00:00.000,2016-06-27T00:00:00.000,2016-06-22T00:00:00.000,Done
2019OPA-0442,Done,OPA Close Case,12/19/2019 12:00:00 AM,12/19/2019 12:00:00 AM,12/09/2019 12:00:00 AM,2019-200434,2019-12-19T00:00:00.000,2019-12-19T00:00:00.000,2019-12-09T00:00:00.000,Done
2016OPA-1034,Done,OPA Close Case,02/27/2017 12:00:00 AM,03/15/2017 12:00:00 AM,02/17/2017 12:00:00 AM,2016-303084,2017-02-27T00:00:00.000,2017-03-15T00:00:00.000,2017-02-17T00:00:00.000,Done
2017OPA-0025,Done,OPA Close Case,06/25/2017 12:00:00 AM,07/10/2017 12:00:00 AM,06/15/2017 12:00:00 AM,2016-380316,2017-06-25T00:00:00.000,2017-07-10T00:00:00.000,2017-06-15T00:00:00.000,Done
2017OPA-0852,Done,OPA Close Case,02/16/2018 12:00:00 AM,04/23/2018 12:00:00 AM,02/15/2018 12:00:00 AM,,2018-02-16T00:00:00.000,2018-04-23T00:00:00.000,2018-02-15T00:00:00.000,Done
2018OPA-0454,Done,OPA Close SA,,10/05/2018 12:00:00 AM,10/05/2018 12:00:00 AM,2018-175557,,2018-10-05T00:00:00.000,2018-10-05T00:00:00.000,Done
2019OPA-0133,Done,OPA Close CL,03/17/2019 12:00:00 AM,03/14/2019 12:00:00 AM,03/12/2019 12:00:00 AM,2017-461037,2019-03-17T00:00:00.000,2019-03-14T00:00:00.000,2019-03-12T00:00:00.000,Done
2015OPA-0346,Done,OPA Monitor SA,05/07/2015 12:00:00 AM,05/20/2015 12:00:00 AM,04/07/2015 12:00:00 AM,,2015-05-07T00:00:00.000,2015-05-20T00:00:00.000,2015-04-07T00:00:00.000,Done
2015OPA-0846,Done,OPA Close Case,,12/23/2015 12:00:00 AM,11/25/2015 12:00:00 AM,,,2015-12-23T00:00:00.000,2015-11-25T00:00:00.000,Done
2015OPA-1295,Done,OPA Close SA,10/11/2015 12:00:00 AM,10/07/2015 12:00:00 AM,10/06/2015 12:00:00 AM,,2015-10-11T00:00:00.000,2015-10-07T00:00:00.000,2015-10-06T00:00:00.000,Done
2015OPA-1673,Done,OPA Close Case,04/28/2016 12:00:00 AM,05/03/2016 12:00:00 AM,04/15/2016 12:00:00 AM,,2016-04-28T00:00:00.000,2016-05-03T00:00:00.000,2016-04-15T00:00:00.000,Done
2016OPA-1136,Done,OPA Close SA,,11/14/2016 12:00:00 AM,11/14/2016 12:00:00 AM,,,2016-11-14T00:00:00.000,2016-11-14T00:00:00.000,Done
2019OPA-0731,Done,OPA Close SA,,01/30/2020 12:00:00 AM,01/30/2020 12:00:00 AM,2019-039616,,2020-01-30T00:00:00.000,2020-01-30T00:00:00.000,Done
2019OPA-0842,Done,OPA Close CL,12/16/2019 12:00:00 AM,12/16/2019 12:00:00 AM,12/09/2019 12:00:00 AM,,2019-12-16T00:00:00.000,2019-12-16T00:00:00.000,2019-12-09T00:00:00.000,Done
2020OPA-0246,Done,OPA Intake Review,05/14/2020 12:00:00 AM,05/05/2020 12:00:00 AM,04/27/2020 12:00:00 AM,,2020-05-14T00:00:00.000,2020-05-05T00:00:00.000,2020-04-27T00:00:00.000,Done
2017OPA-0031,Done,OPA Missed 180 Day Deadline,07/10/2017 12:00:00 AM,03/07/2018 12:00:00 AM,02/26/2019 12:00:00 AM,2016-117736,2017-07-10T00:00:00.000,2018-03-07T00:00:00.000,2019-02-26T00:00:00.000,Done
2017OPA-0794,Done,OPA Close CL,08/27/2017 12:00:00 AM,08/29/2017 12:00:00 AM,08/22/2017 12:00:00 AM,2015-429437,2017-08-27T00:00:00.000,2017-08-29T00:00:00.000,2017-08-22T00:00:00.000,Done
2017OPA-0847,Done,OPA Close CL,09/17/2017 12:00:00 AM,09/15/2017 12:00:00 AM,09/12/2017 12:00:00 AM,,2017-09-17T00:00:00.000,2017-09-15T00:00:00.000,2017-09-12T00:00:00.000,Done
2018OPA-1133,Done,OPA Close Case,08/12/2019 12:00:00 AM,08/13/2019 12:00:00 AM,08/02/2019 12:00:00 AM,2018-440690,2019-08-12T00:00:00.000,2019-08-13T00:00:00.000,2019-08-02T00:00:00.000,Done
2015OPA-1278,Done,OPA Close CL,,09/18/2015 12:00:00 AM,10/14/2015 12:00:00 AM,2014-417105,,2015-09-18T00:00:00.000,2015-10-14T00:00:00.000,Done
2017OPA-1249,Done,OPA Close CL,01/02/2018 12:00:00 AM,12/29/2017 12:00:00 AM,12/28/2017 12:00:00 AM,2017-447542,2018-01-02T00:00:00.000,2017-12-29T00:00:00.000,2017-12-28T00:00:00.000,Done
2019OPA-0386,Done,OPA Close CL,07/08/2019 12:00:00 AM,07/09/2019 12:00:00 AM,07/03/2019 12:00:00 AM,,2019-07-08T00:00:00.000,2019-07-09T00:00:00.000,2019-07-03T00:00:00.000,Done
2019OPA-0662,Done,OPA Close Case,,04/21/2020 12:00:00 AM,04/20/2020 12:00:00 AM,2019-322499,,2020-04-21T00:00:00.000,2020-04-20T00:00:00.000,Done
2015OPA-0878,Done,OPA Close SA,11/07/2015 12:00:00 AM,11/02/2015 12:00:00 AM,11/02/2015 12:00:00 AM,2014-306168,2015-11-07T00:00:00.000,2015-11-02T00:00:00.000,2015-11-02T00:00:00.000,Done
2015OPA-1778,Done,OPA Close CL,11/28/2015 12:00:00 AM,11/30/2015 12:00:00 AM,11/23/2015 12:00:00 AM,,2015-11-28T00:00:00.000,2015-11-30T00:00:00.000,2015-11-23T00:00:00.000,Done
2016OPA-0165,Done,OPA Close CL,03/16/2016 12:00:00 AM,03/15/2016 12:00:00 AM,03/11/2016 12:00:00 AM,,2016-03-16T00:00:00.000,2016-03-15T00:00:00.000,2016-03-11T00:00:00.000,Done
2016OPA-1038,Done,OPA Close CL,09/26/2016 12:00:00 AM,09/26/2016 12:00:00 AM,09/21/2016 12:00:00 AM,,2016-09-26T00:00:00.000,2016-09-26T00:00:00.000,2016-09-21T00:00:00.000,Done
2017OPA-1173,Done,OPA Close Case,05/19/2018 12:00:00 AM,08/23/2018 12:00:00 AM,08/23/2018 12:00:00 AM,2017-417546,2018-05-19T00:00:00.000,2018-08-23T00:00:00.000,2018-08-23T00:00:00.000,Done
2015OPA-1771,Done,OPA Close SA,02/10/2016 12:00:00 AM,02/09/2016 12:00:00 AM,02/05/2016 12:00:00 AM,,2016-02-10T00:00:00.000,2016-02-09T00:00:00.000,2016-02-05T00:00:00.000,Done
2015OPA-1694,Done,OPA Close SA,05/07/2016 12:00:00 AM,07/28/2016 12:00:00 AM,05/02/2016 12:00:00 AM,,2016-05-07T00:00:00.000,2016-07-28T00:00:00.000,2016-05-02T00:00:00.000,Done
2016OPA-0110,Done,OPA Close SA,05/01/2016 12:00:00 AM,04/28/2016 12:00:00 AM,04/26/2016 12:00:00 AM,2016-027528,2016-05-01T00:00:00.000,2016-04-28T00:00:00.000,2016-04-26T00:00:00.000,Done
2016OPA-0133,Done,OPA Close SA,03/23/2016 12:00:00 AM,03/18/2016 12:00:00 AM,03/18/2016 12:00:00 AM,2016-007587,2016-03-23T00:00:00.000,2016-03-18T00:00:00.000,2016-03-18T00:00:00.000,Done
2016OPA-0533,Done,OPA Close SA,07/02/2016 12:00:00 AM,06/27/2016 12:00:00 AM,06/27/2016 12:00:00 AM,,2016-07-02T00:00:00.000,2016-06-27T00:00:00.000,2016-06-27T00:00:00.000,Done
2018OPA-0107,Done,OPA Training Referral,,08/06/2018 12:00:00 AM,10/03/2018 12:00:00 AM,2018-033744,,2018-08-06T00:00:00.000,2018-10-03T00:00:00.000,Done
2018OPA-0238,Done,OPA Training Referral,03/14/2019 12:00:00 AM,10/08/2019 12:00:00 AM,03/04/2019 12:00:00 AM,2018-090451,2019-03-14T00:00:00.000,2019-10-08T00:00:00.000,2019-03-04T00:00:00.000,Done
2018OPA-0688,Done,OPA Close CL,08/27/2018 12:00:00 AM,08/27/2018 12:00:00 AM,08/22/2018 12:00:00 AM,2018-283981,2018-08-27T00:00:00.000,2018-08-27T00:00:00.000,2018-08-22T00:00:00.000,Done
2019OPA-0849,Done,OPA Close Case,02/18/2020 12:00:00 AM,04/14/2020 12:00:00 AM,02/08/2020 12:00:00 AM,2019-423051,2020-02-18T00:00:00.000,2020-04-14T00:00:00.000,2020-02-08T00:00:00.000,Done
2015OPA-0412,Done,OPA Close CL,,03/27/2015 12:00:00 AM,10/20/2015 12:00:00 AM,,,2015-03-27T00:00:00.000,2015-10-20T00:00:00.000,Done
2015OPA-0915,Done,OPA Close SA,,07/15/2015 12:00:00 AM,07/13/2015 12:00:00 AM,2015-105050,,2015-07-15T00:00:00.000,2015-07-13T00:00:00.000,Done
2015OPA-1732,Done,OPA Close SA,,01/05/2016 12:00:00 AM,01/05/2016 12:00:00 AM,,,2016-01-05T00:00:00.000,2016-01-05T00:00:00.000,Done
2015OPA-1713,Done,OPA Close SA,01/16/2016 12:00:00 AM,01/12/2016 12:00:00 AM,01/11/2016 12:00:00 AM,,2016-01-16T00:00:00.000,2016-01-12T00:00:00.000,2016-01-11T00:00:00.000,Done
2016OPA-0539,Done,OPA Send Complainant Closing Letter,06/26/2016 12:00:00 AM,06/22/2016 12:00:00 AM,06/21/2016 12:00:00 AM,,2016-06-26T00:00:00.000,2016-06-22T00:00:00.000,2016-06-21T00:00:00.000,Done
2017OPA-0816,Done,OPA Close SA,,11/01/2017 12:00:00 AM,11/01/2017 12:00:00 AM,2017-291191,,2017-11-01T00:00:00.000,2017-11-01T00:00:00.000,Done
2017OPA-1214,Done,OPA Close CL,12/21/2017 12:00:00 AM,12/15/2017 12:00:00 AM,11/21/2017 12:00:00 AM,,2017-12-21T00:00:00.000,2017-12-15T00:00:00.000,2017-11-21T00:00:00.000,Done
2018OPA-0183,Done,OPA Close CL,03/19/2018 12:00:00 AM,03/14/2018 12:00:00 AM,03/14/2018 12:00:00 AM,,2018-03-19T00:00:00.000,2018-03-14T00:00:00.000,2018-03-14T00:00:00.000,Done
2018OPA-0846,Done,OPA Close CL,09/29/2018 12:00:00 AM,09/27/2018 12:00:00 AM,09/24/2018 12:00:00 AM,2018-307283,2018-09-29T00:00:00.000,2018-09-27T00:00:00.000,2018-09-24T00:00:00.000,Done
2020OPA-0009,Done,OPA Mediation,,03/16/2020 12:00:00 AM,02/03/2020 12:00:00 AM,2019-457226,,2020-03-16T00:00:00.000,2020-02-03T00:00:00.000,Done
2020OPA-0018,Done,OPA Director Certification/Finding,07/05/2020 12:00:00 AM,02/28/2020 12:00:00 AM,01/28/2020 12:00:00 AM,,2020-07-05T00:00:00.000,2020-02-28T00:00:00.000,2020-01-28T00:00:00.000,Done
2020OPA-0097,Done,OPA Process SA,,03/04/2020 12:00:00 AM,03/04/2020 12:00:00 AM,2019-278798,,2020-03-04T00:00:00.000,2020-03-04T00:00:00.000,Done
2015OPA-1752,Done,OPA Close Case,04/25/2016 12:00:00 AM,04/28/2016 12:00:00 AM,04/12/2016 12:00:00 AM,2015-382669,2016-04-25T00:00:00.000,2016-04-28T00:00:00.000,2016-04-12T00:00:00.000,Done
2017OPA-1217,Done,OPA Close CL,12/02/2017 12:00:00 AM,11/27/2017 12:00:00 AM,11/27/2017 12:00:00 AM,2017-417824,2017-12-02T00:00:00.000,2017-11-27T00:00:00.000,2017-11-27T00:00:00.000,Done
2018OPA-0692,Done,OPA Close CL,08/05/2018 12:00:00 AM,08/10/2018 12:00:00 AM,07/31/2018 12:00:00 AM,,2018-08-05T00:00:00.000,2018-08-10T00:00:00.000,2018-07-31T00:00:00.000,Done
2019OPA-0024,Done,OPA OIG Certification,06/11/2019 12:00:00 AM,06/05/2019 12:00:00 AM,05/31/2019 12:00:00 AM,,2019-06-11T00:00:00.000,2019-06-05T00:00:00.000,2019-05-31T00:00:00.000,Done
2020OPA-0013,Done,OPA Director Certification/Finding,07/03/2020 12:00:00 AM,02/28/2020 12:00:00 AM,02/03/2020 12:00:00 AM,,2020-07-03T00:00:00.000,2020-02-28T00:00:00.000,2020-02-03T00:00:00.000,Done
2015OPA-1307,Done,OPA Close SA,10/20/2015 12:00:00 AM,10/16/2015 12:00:00 AM,10/15/2015 12:00:00 AM,,2015-10-20T00:00:00.000,2015-10-16T00:00:00.000,2015-10-15T00:00:00.000,Done
2015OPA-1326,Done,OPA Close SA,10/19/2015 12:00:00 AM,10/14/2015 12:00:00 AM,10/14/2015 12:00:00 AM,,2015-10-19T00:00:00.000,2015-10-14T00:00:00.000,2015-10-14T00:00:00.000,Done
2015OPA-1639,Done,OPA Close CL,11/28/2015 12:00:00 AM,11/30/2015 12:00:00 AM,11/23/2015 12:00:00 AM,,2015-11-28T00:00:00.000,2015-11-30T00:00:00.000,2015-11-23T00:00:00.000,Done
2016OPA-0136,Done,OPA Close CL,02/14/2016 12:00:00 AM,02/12/2016 12:00:00 AM,02/12/2016 12:00:00 AM,,2016-02-14T00:00:00.000,2016-02-12T00:00:00.000,2016-02-12T00:00:00.000,Done
2018OPA-0597,Done,OPA Close Case,,01/22/2019 12:00:00 AM,01/13/2019 12:00:00 AM,,,2019-01-22T00:00:00.000,2019-01-13T00:00:00.000,Done
2017OPA-1053,Done,OPA Close Case,04/01/2018 12:00:00 AM,08/01/2018 12:00:00 AM,03/22/2018 12:00:00 AM,2017-348164,2018-04-01T00:00:00.000,2018-08-01T00:00:00.000,2018-03-22T00:00:00.000,Done
2018OPA-0167,Done,OPA Close Case,08/30/2018 12:00:00 AM,10/10/2018 12:00:00 AM,08/20/2018 12:00:00 AM,2018-061303,2018-08-30T00:00:00.000,2018-10-10T00:00:00.000,2018-08-20T00:00:00.000,Done
2019OPA-0337,Done,OPA Close CL,06/11/2019 12:00:00 AM,06/11/2019 12:00:00 AM,06/06/2019 12:00:00 AM,,2019-06-11T00:00:00.000,2019-06-11T00:00:00.000,2019-06-06T00:00:00.000,Done
2015OPA-0792,Done,OPA Close CL,,06/15/2015 12:00:00 AM,10/19/2015 12:00:00 AM,,,2015-06-15T00:00:00.000,2015-10-19T00:00:00.000,Done
2015OPA-1176,Done,OPA Close CL,,08/27/2015 12:00:00 AM,10/15/2015 12:00:00 AM,,,2015-08-27T00:00:00.000,2015-10-15T00:00:00.000,Done
2015OPA-1757,Done,OPA Close SA,03/23/2016 12:00:00 AM,03/18/2016 12:00:00 AM,03/18/2016 12:00:00 AM,,2016-03-23T00:00:00.000,2016-03-18T00:00:00.000,2016-03-18T00:00:00.000,Done
2016OPA-0060,Done,OPA Close SA,03/07/2016 12:00:00 AM,03/02/2016 12:00:00 AM,03/02/2016 12:00:00 AM,2016-019809,2016-03-07T00:00:00.000,2016-03-02T00:00:00.000,2016-03-02T00:00:00.000,Done
2015OPA-1185,Done,OPA Close SA,09/20/2015 12:00:00 AM,09/16/2015 12:00:00 AM,09/15/2015 12:00:00 AM,,2015-09-20T00:00:00.000,2015-09-16T00:00:00.000,2015-09-15T00:00:00.000,Done
2016OPA-1482,Done,OPA Close SA,,01/31/2017 12:00:00 AM,01/31/2017 12:00:00 AM,,,2017-01-31T00:00:00.000,2017-01-31T00:00:00.000,Done
2019OPA-0094,Done,OPA Close Case,08/02/2019 12:00:00 AM,08/07/2019 12:00:00 AM,07/23/2019 12:00:00 AM,2019-037525,2019-08-02T00:00:00.000,2019-08-07T00:00:00.000,2019-07-23T00:00:00.000,Done
2015OPA-1494,Done,OPA Close SA,02/02/2016 12:00:00 AM,01/28/2016 12:00:00 AM,01/28/2016 12:00:00 AM,2015-223500,2016-02-02T00:00:00.000,2016-01-28T00:00:00.000,2016-01-28T00:00:00.000,Done
2015OPA-1636,Done,OPA Close SA,12/14/2015 12:00:00 AM,12/10/2015 12:00:00 AM,12/09/2015 12:00:00 AM,2015-331212,2015-12-14T00:00:00.000,2015-12-10T00:00:00.000,2015-12-09T00:00:00.000,Done
2016OPA-0054,Done,OPA Close CL,01/26/2016 12:00:00 AM,01/25/2016 12:00:00 AM,01/21/2016 12:00:00 AM,,2016-01-26T00:00:00.000,2016-01-25T00:00:00.000,2016-01-21T00:00:00.000,Done
2016OPA-0809,Done,OPA Close Case,02/06/2017 12:00:00 AM,02/06/2017 12:00:00 AM,01/27/2017 12:00:00 AM,,2017-02-06T00:00:00.000,2017-02-06T00:00:00.000,2017-01-27T00:00:00.000,Done
2016OPA-1157,Done,OPA Close SA,,11/07/2016 12:00:00 AM,11/07/2016 12:00:00 AM,,,2016-11-07T00:00:00.000,2016-11-07T00:00:00.000,Done
2016OPA-1421,Done,OPA Close CL,12/25/2016 12:00:00 AM,12/22/2016 12:00:00 AM,12/20/2016 12:00:00 AM,,2016-12-25T00:00:00.000,2016-12-22T00:00:00.000,2016-12-20T00:00:00.000,Done
2017OPA-0103,Done,OPA Close CL,03/03/2017 12:00:00 AM,03/02/2017 12:00:00 AM,02/26/2017 12:00:00 AM,2016-466051,2017-03-03T00:00:00.000,2017-03-02T00:00:00.000,2017-02-26T00:00:00.000,Done
2018OPA-1098,Done,OPA Close SA,,01/07/2019 12:00:00 AM,01/07/2019 12:00:00 AM,2018-404855,,2019-01-07T00:00:00.000,2019-01-07T00:00:00.000,Done
2018OPA-1148,Done,OPA Training Referral,06/10/2019 12:00:00 AM,11/12/2019 12:00:00 AM,05/31/2019 12:00:00 AM,2018-244633,2019-06-10T00:00:00.000,2019-11-12T00:00:00.000,2019-05-31T00:00:00.000,Done
2016OPA-0782,Done,OPA Close CL,08/03/2016 12:00:00 AM,08/08/2016 12:00:00 AM,07/29/2016 12:00:00 AM,,2016-08-03T00:00:00.000,2016-08-08T00:00:00.000,2016-07-29T00:00:00.000,Done
2016OPA-1466,Done,OPA Close SA,,02/13/2017 12:00:00 AM,02/13/2017 12:00:00 AM,,,2017-02-13T00:00:00.000,2017-02-13T00:00:00.000,Done
2017OPA-0120,Done,OPA Close Case,08/04/2017 12:00:00 AM,08/08/2017 12:00:00 AM,07/25/2017 12:00:00 AM,2017-036376,2017-08-04T00:00:00.000,2017-08-08T00:00:00.000,2017-07-25T00:00:00.000,Done
2017OPA-0645,Done,OPA Close Case,12/21/2017 12:00:00 AM,03/09/2018 12:00:00 AM,12/11/2017 12:00:00 AM,2017-224293,2017-12-21T00:00:00.000,2018-03-09T00:00:00.000,2017-12-11T00:00:00.000,Done
2018OPA-0518,Done,OPA Close Case,12/07/2018 12:00:00 AM,01/23/2019 12:00:00 AM,11/27/2018 12:00:00 AM,2018-200864,2018-12-07T00:00:00.000,2019-01-23T00:00:00.000,2018-11-27T00:00:00.000,Done
2015OPA-0207,Done,OPA SA Review,04/11/2015 12:00:00 AM,04/13/2015 12:00:00 AM,04/06/2015 12:00:00 AM,2015-049467,2015-04-11T00:00:00.000,2015-04-13T00:00:00.000,2015-04-06T00:00:00.000,Done
2016OPA-0356,Done,OPA Close Case,03/23/2017 12:00:00 AM,03/17/2017 12:00:00 AM,03/13/2017 12:00:00 AM,2016-106271,2017-03-23T00:00:00.000,2017-03-17T00:00:00.000,2017-03-13T00:00:00.000,Done
2017OPA-0512,Done,OPA Close Case,11/24/2017 12:00:00 AM,11/29/2017 12:00:00 AM,11/14/2017 12:00:00 AM,,2017-11-24T00:00:00.000,2017-11-29T00:00:00.000,2017-11-14T00:00:00.000,Done
2018OPA-0491,Done,OPA Close CL,06/11/2018 12:00:00 AM,06/14/2018 12:00:00 AM,06/04/2018 12:00:00 AM,2018-166693,2018-06-11T00:00:00.000,2018-06-14T00:00:00.000,2018-06-04T00:00:00.000,Done
2018OPA-1142,Done,OPA Training Referral,06/02/2019 12:00:00 AM,06/05/2019 12:00:00 AM,05/23/2019 12:00:00 AM,,2019-06-02T00:00:00.000,2019-06-05T00:00:00.000,2019-05-23T00:00:00.000,Done
2019OPA-0432,Done,OPA Captain Investigation Review,09/25/2019 12:00:00 AM,09/25/2019 12:00:00 AM,09/25/2019 12:00:00 AM,,2019-09-25T00:00:00.000,2019-09-25T00:00:00.000,2019-09-25T00:00:00.000,Done
2019OPA-0796,Done,OPA Close CL,12/04/2019 12:00:00 AM,12/03/2019 12:00:00 AM,11/26/2019 12:00:00 AM,2019-401970,2019-12-04T00:00:00.000,2019-12-03T00:00:00.000,2019-11-26T00:00:00.000,Done
2020OPA-0187,Done,OPA Process SA,,04/21/2020 12:00:00 AM,04/21/2020 12:00:00 AM,2020-084764,,2020-04-21T00:00:00.000,2020-04-21T00:00:00.000,Done
2015OPA-0605,Done,OPA Close CL,,05/19/2015 12:00:00 AM,10/20/2015 12:00:00 AM,2014-417754,,2015-05-19T00:00:00.000,2015-10-20T00:00:00.000,Done
2016OPA-0489,Done,OPA Close CL,05/18/2016 12:00:00 AM,05/16/2016 12:00:00 AM,05/13/2016 12:00:00 AM,,2016-05-18T00:00:00.000,2016-05-16T00:00:00.000,2016-05-13T00:00:00.000,Done
2018OPA-0045,Done,OPA Close Case,02/05/2018 12:00:00 AM,01/31/2018 12:00:00 AM,01/31/2018 12:00:00 AM,,2018-02-05T00:00:00.000,2018-01-31T00:00:00.000,2018-01-31T00:00:00.000,Done
2018OPA-0702,Done,OPA Close SA,,11/01/2018 12:00:00 AM,11/01/2018 12:00:00 AM,2018-275525,,2018-11-01T00:00:00.000,2018-11-01T00:00:00.000,Done
2018OPA-1138,Done,OPA Close CL,01/05/2018 12:00:00 AM,01/10/2019 12:00:00 AM,01/08/2019 12:00:00 AM,2018-431379,2018-01-05T00:00:00.000,2019-01-10T00:00:00.000,2019-01-08T00:00:00.000,Done
2015OPA-1301,Done,OPA Close SA,09/21/2015 12:00:00 AM,09/17/2015 12:00:00 AM,09/16/2015 12:00:00 AM,,2015-09-21T00:00:00.000,2015-09-17T00:00:00.000,2015-09-16T00:00:00.000,Done
2015OPA-1719,Done,OPA Close SA,05/06/2016 12:00:00 AM,05/06/2016 12:00:00 AM,04/21/2016 12:00:00 AM,,2016-05-06T00:00:00.000,2016-05-06T00:00:00.000,2016-04-21T00:00:00.000,Done
2016OPA-0309,Done,OPA Close CL,04/05/2016 12:00:00 AM,03/31/2016 12:00:00 AM,03/30/2016 12:00:00 AM,,2016-04-05T00:00:00.000,2016-03-31T00:00:00.000,2016-03-30T00:00:00.000,Done
2016OPA-0621,Done,OPA Close SA,07/24/2016 12:00:00 AM,07/19/2016 12:00:00 AM,07/19/2016 12:00:00 AM,,2016-07-24T00:00:00.000,2016-07-19T00:00:00.000,2016-07-19T00:00:00.000,Done
2016OPA-1481,Done,OPA Close Case,06/05/2017 12:00:00 AM,06/06/2017 12:00:00 AM,05/26/2017 12:00:00 AM,2016-447296,2017-06-05T00:00:00.000,2017-06-06T00:00:00.000,2017-05-26T00:00:00.000,Done
2018OPA-0547,Done,OPA Training Referral,,02/07/2019 12:00:00 AM,01/13/2019 12:00:00 AM,2018-221099,,2019-02-07T00:00:00.000,2019-01-13T00:00:00.000,Done
2019OPA-0227,Done,OPA Close Case,10/06/2019 12:00:00 AM,11/20/2019 12:00:00 AM,09/26/2019 12:00:00 AM,2019-128678,2019-10-06T00:00:00.000,2019-11-20T00:00:00.000,2019-09-26T00:00:00.000,Done
2020OPA-0077,Done,OPA Director Certification/Finding,07/17/2020 12:00:00 AM,03/02/2020 12:00:00 AM,02/28/2020 12:00:00 AM,2020-022029,2020-07-17T00:00:00.000,2020-03-02T00:00:00.000,2020-02-28T00:00:00.000,Done
2016OPA-0361,Done,OPA Close CL,05/02/2016 12:00:00 AM,05/02/2016 12:00:00 AM,05/02/2016 12:00:00 AM,2016-108573,2016-05-02T00:00:00.000,2016-05-02T00:00:00.000,2016-05-02T00:00:00.000,Done
2016OPA-0502,Done,OPA Close CL,05/23/2016 12:00:00 AM,05/27/2016 12:00:00 AM,05/23/2016 12:00:00 AM,,2016-05-23T00:00:00.000,2016-05-27T00:00:00.000,2016-05-23T00:00:00.000,Done
2016OPA-1283,Done,OPA Send Complainant Closing Letter,11/24/2016 12:00:00 AM,11/02/2016 12:00:00 AM,10/27/2016 12:00:00 AM,,2016-11-24T00:00:00.000,2016-11-02T00:00:00.000,2016-10-27T00:00:00.000,Done
2017OPA-0357,Done,OPA Close CL,04/17/2017 12:00:00 AM,04/17/2017 12:00:00 AM,04/17/2017 12:00:00 AM,,2017-04-17T00:00:00.000,2017-04-17T00:00:00.000,2017-04-17T00:00:00.000,Done
2019OPA-0013,Done,OPA Close SA,,02/15/2019 12:00:00 AM,02/15/2019 12:00:00 AM,2019-003029,,2019-02-15T00:00:00.000,2019-02-15T00:00:00.000,Done
2015OPA-0367,Done,OPA Close Case,11/05/2015 12:00:00 AM,11/05/2015 12:00:00 AM,10/22/2015 12:00:00 AM,,2015-11-05T00:00:00.000,2015-11-05T00:00:00.000,2015-10-22T00:00:00.000,Done
2016OPA-0514,Done,OPA Close Case,02/06/2017 12:00:00 AM,02/06/2017 12:00:00 AM,01/27/2017 12:00:00 AM,2016-157380,2017-02-06T00:00:00.000,2017-02-06T00:00:00.000,2017-01-27T00:00:00.000,Done
2016OPA-0838,Done,OPA Close SA,,10/04/2016 12:00:00 AM,10/04/2016 12:00:00 AM,2016-286231,,2016-10-04T00:00:00.000,2016-10-04T00:00:00.000,Done
2017OPA-0550,Done,OPA Close Case,10/21/2018 12:00:00 AM,11/15/2018 12:00:00 AM,10/11/2018 12:00:00 AM,2017-185652,2018-10-21T00:00:00.000,2018-11-15T00:00:00.000,2018-10-11T00:00:00.000,Done
2018OPA-0218,Done,OPA Close Case,09/17/2018 12:00:00 AM,10/15/2018 12:00:00 AM,09/07/2018 12:00:00 AM,2018-080221,2018-09-17T00:00:00.000,2018-10-15T00:00:00.000,2018-09-07T00:00:00.000,Done
2019OPA-0917,Done,OPA OIG Certification,04/12/2020 12:00:00 AM,04/09/2020 12:00:00 AM,04/02/2020 12:00:00 AM,2019-456348,2020-04-12T00:00:00.000,2020-04-09T00:00:00.000,2020-04-02T00:00:00.000,Done
2015OPA-1508,Done,OPA Close CL,,10/27/2015 12:00:00 AM,10/27/2015 12:00:00 AM,,,2015-10-27T00:00:00.000,2015-10-27T00:00:00.000,Done
2015OPA-1884,Done,OPA Close CL,12/23/2015 12:00:00 AM,12/21/2015 12:00:00 AM,12/18/2015 12:00:00 AM,,2015-12-23T00:00:00.000,2015-12-21T00:00:00.000,2015-12-18T00:00:00.000,Done
2017OPA-1041,Done,OPA Close CL,11/05/2017 12:00:00 AM,11/02/2017 12:00:00 AM,10/06/2017 12:00:00 AM,,2017-11-05T00:00:00.000,2017-11-02T00:00:00.000,2017-10-06T00:00:00.000,Done
2017OPA-1174,Done,OPA Close CL,12/10/2017 12:00:00 AM,12/08/2017 12:00:00 AM,11/13/2017 12:00:00 AM,,2017-12-10T00:00:00.000,2017-12-08T00:00:00.000,2017-11-13T00:00:00.000,Done
2019OPA-0215,Done,OPA Close Case,10/09/2019 12:00:00 AM,10/11/2019 12:00:00 AM,09/25/2019 12:00:00 AM,,2019-10-09T00:00:00.000,2019-10-11T00:00:00.000,2019-09-25T00:00:00.000,Done
2015OPA-1702,Done,OPA SA Review Lieutenant,03/27/2016 12:00:00 AM,03/23/2016 12:00:00 AM,03/22/2016 12:00:00 AM,,2016-03-27T00:00:00.000,2016-03-23T00:00:00.000,2016-03-22T00:00:00.000,Done
2016OPA-0362,Done,OPA Close CL,05/07/2016 12:00:00 AM,05/04/2016 12:00:00 AM,05/02/2016 12:00:00 AM,,2016-05-07T00:00:00.000,2016-05-04T00:00:00.000,2016-05-02T00:00:00.000,Done
2018OPA-0064,Done,OPA Close Case,07/12/2018 12:00:00 AM,10/01/2018 12:00:00 AM,07/02/2018 12:00:00 AM,2018-012418,2018-07-12T00:00:00.000,2018-10-01T00:00:00.000,2018-07-02T00:00:00.000,Done
2018OPA-0305,Done,OPA Close CL,04/25/2018 12:00:00 AM,05/14/2018 12:00:00 AM,04/25/2018 12:00:00 AM,,2018-04-25T00:00:00.000,2018-05-14T00:00:00.000,2018-04-25T00:00:00.000,Done
2020OPA-0123,Done,OPA Close Case,04/10/2020 12:00:00 AM,04/22/2020 12:00:00 AM,03/25/2020 12:00:00 AM,2020-059376,2020-04-10T00:00:00.000,2020-04-22T00:00:00.000,2020-03-25T00:00:00.000,Done
2015OPA-1785,Done,OPA Close Case,05/31/2016 12:00:00 AM,06/06/2016 12:00:00 AM,05/04/2016 12:00:00 AM,,2016-05-31T00:00:00.000,2016-06-06T00:00:00.000,2016-05-04T00:00:00.000,Done
2016OPA-1323,Done,OPA Close Case,05/08/2017 12:00:00 AM,05/11/2017 12:00:00 AM,04/28/2017 12:00:00 AM,2016-397424,2017-05-08T00:00:00.000,2017-05-11T00:00:00.000,2017-04-28T00:00:00.000,Done
2018OPA-0142,Done,OPA Close Case,08/16/2018 12:00:00 AM,10/09/2018 12:00:00 AM,10/09/2018 12:00:00 AM,,2018-08-16T00:00:00.000,2018-10-09T00:00:00.000,2018-10-09T00:00:00.000,Done
2018OPA-0420,Done,OPA Close CL,08/05/2018 12:00:00 AM,08/01/2018 12:00:00 AM,07/31/2018 12:00:00 AM,2018-166693,2018-08-05T00:00:00.000,2018-08-01T00:00:00.000,2018-07-31T00:00:00.000,Done
2018OPA-0928,Done,OPA Close Case,,04/13/2020 12:00:00 AM,04/10/2020 12:00:00 AM,2018-371582,,2020-04-13T00:00:00.000,2020-04-10T00:00:00.000,Done
2018OPA-1160,Done,OPA Training Referral,06/20/2019 12:00:00 AM,07/24/2019 12:00:00 AM,06/10/2019 12:00:00 AM,,2019-06-20T00:00:00.000,2019-07-24T00:00:00.000,2019-06-10T00:00:00.000,Done
2016OPA-0286,Done,OPA Close CL,04/20/2016 12:00:00 AM,04/19/2016 12:00:00 AM,04/15/2016 12:00:00 AM,,2016-04-20T00:00:00.000,2016-04-19T00:00:00.000,2016-04-15T00:00:00.000,Done
2016OPA-0633,Done,OPA Close SA,,08/05/2016 12:00:00 AM,08/05/2016 12:00:00 AM,2016-197223,,2016-08-05T00:00:00.000,2016-08-05T00:00:00.000,Done
2016OPA-0911,Done,OPA Close SA,,10/03/2016 12:00:00 AM,10/03/2016 12:00:00 AM,2016-264783,,2016-10-03T00:00:00.000,2016-10-03T00:00:00.000,Done
2017OPA-0487,Done,OPA Close SA,,06/20/2017 12:00:00 AM,06/20/2017 12:00:00 AM,,,2017-06-20T00:00:00.000,2017-06-20T00:00:00.000,Done
2018OPA-0322,Done,OPA Close Case,03/18/2020 12:00:00 AM,04/20/2020 12:00:00 AM,03/04/2020 12:00:00 AM,2018-098303,2020-03-18T00:00:00.000,2020-04-20T00:00:00.000,2020-03-04T00:00:00.000,Done
2019OPA-0476,Done,OPA Close Case,07/16/2019 12:00:00 AM,07/16/2019 12:00:00 AM,07/16/2019 12:00:00 AM,2018-346043,2019-07-16T00:00:00.000,2019-07-16T00:00:00.000,2019-07-16T00:00:00.000,Done
2015OPA-0430,Done,OPA Close Case,,09/11/2015 12:00:00 AM,08/31/2015 12:00:00 AM,,,2015-09-11T00:00:00.000,2015-08-31T00:00:00.000,Done
2016OPA-1407,Done,OPA Close CL,12/27/2016 12:00:00 AM,12/22/2016 12:00:00 AM,12/22/2016 12:00:00 AM,,2016-12-27T00:00:00.000,2016-12-22T00:00:00.000,2016-12-22T00:00:00.000,Done
2017OPA-0370,Done,OPA Close CL,05/12/2017 12:00:00 AM,04/14/2017 12:00:00 AM,04/12/2017 12:00:00 AM,,2017-05-12T00:00:00.000,2017-04-14T00:00:00.000,2017-04-12T00:00:00.000,Done
2018OPA-0392,Done,OPA Close SA,07/01/2018 12:00:00 AM,06/21/2018 12:00:00 AM,06/21/2018 12:00:00 AM,2018-155581,2018-07-01T00:00:00.000,2018-06-21T00:00:00.000,2018-06-21T00:00:00.000,Done
2018OPA-1059,Done,OPA Close CL,12/03/2018 12:00:00 AM,12/04/2018 12:00:00 AM,11/28/2018 12:00:00 AM,2018-415517,2018-12-03T00:00:00.000,2018-12-04T00:00:00.000,2018-11-28T00:00:00.000,Done
2015OPA-1823,Done,OPA Close SA,04/27/2016 12:00:00 AM,05/06/2016 12:00:00 AM,04/12/2016 12:00:00 AM,2015-415103,2016-04-27T00:00:00.000,2016-05-06T00:00:00.000,2016-04-12T00:00:00.000,Done
2016OPA-0123,Done,OPA Close SA,04/07/2016 12:00:00 AM,04/01/2016 12:00:00 AM,03/23/2016 12:00:00 AM,,2016-04-07T00:00:00.000,2016-04-01T00:00:00.000,2016-03-23T00:00:00.000,Done
2016OPA-1351,Done,OPA Close SA,,12/30/2016 12:00:00 AM,12/30/2016 12:00:00 AM,2016-410057,,2016-12-30T00:00:00.000,2016-12-30T00:00:00.000,Done
2017OPA-0440,Done,OPA Close SA,,06/20/2017 12:00:00 AM,06/20/2017 12:00:00 AM,,,2017-06-20T00:00:00.000,2017-06-20T00:00:00.000,Done
2020OPA-0091,Done,OPA Close CL,03/13/2020 12:00:00 AM,03/16/2020 12:00:00 AM,03/06/2020 12:00:00 AM,,2020-03-13T00:00:00.000,2020-03-16T00:00:00.000,2020-03-06T00:00:00.000,Done
2015OPA-0180,Done,OPA Close CL,,03/05/2015 12:00:00 AM,10/22/2015 12:00:00 AM,,,2015-03-05T00:00:00.000,2015-10-22T00:00:00.000,Done
2015OPA-0556,Done,OPA Close CL,,05/11/2015 12:00:00 AM,10/20/2015 12:00:00 AM,,,2015-05-11T00:00:00.000,2015-10-20T00:00:00.000,Done
2018OPA-0270,Done,OPA Close CL,04/25/2018 12:00:00 AM,04/10/2018 12:00:00 AM,03/27/2018 12:00:00 AM,,2018-04-25T00:00:00.000,2018-04-10T00:00:00.000,2018-03-27T00:00:00.000,Done
2018OPA-0751,Done,OPA Close Case,02/15/2019 12:00:00 AM,05/01/2019 12:00:00 AM,02/05/2019 12:00:00 AM,2018-292034,2019-02-15T00:00:00.000,2019-05-01T00:00:00.000,2019-02-05T00:00:00.000,Done
2019OPA-0329,Done,OPA Close SA,,08/02/2019 12:00:00 AM,08/02/2019 12:00:00 AM,2019-150728,,2019-08-02T00:00:00.000,2019-08-02T00:00:00.000,Done
2015OPA-0823,Done,OPA Close CL,,06/15/2015 12:00:00 AM,10/19/2015 12:00:00 AM,2015-166034,,2015-06-15T00:00:00.000,2015-10-19T00:00:00.000,Done
2015OPA-1686,Done,OPA Close Case,05/31/2016 12:00:00 AM,06/06/2016 12:00:00 AM,04/28/2016 12:00:00 AM,2015-296462,2016-05-31T00:00:00.000,2016-06-06T00:00:00.000,2016-04-28T00:00:00.000,Done
2017OPA-0981,Done,OPA Close Case,03/20/2018 12:00:00 AM,06/07/2018 12:00:00 AM,03/21/2018 12:00:00 AM,2017-046947,2018-03-20T00:00:00.000,2018-06-07T00:00:00.000,2018-03-21T00:00:00.000,Done
2018OPA-0598,Done,OPA Close CL,08/04/2018 12:00:00 AM,08/01/2018 12:00:00 AM,07/30/2018 12:00:00 AM,2018-229961,2018-08-04T00:00:00.000,2018-08-01T00:00:00.000,2018-07-30T00:00:00.000,Done
2019OPA-0481,Done,OPA Close CL,08/07/2019 12:00:00 AM,08/06/2019 12:00:00 AM,08/02/2019 12:00:00 AM,,2019-08-07T00:00:00.000,2019-08-06T00:00:00.000,2019-08-02T00:00:00.000,Done
2019OPA-0836,Done,OPA 180 Extension Request,06/10/2020 12:00:00 AM,07/10/2020 12:00:00 AM,04/02/2020 12:00:00 AM,,2020-06-10T00:00:00.000,2020-07-10T00:00:00.000,2020-04-02T00:00:00.000,Done
2016OPA-0153,Done,OPA Close SA,04/18/2016 12:00:00 AM,04/13/2016 12:00:00 AM,04/13/2016 12:00:00 AM,,2016-04-18T00:00:00.000,2016-04-13T00:00:00.000,2016-04-13T00:00:00.000,Done
2016OPA-0380,Done,OPA Close CL,05/04/2016 12:00:00 AM,05/02/2016 12:00:00 AM,04/29/2016 12:00:00 AM,,2016-05-04T00:00:00.000,2016-05-02T00:00:00.000,2016-04-29T00:00:00.000,Done
2016OPA-1435,Done,OPA Close Case,05/10/2017 12:00:00 AM,05/16/2017 12:00:00 AM,05/05/2017 12:00:00 AM,,2017-05-10T00:00:00.000,2017-05-16T00:00:00.000,2017-05-05T00:00:00.000,Done
2017OPA-0066,Done,OPA Close SA,,03/14/2017 12:00:00 AM,03/14/2017 12:00:00 AM,,,2017-03-14T00:00:00.000,2017-03-14T00:00:00.000,Done
2017OPA-0607,Done,OPA Close CL,07/19/2017 12:00:00 AM,07/20/2017 12:00:00 AM,07/14/2017 12:00:00 AM,,2017-07-19T00:00:00.000,2017-07-20T00:00:00.000,2017-07-14T00:00:00.000,Done
2017OPA-0888,Done,OPA Close CL,09/26/2017 12:00:00 AM,09/29/2017 12:00:00 AM,09/21/2017 12:00:00 AM,2017-320787,2017-09-26T00:00:00.000,2017-09-29T00:00:00.000,2017-09-21T00:00:00.000,Done
2015OPA-0487,Done,OPA Close CL,,04/10/2015 12:00:00 AM,10/20/2015 12:00:00 AM,,,2015-04-10T00:00:00.000,2015-10-20T00:00:00.000,Done
2015OPA-0673,Done,OPA Close SA,06/21/2015 12:00:00 AM,06/17/2015 12:00:00 AM,06/16/2015 12:00:00 AM,2015-157296,2015-06-21T00:00:00.000,2015-06-17T00:00:00.000,2015-06-16T00:00:00.000,Done
2016OPA-1453,Done,OPA Close CL,12/21/2016 12:00:00 AM,12/19/2016 12:00:00 AM,12/16/2016 12:00:00 AM,,2016-12-21T00:00:00.000,2016-12-19T00:00:00.000,2016-12-16T00:00:00.000,Done
2015OPA-0783,Done,OPA Close CL,,07/23/2015 12:00:00 AM,10/16/2015 12:00:00 AM,2014-307258,,2015-07-23T00:00:00.000,2015-10-16T00:00:00.000,Done
2015OPA-1330,Done,OPA Close CL,,09/18/2015 12:00:00 AM,10/14/2015 12:00:00 AM,2015-305468,,2015-09-18T00:00:00.000,2015-10-14T00:00:00.000,Done
2015OPA-1540,Done,OPA Close CL,,10/27/2015 12:00:00 AM,10/27/2015 12:00:00 AM,,,2015-10-27T00:00:00.000,2015-10-27T00:00:00.000,Done
2017OPA-0040,Done,OPA Appeal/Grievance Filed,03/13/2018 12:00:00 AM,03/08/2018 12:00:00 AM,03/08/2018 12:00:00 AM,2016-406737,2018-03-13T00:00:00.000,2018-03-08T00:00:00.000,2018-03-08T00:00:00.000,Done
2018OPA-0480,Done,OPA Training Referral,12/07/2018 12:00:00 AM,01/13/2019 12:00:00 AM,11/27/2018 12:00:00 AM,2018-191960,2018-12-07T00:00:00.000,2019-01-13T00:00:00.000,2018-11-27T00:00:00.000,Done
2018OPA-1118,Done,OPA Close CL,12/24/2018 12:00:00 AM,01/02/2019 12:00:00 AM,12/19/2018 12:00:00 AM,2018-378305,2018-12-24T00:00:00.000,2019-01-02T00:00:00.000,2018-12-19T00:00:00.000,Done
2018OPA-1129,Done,OPA Close CL,01/01/2019 12:00:00 AM,01/10/2019 12:00:00 AM,01/08/2019 12:00:00 AM,,2019-01-01T00:00:00.000,2019-01-10T00:00:00.000,2019-01-08T00:00:00.000,Done
2015OPA-1590,Done,OPA Close Case,07/15/2016 12:00:00 AM,07/15/2016 12:00:00 AM,01/10/2017 12:00:00 AM,,2016-07-15T00:00:00.000,2016-07-15T00:00:00.000,2017-01-10T00:00:00.000,Done
2016OPA-0855,Done,OPA Close CL,08/24/2016 12:00:00 AM,08/24/2016 12:00:00 AM,08/19/2016 12:00:00 AM,,2016-08-24T00:00:00.000,2016-08-24T00:00:00.000,2016-08-19T00:00:00.000,Done
2017OPA-0056,Done,OPA Close Case,07/09/2017 12:00:00 AM,07/21/2017 12:00:00 AM,06/29/2017 12:00:00 AM,2017-018391,2017-07-09T00:00:00.000,2017-07-21T00:00:00.000,2017-06-29T00:00:00.000,Done
2017OPA-0600,Done,OPA Close CL,07/20/2017 12:00:00 AM,07/11/2017 12:00:00 AM,06/22/2017 12:00:00 AM,,2017-07-20T00:00:00.000,2017-07-11T00:00:00.000,2017-06-22T00:00:00.000,Done
2018OPA-0716,Done,OPA Close CL,08/27/2018 12:00:00 AM,08/24/2018 12:00:00 AM,08/22/2018 12:00:00 AM,,2018-08-27T00:00:00.000,2018-08-24T00:00:00.000,2018-08-22T00:00:00.000,Done
2019OPA-0440,Done,OPA Close CL,07/20/2019 12:00:00 AM,07/18/2019 12:00:00 AM,07/15/2019 12:00:00 AM,,2019-07-20T00:00:00.000,2019-07-18T00:00:00.000,2019-07-15T00:00:00.000,Done
2019OPA-0861,Done,OPA 180 Extension Request,06/24/2020 12:00:00 AM,07/24/2020 12:00:00 AM,04/02/2020 12:00:00 AM,2019-440837,2020-06-24T00:00:00.000,2020-07-24T00:00:00.000,2020-04-02T00:00:00.000,Done
2015OPA-1579,Done,OPA Close CL,11/02/2015 12:00:00 AM,11/02/2015 12:00:00 AM,10/28/2015 12:00:00 AM,,2015-11-02T00:00:00.000,2015-11-02T00:00:00.000,2015-10-28T00:00:00.000,Done
2016OPA-0013,Done,OPA Close Case,09/30/2016 12:00:00 AM,09/30/2016 12:00:00 AM,09/19/2016 12:00:00 AM,2015-311016,2016-09-30T00:00:00.000,2016-09-30T00:00:00.000,2016-09-19T00:00:00.000,Done
2017OPA-1139,Done,OPA Close CL,12/04/2017 12:00:00 AM,12/01/2017 12:00:00 AM,11/29/2017 12:00:00 AM,,2017-12-04T00:00:00.000,2017-12-01T00:00:00.000,2017-11-29T00:00:00.000,Done
2018OPA-0681,Done,OPA Close SA,,09/11/2018 12:00:00 AM,09/11/2018 12:00:00 AM,2018-268537,,2018-09-11T00:00:00.000,2018-09-11T00:00:00.000,Done
2018OPA-0791,Done,OPA Close Case,02/07/2019 12:00:00 AM,02/19/2019 12:00:00 AM,01/28/2019 12:00:00 AM,2018-298441,2019-02-07T00:00:00.000,2019-02-19T00:00:00.000,2019-01-28T00:00:00.000,Done
2015OPA-0071,Done,OPA Close CL,,01/26/2015 12:00:00 AM,10/23/2015 12:00:00 AM,,,2015-01-26T00:00:00.000,2015-10-23T00:00:00.000,Done
2015OPA-0253,Done,OPA Close CL,,03/12/2015 12:00:00 AM,10/22/2015 12:00:00 AM,,,2015-03-12T00:00:00.000,2015-10-22T00:00:00.000,Done
2016OPA-1096,Done,OPA Close CL,09/12/2016 12:00:00 AM,09/12/2016 12:00:00 AM,09/07/2016 12:00:00 AM,,2016-09-12T00:00:00.000,2016-09-12T00:00:00.000,2016-09-07T00:00:00.000,Done
2016OPA-1274,Done,OPA Close Case,08/17/2017 12:00:00 AM,08/21/2017 12:00:00 AM,08/07/2017 12:00:00 AM,2016-374895,2017-08-17T00:00:00.000,2017-08-21T00:00:00.000,2017-08-07T00:00:00.000,Done
2017OPA-0257,Done,OPA Close SA,,05/31/2017 12:00:00 AM,05/31/2017 12:00:00 AM,2014-162566,,2017-05-31T00:00:00.000,2017-05-31T00:00:00.000,Done
2019OPA-0270,Done,OPA Close CL,05/26/2019 12:00:00 AM,05/29/2019 12:00:00 AM,05/21/2019 12:00:00 AM,2019-143550,2019-05-26T00:00:00.000,2019-05-29T00:00:00.000,2019-05-21T00:00:00.000,Done
2015OPA-0366,Done,OPA Close CL,,03/30/2015 12:00:00 AM,10/20/2015 12:00:00 AM,,,2015-03-30T00:00:00.000,2015-10-20T00:00:00.000,Done
2015OPA-1036,Done,OPA Close SA,10/03/2015 12:00:00 AM,10/06/2015 12:00:00 AM,09/28/2015 12:00:00 AM,2015-051024,2015-10-03T00:00:00.000,2015-10-06T00:00:00.000,2015-09-28T00:00:00.000,Done
2015OPA-1580,Done,OPA Close CL,11/02/2015 12:00:00 AM,11/02/2015 12:00:00 AM,10/28/2015 12:00:00 AM,,2015-11-02T00:00:00.000,2015-11-02T00:00:00.000,2015-10-28T00:00:00.000,Done
2015OPA-1789,Done,OPA Close Case,06/13/2016 12:00:00 AM,06/24/2016 12:00:00 AM,05/13/2016 12:00:00 AM,,2016-06-13T00:00:00.000,2016-06-24T00:00:00.000,2016-05-13T00:00:00.000,Done
2016OPA-1443,Done,OPA Close Case,06/13/2017 12:00:00 AM,06/28/2017 12:00:00 AM,05/30/2017 12:00:00 AM,,2017-06-13T00:00:00.000,2017-06-28T00:00:00.000,2017-05-30T00:00:00.000,Done
2017OPA-0112,Done,OPA Close Case,12/01/2017 12:00:00 AM,01/11/2018 12:00:00 AM,01/08/2018 12:00:00 AM,2017-036217,2017-12-01T00:00:00.000,2018-01-11T00:00:00.000,2018-01-08T00:00:00.000,Done
2017OPA-0517,Done,OPA Close SA,,07/21/2017 12:00:00 AM,07/21/2017 12:00:00 AM,,,2017-07-21T00:00:00.000,2017-07-21T00:00:00.000,Done
2018OPA-0975,Done,OPA Close CL,11/05/2018 12:00:00 AM,11/07/2018 12:00:00 AM,11/02/2018 12:00:00 AM,2018-372884,2018-11-05T00:00:00.000,2018-11-07T00:00:00.000,2018-11-02T00:00:00.000,Done
2019OPA-0916,Done,OPA Close CL,01/23/2020 12:00:00 AM,01/23/2020 12:00:00 AM,01/15/2020 12:00:00 AM,2019-467798,2020-01-23T00:00:00.000,2020-01-23T00:00:00.000,2020-01-15T00:00:00.000,Done
2015OPA-0702,Done,OPA Close Case,12/09/2015 12:00:00 AM,12/14/2015 12:00:00 AM,11/25/2015 12:00:00 AM,,2015-12-09T00:00:00.000,2015-12-14T00:00:00.000,2015-11-25T00:00:00.000,Done
2018OPA-0118,Done,OPA Training Referral,,01/28/2019 12:00:00 AM,03/07/2019 12:00:00 AM,2018-035996,,2019-01-28T00:00:00.000,2019-03-07T00:00:00.000,Done
2020OPA-0153,Done,OPA Process SA,,04/02/2020 12:00:00 AM,04/02/2020 12:00:00 AM,2020-072154,,2020-04-02T00:00:00.000,2020-04-02T00:00:00.000,Done
2015OPA-0390,Done,OPA Close CL,,04/06/2015 12:00:00 AM,10/20/2015 12:00:00 AM,,,2015-04-06T00:00:00.000,2015-10-20T00:00:00.000,Done
2015OPA-0903,Done,OPA Training Referral,12/24/2015 12:00:00 AM,12/24/2015 12:00:00 AM,11/25/2015 12:00:00 AM,,2015-12-24T00:00:00.000,2015-12-24T00:00:00.000,2015-11-25T00:00:00.000,Done
2016OPA-1230,Done,OPA Close CL,11/08/2016 12:00:00 AM,11/10/2016 12:00:00 AM,11/03/2016 12:00:00 AM,,2016-11-08T00:00:00.000,2016-11-10T00:00:00.000,2016-11-03T00:00:00.000,Done
2019OPA-0420,Done,OPA Close Case,12/19/2019 12:00:00 AM,01/07/2020 12:00:00 AM,01/07/2020 12:00:00 AM,,2019-12-19T00:00:00.000,2020-01-07T00:00:00.000,2020-01-07T00:00:00.000,Done
2015OPA-1569,Done,OPA Close CL,,10/28/2015 12:00:00 AM,10/28/2015 12:00:00 AM,,,2015-10-28T00:00:00.000,2015-10-28T00:00:00.000,Done
2015OPA-1697,Done,OPA Close SA,03/27/2016 12:00:00 AM,03/22/2016 12:00:00 AM,03/22/2016 12:00:00 AM,,2016-03-27T00:00:00.000,2016-03-22T00:00:00.000,2016-03-22T00:00:00.000,Done
2016OPA-0126,Done,OPA Close CL,02/14/2016 12:00:00 AM,02/10/2016 12:00:00 AM,02/09/2016 12:00:00 AM,,2016-02-14T00:00:00.000,2016-02-10T00:00:00.000,2016-02-09T00:00:00.000,Done
2016OPA-0545,Done,OPA Send Closing Letter,06/18/2016 12:00:00 AM,06/14/2016 12:00:00 AM,06/13/2016 12:00:00 AM,,2016-06-18T00:00:00.000,2016-06-14T00:00:00.000,2016-06-13T00:00:00.000,Done
2016OPA-0620,Done,OPA Close Case,02/05/2017 12:00:00 AM,02/05/2017 12:00:00 AM,01/26/2017 12:00:00 AM,,2017-02-05T00:00:00.000,2017-02-05T00:00:00.000,2017-01-26T00:00:00.000,Done
2015OPA-0726,Done,OPA Close Case,,12/23/2015 12:00:00 AM,11/25/2015 12:00:00 AM,,,2015-12-23T00:00:00.000,2015-11-25T00:00:00.000,Done
2016OPA-0250,Done,OPA Close Case,10/15/2016 12:00:00 AM,10/17/2016 12:00:00 AM,10/04/2016 12:00:00 AM,2014-340946,2016-10-15T00:00:00.000,2016-10-17T00:00:00.000,2016-10-04T00:00:00.000,Done
2017OPA-0789,Done,OPA Close Case,01/22/2018 12:00:00 AM,04/23/2018 12:00:00 AM,01/17/2018 12:00:00 AM,2017-276911,2018-01-22T00:00:00.000,2018-04-23T00:00:00.000,2018-01-17T00:00:00.000,Done
2018OPA-0083,Done,OPA Close CL,02/22/2018 12:00:00 AM,02/22/2018 12:00:00 AM,02/16/2018 12:00:00 AM,,2018-02-22T00:00:00.000,2018-02-22T00:00:00.000,2018-02-16T00:00:00.000,Done
2018OPA-1062,Done,OPA Training Referral,05/13/2019 12:00:00 AM,03/30/2020 12:00:00 AM,05/08/2019 12:00:00 AM,,2019-05-13T00:00:00.000,2020-03-30T00:00:00.000,2019-05-08T00:00:00.000,Done
2017OPA-0486,Done,OPA Close SA,,08/29/2017 12:00:00 AM,08/29/2017 12:00:00 AM,,,2017-08-29T00:00:00.000,2017-08-29T00:00:00.000,Done
2018OPA-0377,Done,OPA Training Referral,,11/16/2019 12:00:00 AM,03/11/2019 12:00:00 AM,,,2019-11-16T00:00:00.000,2019-03-11T00:00:00.000,Done
2018OPA-0916,Done,OPA Close CL,10/20/2018 12:00:00 AM,10/19/2018 12:00:00 AM,10/15/2018 12:00:00 AM,,2018-10-20T00:00:00.000,2018-10-19T00:00:00.000,2018-10-15T00:00:00.000,Done
2019OPA-0634,Done,OPA Close CL,09/21/2019 12:00:00 AM,09/18/2019 12:00:00 AM,09/13/2019 12:00:00 AM,2019-316366,2019-09-21T00:00:00.000,2019-09-18T00:00:00.000,2019-09-13T00:00:00.000,Done
2015OPA-0655,Done,OPA Close Case,08/08/2016 12:00:00 AM,08/09/2016 12:00:00 AM,08/01/2016 12:00:00 AM,2010-386198,2016-08-08T00:00:00.000,2016-08-09T00:00:00.000,2016-08-01T00:00:00.000,Done
2015OPA-1267,Done,OPA Close SA,10/11/2015 12:00:00 AM,10/06/2015 12:00:00 AM,10/06/2015 12:00:00 AM,2015-226582,2015-10-11T00:00:00.000,2015-10-06T00:00:00.000,2015-10-06T00:00:00.000,Done
2016OPA-0638,Done,OPA Close Case,01/30/2017 12:00:00 AM,01/30/2017 12:00:00 AM,11/28/2016 12:00:00 AM,,2017-01-30T00:00:00.000,2017-01-30T00:00:00.000,2016-11-28T00:00:00.000,Done
2016OPA-1480,Done,OPA Close SA,,02/08/2017 12:00:00 AM,02/08/2017 12:00:00 AM,,,2017-02-08T00:00:00.000,2017-02-08T00:00:00.000,Done
2015OPA-0797,Done,OPA Close SA,08/02/2015 12:00:00 AM,07/29/2015 12:00:00 AM,07/28/2015 12:00:00 AM,2015-181545,2015-08-02T00:00:00.000,2015-07-29T00:00:00.000,2015-07-28T00:00:00.000,Done
2016OPA-1062,Done,OPA Close Case,03/06/2017 12:00:00 AM,03/17/2017 12:00:00 AM,02/23/2017 12:00:00 AM,,2017-03-06T00:00:00.000,2017-03-17T00:00:00.000,2017-02-23T00:00:00.000,Done
2015OPA-0193,Done,OPA Close CL,,03/13/2015 12:00:00 AM,10/22/2015 12:00:00 AM,,,2015-03-13T00:00:00.000,2015-10-22T00:00:00.000,Done
2015OPA-0272,Done,OPA Close CL,,03/23/2015 12:00:00 AM,10/21/2015 12:00:00 AM,,,2015-03-23T00:00:00.000,2015-10-21T00:00:00.000,Done
2015OPA-0350,Done,OPA Close CL,,10/16/2015 12:00:00 AM,10/16/2015 12:00:00 AM,,,2015-10-16T00:00:00.000,2015-10-16T00:00:00.000,Done
2019OPA-0409,Done,OPA Close CL,07/14/2019 12:00:00 AM,07/11/2019 12:00:00 AM,07/09/2019 12:00:00 AM,,2019-07-14T00:00:00.000,2019-07-11T00:00:00.000,2019-07-09T00:00:00.000,Done
2016OPA-0311,Done,OPA Close CL,04/02/2016 12:00:00 AM,03/30/2016 12:00:00 AM,03/28/2016 12:00:00 AM,,2016-04-02T00:00:00.000,2016-03-30T00:00:00.000,2016-03-28T00:00:00.000,Done
2016OPA-1457,Done,OPA Close SA,,02/15/2017 12:00:00 AM,02/15/2017 12:00:00 AM,,,2017-02-15T00:00:00.000,2017-02-15T00:00:00.000,Done
2016OPA-1533,Done,OPA Close SA,,02/02/2017 12:00:00 AM,02/02/2017 12:00:00 AM,,,2017-02-02T00:00:00.000,2017-02-02T00:00:00.000,Done
2017OPA-0428,Done,OPA Close CL,05/21/2017 12:00:00 AM,05/17/2017 12:00:00 AM,05/16/2017 12:00:00 AM,2017-127797,2017-05-21T00:00:00.000,2017-05-17T00:00:00.000,2017-05-16T00:00:00.000,Done
2018OPA-1089,Done,OPA Close CL,12/16/2018 12:00:00 AM,11/28/2018 12:00:00 AM,11/16/2018 12:00:00 AM,2018-406658,2018-12-16T00:00:00.000,2018-11-28T00:00:00.000,2018-11-16T00:00:00.000,Done
2015OPA-0229,Done,OPA Close Case,08/17/2015 12:00:00 AM,09/09/2015 12:00:00 AM,08/31/2015 12:00:00 AM,,2015-08-17T00:00:00.000,2015-09-09T00:00:00.000,2015-08-31T00:00:00.000,Done
2016OPA-0697,Done,OPA Close CL,07/20/2016 12:00:00 AM,07/18/2016 12:00:00 AM,07/15/2016 12:00:00 AM,,2016-07-20T00:00:00.000,2016-07-18T00:00:00.000,2016-07-15T00:00:00.000,Done
2016OPA-1519,Done,OPA Close Case,11/02/2017 12:00:00 AM,11/14/2017 12:00:00 AM,10/31/2017 12:00:00 AM,2016-459569,2017-11-02T00:00:00.000,2017-11-14T00:00:00.000,2017-10-31T00:00:00.000,Done
2017OPA-0055,Done,OPA Close CL,02/16/2017 12:00:00 AM,02/06/2017 12:00:00 AM,01/18/2017 12:00:00 AM,,2017-02-16T00:00:00.000,2017-02-06T00:00:00.000,2017-01-18T00:00:00.000,Done
2017OPA-0369,Done,OPA Close SA,,05/30/2017 12:00:00 AM,05/30/2017 12:00:00 AM,,,2017-05-30T00:00:00.000,2017-05-30T00:00:00.000,Done
2017OPA-0744,Done,OPA Close Case,02/01/2018 12:00:00 AM,05/18/2018 12:00:00 AM,01/22/2018 12:00:00 AM,2017-250895,2018-02-01T00:00:00.000,2018-05-18T00:00:00.000,2018-01-22T00:00:00.000,Done
2018OPA-0959,Done,OPA Close SA,,11/21/2018 12:00:00 AM,11/21/2018 12:00:00 AM,,,2018-11-21T00:00:00.000,2018-11-21T00:00:00.000,Done
2015OPA-0420,Done,OPA Close CL,,03/27/2015 12:00:00 AM,10/21/2015 12:00:00 AM,,,2015-03-27T00:00:00.000,2015-10-21T00:00:00.000,Done
2016OPA-0798,Done,OPA Close CL,08/10/2016 12:00:00 AM,08/08/2016 12:00:00 AM,08/05/2016 12:00:00 AM,,2016-08-10T00:00:00.000,2016-08-08T00:00:00.000,2016-08-05T00:00:00.000,Done
2016OPA-0986,Done,OPA Close CL,09/06/2016 12:00:00 AM,09/07/2016 12:00:00 AM,09/01/2016 12:00:00 AM,,2016-09-06T00:00:00.000,2016-09-07T00:00:00.000,2016-09-01T00:00:00.000,Done
2018OPA-0135,Done,OPA Close CL,03/10/2018 12:00:00 AM,03/08/2018 12:00:00 AM,02/08/2018 12:00:00 AM,2018-048038,2018-03-10T00:00:00.000,2018-03-08T00:00:00.000,2018-02-08T00:00:00.000,Done
2018OPA-0358,Done,OPA Close Case,,04/08/2020 12:00:00 AM,04/08/2020 12:00:00 AM,,,2020-04-08T00:00:00.000,2020-04-08T00:00:00.000,Done
2020OPA-0073,Done,OPA Close CL,02/22/2020 12:00:00 AM,02/21/2020 12:00:00 AM,02/13/2020 12:00:00 AM,,2020-02-22T00:00:00.000,2020-02-21T00:00:00.000,2020-02-13T00:00:00.000,Done
2020OPA-0090,Done,OPA Close Case,04/10/2020 12:00:00 AM,04/22/2020 12:00:00 AM,03/31/2020 12:00:00 AM,2020-014076,2020-04-10T00:00:00.000,2020-04-22T00:00:00.000,2020-03-31T00:00:00.000,Done
2015OPA-0202,Done,OPA Close CL,,03/02/2015 12:00:00 AM,10/22/2015 12:00:00 AM,,,2015-03-02T00:00:00.000,2015-10-22T00:00:00.000,Done
2016OPA-0302,Done,OPA Close Case,01/29/2017 12:00:00 AM,01/29/2017 12:00:00 AM,01/19/2017 12:00:00 AM,2016-096110,2017-01-29T00:00:00.000,2017-01-29T00:00:00.000,2017-01-19T00:00:00.000,Done
2016OPA-0466,Done,OPA Close CL,05/10/2016 12:00:00 AM,05/09/2016 12:00:00 AM,05/05/2016 12:00:00 AM,,2016-05-10T00:00:00.000,2016-05-09T00:00:00.000,2016-05-05T00:00:00.000,Done
2017OPA-1098,Done,OPA Close CL,11/19/2017 12:00:00 AM,11/15/2017 12:00:00 AM,10/20/2017 12:00:00 AM,,2017-11-19T00:00:00.000,2017-11-15T00:00:00.000,2017-10-20T00:00:00.000,Done
2018OPA-0563,Done,OPA Close Case,,02/06/2019 12:00:00 AM,01/13/2019 12:00:00 AM,2018-222617,,2019-02-06T00:00:00.000,2019-01-13T00:00:00.000,Done
2018OPA-0829,Done,OPA Close Case,02/18/2019 12:00:00 AM,02/14/2019 12:00:00 AM,02/08/2019 12:00:00 AM,2018-297955,2019-02-18T00:00:00.000,2019-02-14T00:00:00.000,2019-02-08T00:00:00.000,Done
2018OPA-0848,Done,OPA Close Case,02/27/2020 12:00:00 AM,02/17/2020 12:00:00 AM,02/13/2020 12:00:00 AM,,2020-02-27T00:00:00.000,2020-02-17T00:00:00.000,2020-02-13T00:00:00.000,Done
2015OPA-0040,Done,OPA Director SA Review,03/01/2015 12:00:00 AM,03/11/2015 12:00:00 AM,02/24/2015 12:00:00 AM,2014-241242,2015-03-01T00:00:00.000,2015-03-11T00:00:00.000,2015-02-24T00:00:00.000,Done
2015OPA-0940,Done,OPA Close CL,,06/30/2015 12:00:00 AM,10/19/2015 12:00:00 AM,,,2015-06-30T00:00:00.000,2015-10-19T00:00:00.000,Done
2016OPA-0272,Done,OPA Close Case,08/22/2016 12:00:00 AM,08/22/2016 12:00:00 AM,08/12/2016 12:00:00 AM,2016-051171,2016-08-22T00:00:00.000,2016-08-22T00:00:00.000,2016-08-12T00:00:00.000,Done
2019OPA-0267,Done,OPA Close Case,10/09/2019 12:00:00 AM,10/30/2019 12:00:00 AM,10/30/2019 12:00:00 AM,2018-333736,2019-10-09T00:00:00.000,2019-10-30T00:00:00.000,2019-10-30T00:00:00.000,Done
2019OPA-0894,Done,OPA 180 Extension Request,06/07/2020 12:00:00 AM,07/07/2020 12:00:00 AM,04/04/2020 12:00:00 AM,,2020-06-07T00:00:00.000,2020-07-07T00:00:00.000,2020-04-04T00:00:00.000,Done
2017OPA-0539,Done,OPA Close Case,12/07/2017 12:00:00 AM,01/19/2018 12:00:00 AM,11/27/2017 12:00:00 AM,2017-186812,2017-12-07T00:00:00.000,2018-01-19T00:00:00.000,2017-11-27T00:00:00.000,Done
2017OPA-0728,Done,OPA Close CL,08/19/2017 12:00:00 AM,08/15/2017 12:00:00 AM,08/14/2017 12:00:00 AM,,2017-08-19T00:00:00.000,2017-08-15T00:00:00.000,2017-08-14T00:00:00.000,Done
2018OPA-0201,Done,OPA Management Action,,03/13/2019 12:00:00 AM,01/13/2019 12:00:00 AM,2018-072682,,2019-03-13T00:00:00.000,2019-01-13T00:00:00.000,Done
2018OPA-0278,Done,OPA Final Discipline Action Report,,10/08/2018 12:00:00 AM,01/22/2019 12:00:00 AM,,,2018-10-08T00:00:00.000,2019-01-22T00:00:00.000,Done
2019OPA-0181,Done,OPA Close CL,04/22/2019 12:00:00 AM,04/22/2019 12:00:00 AM,04/17/2019 12:00:00 AM,,2019-04-22T00:00:00.000,2019-04-22T00:00:00.000,2019-04-17T00:00:00.000,Done
2015OPA-0450,Done,OPA Close CL,05/19/2015 12:00:00 AM,05/14/2015 12:00:00 AM,05/14/2015 12:00:00 AM,,2015-05-19T00:00:00.000,2015-05-14T00:00:00.000,2015-05-14T00:00:00.000,Done
2016OPA-0702,Done,OPA Close CL,08/09/2016 12:00:00 AM,08/08/2016 12:00:00 AM,08/04/2016 12:00:00 AM,,2016-08-09T00:00:00.000,2016-08-08T00:00:00.000,2016-08-04T00:00:00.000,Done
2016OPA-0950,Done,OPA Close SA,,09/28/2016 12:00:00 AM,09/28/2016 12:00:00 AM,,,2016-09-28T00:00:00.000,2016-09-28T00:00:00.000,Done
2017OPA-0276,Done,OPA Close Case,09/01/2017 12:00:00 AM,09/06/2017 12:00:00 AM,09/05/2017 12:00:00 AM,,2017-09-01T00:00:00.000,2017-09-06T00:00:00.000,2017-09-05T00:00:00.000,Done
2017OPA-0552,Done,OPA Close Case,11/25/2017 12:00:00 AM,12/07/2017 12:00:00 AM,11/15/2017 12:00:00 AM,2017-188822,2017-11-25T00:00:00.000,2017-12-07T00:00:00.000,2017-11-15T00:00:00.000,Done
2017OPA-1290,Done,OPA Close CL,01/18/2018 12:00:00 AM,01/18/2018 12:00:00 AM,12/19/2017 12:00:00 AM,,2018-01-18T00:00:00.000,2018-01-18T00:00:00.000,2017-12-19T00:00:00.000,Done
2019OPA-0430,Done,OPA Close SA,,08/16/2019 12:00:00 AM,08/16/2019 12:00:00 AM,,,2019-08-16T00:00:00.000,2019-08-16T00:00:00.000,Done
2015OPA-1086,Done,OPA Close CL,,07/23/2015 12:00:00 AM,10/16/2015 12:00:00 AM,,,2015-07-23T00:00:00.000,2015-10-16T00:00:00.000,Done
2016OPA-0097,Done,OPA Close Case,08/05/2016 12:00:00 AM,08/05/2016 12:00:00 AM,07/29/2016 12:00:00 AM,2015-400449,2016-08-05T00:00:00.000,2016-08-05T00:00:00.000,2016-07-29T00:00:00.000,Done
2016OPA-0404,Done,OPA Close CL,05/16/2016 12:00:00 AM,05/19/2016 12:00:00 AM,05/16/2016 12:00:00 AM,,2016-05-16T00:00:00.000,2016-05-19T00:00:00.000,2016-05-16T00:00:00.000,Done
2017OPA-0919,Done,OPA Close CL,09/12/2017 12:00:00 AM,09/14/2017 12:00:00 AM,09/07/2017 12:00:00 AM,,2017-09-12T00:00:00.000,2017-09-14T00:00:00.000,2017-09-07T00:00:00.000,Done
2018OPA-1053,Done,OPA Close CL,12/08/2018 12:00:00 AM,03/06/2019 12:00:00 AM,12/03/2018 12:00:00 AM,,2018-12-08T00:00:00.000,2019-03-06T00:00:00.000,2018-12-03T00:00:00.000,Done
2019OPA-0778,Done,OPA Close SA,,12/05/2019 12:00:00 AM,12/05/2019 12:00:00 AM,2019-380904,,2019-12-05T00:00:00.000,2019-12-05T00:00:00.000,Done
2015OPA-1534,Done,OPA Close SA,01/24/2016 12:00:00 AM,01/19/2016 12:00:00 AM,01/19/2016 12:00:00 AM,2015-157666,2016-01-24T00:00:00.000,2016-01-19T00:00:00.000,2016-01-19T00:00:00.000,Done
2016OPA-0004,Done,OPA Close CL,01/20/2016 12:00:00 AM,01/20/2016 12:00:00 AM,01/15/2016 12:00:00 AM,,2016-01-20T00:00:00.000,2016-01-20T00:00:00.000,2016-01-15T00:00:00.000,Done
2019OPA-0247,Done,OPA Close Case,10/17/2019 12:00:00 AM,10/21/2019 12:00:00 AM,10/07/2019 12:00:00 AM,,2019-10-17T00:00:00.000,2019-10-21T00:00:00.000,2019-10-07T00:00:00.000,Done
2017OPA-0178,Done,OPA Close Case,08/31/2017 12:00:00 AM,08/31/2017 12:00:00 AM,08/21/2017 12:00:00 AM,2017-063073,2017-08-31T00:00:00.000,2017-08-31T00:00:00.000,2017-08-21T00:00:00.000,Done
2017OPA-0626,Done,OPA Close SA,,09/19/2017 12:00:00 AM,09/19/2017 12:00:00 AM,,,2017-09-19T00:00:00.000,2017-09-19T00:00:00.000,Done
2017OPA-1308,Done,OPA Close Case,07/06/2018 12:00:00 AM,10/03/2018 12:00:00 AM,06/26/2018 12:00:00 AM,2017-311445,2018-07-06T00:00:00.000,2018-10-03T00:00:00.000,2018-06-26T00:00:00.000,Done
2019OPA-0090,Done,OPA Close CL,03/02/2019 12:00:00 AM,03/01/2019 12:00:00 AM,02/25/2019 12:00:00 AM,,2019-03-02T00:00:00.000,2019-03-01T00:00:00.000,2019-02-25T00:00:00.000,Done
2019OPA-0119,Done,OPA Close Case,08/17/2019 12:00:00 AM,08/26/2019 12:00:00 AM,08/07/2019 12:00:00 AM,2019-045939,2019-08-17T00:00:00.000,2019-08-26T00:00:00.000,2019-08-07T00:00:00.000,Done
2015OPA-1050,Done,OPA Close SA,11/28/2015 12:00:00 AM,11/24/2015 12:00:00 AM,11/23/2015 12:00:00 AM,2015-228293,2015-11-28T00:00:00.000,2015-11-24T00:00:00.000,2015-11-23T00:00:00.000,Done
2015OPA-1549,Done,OPA Close Case,04/07/2016 12:00:00 AM,04/06/2016 12:00:00 AM,03/16/2016 12:00:00 AM,2015-356398,2016-04-07T00:00:00.000,2016-04-06T00:00:00.000,2016-03-16T00:00:00.000,Done
2015OPA-1799,Done,OPA Close CL,12/22/2015 12:00:00 AM,12/17/2015 12:00:00 AM,12/17/2015 12:00:00 AM,,2015-12-22T00:00:00.000,2015-12-17T00:00:00.000,2015-12-17T00:00:00.000,Done
2018OPA-1072,Done,OPA SA Review,,01/15/2019 12:00:00 AM,01/15/2019 12:00:00 AM,2018-423103,,2019-01-15T00:00:00.000,2019-01-15T00:00:00.000,Done
2019OPA-0688,Done,OPA Close Case,04/10/2020 12:00:00 AM,04/21/2020 12:00:00 AM,02/23/2020 12:00:00 AM,2019-348880,2020-04-10T00:00:00.000,2020-04-21T00:00:00.000,2020-02-23T00:00:00.000,Done
2015OPA-0559,Done,OPA Close SA,,03/17/2017 12:00:00 AM,03/17/2017 12:00:00 AM,,,2017-03-17T00:00:00.000,2017-03-17T00:00:00.000,Done
2015OPA-1502,Done,OPA Close CL,,10/27/2015 12:00:00 AM,10/27/2015 12:00:00 AM,,,2015-10-27T00:00:00.000,2015-10-27T00:00:00.000,Done
2017OPA-0262,Done,OPA Close CL,04/08/2017 12:00:00 AM,04/04/2017 12:00:00 AM,04/03/2017 12:00:00 AM,,2017-04-08T00:00:00.000,2017-04-04T00:00:00.000,2017-04-03T00:00:00.000,Done
2017OPA-0587,Done,OPA Close CL,07/13/2017 12:00:00 AM,06/27/2017 12:00:00 AM,06/13/2017 12:00:00 AM,2016-154028,2017-07-13T00:00:00.000,2017-06-27T00:00:00.000,2017-06-13T00:00:00.000,Done
2017OPA-1147,Done,OPA Close CL,12/03/2017 12:00:00 AM,12/01/2017 12:00:00 AM,11/03/2017 12:00:00 AM,,2017-12-03T00:00:00.000,2017-12-01T00:00:00.000,2017-11-03T00:00:00.000,Done
2018OPA-0857,Done,OPA Close SA,,10/09/2018 12:00:00 AM,10/09/2018 12:00:00 AM,,,2018-10-09T00:00:00.000,2018-10-09T00:00:00.000,Done
2019OPA-0575,Done,OPA Close CL,08/25/2019 12:00:00 AM,08/22/2019 12:00:00 AM,08/20/2019 12:00:00 AM,,2019-08-25T00:00:00.000,2019-08-22T00:00:00.000,2019-08-20T00:00:00.000,Done
2019OPA-0869,Done,OPA Close CL,12/13/2019 12:00:00 AM,12/09/2019 12:00:00 AM,12/06/2019 12:00:00 AM,,2019-12-13T00:00:00.000,2019-12-09T00:00:00.000,2019-12-06T00:00:00.000,Done
2020OPA-0132,Done,OPA 180 Extension Request,07/31/2020 12:00:00 AM,08/30/2020 12:00:00 AM,04/04/2020 12:00:00 AM,2020-041087,2020-07-31T00:00:00.000,2020-08-30T00:00:00.000,2020-04-04T00:00:00.000,Done
2015OPA-0238,Done,OPA Close CL,,03/05/2015 12:00:00 AM,10/22/2015 12:00:00 AM,2011-221091,,2015-03-05T00:00:00.000,2015-10-22T00:00:00.000,Done
2015OPA-1063,Done,OPA Close Case,12/31/2015 12:00:00 AM,12/29/2015 12:00:00 AM,12/23/2015 12:00:00 AM,2015-228586,2015-12-31T00:00:00.000,2015-12-29T00:00:00.000,2015-12-23T00:00:00.000,Done
2016OPA-1179,Done,OPA Close Case,12/28/2017 12:00:00 AM,03/08/2018 12:00:00 AM,12/18/2017 12:00:00 AM,2016-340764,2017-12-28T00:00:00.000,2018-03-08T00:00:00.000,2017-12-18T00:00:00.000,Done
2016OPA-1311,Done,OPA Close CL,11/07/2016 12:00:00 AM,11/08/2016 12:00:00 AM,11/02/2016 12:00:00 AM,2016-246766,2016-11-07T00:00:00.000,2016-11-08T00:00:00.000,2016-11-02T00:00:00.000,Done
2017OPA-0003,Done,OPA Send Complainant Closing Letter,01/23/2017 12:00:00 AM,01/23/2017 12:00:00 AM,01/18/2017 12:00:00 AM,,2017-01-23T00:00:00.000,2017-01-23T00:00:00.000,2017-01-18T00:00:00.000,Done
2015OPA-0572,Done,OPA Close CL,,05/11/2015 12:00:00 AM,10/20/2015 12:00:00 AM,,,2015-05-11T00:00:00.000,2015-10-20T00:00:00.000,Done
2015OPA-1800,Done,OPA Close CL,02/17/2016 12:00:00 AM,02/16/2016 12:00:00 AM,02/12/2016 12:00:00 AM,2015-349317,2016-02-17T00:00:00.000,2016-02-16T00:00:00.000,2016-02-12T00:00:00.000,Done
2019OPA-0459,Done,OPA Close CL,07/20/2019 12:00:00 AM,07/18/2019 12:00:00 AM,07/15/2019 12:00:00 AM,,2019-07-20T00:00:00.000,2019-07-18T00:00:00.000,2019-07-15T00:00:00.000,Done
2019OPA-0498,Done,OPA Close Case,02/06/2020 12:00:00 AM,02/26/2020 12:00:00 AM,01/15/2020 12:00:00 AM,,2020-02-06T00:00:00.000,2020-02-26T00:00:00.000,2020-01-15T00:00:00.000,Done
2020OPA-0064,Done,OPA 180 Extension Request,07/02/2020 12:00:00 AM,08/01/2020 12:00:00 AM,04/02/2020 12:00:00 AM,,2020-07-02T00:00:00.000,2020-08-01T00:00:00.000,2020-04-02T00:00:00.000,Done
2016OPA-1002,Done,OPA Close SA,,09/27/2016 12:00:00 AM,09/27/2016 12:00:00 AM,2016-220649,,2016-09-27T00:00:00.000,2016-09-27T00:00:00.000,Done
2017OPA-0190,Done,OPA Close CL,03/24/2017 12:00:00 AM,03/01/2017 12:00:00 AM,02/22/2017 12:00:00 AM,,2017-03-24T00:00:00.000,2017-03-01T00:00:00.000,2017-02-22T00:00:00.000,Done
2017OPA-1317,Done,OPA Close CL,01/27/2018 12:00:00 AM,01/23/2018 12:00:00 AM,12/28/2017 12:00:00 AM,,2018-01-27T00:00:00.000,2018-01-23T00:00:00.000,2017-12-28T00:00:00.000,Done
2018OPA-0428,Done,OPA Close Case,09/27/2018 12:00:00 AM,10/17/2018 12:00:00 AM,09/17/2018 12:00:00 AM,2018-098491,2018-09-27T00:00:00.000,2018-10-17T00:00:00.000,2018-09-17T00:00:00.000,Done
2018OPA-0644,Done,OPA Close SA,,09/10/2018 12:00:00 AM,09/10/2018 12:00:00 AM,,,2018-09-10T00:00:00.000,2018-09-10T00:00:00.000,Done
2015OPA-0529,Done,OPA Close CL,,04/16/2015 12:00:00 AM,10/20/2015 12:00:00 AM,,,2015-04-16T00:00:00.000,2015-10-20T00:00:00.000,Done
2015OPA-1432,Done,OPA Close CL,,10/06/2015 12:00:00 AM,10/13/2015 12:00:00 AM,,,2015-10-06T00:00:00.000,2015-10-13T00:00:00.000,Done
2015OPA-1841,Done,OPA Close Case,06/15/2016 12:00:00 AM,06/29/2016 12:00:00 AM,06/01/2016 12:00:00 AM,2016-006773,2016-06-15T00:00:00.000,2016-06-29T00:00:00.000,2016-06-01T00:00:00.000,Done
2016OPA-0878,Done,OPA Close CL,08/24/2016 12:00:00 AM,08/24/2016 12:00:00 AM,08/19/2016 12:00:00 AM,,2016-08-24T00:00:00.000,2016-08-24T00:00:00.000,2016-08-19T00:00:00.000,Done
2017OPA-0219,Done,OPA Close CL,03/31/2017 12:00:00 AM,03/09/2017 12:00:00 AM,03/01/2017 12:00:00 AM,,2017-03-31T00:00:00.000,2017-03-09T00:00:00.000,2017-03-01T00:00:00.000,Done
2019OPA-0522,Done,OPA Close Case,01/27/2019 12:00:00 AM,02/05/2020 12:00:00 AM,01/15/2020 12:00:00 AM,,2019-01-27T00:00:00.000,2020-02-05T00:00:00.000,2020-01-15T00:00:00.000,Done
2019OPA-0391,Done,OPA Close CL,07/08/2019 12:00:00 AM,07/09/2019 12:00:00 AM,07/03/2019 12:00:00 AM,,2019-07-08T00:00:00.000,2019-07-09T00:00:00.000,2019-07-03T00:00:00.000,Done
2019OPA-0504,Done,OPA Close CL,08/07/2019 12:00:00 AM,08/06/2019 12:00:00 AM,08/02/2019 12:00:00 AM,,2019-08-07T00:00:00.000,2019-08-06T00:00:00.000,2019-08-02T00:00:00.000,Done
2020OPA-0085,Done,OPA Close SA,,03/19/2020 12:00:00 AM,03/19/2020 12:00:00 AM,2020-047612,,2020-03-19T00:00:00.000,2020-03-19T00:00:00.000,Done
2015OPA-0132,Done,OPA Close CL,,02/18/2015 12:00:00 AM,10/22/2015 12:00:00 AM,,,2015-02-18T00:00:00.000,2015-10-22T00:00:00.000,Done
2015OPA-0505,Done,OPA Director SA Review,05/25/2015 12:00:00 AM,06/17/2015 12:00:00 AM,05/20/2015 12:00:00 AM,2015-058755,2015-05-25T00:00:00.000,2015-06-17T00:00:00.000,2015-05-20T00:00:00.000,Done
2015OPA-0805,Done,OPA Close SA,08/29/2015 12:00:00 AM,08/24/2015 12:00:00 AM,08/24/2015 12:00:00 AM,2015-183479,2015-08-29T00:00:00.000,2015-08-24T00:00:00.000,2015-08-24T00:00:00.000,Done
2015OPA-1044,Done,OPA Close SA,10/11/2015 12:00:00 AM,10/08/2015 12:00:00 AM,10/06/2015 12:00:00 AM,,2015-10-11T00:00:00.000,2015-10-08T00:00:00.000,2015-10-06T00:00:00.000,Done
2016OPA-0966,Done,OPA Close CL,09/18/2016 12:00:00 AM,09/15/2016 12:00:00 AM,09/13/2016 12:00:00 AM,,2016-09-18T00:00:00.000,2016-09-15T00:00:00.000,2016-09-13T00:00:00.000,Done
2016OPA-1289,Done,OPA Send Complainant Closing Letter,11/21/2016 12:00:00 AM,12/06/2016 12:00:00 AM,11/16/2016 12:00:00 AM,,2016-11-21T00:00:00.000,2016-12-06T00:00:00.000,2016-11-16T00:00:00.000,Done
2017OPA-0062,Done,OPA Close CL,02/05/2017 12:00:00 AM,01/30/2017 12:00:00 AM,01/26/2017 12:00:00 AM,,2017-02-05T00:00:00.000,2017-01-30T00:00:00.000,2017-01-26T00:00:00.000,Done
2018OPA-1067,Done,OPA Close Case,05/06/2019 12:00:00 AM,05/06/2019 12:00:00 AM,04/26/2019 12:00:00 AM,2018-410353,2019-05-06T00:00:00.000,2019-05-06T00:00:00.000,2019-04-26T00:00:00.000,Done
2015OPA-1001,Done,OPA Close SA,09/20/2015 12:00:00 AM,09/15/2015 12:00:00 AM,09/15/2015 12:00:00 AM,,2015-09-20T00:00:00.000,2015-09-15T00:00:00.000,2015-09-15T00:00:00.000,Done
2015OPA-1383,Done,OPA Close SA,11/28/2015 12:00:00 AM,11/24/2015 12:00:00 AM,11/23/2015 12:00:00 AM,2015-317547,2015-11-28T00:00:00.000,2015-11-24T00:00:00.000,2015-11-23T00:00:00.000,Done
2016OPA-0299,Done,OPA Close CL,03/28/2016 12:00:00 AM,03/28/2016 12:00:00 AM,03/23/2016 12:00:00 AM,,2016-03-28T00:00:00.000,2016-03-28T00:00:00.000,2016-03-23T00:00:00.000,Done
2018OPA-0572,Done,OPA Close SA,,08/21/2018 12:00:00 AM,08/21/2018 12:00:00 AM,,,2018-08-21T00:00:00.000,2018-08-21T00:00:00.000,Done
2018OPA-1115,Done,OPA Close Case,05/31/2019 12:00:00 AM,07/08/2019 12:00:00 AM,05/14/2019 12:00:00 AM,2018-426781,2019-05-31T00:00:00.000,2019-07-08T00:00:00.000,2019-05-14T00:00:00.000,Done
2019OPA-0370,Done,OPA Close CL,07/03/2019 12:00:00 AM,07/02/2019 12:00:00 AM,07/02/2019 12:00:00 AM,2019-191547,2019-07-03T00:00:00.000,2019-07-02T00:00:00.000,2019-07-02T00:00:00.000,Done
2015OPA-0415,Done,OPA Close CL,,03/27/2015 12:00:00 AM,10/21/2015 12:00:00 AM,,,2015-03-27T00:00:00.000,2015-10-21T00:00:00.000,Done
2015OPA-0693,Done,OPA Close SA,08/02/2015 12:00:00 AM,07/29/2015 12:00:00 AM,07/28/2015 12:00:00 AM,,2015-08-02T00:00:00.000,2015-07-29T00:00:00.000,2015-07-28T00:00:00.000,Done
2019OPA-0398,Done,OPA Close CL,07/10/2019 12:00:00 AM,07/09/2019 12:00:00 AM,07/05/2019 12:00:00 AM,,2019-07-10T00:00:00.000,2019-07-09T00:00:00.000,2019-07-05T00:00:00.000,Done
2019OPA-0733,Done,OPA Close CL,10/24/2019 12:00:00 AM,10/29/2019 12:00:00 AM,10/19/2019 12:00:00 AM,,2019-10-24T00:00:00.000,2019-10-29T00:00:00.000,2019-10-19T00:00:00.000,Done
2016OPA-1505,Done,OPA Close CL,01/16/2017 12:00:00 AM,01/13/2017 12:00:00 AM,01/11/2017 12:00:00 AM,,2017-01-16T00:00:00.000,2017-01-13T00:00:00.000,2017-01-11T00:00:00.000,Done
2017OPA-1180,Done,OPA Final Discipline Action Report,,04/18/2018 12:00:00 AM,01/22/2019 12:00:00 AM,2017-394350,,2018-04-18T00:00:00.000,2019-01-22T00:00:00.000,Done
2018OPA-0067,Done,OPA Close Case,07/27/2018 12:00:00 AM,08/07/2018 12:00:00 AM,07/17/2018 12:00:00 AM,2018-019828,2018-07-27T00:00:00.000,2018-08-07T00:00:00.000,2018-07-17T00:00:00.000,Done
2018OPA-0079,Done,OPA Final Discipline Action Report,,07/12/2018 12:00:00 AM,01/22/2019 12:00:00 AM,2018-017258,,2018-07-12T00:00:00.000,2019-01-22T00:00:00.000,Done
2018OPA-0302,Done,OPA Training Referral,,08/06/2018 12:00:00 AM,03/08/2019 12:00:00 AM,2018-051163,,2018-08-06T00:00:00.000,2019-03-08T00:00:00.000,Done
2018OPA-0713,Done,OPA Close CL,09/02/2018 12:00:00 AM,08/30/2018 12:00:00 AM,08/28/2018 12:00:00 AM,2018-275336,2018-09-02T00:00:00.000,2018-08-30T00:00:00.000,2018-08-28T00:00:00.000,Done
2015OPA-0264,Done,OPA Close CL,,03/12/2015 12:00:00 AM,10/22/2015 12:00:00 AM,,,2015-03-12T00:00:00.000,2015-10-22T00:00:00.000,Done
2015OPA-1745,Done,OPA Close SA,08/09/2016 12:00:00 AM,07/25/2016 12:00:00 AM,07/25/2016 12:00:00 AM,,2016-08-09T00:00:00.000,2016-07-25T00:00:00.000,2016-07-25T00:00:00.000,Done
2016OPA-0201,Done,OPA Close SA,04/12/2016 12:00:00 AM,04/20/2016 12:00:00 AM,03/28/2016 12:00:00 AM,2015-420231,2016-04-12T00:00:00.000,2016-04-20T00:00:00.000,2016-03-28T00:00:00.000,Done
2016OPA-0518,Done,OPA Close Case,03/16/2017 12:00:00 AM,03/15/2017 12:00:00 AM,03/06/2017 12:00:00 AM,2016-166175,2017-03-16T00:00:00.000,2017-03-15T00:00:00.000,2017-03-06T00:00:00.000,Done
2016OPA-1066,Done,OPA Close Case,06/15/2017 12:00:00 AM,07/20/2017 12:00:00 AM,06/13/2017 12:00:00 AM,2016-293409,2017-06-15T00:00:00.000,2017-07-20T00:00:00.000,2017-06-13T00:00:00.000,Done
2017OPA-0083,Done,OPA Close CL,,02/27/2017 12:00:00 AM,02/17/2017 12:00:00 AM,,,2017-02-27T00:00:00.000,2017-02-17T00:00:00.000,Done
2017OPA-0855,Done,OPA Close CL,09/07/2017 12:00:00 AM,09/12/2017 12:00:00 AM,09/02/2017 12:00:00 AM,2017-228146,2017-09-07T00:00:00.000,2017-09-12T00:00:00.000,2017-09-02T00:00:00.000,Done
2018OPA-0745,Done,OPA Close Case,01/20/2019 12:00:00 AM,02/13/2019 12:00:00 AM,01/10/2019 12:00:00 AM,,2019-01-20T00:00:00.000,2019-02-13T00:00:00.000,2019-01-10T00:00:00.000,Done
2015OPA-0530,Done,OPA Close SA,,10/12/2015 12:00:00 AM,10/12/2015 12:00:00 AM,2014-404645,,2015-10-12T00:00:00.000,2015-10-12T00:00:00.000,Done
2016OPA-0602,Done,OPA Close CL,06/08/2016 12:00:00 AM,06/07/2016 12:00:00 AM,06/03/2016 12:00:00 AM,,2016-06-08T00:00:00.000,2016-06-07T00:00:00.000,2016-06-03T00:00:00.000,Done
2017OPA-1032,Done,OIG  Investigation review,01/31/2018 12:00:00 AM,12/29/2018 12:00:00 AM,10/31/2017 12:00:00 AM,2016-225415,2018-01-31T00:00:00.000,2018-12-29T00:00:00.000,2017-10-31T00:00:00.000,Done
2018OPA-0215,Done,OPA Training Referral,,10/16/2019 12:00:00 AM,03/07/2019 12:00:00 AM,2018-069648,,2019-10-16T00:00:00.000,2019-03-07T00:00:00.000,Done
2018OPA-0426,Done,OPA Close SA,,09/24/2018 12:00:00 AM,09/24/2018 12:00:00 AM,,,2018-09-24T00:00:00.000,2018-09-24T00:00:00.000,Done
2019OPA-0253,Done,OPA Close CL,05/19/2019 12:00:00 AM,05/16/2019 12:00:00 AM,05/14/2019 12:00:00 AM,,2019-05-19T00:00:00.000,2019-05-16T00:00:00.000,2019-05-14T00:00:00.000,Done
2017OPA-0940,Done,OPA Close Case,03/31/2018 12:00:00 AM,07/25/2018 12:00:00 AM,03/21/2018 12:00:00 AM,2017-334475,2018-03-31T00:00:00.000,2018-07-25T00:00:00.000,2018-03-21T00:00:00.000,Done
2018OPA-0431,Done,OPA Training Referral,,11/19/2018 12:00:00 AM,03/12/2019 12:00:00 AM,2018-175166,,2018-11-19T00:00:00.000,2019-03-12T00:00:00.000,Done
2019OPA-0130,Done,OPA Close CL,03/19/2019 12:00:00 AM,03/19/2019 12:00:00 AM,03/14/2019 12:00:00 AM,2019-062759,2019-03-19T00:00:00.000,2019-03-19T00:00:00.000,2019-03-14T00:00:00.000,Done
2019OPA-0785,Done,OPA Close Case,,03/25/2020 12:00:00 AM,01/31/2020 12:00:00 AM,2019-363156,,2020-03-25T00:00:00.000,2020-01-31T00:00:00.000,Done
2015OPA-1057,Done,OPA Close CL,,09/14/2015 12:00:00 AM,10/14/2015 12:00:00 AM,,,2015-09-14T00:00:00.000,2015-10-14T00:00:00.000,Done
2016OPA-0031,Done,OPA Send Disregard Notice,02/09/2016 12:00:00 AM,02/05/2016 12:00:00 AM,02/04/2016 12:00:00 AM,,2016-02-09T00:00:00.000,2016-02-05T00:00:00.000,2016-02-04T00:00:00.000,Done
2016OPA-0684,Done,OPA Close CL,08/01/2016 12:00:00 AM,08/01/2016 12:00:00 AM,07/27/2016 12:00:00 AM,,2016-08-01T00:00:00.000,2016-08-01T00:00:00.000,2016-07-27T00:00:00.000,Done
2018OPA-0035,Done,OPA Close Case,07/12/2018 12:00:00 AM,10/01/2018 12:00:00 AM,07/02/2018 12:00:00 AM,2018-004914,2018-07-12T00:00:00.000,2018-10-01T00:00:00.000,2018-07-02T00:00:00.000,Done
2018OPA-0496,Done,OPA Close CL,07/14/2018 12:00:00 AM,07/11/2018 12:00:00 AM,06/20/2018 12:00:00 AM,,2018-07-14T00:00:00.000,2018-07-11T00:00:00.000,2018-06-20T00:00:00.000,Done
2018OPA-0065,Done,OPA Final Discipline Action Report,10/19/2018 12:00:00 AM,10/19/2018 12:00:00 AM,01/29/2019 12:00:00 AM,,2018-10-19T00:00:00.000,2018-10-19T00:00:00.000,2019-01-29T00:00:00.000,Done
2018OPA-0209,Done,OPA Close CL,05/04/2018 12:00:00 AM,03/13/2018 12:00:00 AM,03/05/2018 12:00:00 AM,,2018-05-04T00:00:00.000,2018-03-13T00:00:00.000,2018-03-05T00:00:00.000,Done
2018OPA-0365,Done,OPA Close CL,05/28/2018 12:00:00 AM,06/14/2018 12:00:00 AM,05/23/2018 12:00:00 AM,2017-250738,2018-05-28T00:00:00.000,2018-06-14T00:00:00.000,2018-05-23T00:00:00.000,Done
2018OPA-0599,Done,OPA Training Referral,01/06/2019 12:00:00 AM,05/15/2019 12:00:00 AM,12/27/2018 12:00:00 AM,2018-240252,2019-01-06T00:00:00.000,2019-05-15T00:00:00.000,2018-12-27T00:00:00.000,Done
2018OPA-0746,Done,OPA Close SA,,10/08/2018 12:00:00 AM,10/08/2018 12:00:00 AM,,,2018-10-08T00:00:00.000,2018-10-08T00:00:00.000,Done
2019OPA-0265,Done,OPA Close CL,05/25/2019 12:00:00 AM,05/29/2019 12:00:00 AM,05/20/2019 12:00:00 AM,2019-145644,2019-05-25T00:00:00.000,2019-05-29T00:00:00.000,2019-05-20T00:00:00.000,Done
2019OPA-0513,Done,OPA Close Case,,04/20/2020 12:00:00 AM,01/28/2020 12:00:00 AM,2016-157676,,2020-04-20T00:00:00.000,2020-01-28T00:00:00.000,Done
2015OPA-0218,Done,OPA Close CL,,03/20/2015 12:00:00 AM,10/22/2015 12:00:00 AM,,,2015-03-20T00:00:00.000,2015-10-22T00:00:00.000,Done
2015OPA-0684,Done,OPA Close CL,,06/08/2015 12:00:00 AM,10/19/2015 12:00:00 AM,,,2015-06-08T00:00:00.000,2015-10-19T00:00:00.000,Done
2015OPA-1224,Done,OPA Close CL,,09/03/2015 12:00:00 AM,10/15/2015 12:00:00 AM,,,2015-09-03T00:00:00.000,2015-10-15T00:00:00.000,Done
2016OPA-1433,Done,OPA Close Case,06/05/2017 12:00:00 AM,06/12/2017 12:00:00 AM,05/26/2017 12:00:00 AM,2016-431608,2017-06-05T00:00:00.000,2017-06-12T00:00:00.000,2017-05-26T00:00:00.000,Done
2017OPA-0752,Done,OPA Close SA,,10/06/2017 12:00:00 AM,10/06/2017 12:00:00 AM,2017-229069,,2017-10-06T00:00:00.000,2017-10-06T00:00:00.000,Done
2018OPA-1185,Done,OPA Close CL,01/15/2019 12:00:00 AM,01/14/2019 12:00:00 AM,01/10/2019 12:00:00 AM,2018-424277,2019-01-15T00:00:00.000,2019-01-14T00:00:00.000,2019-01-10T00:00:00.000,Done
2015OPA-0687,Done,OPA Close Case,12/09/2015 12:00:00 AM,12/11/2015 12:00:00 AM,11/16/2015 12:00:00 AM,,2015-12-09T00:00:00.000,2015-12-11T00:00:00.000,2015-11-16T00:00:00.000,Done
2015OPA-1239,Done,OPA Close CL,,08/27/2015 12:00:00 AM,10/15/2015 12:00:00 AM,2015-161471,,2015-08-27T00:00:00.000,2015-10-15T00:00:00.000,Done
2018OPA-1116,Done,OPA Close CL,12/22/2018 12:00:00 AM,12/27/2018 12:00:00 AM,12/17/2018 12:00:00 AM,,2018-12-22T00:00:00.000,2018-12-27T00:00:00.000,2018-12-17T00:00:00.000,Done
2015OPA-1557,Done,OPA Close CL,,10/28/2015 12:00:00 AM,10/28/2015 12:00:00 AM,,,2015-10-28T00:00:00.000,2015-10-28T00:00:00.000,Done
2016OPA-0463,Done,OPA Close Case,01/30/2017 12:00:00 AM,01/31/2017 12:00:00 AM,01/26/2017 12:00:00 AM,2016-149898,2017-01-30T00:00:00.000,2017-01-31T00:00:00.000,2017-01-26T00:00:00.000,Done
2016OPA-1430,Done,OPA Close CL,12/12/2016 12:00:00 AM,12/16/2016 12:00:00 AM,12/07/2016 12:00:00 AM,,2016-12-12T00:00:00.000,2016-12-16T00:00:00.000,2016-12-07T00:00:00.000,Done
2018OPA-0289,Done,OPA Close SA,,05/31/2018 12:00:00 AM,05/31/2018 12:00:00 AM,,,2018-05-31T00:00:00.000,2018-05-31T00:00:00.000,Done
2015OPA-0679,Done,OPA Close CL,,06/08/2015 12:00:00 AM,10/19/2015 12:00:00 AM,,,2015-06-08T00:00:00.000,2015-10-19T00:00:00.000,Done
2015OPA-1229,Done,OPA Close CL,10/06/2015 12:00:00 AM,10/06/2015 12:00:00 AM,10/13/2015 12:00:00 AM,2015-274177,2015-10-06T00:00:00.000,2015-10-06T00:00:00.000,2015-10-13T00:00:00.000,Done
2019OPA-0710,Done,OPA 180 Extension Request,06/22/2020 12:00:00 AM,07/22/2020 12:00:00 AM,04/02/2020 12:00:00 AM,,2020-06-22T00:00:00.000,2020-07-22T00:00:00.000,2020-04-02T00:00:00.000,Done
2016OPA-0067,Done,OPA Close CL,02/21/2016 12:00:00 AM,02/18/2016 12:00:00 AM,02/16/2016 12:00:00 AM,,2016-02-21T00:00:00.000,2016-02-18T00:00:00.000,2016-02-16T00:00:00.000,Done
2017OPA-0365,Done,OPA Close SA,,06/20/2017 12:00:00 AM,06/20/2017 12:00:00 AM,,,2017-06-20T00:00:00.000,2017-06-20T00:00:00.000,Done
2017OPA-0713,Done,OPA Close Case,12/28/2017 12:00:00 AM,03/13/2018 12:00:00 AM,12/18/2017 12:00:00 AM,2017-240197,2017-12-28T00:00:00.000,2018-03-13T00:00:00.000,2017-12-18T00:00:00.000,Done
2017OPA-1087,Done,OPA Training Referral,04/02/2018 12:00:00 AM,04/27/2018 12:00:00 AM,03/23/2018 12:00:00 AM,2017-374667,2018-04-02T00:00:00.000,2018-04-27T00:00:00.000,2018-03-23T00:00:00.000,Done
2017OPA-1160,Done,OPA Close SA,,01/04/2018 12:00:00 AM,01/04/2018 12:00:00 AM,,,2018-01-04T00:00:00.000,2018-01-04T00:00:00.000,Done
2018OPA-0691,Done,OPA Close Case,02/07/2019 12:00:00 AM,02/20/2019 12:00:00 AM,01/28/2019 12:00:00 AM,2018-274756,2019-02-07T00:00:00.000,2019-02-20T00:00:00.000,2019-01-28T00:00:00.000,Done
2015OPA-1208,Done,OPA Close CL,,08/27/2015 12:00:00 AM,10/15/2015 12:00:00 AM,,,2015-08-27T00:00:00.000,2015-10-15T00:00:00.000,Done
2017OPA-0669,Done,OPA Close CL,08/06/2017 12:00:00 AM,08/03/2017 12:00:00 AM,07/26/2017 12:00:00 AM,,2017-08-06T00:00:00.000,2017-08-03T00:00:00.000,2017-07-26T00:00:00.000,Done
2017OPA-1048,Done,OPA Close CL,11/05/2017 12:00:00 AM,11/01/2017 12:00:00 AM,10/31/2017 12:00:00 AM,2017-363195,2017-11-05T00:00:00.000,2017-11-01T00:00:00.000,2017-10-31T00:00:00.000,Done
2018OPA-0429,Done,OPA Training Referral,,03/12/2019 12:00:00 AM,03/12/2019 12:00:00 AM,2018-152386,,2019-03-12T00:00:00.000,2019-03-12T00:00:00.000,Done
2018OPA-0690,Done,OPA Training Referral,03/07/2019 12:00:00 AM,06/11/2019 12:00:00 AM,02/25/2019 12:00:00 AM,2018-144938,2019-03-07T00:00:00.000,2019-06-11T00:00:00.000,2019-02-25T00:00:00.000,Done
2018OPA-0785,Done,OPA Close CL,09/15/2018 12:00:00 AM,09/12/2018 12:00:00 AM,09/10/2018 12:00:00 AM,,2018-09-15T00:00:00.000,2018-09-12T00:00:00.000,2018-09-10T00:00:00.000,Done
2015OPA-0638,Done,OPA Close CL,,05/19/2015 12:00:00 AM,10/20/2015 12:00:00 AM,,,2015-05-19T00:00:00.000,2015-10-20T00:00:00.000,Done
2015OPA-0664,Done,OPA Close CL,,06/08/2015 12:00:00 AM,10/19/2015 12:00:00 AM,,,2015-06-08T00:00:00.000,2015-10-19T00:00:00.000,Done
2015OPA-1625,Done,OPA Close CL,11/15/2015 12:00:00 AM,11/12/2015 12:00:00 AM,11/10/2015 12:00:00 AM,,2015-11-15T00:00:00.000,2015-11-12T00:00:00.000,2015-11-10T00:00:00.000,Done
2016OPA-0509,Done,OPA Close CL,06/08/2016 12:00:00 AM,06/07/2016 12:00:00 AM,06/03/2016 12:00:00 AM,,2016-06-08T00:00:00.000,2016-06-07T00:00:00.000,2016-06-03T00:00:00.000,Done
2016OPA-0919,Done,OPA Close SA,,09/27/2016 12:00:00 AM,09/27/2016 12:00:00 AM,,,2016-09-27T00:00:00.000,2016-09-27T00:00:00.000,Done
2016OPA-1049,Done,OPA Close CL,09/26/2016 12:00:00 AM,09/26/2016 12:00:00 AM,08/29/2016 12:00:00 AM,,2016-09-26T00:00:00.000,2016-09-26T00:00:00.000,2016-08-29T00:00:00.000,Done
2017OPA-0264,Done,OPA Close CL,04/09/2017 12:00:00 AM,04/12/2017 12:00:00 AM,04/04/2017 12:00:00 AM,2017-088252,2017-04-09T00:00:00.000,2017-04-12T00:00:00.000,2017-04-04T00:00:00.000,Done
2015OPA-0160,Done,OPA Close Case,10/30/2015 12:00:00 AM,10/30/2015 12:00:00 AM,10/22/2015 12:00:00 AM,2014-222942,2015-10-30T00:00:00.000,2015-10-30T00:00:00.000,2015-10-22T00:00:00.000,Done
2015OPA-0199,Done,OPA Close CL,,03/02/2015 12:00:00 AM,10/22/2015 12:00:00 AM,,,2015-03-02T00:00:00.000,2015-10-22T00:00:00.000,Done
2019OPA-0360,Done,OPA Close Case,11/14/2019 12:00:00 AM,11/26/2019 12:00:00 AM,11/04/2019 12:00:00 AM,2019-164701,2019-11-14T00:00:00.000,2019-11-26T00:00:00.000,2019-11-04T00:00:00.000,Done
2016OPA-1041,Done,OPA Close CL,10/25/2016 12:00:00 AM,10/20/2016 12:00:00 AM,10/20/2016 12:00:00 AM,2016-282562,2016-10-25T00:00:00.000,2016-10-20T00:00:00.000,2016-10-20T00:00:00.000,Done
2016OPA-1366,Done,OPA Send Complaint Receipt,,12/06/2016 12:00:00 AM,12/06/2016 12:00:00 AM,,,2016-12-06T00:00:00.000,2016-12-06T00:00:00.000,Done
2016OPA-1485,Done,OPA Close CL,01/14/2017 12:00:00 AM,01/10/2017 12:00:00 AM,01/04/2017 12:00:00 AM,,2017-01-14T00:00:00.000,2017-01-10T00:00:00.000,2017-01-04T00:00:00.000,Done
2017OPA-0706,Done,OPA Close CL,08/14/2017 12:00:00 AM,08/02/2017 12:00:00 AM,07/17/2017 12:00:00 AM,,2017-08-14T00:00:00.000,2017-08-02T00:00:00.000,2017-07-17T00:00:00.000,Done
2018OPA-0956,Done,OPA Close SA,,02/06/2019 12:00:00 AM,02/06/2019 12:00:00 AM,2018-272125,,2019-02-06T00:00:00.000,2019-02-06T00:00:00.000,Done
2015OPA-0092,Done,OPA Close Case,07/28/2015 12:00:00 AM,07/28/2015 12:00:00 AM,07/14/2015 12:00:00 AM,,2015-07-28T00:00:00.000,2015-07-28T00:00:00.000,2015-07-14T00:00:00.000,Done
2015OPA-0149,Done,OPA Close CL,,03/04/2015 12:00:00 AM,10/22/2015 12:00:00 AM,,,2015-03-04T00:00:00.000,2015-10-22T00:00:00.000,Done
2016OPA-0588,Done,OPA Close Case,02/17/2017 12:00:00 AM,03/06/2017 12:00:00 AM,02/07/2017 12:00:00 AM,2016-018018,2017-02-17T00:00:00.000,2017-03-06T00:00:00.000,2017-02-07T00:00:00.000,Done
2016OPA-1022,Done,OPA Close CL,09/21/2016 12:00:00 AM,09/21/2016 12:00:00 AM,09/16/2016 12:00:00 AM,,2016-09-21T00:00:00.000,2016-09-21T00:00:00.000,2016-09-16T00:00:00.000,Done
2016OPA-1476,Done,OPA Close SA,,02/08/2017 12:00:00 AM,02/08/2017 12:00:00 AM,,,2017-02-08T00:00:00.000,2017-02-08T00:00:00.000,Done
2017OPA-0337,Done,OPA Close CL,03/18/2017 12:00:00 AM,04/12/2017 12:00:00 AM,04/04/2017 12:00:00 AM,,2017-03-18T00:00:00.000,2017-04-12T00:00:00.000,2017-04-04T00:00:00.000,Done
2015OPA-0101,Done,OPA Director SA Review,04/15/2015 12:00:00 AM,04/13/2015 12:00:00 AM,04/10/2015 12:00:00 AM,,2015-04-15T00:00:00.000,2015-04-13T00:00:00.000,2015-04-10T00:00:00.000,Done
2016OPA-1379,Done,OPA Close SA,,02/08/2017 12:00:00 AM,02/08/2017 12:00:00 AM,,,2017-02-08T00:00:00.000,2017-02-08T00:00:00.000,Done
2018OPA-1019,Done,OPA Close Case,04/29/2019 12:00:00 AM,04/24/2019 12:00:00 AM,04/19/2019 12:00:00 AM,2018-393439,2019-04-29T00:00:00.000,2019-04-24T00:00:00.000,2019-04-19T00:00:00.000,Done
2019OPA-0493,Done,OPA Close CL,08/15/2019 12:00:00 AM,08/15/2019 12:00:00 AM,08/10/2019 12:00:00 AM,2019-255928,2019-08-15T00:00:00.000,2019-08-15T00:00:00.000,2019-08-10T00:00:00.000,Done
2015OPA-0240,Done,OPA Close CL,,03/13/2015 12:00:00 AM,10/22/2015 12:00:00 AM,,,2015-03-13T00:00:00.000,2015-10-22T00:00:00.000,Done
2015OPA-1931,Done,OPA Close Case,08/05/2016 12:00:00 AM,08/05/2016 12:00:00 AM,07/29/2016 12:00:00 AM,2015-431554,2016-08-05T00:00:00.000,2016-08-05T00:00:00.000,2016-07-29T00:00:00.000,Done
2016OPA-1009,Done,OPA Close SA,,11/03/2016 12:00:00 AM,10/31/2016 12:00:00 AM,,,2016-11-03T00:00:00.000,2016-10-31T00:00:00.000,Done
2018OPA-0058,Done,OPA Investigation,06/14/2018 12:00:00 AM,06/26/2018 12:00:00 AM,05/15/2018 12:00:00 AM,2018-017740,2018-06-14T00:00:00.000,2018-06-26T00:00:00.000,2018-05-15T00:00:00.000,Done
2018OPA-0265,Done,OPA Send Complainant Closing Letter,05/05/2018 12:00:00 AM,05/09/2018 12:00:00 AM,04/25/2018 12:00:00 AM,,2018-05-05T00:00:00.000,2018-05-09T00:00:00.000,2018-04-25T00:00:00.000,Done
2019OPA-0557,Done,OPA Final Discipline Action Report,,01/28/2020 12:00:00 AM,03/30/2020 12:00:00 AM,2019-285784,,2020-01-28T00:00:00.000,2020-03-30T00:00:00.000,Done
2015OPA-0604,Done,OPA Close CL,,05/11/2015 12:00:00 AM,10/20/2015 12:00:00 AM,,,2015-05-11T00:00:00.000,2015-10-20T00:00:00.000,Done
2015OPA-1105,Done,OPA Close SA,10/03/2015 12:00:00 AM,10/06/2015 12:00:00 AM,09/28/2015 12:00:00 AM,,2015-10-03T00:00:00.000,2015-10-06T00:00:00.000,2015-09-28T00:00:00.000,Done
2019OPA-0081,Done,OPA Close SA,,03/01/2019 12:00:00 AM,03/01/2019 12:00:00 AM,,,2019-03-01T00:00:00.000,2019-03-01T00:00:00.000,Done
2016OPA-0500,Done,OPA Close CL,06/12/2016 12:00:00 AM,06/10/2016 12:00:00 AM,06/07/2016 12:00:00 AM,,2016-06-12T00:00:00.000,2016-06-10T00:00:00.000,2016-06-07T00:00:00.000,Done
2016OPA-1388,Done,OPA Close CL,12/12/2016 12:00:00 AM,12/16/2016 12:00:00 AM,12/07/2016 12:00:00 AM,,2016-12-12T00:00:00.000,2016-12-16T00:00:00.000,2016-12-07T00:00:00.000,Done
2017OPA-0229,Done,OPA Send Complaint Receipt,03/07/2017 12:00:00 AM,03/03/2017 12:00:00 AM,03/02/2017 12:00:00 AM,,2017-03-07T00:00:00.000,2017-03-03T00:00:00.000,2017-03-02T00:00:00.000,Done
2017OPA-1177,Done,OPA Close SA,,02/01/2018 12:00:00 AM,02/01/2018 12:00:00 AM,2017-294889,,2018-02-01T00:00:00.000,2018-02-01T00:00:00.000,Done
2018OPA-0703,Done,OPA Close CL,08/28/2018 12:00:00 AM,08/27/2018 12:00:00 AM,08/23/2018 12:00:00 AM,,2018-08-28T00:00:00.000,2018-08-27T00:00:00.000,2018-08-23T00:00:00.000,Done
2018OPA-0899,Done,OPA Close SA,,11/07/2018 12:00:00 AM,11/07/2018 12:00:00 AM,,,2018-11-07T00:00:00.000,2018-11-07T00:00:00.000,Done
2015OPA-0736,Done,OPA Close Case,12/09/2015 12:00:00 AM,12/14/2015 12:00:00 AM,11/25/2015 12:00:00 AM,,2015-12-09T00:00:00.000,2015-12-14T00:00:00.000,2015-11-25T00:00:00.000,Done
2015OPA-1173,Done,OPA Close CL,,08/27/2015 12:00:00 AM,10/15/2015 12:00:00 AM,,,2015-08-27T00:00:00.000,2015-10-15T00:00:00.000,Done
2015OPA-1690,Done,OPA Close SA,12/21/2015 12:00:00 AM,12/16/2015 12:00:00 AM,12/16/2015 12:00:00 AM,,2015-12-21T00:00:00.000,2015-12-16T00:00:00.000,2015-12-16T00:00:00.000,Done
2016OPA-0578,Done,OPA Close Case,11/26/2016 12:00:00 AM,11/26/2016 12:00:00 AM,11/16/2016 12:00:00 AM,2016-183568,2016-11-26T00:00:00.000,2016-11-26T00:00:00.000,2016-11-16T00:00:00.000,Done
2017OPA-0392,Done,OPA Close SA,,05/22/2017 12:00:00 AM,05/22/2017 12:00:00 AM,2017-121381,,2017-05-22T00:00:00.000,2017-05-22T00:00:00.000,Done
2018OPA-0607,Done,OPA Close SA,,09/13/2018 12:00:00 AM,09/13/2018 12:00:00 AM,2018-235741,,2018-09-13T00:00:00.000,2018-09-13T00:00:00.000,Done
2020OPA-0222,To do,OPA 180 Timeline Calculation,04/06/2020 12:00:00 AM,10/03/2020 12:00:00 AM,04/23/2020 12:00:00 AM,2020-116001,2020-04-06T00:00:00.000,2020-10-03T00:00:00.000,2020-04-23T00:00:00.000,To do
2017OPA-0410,Done,OPA Close Case,02/09/2018 12:00:00 AM,02/09/2018 12:00:00 AM,10/05/2017 12:00:00 AM,2017-123413,2018-02-09T00:00:00.000,2018-02-09T00:00:00.000,2017-10-05T00:00:00.000,Done
2017OPA-0969,Done,OPA Close Case,03/31/2018 12:00:00 AM,08/07/2018 12:00:00 AM,03/21/2018 12:00:00 AM,2017-346763,2018-03-31T00:00:00.000,2018-08-07T00:00:00.000,2018-03-21T00:00:00.000,Done
2017OPA-1127,Done,OPA Close Case,04/20/2018 12:00:00 AM,08/13/2018 12:00:00 AM,04/10/2018 12:00:00 AM,2017-391242,2018-04-20T00:00:00.000,2018-08-13T00:00:00.000,2018-04-10T00:00:00.000,Done
2018OPA-0346,Done,OPA Close Case,10/22/2018 12:00:00 AM,10/19/2018 12:00:00 AM,10/12/2018 12:00:00 AM,2018-131218,2018-10-22T00:00:00.000,2018-10-19T00:00:00.000,2018-10-12T00:00:00.000,Done
2019OPA-0105,Done,OPA Management Action,,10/10/2019 12:00:00 AM,10/11/2019 12:00:00 AM,2018-453288,,2019-10-10T00:00:00.000,2019-10-11T00:00:00.000,Done
2015OPA-0295,Done,OPA Close CL,,03/23/2015 12:00:00 AM,10/21/2015 12:00:00 AM,,,2015-03-23T00:00:00.000,2015-10-21T00:00:00.000,Done
2015OPA-0885,Done,OPA Close CL,,07/10/2015 12:00:00 AM,10/16/2015 12:00:00 AM,,,2015-07-10T00:00:00.000,2015-10-16T00:00:00.000,Done
2016OPA-0575,Done,OPA Close Case,12/11/2016 12:00:00 AM,12/03/2016 12:00:00 AM,12/02/2016 12:00:00 AM,2016-142377,2016-12-11T00:00:00.000,2016-12-03T00:00:00.000,2016-12-02T00:00:00.000,Done
2016OPA-1300,Done,OPA Send Complainant Closing Letter,11/30/2016 12:00:00 AM,12/06/2016 12:00:00 AM,11/01/2016 12:00:00 AM,,2016-11-30T00:00:00.000,2016-12-06T00:00:00.000,2016-11-01T00:00:00.000,Done
2017OPA-0562,Done,OPA Send Complainant Closing Letter,07/05/2017 12:00:00 AM,06/06/2017 12:00:00 AM,06/05/2017 12:00:00 AM,,2017-07-05T00:00:00.000,2017-06-06T00:00:00.000,2017-06-05T00:00:00.000,Done
2020OPA-0177,Done,OPA Director Certification/Finding,09/04/2020 12:00:00 AM,04/08/2020 12:00:00 AM,04/02/2020 12:00:00 AM,,2020-09-04T00:00:00.000,2020-04-08T00:00:00.000,2020-04-02T00:00:00.000,Done
OPA2014-0915,Done,OPA Director SA Review,04/22/2015 12:00:00 AM,04/21/2015 12:00:00 AM,04/17/2015 12:00:00 AM,2014-227918,2015-04-22T00:00:00.000,2015-04-21T00:00:00.000,2015-04-17T00:00:00.000,Done
2017OPA-0315,Done,OPA Close Case,,02/28/2019 12:00:00 AM,12/16/2018 12:00:00 AM,2017-111319,,2019-02-28T00:00:00.000,2018-12-16T00:00:00.000,Done
2017OPA-0465,Done,OPA Close Case,06/01/2018 12:00:00 AM,08/20/2018 12:00:00 AM,05/22/2018 12:00:00 AM,,2018-06-01T00:00:00.000,2018-08-20T00:00:00.000,2018-05-22T00:00:00.000,Done
2018OPA-0439,Done,OPA Close CL,06/03/2018 12:00:00 AM,06/04/2018 12:00:00 AM,05/29/2018 12:00:00 AM,,2018-06-03T00:00:00.000,2018-06-04T00:00:00.000,2018-05-29T00:00:00.000,Done
2019OPA-0419,Done,OPA Close CL,07/11/2019 12:00:00 AM,07/11/2019 12:00:00 AM,07/06/2019 12:00:00 AM,,2019-07-11T00:00:00.000,2019-07-11T00:00:00.000,2019-07-06T00:00:00.000,Done
2015OPA-0795,Done,OPA Close SA,10/03/2015 12:00:00 AM,10/06/2015 12:00:00 AM,09/28/2015 12:00:00 AM,,2015-10-03T00:00:00.000,2015-10-06T00:00:00.000,2015-09-28T00:00:00.000,Done
2016OPA-0460,Done,OPA Close SA,07/01/2016 12:00:00 AM,06/16/2016 12:00:00 AM,06/16/2016 12:00:00 AM,,2016-07-01T00:00:00.000,2016-06-16T00:00:00.000,2016-06-16T00:00:00.000,Done
2016OPA-0811,Done,OPA Missed 180 Day Deadline,01/11/2017 12:00:00 AM,01/17/2018 12:00:00 AM,02/26/2019 12:00:00 AM,2016-242276,2017-01-11T00:00:00.000,2018-01-17T00:00:00.000,2019-02-26T00:00:00.000,Done
2016OPA-1329,Done,OPA Close CL,12/03/2016 12:00:00 AM,12/06/2016 12:00:00 AM,12/06/2016 12:00:00 AM,2016-309079,2016-12-03T00:00:00.000,2016-12-06T00:00:00.000,2016-12-06T00:00:00.000,Done
2015OPA-0170,Done,OPA SA Review,07/18/2015 12:00:00 AM,07/21/2015 12:00:00 AM,07/08/2015 12:00:00 AM,2014-418136,2015-07-18T00:00:00.000,2015-07-21T00:00:00.000,2015-07-08T00:00:00.000,Done
2015OPA-1387,Done,OPA Close SA,12/05/2015 12:00:00 AM,12/01/2015 12:00:00 AM,11/30/2015 12:00:00 AM,2015-318269,2015-12-05T00:00:00.000,2015-12-01T00:00:00.000,2015-11-30T00:00:00.000,Done
2016OPA-0644,Done,OPA Close CL,07/13/2016 12:00:00 AM,07/13/2016 12:00:00 AM,07/08/2016 12:00:00 AM,,2016-07-13T00:00:00.000,2016-07-13T00:00:00.000,2016-07-08T00:00:00.000,Done
2016OPA-1219,Done,OPA Send Complainant Closing Letter,11/02/2016 12:00:00 AM,11/02/2016 12:00:00 AM,10/28/2016 12:00:00 AM,,2016-11-02T00:00:00.000,2016-11-02T00:00:00.000,2016-10-28T00:00:00.000,Done
2018OPA-0862,Done,OPA Close Case,02/03/2019 12:00:00 AM,03/05/2019 12:00:00 AM,03/05/2019 12:00:00 AM,2018-288031,2019-02-03T00:00:00.000,2019-03-05T00:00:00.000,2019-03-05T00:00:00.000,Done
2018OPA-1054,Done,OPA Close CL,12/02/2018 12:00:00 AM,11/27/2018 12:00:00 AM,11/27/2018 12:00:00 AM,,2018-12-02T00:00:00.000,2018-11-27T00:00:00.000,2018-11-27T00:00:00.000,Done
2019OPA-0295,Done,OPA Close CL,06/03/2019 12:00:00 AM,05/31/2019 12:00:00 AM,05/29/2019 12:00:00 AM,2019-157137,2019-06-03T00:00:00.000,2019-05-31T00:00:00.000,2019-05-29T00:00:00.000,Done
2015OPA-0136,Done,OPA Close Case,08/11/2015 12:00:00 AM,08/11/2015 12:00:00 AM,07/29/2015 12:00:00 AM,2014-267560,2015-08-11T00:00:00.000,2015-08-11T00:00:00.000,2015-07-29T00:00:00.000,Done
2019OPA-0622,Done,OPA Close SA,,09/27/2019 12:00:00 AM,09/27/2019 12:00:00 AM,2019-316429,,2019-09-27T00:00:00.000,2019-09-27T00:00:00.000,Done
2016OPA-1255,Done,OPA Close CL,11/18/2016 12:00:00 AM,10/21/2016 12:00:00 AM,10/14/2016 12:00:00 AM,,2016-11-18T00:00:00.000,2016-10-21T00:00:00.000,2016-10-14T00:00:00.000,Done
2017OPA-0251,Done,OPA Close Case,09/15/2017 12:00:00 AM,09/25/2017 12:00:00 AM,09/05/2017 12:00:00 AM,2017-082584,2017-09-15T00:00:00.000,2017-09-25T00:00:00.000,2017-09-05T00:00:00.000,Done
2017OPA-0979,Done,OPA Close SA,,12/04/2017 12:00:00 AM,12/04/2017 12:00:00 AM,,,2017-12-04T00:00:00.000,2017-12-04T00:00:00.000,Done
2015OPA-1089,Done,OPA Close CL,,08/09/2015 12:00:00 AM,10/15/2015 12:00:00 AM,,,2015-08-09T00:00:00.000,2015-10-15T00:00:00.000,Done
2017OPA-0272,Done,OPA Close Case,09/12/2017 12:00:00 AM,09/20/2017 12:00:00 AM,09/12/2017 12:00:00 AM,2017-090403,2017-09-12T00:00:00.000,2017-09-20T00:00:00.000,2017-09-12T00:00:00.000,Done
2018OPA-0979,Done,OPA Close CL,11/05/2018 12:00:00 AM,11/16/2018 12:00:00 AM,11/02/2018 12:00:00 AM,,2018-11-05T00:00:00.000,2018-11-16T00:00:00.000,2018-11-02T00:00:00.000,Done
2019OPA-0179,Done,OPA Close SA,,04/22/2019 12:00:00 AM,04/22/2019 12:00:00 AM,,,2019-04-22T00:00:00.000,2019-04-22T00:00:00.000,Done
2017OPA-0686,Done,OPA Close SA,,09/27/2017 12:00:00 AM,09/27/2017 12:00:00 AM,,,2017-09-27T00:00:00.000,2017-09-27T00:00:00.000,Done
2018OPA-0506,Done,OPA Close SA,,08/21/2018 12:00:00 AM,08/21/2018 12:00:00 AM,2018-131691,,2018-08-21T00:00:00.000,2018-08-21T00:00:00.000,Done
2018OPA-0876,Done,OPA Close Case,03/09/2019 12:00:00 AM,03/11/2019 12:00:00 AM,02/27/2019 12:00:00 AM,2018-325684,2019-03-09T00:00:00.000,2019-03-11T00:00:00.000,2019-02-27T00:00:00.000,Done
2018OPA-0898,Done,OPA Close SA,,11/13/2018 12:00:00 AM,11/13/2018 12:00:00 AM,2017-231695,,2018-11-13T00:00:00.000,2018-11-13T00:00:00.000,Done
2015OPA-0094,Done,OPA Director SA Review,02/22/2015 12:00:00 AM,03/11/2015 12:00:00 AM,02/17/2015 12:00:00 AM,2014-258454,2015-02-22T00:00:00.000,2015-03-11T00:00:00.000,2015-02-17T00:00:00.000,Done
2015OPA-1056,Done,OPA Close CL,,07/23/2015 12:00:00 AM,10/16/2015 12:00:00 AM,,,2015-07-23T00:00:00.000,2015-10-16T00:00:00.000,Done
2015OPA-1178,Done,OPA closing letter to complainant,,04/28/2016 12:00:00 AM,03/29/2016 12:00:00 AM,,,2016-04-28T00:00:00.000,2016-03-29T00:00:00.000,Done
2016OPA-0325,Done,OPA Close CL,04/26/2016 12:00:00 AM,05/02/2016 12:00:00 AM,04/21/2016 12:00:00 AM,,2016-04-26T00:00:00.000,2016-05-02T00:00:00.000,2016-04-21T00:00:00.000,Done
2016OPA-0436,Done,OPA Close CL,05/28/2016 12:00:00 AM,08/08/2016 12:00:00 AM,05/23/2016 12:00:00 AM,,2016-05-28T00:00:00.000,2016-08-08T00:00:00.000,2016-05-23T00:00:00.000,Done
2017OPA-0703,Done,OPA 180 Expiration,01/10/2018 12:00:00 AM,01/04/2019 12:00:00 AM,01/30/2019 12:00:00 AM,,2018-01-10T00:00:00.000,2019-01-04T00:00:00.000,2019-01-30T00:00:00.000,Done
2018OPA-0371,Done,OPA Close Case,10/29/2018 12:00:00 AM,10/24/2018 12:00:00 AM,10/24/2018 12:00:00 AM,2018-131691,2018-10-29T00:00:00.000,2018-10-24T00:00:00.000,2018-10-24T00:00:00.000,Done
2019OPA-0685,Done,OPA Close SA,,10/18/2019 12:00:00 AM,10/18/2019 12:00:00 AM,2019-322768,,2019-10-18T00:00:00.000,2019-10-18T00:00:00.000,Done
2015OPA-0086,Done,OPA Close Case,09/03/2015 12:00:00 AM,09/09/2015 12:00:00 AM,09/04/2015 12:00:00 AM,2015-020616,2015-09-03T00:00:00.000,2015-09-09T00:00:00.000,2015-09-04T00:00:00.000,Done
2015OPA-1187,Done,OPA Close SA,12/08/2015 12:00:00 AM,12/03/2015 12:00:00 AM,12/03/2015 12:00:00 AM,2015-267545,2015-12-08T00:00:00.000,2015-12-03T00:00:00.000,2015-12-03T00:00:00.000,Done
2017OPA-0636,Done,OPA Close Case,12/22/2017 12:00:00 AM,03/12/2018 12:00:00 AM,12/12/2017 12:00:00 AM,2017-228323,2017-12-22T00:00:00.000,2018-03-12T00:00:00.000,2017-12-12T00:00:00.000,Done
2017OPA-0690,Done,OPA Close Case,01/21/2018 12:00:00 AM,02/08/2018 12:00:00 AM,01/11/2018 12:00:00 AM,,2018-01-21T00:00:00.000,2018-02-08T00:00:00.000,2018-01-11T00:00:00.000,Done
2017OPA-0978,Done,OPA Close SA,,12/04/2017 12:00:00 AM,11/30/2017 12:00:00 AM,2017-349355,,2017-12-04T00:00:00.000,2017-11-30T00:00:00.000,Done
2020OPA-0092,Done,OPA Close CL,02/22/2020 12:00:00 AM,02/21/2020 12:00:00 AM,02/14/2020 12:00:00 AM,,2020-02-22T00:00:00.000,2020-02-21T00:00:00.000,2020-02-14T00:00:00.000,Done
2015OPA-1073,Done,OPA Close CL,,07/23/2015 12:00:00 AM,10/16/2015 12:00:00 AM,,,2015-07-23T00:00:00.000,2015-10-16T00:00:00.000,Done
2015OPA-1134,Done,OPA Close SA,10/03/2015 12:00:00 AM,10/06/2015 12:00:00 AM,09/28/2015 12:00:00 AM,,2015-10-03T00:00:00.000,2015-10-06T00:00:00.000,2015-09-28T00:00:00.000,Done
2016OPA-0242,Done,OPA Close CL,03/16/2016 12:00:00 AM,03/15/2016 12:00:00 AM,03/11/2016 12:00:00 AM,,2016-03-16T00:00:00.000,2016-03-15T00:00:00.000,2016-03-11T00:00:00.000,Done
2016OPA-0400,Done,OPA Training Referral,11/22/2016 12:00:00 AM,11/11/2016 12:00:00 AM,10/20/2016 12:00:00 AM,2016-023959,2016-11-22T00:00:00.000,2016-11-11T00:00:00.000,2016-10-20T00:00:00.000,Done
2016OPA-1371,Done,OPA Close Case,01/07/2019 12:00:00 AM,01/09/2019 12:00:00 AM,01/09/2019 12:00:00 AM,,2019-01-07T00:00:00.000,2019-01-09T00:00:00.000,2019-01-09T00:00:00.000,Done
2018OPA-0489,Done,OPA Close SA,08/02/2018 12:00:00 AM,07/23/2018 12:00:00 AM,07/23/2018 12:00:00 AM,2018-019828,2018-08-02T00:00:00.000,2018-07-23T00:00:00.000,2018-07-23T00:00:00.000,Done
2020OPA-0044,Done,OPA Director Certification/Finding,07/17/2020 12:00:00 AM,02/16/2020 12:00:00 AM,02/11/2020 12:00:00 AM,,2020-07-17T00:00:00.000,2020-02-16T00:00:00.000,2020-02-11T00:00:00.000,Done
2015OPA-1121,Done,OPA Close CL,,08/09/2015 12:00:00 AM,10/15/2015 12:00:00 AM,,,2015-08-09T00:00:00.000,2015-10-15T00:00:00.000,Done
2015OPA-1251,Done,OPA Close CL,,09/03/2015 12:00:00 AM,10/15/2015 12:00:00 AM,,,2015-09-03T00:00:00.000,2015-10-15T00:00:00.000,Done
2018OPA-0337,Done,OPA Investigation Review,08/15/2018 12:00:00 AM,10/09/2018 12:00:00 AM,05/12/2018 12:00:00 AM,,2018-08-15T00:00:00.000,2018-10-09T00:00:00.000,2018-05-12T00:00:00.000,Done
2018OPA-1196,Done,OPA Training Referral,06/24/2019 12:00:00 AM,08/05/2019 12:00:00 AM,06/14/2019 12:00:00 AM,,2019-06-24T00:00:00.000,2019-08-05T00:00:00.000,2019-06-14T00:00:00.000,Done
2019OPA-0242,Done,OPA Close CL,05/15/2019 12:00:00 AM,05/14/2019 12:00:00 AM,05/10/2019 12:00:00 AM,,2019-05-15T00:00:00.000,2019-05-14T00:00:00.000,2019-05-10T00:00:00.000,Done
2019OPA-0434,Done,OPA Close SA,,08/08/2019 12:00:00 AM,08/08/2019 12:00:00 AM,2019-142444,,2019-08-08T00:00:00.000,2019-08-08T00:00:00.000,Done
2019OPA-0506,Done,OPA Close Case,01/12/2020 12:00:00 AM,01/29/2020 12:00:00 AM,01/02/2020 12:00:00 AM,2019-248912,2020-01-12T00:00:00.000,2020-01-29T00:00:00.000,2020-01-02T00:00:00.000,Done
2015OPA-1400,Done,OPA Close CL,,10/01/2015 12:00:00 AM,10/13/2015 12:00:00 AM,,,2015-10-01T00:00:00.000,2015-10-13T00:00:00.000,Done
2016OPA-1399,Done,OPA Close Case,06/26/2017 12:00:00 AM,07/18/2017 12:00:00 AM,06/16/2017 12:00:00 AM,2016-422353,2017-06-26T00:00:00.000,2017-07-18T00:00:00.000,2017-06-16T00:00:00.000,Done
2017OPA-0546,Done,OPA Close SA,,07/17/2017 12:00:00 AM,07/17/2017 12:00:00 AM,,,2017-07-17T00:00:00.000,2017-07-17T00:00:00.000,Done
2017OPA-0721,Done,OPA Close SA,,10/06/2017 12:00:00 AM,10/06/2017 12:00:00 AM,,,2017-10-06T00:00:00.000,2017-10-06T00:00:00.000,Done
2015OPA-0153,Done,OPA Close CL,,02/18/2015 12:00:00 AM,10/22/2015 12:00:00 AM,2014-409135,,2015-02-18T00:00:00.000,2015-10-22T00:00:00.000,Done
2015OPA-1236,Done,OPA Close CL,,09/03/2015 12:00:00 AM,10/15/2015 12:00:00 AM,,,2015-09-03T00:00:00.000,2015-10-15T00:00:00.000,Done
2016OPA-1241,Done,OPA Close CL,11/13/2016 12:00:00 AM,11/10/2016 12:00:00 AM,11/03/2016 12:00:00 AM,,2016-11-13T00:00:00.000,2016-11-10T00:00:00.000,2016-11-03T00:00:00.000,Done
2016OPA-1448,Done,OPA Close CL,12/21/2016 12:00:00 AM,12/20/2016 12:00:00 AM,12/16/2016 12:00:00 AM,,2016-12-21T00:00:00.000,2016-12-20T00:00:00.000,2016-12-16T00:00:00.000,Done
2017OPA-0655,Done,OPA Send Complainant Closing Letter,08/02/2017 12:00:00 AM,07/31/2017 12:00:00 AM,07/03/2017 12:00:00 AM,2017-121499,2017-08-02T00:00:00.000,2017-07-31T00:00:00.000,2017-07-03T00:00:00.000,Done
2015OPA-0606,Done,OPA Close CL,,05/11/2015 12:00:00 AM,10/20/2015 12:00:00 AM,,,2015-05-11T00:00:00.000,2015-10-20T00:00:00.000,Done
2015OPA-1107,Done,OPA Close CL,,08/04/2015 12:00:00 AM,10/16/2015 12:00:00 AM,,,2015-08-04T00:00:00.000,2015-10-16T00:00:00.000,Done
2016OPA-0257,Done,OPA Close CL,03/18/2016 12:00:00 AM,03/18/2016 12:00:00 AM,03/18/2016 12:00:00 AM,,2016-03-18T00:00:00.000,2016-03-18T00:00:00.000,2016-03-18T00:00:00.000,Done
2016OPA-0812,Done,OPA Close CL,08/13/2016 12:00:00 AM,08/10/2016 12:00:00 AM,08/08/2016 12:00:00 AM,2016-168830,2016-08-13T00:00:00.000,2016-08-10T00:00:00.000,2016-08-08T00:00:00.000,Done
2016OPA-1239,Done,OPA Close CL,11/21/2016 12:00:00 AM,11/23/2016 12:00:00 AM,10/10/2016 12:00:00 AM,2016-363300,2016-11-21T00:00:00.000,2016-11-23T00:00:00.000,2016-10-10T00:00:00.000,Done
2017OPA-0121,Done,OPA Close Case,06/16/2017 12:00:00 AM,06/28/2017 12:00:00 AM,06/19/2017 12:00:00 AM,2017-013499,2017-06-16T00:00:00.000,2017-06-28T00:00:00.000,2017-06-19T00:00:00.000,Done
2018OPA-0650,Done,OPA Close CL,08/04/2018 12:00:00 AM,08/01/2018 12:00:00 AM,07/30/2018 12:00:00 AM,2018-207364,2018-08-04T00:00:00.000,2018-08-01T00:00:00.000,2018-07-30T00:00:00.000,Done
2020OPA-0126,Done,OPA Investigation Planning,03/26/2020 12:00:00 AM,03/19/2020 12:00:00 AM,03/19/2020 12:00:00 AM,2019-433609,2020-03-26T00:00:00.000,2020-03-19T00:00:00.000,2020-03-19T00:00:00.000,Done
2015OPA-1468,Done,OPA Close CL,,10/06/2015 12:00:00 AM,10/13/2015 12:00:00 AM,,,2015-10-06T00:00:00.000,2015-10-13T00:00:00.000,Done
2019OPA-0424,Done,OPA Close CL,07/17/2019 12:00:00 AM,07/18/2019 12:00:00 AM,07/12/2019 12:00:00 AM,,2019-07-17T00:00:00.000,2019-07-18T00:00:00.000,2019-07-12T00:00:00.000,Done
2019OPA-0797,Done,OPA Close CL,12/03/2019 12:00:00 AM,12/02/2019 12:00:00 AM,11/25/2019 12:00:00 AM,,2019-12-03T00:00:00.000,2019-12-02T00:00:00.000,2019-11-25T00:00:00.000,Done
2016OPA-0792,Done,OPA Director Certification/Finding,02/01/2018 12:00:00 AM,01/24/2018 12:00:00 AM,01/30/2019 12:00:00 AM,2016-213639,2018-02-01T00:00:00.000,2018-01-24T00:00:00.000,2019-01-30T00:00:00.000,Done
2016OPA-1169,Done,OPA Close SA,,11/28/2016 12:00:00 AM,11/28/2016 12:00:00 AM,,,2016-11-28T00:00:00.000,2016-11-28T00:00:00.000,Done
2017OPA-0646,Done,OPA Training Referral,02/04/2018 12:00:00 AM,02/13/2018 12:00:00 AM,01/25/2018 12:00:00 AM,2017-232467,2018-02-04T00:00:00.000,2018-02-13T00:00:00.000,2018-01-25T00:00:00.000,Done
2017OPA-1016,Done,OPA Close Case,09/27/2018 12:00:00 AM,09/25/2018 12:00:00 AM,09/17/2018 12:00:00 AM,2017-311363,2018-09-27T00:00:00.000,2018-09-25T00:00:00.000,2018-09-17T00:00:00.000,Done
2018OPA-0225,Done,OPA Close Case,09/20/2018 12:00:00 AM,10/16/2018 12:00:00 AM,09/07/2018 12:00:00 AM,2018-082707,2018-09-20T00:00:00.000,2018-10-16T00:00:00.000,2018-09-07T00:00:00.000,Done
2018OPA-0776,Done,OPA Close Case,02/07/2019 12:00:00 AM,02/14/2019 12:00:00 AM,01/28/2019 12:00:00 AM,2018-290705,2019-02-07T00:00:00.000,2019-02-14T00:00:00.000,2019-01-28T00:00:00.000,Done
2015OPA-1162,Done,OPA Close Case,02/12/2016 12:00:00 AM,03/03/2016 12:00:00 AM,01/12/2016 12:00:00 AM,2015-266726,2016-02-12T00:00:00.000,2016-03-03T00:00:00.000,2016-01-12T00:00:00.000,Done
2015OPA-1458,Done,OPA Close CL,,10/06/2015 12:00:00 AM,10/13/2015 12:00:00 AM,2015-331985,,2015-10-06T00:00:00.000,2015-10-13T00:00:00.000,Done
2016OPA-0784,Done,OPA Close CL,08/13/2016 12:00:00 AM,08/10/2016 12:00:00 AM,07/29/2016 12:00:00 AM,,2016-08-13T00:00:00.000,2016-08-10T00:00:00.000,2016-07-29T00:00:00.000,Done
2018OPA-0063,Done,OPA Training Referral,10/06/2018 12:00:00 AM,10/12/2018 12:00:00 AM,10/11/2018 12:00:00 AM,2018-011801,2018-10-06T00:00:00.000,2018-10-12T00:00:00.000,2018-10-11T00:00:00.000,Done
2019OPA-0584,Done,OPA Close CL,09/10/2019 12:00:00 AM,09/11/2019 12:00:00 AM,09/05/2019 12:00:00 AM,,2019-09-10T00:00:00.000,2019-09-11T00:00:00.000,2019-09-05T00:00:00.000,Done
2015OPA-0209,Done,OPA Close CL,,03/05/2015 12:00:00 AM,10/22/2015 12:00:00 AM,,,2015-03-05T00:00:00.000,2015-10-22T00:00:00.000,Done
2015OPA-0596,Done,OPA Close CL,,05/26/2015 12:00:00 AM,10/20/2015 12:00:00 AM,,,2015-05-26T00:00:00.000,2015-10-20T00:00:00.000,Done
2016OPA-0409,Done,OPA Close CL,04/25/2016 12:00:00 AM,04/25/2016 12:00:00 AM,04/20/2016 12:00:00 AM,,2016-04-25T00:00:00.000,2016-04-25T00:00:00.000,2016-04-20T00:00:00.000,Done
2016OPA-0840,Done,OPA Close SA,,09/08/2016 12:00:00 AM,09/08/2016 12:00:00 AM,,,2016-09-08T00:00:00.000,2016-09-08T00:00:00.000,Done
2016OPA-1185,Done,OPA Close SA,,11/22/2016 12:00:00 AM,11/22/2016 12:00:00 AM,2016-337136,,2016-11-22T00:00:00.000,2016-11-22T00:00:00.000,Done
2018OPA-1017,Done,OPA Close Case,04/25/2019 12:00:00 AM,04/24/2019 12:00:00 AM,04/15/2019 12:00:00 AM,2018-394152,2019-04-25T00:00:00.000,2019-04-24T00:00:00.000,2019-04-15T00:00:00.000,Done
2015OPA-0073,Done,OPA Close CL,,01/26/2015 12:00:00 AM,10/23/2015 12:00:00 AM,,,2015-01-26T00:00:00.000,2015-10-23T00:00:00.000,Done
2015OPA-0432,Done,OPA Close Case,,09/11/2015 12:00:00 AM,08/31/2015 12:00:00 AM,,,2015-09-11T00:00:00.000,2015-08-31T00:00:00.000,Done
2015OPA-0929,Done,OPA Close CL,,06/30/2015 12:00:00 AM,10/19/2015 12:00:00 AM,,,2015-06-30T00:00:00.000,2015-10-19T00:00:00.000,Done
2020OPA-0178,Done,OPA Close SA,,04/29/2020 12:00:00 AM,04/29/2020 12:00:00 AM,,,2020-04-29T00:00:00.000,2020-04-29T00:00:00.000,Done
2020OPA-0196,Done,OPA Process SA,,04/17/2020 12:00:00 AM,04/17/2020 12:00:00 AM,2020-091774,,2020-04-17T00:00:00.000,2020-04-17T00:00:00.000,Done
2020OPA-0263,Done,OPA 5 Day Notice,05/04/2020 12:00:00 AM,05/05/2020 12:00:00 AM,05/05/2020 12:00:00 AM,2019-447113,2020-05-04T00:00:00.000,2020-05-05T00:00:00.000,2020-05-05T00:00:00.000,Done
2018OPA-0157,Done,OPA Training Referral,,08/14/2018 12:00:00 AM,03/07/2019 12:00:00 AM,2018-047855,,2018-08-14T00:00:00.000,2019-03-07T00:00:00.000,Done
2018OPA-0578,Done,OPA Close CL,07/31/2018 12:00:00 AM,08/01/2018 12:00:00 AM,07/26/2018 12:00:00 AM,2018-231994,2018-07-31T00:00:00.000,2018-08-01T00:00:00.000,2018-07-26T00:00:00.000,Done
2018OPA-0942,Done,OPA Close SA,,12/13/2018 12:00:00 AM,12/13/2018 12:00:00 AM,2018-355772,,2018-12-13T00:00:00.000,2018-12-13T00:00:00.000,Done
2018OPA-1096,Done,OPA Close Case,04/01/2019 12:00:00 AM,04/09/2019 12:00:00 AM,03/21/2019 12:00:00 AM,2018-379151,2019-04-01T00:00:00.000,2019-04-09T00:00:00.000,2019-03-21T00:00:00.000,Done
2018OPA-1109,Done,OPA Close SA,,02/28/2019 12:00:00 AM,02/28/2019 12:00:00 AM,2018-441698,,2019-02-28T00:00:00.000,2019-02-28T00:00:00.000,Done
2015OPA-1416,Done,OPA Close CL,,10/06/2015 12:00:00 AM,10/13/2015 12:00:00 AM,,,2015-10-06T00:00:00.000,2015-10-13T00:00:00.000,Done
2016OPA-0527,Done,OPA Close CL,06/14/2016 12:00:00 AM,06/13/2016 12:00:00 AM,06/09/2016 12:00:00 AM,,2016-06-14T00:00:00.000,2016-06-13T00:00:00.000,2016-06-09T00:00:00.000,Done
2016OPA-0979,Done,OPA Close CL,09/13/2016 12:00:00 AM,09/12/2016 12:00:00 AM,09/08/2016 12:00:00 AM,,2016-09-13T00:00:00.000,2016-09-12T00:00:00.000,2016-09-08T00:00:00.000,Done
2017OPA-0527,Done,OPA Close CL,06/25/2017 12:00:00 AM,06/16/2017 12:00:00 AM,06/07/2017 12:00:00 AM,,2017-06-25T00:00:00.000,2017-06-16T00:00:00.000,2017-06-07T00:00:00.000,Done
2017OPA-0882,Done,OPA Close CL,09/28/2017 12:00:00 AM,09/21/2017 12:00:00 AM,08/29/2017 12:00:00 AM,2017-319569,2017-09-28T00:00:00.000,2017-09-21T00:00:00.000,2017-08-29T00:00:00.000,Done
2017OPA-1110,Done,OPA Case Assignment,11/22/2017 12:00:00 AM,11/20/2017 12:00:00 AM,11/17/2017 12:00:00 AM,2017-384631,2017-11-22T00:00:00.000,2017-11-20T00:00:00.000,2017-11-17T00:00:00.000,Done
2015OPA-0275,Done,OPA Close CL,,03/20/2015 12:00:00 AM,10/22/2015 12:00:00 AM,2014-046504,,2015-03-20T00:00:00.000,2015-10-22T00:00:00.000,Done
2015OPA-1372,Done,OPA Close CL,02/09/2016 12:00:00 AM,02/05/2016 12:00:00 AM,02/04/2016 12:00:00 AM,,2016-02-09T00:00:00.000,2016-02-05T00:00:00.000,2016-02-04T00:00:00.000,Done
2015OPA-1539,Done,OPA Close CL,,10/27/2015 12:00:00 AM,10/27/2015 12:00:00 AM,,,2015-10-27T00:00:00.000,2015-10-27T00:00:00.000,Done
2016OPA-0791,Done,OPA Missed 180 Day Deadline,01/08/2017 12:00:00 AM,01/02/2018 12:00:00 AM,02/26/2019 12:00:00 AM,2016-233867,2017-01-08T00:00:00.000,2018-01-02T00:00:00.000,2019-02-26T00:00:00.000,Done
2017OPA-1324,Done,OPA Close Case,11/25/2018 12:00:00 AM,01/04/2019 12:00:00 AM,11/15/2018 12:00:00 AM,2017-286764,2018-11-25T00:00:00.000,2019-01-04T00:00:00.000,2018-11-15T00:00:00.000,Done
2018OPA-0837,Done,OPA Close Case,04/04/2019 12:00:00 AM,04/11/2019 12:00:00 AM,03/21/2019 12:00:00 AM,,2019-04-04T00:00:00.000,2019-04-11T00:00:00.000,2019-03-21T00:00:00.000,Done
2018OPA-0861,Done,OPA Close CL,09/24/2018 12:00:00 AM,09/24/2018 12:00:00 AM,09/19/2018 12:00:00 AM,,2018-09-24T00:00:00.000,2018-09-24T00:00:00.000,2018-09-19T00:00:00.000,Done
2018OPA-0873,Done,OPA Close Case,03/03/2019 12:00:00 AM,03/07/2019 12:00:00 AM,02/21/2019 12:00:00 AM,2018-326847,2019-03-03T00:00:00.000,2019-03-07T00:00:00.000,2019-02-21T00:00:00.000,Done
2015OPA-0143,Done,OPA SA Review,04/01/2015 12:00:00 AM,04/03/2015 12:00:00 AM,03/27/2015 12:00:00 AM,2015-028699,2015-04-01T00:00:00.000,2015-04-03T00:00:00.000,2015-03-27T00:00:00.000,Done
2015OPA-0513,Done,OPA Director SA Review,06/06/2015 12:00:00 AM,06/17/2015 12:00:00 AM,06/01/2015 12:00:00 AM,,2015-06-06T00:00:00.000,2015-06-17T00:00:00.000,2015-06-01T00:00:00.000,Done
2018OPA-0024,Done,OPA Close Case,09/20/2018 12:00:00 AM,09/12/2018 12:00:00 AM,06/21/2018 12:00:00 AM,2017-473207,2018-09-20T00:00:00.000,2018-09-12T00:00:00.000,2018-06-21T00:00:00.000,Done
2015OPA-0128,Done,OPA Close Case,08/10/2015 12:00:00 AM,08/10/2015 12:00:00 AM,07/29/2015 12:00:00 AM,2003-261952,2015-08-10T00:00:00.000,2015-08-10T00:00:00.000,2015-07-29T00:00:00.000,Done
2015OPA-1391,Done,OPA Close SA,11/14/2015 12:00:00 AM,11/10/2015 12:00:00 AM,11/09/2015 12:00:00 AM,2015-231550,2015-11-14T00:00:00.000,2015-11-10T00:00:00.000,2015-11-09T00:00:00.000,Done
2016OPA-0040,Done,OPA Close CL,01/20/2016 12:00:00 AM,01/20/2016 12:00:00 AM,01/15/2016 12:00:00 AM,,2016-01-20T00:00:00.000,2016-01-20T00:00:00.000,2016-01-15T00:00:00.000,Done
2018OPA-1126,Done,OPA Close Case,05/26/2019 12:00:00 AM,05/21/2019 12:00:00 AM,05/16/2019 12:00:00 AM,2018-437740,2019-05-26T00:00:00.000,2019-05-21T00:00:00.000,2019-05-16T00:00:00.000,Done
2020OPA-0093,Done,OPA OIG Certification,02/28/2020 12:00:00 AM,02/25/2020 12:00:00 AM,02/25/2020 12:00:00 AM,2020-038646,2020-02-28T00:00:00.000,2020-02-25T00:00:00.000,2020-02-25T00:00:00.000,Done
2015OPA-1266,Done,OPA Close SA,10/26/2015 12:00:00 AM,10/22/2015 12:00:00 AM,10/21/2015 12:00:00 AM,2014-361575,2015-10-26T00:00:00.000,2015-10-22T00:00:00.000,2015-10-21T00:00:00.000,Done
2015OPA-1535,Done,OPA Close Case,04/13/2016 12:00:00 AM,04/18/2016 12:00:00 AM,03/24/2016 12:00:00 AM,,2016-04-13T00:00:00.000,2016-04-18T00:00:00.000,2016-03-24T00:00:00.000,Done
2015OPA-1708,Done,OPA Close SA,07/27/2016 12:00:00 AM,07/22/2016 12:00:00 AM,07/22/2016 12:00:00 AM,,2016-07-27T00:00:00.000,2016-07-22T00:00:00.000,2016-07-22T00:00:00.000,Done
2019OPA-0258,Done,OPA Close Case,09/22/2019 12:00:00 AM,09/24/2019 12:00:00 AM,09/12/2019 12:00:00 AM,2019-104351,2019-09-22T00:00:00.000,2019-09-24T00:00:00.000,2019-09-12T00:00:00.000,Done
2015OPA-1138,Done,OPA Close Case,04/08/2016 12:00:00 AM,04/12/2016 12:00:00 AM,03/24/2016 12:00:00 AM,,2016-04-08T00:00:00.000,2016-04-12T00:00:00.000,2016-03-24T00:00:00.000,Done
2016OPA-0027,Done,OPA Close Case,07/18/2018 12:00:00 AM,07/18/2016 12:00:00 AM,07/07/2016 12:00:00 AM,2015-150411,2018-07-18T00:00:00.000,2016-07-18T00:00:00.000,2016-07-07T00:00:00.000,Done
2020OPA-0133,Done,OPA Close CL,03/06/2020 12:00:00 AM,03/03/2020 12:00:00 AM,02/28/2020 12:00:00 AM,2020-050319,2020-03-06T00:00:00.000,2020-03-03T00:00:00.000,2020-02-28T00:00:00.000,Done
2016OPA-0107,Done,OPA Close Case,06/17/2016 12:00:00 AM,06/30/2016 12:00:00 AM,06/06/2016 12:00:00 AM,2015-446901,2016-06-17T00:00:00.000,2016-06-30T00:00:00.000,2016-06-06T00:00:00.000,Done
2016OPA-0382,Done,OPA Close CL,05/04/2016 12:00:00 AM,05/02/2016 12:00:00 AM,04/29/2016 12:00:00 AM,,2016-05-04T00:00:00.000,2016-05-02T00:00:00.000,2016-04-29T00:00:00.000,Done
2017OPA-0698,Done,OPA Close Case,01/24/2018 12:00:00 AM,05/18/2018 12:00:00 AM,12/29/2017 12:00:00 AM,,2018-01-24T00:00:00.000,2018-05-18T00:00:00.000,2017-12-29T00:00:00.000,Done
2017OPA-1130,Done,OPA Close CL,11/27/2017 12:00:00 AM,11/22/2017 12:00:00 AM,11/22/2017 12:00:00 AM,2017-390487,2017-11-27T00:00:00.000,2017-11-22T00:00:00.000,2017-11-22T00:00:00.000,Done
2018OPA-0787,Done,OPA Close CL,10/20/2018 12:00:00 AM,10/19/2018 12:00:00 AM,10/15/2018 12:00:00 AM,,2018-10-20T00:00:00.000,2018-10-19T00:00:00.000,2018-10-15T00:00:00.000,Done
2020OPA-0179,Done,OPA Case Assignment,04/12/2020 12:00:00 AM,04/12/2020 12:00:00 AM,04/07/2020 12:00:00 AM,2020-94982,2020-04-12T00:00:00.000,2020-04-12T00:00:00.000,2020-04-07T00:00:00.000,Done
2015OPA-0705,Done,OPA Close CL,,09/25/2015 12:00:00 AM,10/14/2015 12:00:00 AM,,,2015-09-25T00:00:00.000,2015-10-14T00:00:00.000,Done
2015OPA-0800,Done,OPA Close CL,,08/09/2015 12:00:00 AM,10/15/2015 12:00:00 AM,,,2015-08-09T00:00:00.000,2015-10-15T00:00:00.000,Done
2015OPA-1247,Done,OPA Close SA,09/27/2015 12:00:00 AM,09/22/2015 12:00:00 AM,09/22/2015 12:00:00 AM,,2015-09-27T00:00:00.000,2015-09-22T00:00:00.000,2015-09-22T00:00:00.000,Done
2015OPA-1900,Done,OPA Close Case,07/05/2016 12:00:00 AM,07/05/2016 12:00:00 AM,06/18/2016 12:00:00 AM,2015-196227,2016-07-05T00:00:00.000,2016-07-05T00:00:00.000,2016-06-18T00:00:00.000,Done
2016OPA-0328,Done,OPA Close Case,09/30/2016 12:00:00 AM,09/30/2016 12:00:00 AM,09/14/2016 12:00:00 AM,2016-040562,2016-09-30T00:00:00.000,2016-09-30T00:00:00.000,2016-09-14T00:00:00.000,Done
2016OPA-0413,Done,OPA Close CL,04/25/2016 12:00:00 AM,04/25/2016 12:00:00 AM,04/20/2016 12:00:00 AM,,2016-04-25T00:00:00.000,2016-04-25T00:00:00.000,2016-04-20T00:00:00.000,Done
2017OPA-0757,Done,OPA Close SA,09/26/2017 12:00:00 AM,09/27/2017 12:00:00 AM,08/31/2017 12:00:00 AM,,2017-09-26T00:00:00.000,2017-09-27T00:00:00.000,2017-08-31T00:00:00.000,Done
2019OPA-0123,Done,OPA Close Case,08/18/2019 12:00:00 AM,08/27/2019 12:00:00 AM,08/08/2019 12:00:00 AM,2019-045458,2019-08-18T00:00:00.000,2019-08-27T00:00:00.000,2019-08-08T00:00:00.000,Done
2015OPA-0079,Done,OPA Close CL,,01/26/2015 12:00:00 AM,10/23/2015 12:00:00 AM,,,2015-01-26T00:00:00.000,2015-10-23T00:00:00.000,Done
2015OPA-0858,Done,OPA Training Referral,12/24/2015 12:00:00 AM,12/15/2015 12:00:00 AM,11/25/2015 12:00:00 AM,,2015-12-24T00:00:00.000,2015-12-15T00:00:00.000,2015-11-25T00:00:00.000,Done
2015OPA-1071,Done,OPA Close SA,10/20/2015 12:00:00 AM,10/16/2015 12:00:00 AM,10/15/2015 12:00:00 AM,,2015-10-20T00:00:00.000,2015-10-16T00:00:00.000,2015-10-15T00:00:00.000,Done
2016OPA-0599,Done,OPA Close CL,07/02/2016 12:00:00 AM,06/30/2016 12:00:00 AM,06/27/2016 12:00:00 AM,,2016-07-02T00:00:00.000,2016-06-30T00:00:00.000,2016-06-27T00:00:00.000,Done
2017OPA-0036,Done,OPA Close CL,01/23/2017 12:00:00 AM,01/25/2017 12:00:00 AM,01/18/2017 12:00:00 AM,,2017-01-23T00:00:00.000,2017-01-25T00:00:00.000,2017-01-18T00:00:00.000,Done
2018OPA-0016,Done,OPA Close Case,09/20/2018 12:00:00 AM,09/12/2018 12:00:00 AM,06/21/2018 12:00:00 AM,2017-465569,2018-09-20T00:00:00.000,2018-09-12T00:00:00.000,2018-06-21T00:00:00.000,Done
2018OPA-0556,Done,OPA Close Case,12/09/2018 12:00:00 AM,01/10/2019 12:00:00 AM,11/29/2018 12:00:00 AM,2017-013063,2018-12-09T00:00:00.000,2019-01-10T00:00:00.000,2018-11-29T00:00:00.000,Done
2019OPA-0200,Done,OPA Close Case,09/22/2019 12:00:00 AM,09/24/2019 12:00:00 AM,09/12/2019 12:00:00 AM,,2019-09-22T00:00:00.000,2019-09-24T00:00:00.000,2019-09-12T00:00:00.000,Done
2015OPA-0835,Done,OPA Close CL,,07/10/2015 12:00:00 AM,10/16/2015 12:00:00 AM,,,2015-07-10T00:00:00.000,2015-10-16T00:00:00.000,Done
2016OPA-0181,Done,OPA Close CL,03/07/2016 12:00:00 AM,03/07/2016 12:00:00 AM,03/07/2016 12:00:00 AM,,2016-03-07T00:00:00.000,2016-03-07T00:00:00.000,2016-03-07T00:00:00.000,Done
2016OPA-0340,Done,OPA Close CL,04/18/2016 12:00:00 AM,04/15/2016 12:00:00 AM,04/13/2016 12:00:00 AM,,2016-04-18T00:00:00.000,2016-04-15T00:00:00.000,2016-04-13T00:00:00.000,Done
2018OPA-0306,Done,OPA Close SA,,07/09/2018 12:00:00 AM,07/09/2018 12:00:00 AM,2018-123964,,2018-07-09T00:00:00.000,2018-07-09T00:00:00.000,Done
2019OPA-0232,Done,OPA Close Case,10/05/2019 12:00:00 AM,09/25/2019 12:00:00 AM,09/25/2019 12:00:00 AM,2019-056991,2019-10-05T00:00:00.000,2019-09-25T00:00:00.000,2019-09-25T00:00:00.000,Done
2019OPA-0546,Done,OPA Close SA,,08/26/2019 12:00:00 AM,08/26/2019 12:00:00 AM,2019-283755,,2019-08-26T00:00:00.000,2019-08-26T00:00:00.000,Done
2016OPA-0415,Done,OPA Close CL,05/07/2016 12:00:00 AM,05/04/2016 12:00:00 AM,05/02/2016 12:00:00 AM,2015-290678,2016-05-07T00:00:00.000,2016-05-04T00:00:00.000,2016-05-02T00:00:00.000,Done
2016OPA-1232,Done,OPA Close CL,11/09/2016 12:00:00 AM,11/10/2016 12:00:00 AM,11/04/2016 12:00:00 AM,,2016-11-09T00:00:00.000,2016-11-10T00:00:00.000,2016-11-04T00:00:00.000,Done
2016OPA-1287,Done,OPA Close CL,11/21/2016 12:00:00 AM,11/23/2016 12:00:00 AM,11/16/2016 12:00:00 AM,2016-204329,2016-11-21T00:00:00.000,2016-11-23T00:00:00.000,2016-11-16T00:00:00.000,Done
2017OPA-0865,Done,OPA Close Case,02/23/2018 12:00:00 AM,06/11/2018 12:00:00 AM,02/16/2018 12:00:00 AM,2017-312558,2018-02-23T00:00:00.000,2018-06-11T00:00:00.000,2018-02-16T00:00:00.000,Done
2018OPA-0197,Done,OPA Classification,03/31/2018 12:00:00 AM,03/09/2018 12:00:00 AM,03/01/2018 12:00:00 AM,2018-069218,2018-03-31T00:00:00.000,2018-03-09T00:00:00.000,2018-03-01T00:00:00.000,Done
2015OPA-0333,Done,OPA Close CL,,03/23/2015 12:00:00 AM,10/21/2015 12:00:00 AM,,,2015-03-23T00:00:00.000,2015-10-21T00:00:00.000,Done
2016OPA-0156,Done,OPA Close CL,03/04/2016 12:00:00 AM,03/04/2016 12:00:00 AM,03/04/2016 12:00:00 AM,,2016-03-04T00:00:00.000,2016-03-04T00:00:00.000,2016-03-04T00:00:00.000,Done
2016OPA-1153,Done,OPA Close CL,10/21/2016 12:00:00 AM,10/17/2016 12:00:00 AM,10/16/2016 12:00:00 AM,,2016-10-21T00:00:00.000,2016-10-17T00:00:00.000,2016-10-16T00:00:00.000,Done
2016OPA-1236,Done,OPA Close CL,11/14/2016 12:00:00 AM,10/17/2016 12:00:00 AM,10/10/2016 12:00:00 AM,,2016-11-14T00:00:00.000,2016-10-17T00:00:00.000,2016-10-10T00:00:00.000,Done
2016OPA-1278,Done,OPA Close CL,11/21/2016 12:00:00 AM,11/22/2016 12:00:00 AM,11/10/2016 12:00:00 AM,,2016-11-21T00:00:00.000,2016-11-22T00:00:00.000,2016-11-10T00:00:00.000,Done
2017OPA-0983,Done,OPA Close Case,04/01/2018 12:00:00 AM,07/30/2018 12:00:00 AM,03/22/2018 12:00:00 AM,2017-352183,2018-04-01T00:00:00.000,2018-07-30T00:00:00.000,2018-03-22T00:00:00.000,Done
2016OPA-0766,Done,OPA Close Case,03/05/2017 12:00:00 AM,03/17/2017 12:00:00 AM,02/23/2017 12:00:00 AM,,2017-03-05T00:00:00.000,2017-03-17T00:00:00.000,2017-02-23T00:00:00.000,Done
2017OPA-0114,Done,OPA Close CL,03/12/2017 12:00:00 AM,03/09/2017 12:00:00 AM,03/02/2017 12:00:00 AM,,2017-03-12T00:00:00.000,2017-03-09T00:00:00.000,2017-03-02T00:00:00.000,Done
2018OPA-1202,Done,OPA Close CL,01/23/2019 12:00:00 AM,01/29/2019 12:00:00 AM,01/18/2019 12:00:00 AM,2018-482689,2019-01-23T00:00:00.000,2019-01-29T00:00:00.000,2019-01-18T00:00:00.000,Done
2016OPA-1352,Done,OPA Close CL,12/19/2016 12:00:00 AM,12/21/2016 12:00:00 AM,12/13/2016 12:00:00 AM,2016-314434,2016-12-19T00:00:00.000,2016-12-21T00:00:00.000,2016-12-13T00:00:00.000,Done
2016OPA-1517,Done,OPA Close Case,05/29/2017 12:00:00 AM,06/06/2017 12:00:00 AM,05/19/2017 12:00:00 AM,2016-240149,2017-05-29T00:00:00.000,2017-06-06T00:00:00.000,2017-05-19T00:00:00.000,Done
2017OPA-0224,Done,OPA Close SA,,05/10/2017 12:00:00 AM,05/10/2017 12:00:00 AM,,,2017-05-10T00:00:00.000,2017-05-10T00:00:00.000,Done
2019OPA-0567,Done,OPA Close CL,09/07/2019 12:00:00 AM,09/09/2019 12:00:00 AM,08/30/2019 12:00:00 AM,,2019-09-07T00:00:00.000,2019-09-09T00:00:00.000,2019-08-30T00:00:00.000,Done
2019OPA-0765,Done,OPA Close Case,02/13/2020 12:00:00 AM,03/30/2020 12:00:00 AM,03/30/2020 12:00:00 AM,2019-388468,2020-02-13T00:00:00.000,2020-03-30T00:00:00.000,2020-03-30T00:00:00.000,Done
2016OPA-1093,Done,OPA Close SA,,10/25/2016 12:00:00 AM,10/25/2016 12:00:00 AM,2016-317708,,2016-10-25T00:00:00.000,2016-10-25T00:00:00.000,Done
2016OPA-1256,Done,OPA Close CL,11/15/2016 12:00:00 AM,11/15/2016 12:00:00 AM,11/10/2016 12:00:00 AM,2016-375108,2016-11-15T00:00:00.000,2016-11-15T00:00:00.000,2016-11-10T00:00:00.000,Done
2017OPA-0254,Done,OPA Close CL,04/09/2017 12:00:00 AM,03/23/2017 12:00:00 AM,03/10/2017 12:00:00 AM,,2017-04-09T00:00:00.000,2017-03-23T00:00:00.000,2017-03-10T00:00:00.000,Done
2017OPA-0522,Done,OPA Close SA,,07/19/2017 12:00:00 AM,07/19/2017 12:00:00 AM,,,2017-07-19T00:00:00.000,2017-07-19T00:00:00.000,Done
2020OPA-0119,Done,OPA Close SA,,03/31/2020 12:00:00 AM,03/31/2020 12:00:00 AM,2020-62915,,2020-03-31T00:00:00.000,2020-03-31T00:00:00.000,Done
2016OPA-1059,Done,OPA Close CL,09/21/2016 12:00:00 AM,09/20/2016 12:00:00 AM,09/16/2016 12:00:00 AM,,2016-09-21T00:00:00.000,2016-09-20T00:00:00.000,2016-09-16T00:00:00.000,Done
2016OPA-1121,Done,OPA Close SA,,10/31/2016 12:00:00 AM,10/31/2016 12:00:00 AM,2016-327388,,2016-10-31T00:00:00.000,2016-10-31T00:00:00.000,Done
2017OPA-0570,Done,OPA Close SA,,08/04/2017 12:00:00 AM,08/04/2017 12:00:00 AM,,,2017-08-04T00:00:00.000,2017-08-04T00:00:00.000,Done
2018OPA-0353,Done,OPA Director Certification/Finding,10/16/2018 12:00:00 AM,10/15/2018 12:00:00 AM,12/05/2018 12:00:00 AM,2018-137678,2018-10-16T00:00:00.000,2018-10-15T00:00:00.000,2018-12-05T00:00:00.000,Done
2018OPA-0409,Done,OPA Close Case,11/17/2018 12:00:00 AM,12/03/2018 12:00:00 AM,11/07/2018 12:00:00 AM,2018-162241,2018-11-17T00:00:00.000,2018-12-03T00:00:00.000,2018-11-07T00:00:00.000,Done
2020OPA-0038,Done,OPA Close Case,02/19/2020 12:00:00 AM,02/24/2020 12:00:00 AM,02/24/2020 12:00:00 AM,,2020-02-19T00:00:00.000,2020-02-24T00:00:00.000,2020-02-24T00:00:00.000,Done
2015OPA-0027,Done,OPA Director SA Review,03/07/2015 12:00:00 AM,03/11/2015 12:00:00 AM,03/02/2015 12:00:00 AM,2014-354808,2015-03-07T00:00:00.000,2015-03-11T00:00:00.000,2015-03-02T00:00:00.000,Done
2015OPA-0535,Done,OPA Close Case,,09/15/2015 12:00:00 AM,07/31/2015 12:00:00 AM,2015-066932,,2015-09-15T00:00:00.000,2015-07-31T00:00:00.000,Done
2016OPA-0660,Done,OPA Close SA,,08/08/2016 12:00:00 AM,08/08/2016 12:00:00 AM,2016-212269,,2016-08-08T00:00:00.000,2016-08-08T00:00:00.000,Done
2016OPA-0858,Done,OPA Close CL,08/24/2016 12:00:00 AM,08/24/2016 12:00:00 AM,08/19/2016 12:00:00 AM,,2016-08-24T00:00:00.000,2016-08-24T00:00:00.000,2016-08-19T00:00:00.000,Done
2016OPA-1334,Done,OPA Close Case,04/28/2017 12:00:00 AM,05/04/2017 12:00:00 AM,04/18/2017 12:00:00 AM,2016-376723,2017-04-28T00:00:00.000,2017-05-04T00:00:00.000,2017-04-18T00:00:00.000,Done
2017OPA-0896,Done,OPA Close SA,,10/25/2017 12:00:00 AM,10/25/2017 12:00:00 AM,,,2017-10-25T00:00:00.000,2017-10-25T00:00:00.000,Done
2018OPA-0968,Done,OPA Close CL,10/23/2018 12:00:00 AM,10/18/2018 12:00:00 AM,10/18/2018 12:00:00 AM,2018-360701,2018-10-23T00:00:00.000,2018-10-18T00:00:00.000,2018-10-18T00:00:00.000,Done
2015OPA-0442,Done,OPA Close Case,,09/11/2015 12:00:00 AM,08/31/2015 12:00:00 AM,,,2015-09-11T00:00:00.000,2015-08-31T00:00:00.000,Done
2018OPA-0533,Done,OPA Close Case,,02/17/2020 12:00:00 AM,01/18/2019 12:00:00 AM,,,2020-02-17T00:00:00.000,2019-01-18T00:00:00.000,Done
2018OPA-0560,Done,OPA Close Case,12/09/2018 12:00:00 AM,01/30/2019 12:00:00 AM,11/29/2018 12:00:00 AM,2018-203881,2018-12-09T00:00:00.000,2019-01-30T00:00:00.000,2018-11-29T00:00:00.000,Done
2019OPA-0140,Done,OPA Close CL,03/19/2019 12:00:00 AM,03/18/2019 12:00:00 AM,03/14/2019 12:00:00 AM,,2019-03-19T00:00:00.000,2019-03-18T00:00:00.000,2019-03-14T00:00:00.000,Done
2019OPA-0625,Done,OPA Close CL,09/26/2019 12:00:00 AM,09/26/2019 12:00:00 AM,09/19/2019 12:00:00 AM,,2019-09-26T00:00:00.000,2019-09-26T00:00:00.000,2019-09-19T00:00:00.000,Done
2015OPA-0897,Done,OPA Close CL,,06/26/2015 12:00:00 AM,10/19/2015 12:00:00 AM,,,2015-06-26T00:00:00.000,2015-10-19T00:00:00.000,Done
2016OPA-0223,Done,OPA Close SA,04/07/2016 12:00:00 AM,05/06/2016 12:00:00 AM,03/23/2016 12:00:00 AM,,2016-04-07T00:00:00.000,2016-05-06T00:00:00.000,2016-03-23T00:00:00.000,Done
2016OPA-1401,Done,OPA Close CL,12/12/2016 12:00:00 AM,12/16/2016 12:00:00 AM,12/07/2016 12:00:00 AM,,2016-12-12T00:00:00.000,2016-12-16T00:00:00.000,2016-12-07T00:00:00.000,Done
2017OPA-0975,Done,OPA Close CL,10/19/2017 12:00:00 AM,10/18/2017 12:00:00 AM,09/19/2017 12:00:00 AM,,2017-10-19T00:00:00.000,2017-10-18T00:00:00.000,2017-09-19T00:00:00.000,Done
2015OPA-1456,Done,OPA Close CL,,10/20/2015 12:00:00 AM,10/20/2015 12:00:00 AM,2015-265402,,2015-10-20T00:00:00.000,2015-10-20T00:00:00.000,Done
2016OPA-0570,Done,OPA Close Case,02/09/2017 12:00:00 AM,02/01/2017 12:00:00 AM,01/30/2017 12:00:00 AM,,2017-02-09T00:00:00.000,2017-02-01T00:00:00.000,2017-01-30T00:00:00.000,Done
2016OPA-0704,Done,OPA Close CL,07/29/2016 12:00:00 AM,07/27/2016 12:00:00 AM,07/22/2016 12:00:00 AM,,2016-07-29T00:00:00.000,2016-07-27T00:00:00.000,2016-07-22T00:00:00.000,Done
2018OPA-0061,Done,OPA Management Action,09/21/2018 12:00:00 AM,01/18/2019 12:00:00 AM,09/11/2018 12:00:00 AM,2017-424093,2018-09-21T00:00:00.000,2019-01-18T00:00:00.000,2018-09-11T00:00:00.000,Done
2019OPA-0264,Done,OPA Final Discipline Action Report,,02/04/2020 12:00:00 AM,01/29/2020 12:00:00 AM,,,2020-02-04T00:00:00.000,2020-01-29T00:00:00.000,Done
2019OPA-0469,Done,OPA Close CL,07/30/2019 12:00:00 AM,07/30/2019 12:00:00 AM,07/25/2019 12:00:00 AM,,2019-07-30T00:00:00.000,2019-07-30T00:00:00.000,2019-07-25T00:00:00.000,Done
2019OPA-0729,Done,OPA Close CL,11/04/2019 12:00:00 AM,10/29/2019 12:00:00 AM,10/28/2019 12:00:00 AM,,2019-11-04T00:00:00.000,2019-10-29T00:00:00.000,2019-10-28T00:00:00.000,Done
2015OPA-1028,Done,OPA Classification,,07/15/2015 12:00:00 AM,10/16/2015 12:00:00 AM,,,2015-07-15T00:00:00.000,2015-10-16T00:00:00.000,Done
2015OPA-1627,Done,OPA Close SA,01/22/2016 12:00:00 AM,01/19/2016 12:00:00 AM,01/17/2016 12:00:00 AM,2015-351847,2016-01-22T00:00:00.000,2016-01-19T00:00:00.000,2016-01-17T00:00:00.000,Done
2019OPA-0563,Done,OPA Close Case,08/15/2019 12:00:00 AM,08/22/2019 12:00:00 AM,08/10/2019 12:00:00 AM,,2019-08-15T00:00:00.000,2019-08-22T00:00:00.000,2019-08-10T00:00:00.000,Done
2016OPA-0752,Done,OPA Close SA,,08/11/2016 12:00:00 AM,08/11/2016 12:00:00 AM,,,2016-08-11T00:00:00.000,2016-08-11T00:00:00.000,Done
2017OPA-0594,Done,OPA Close CL,07/04/2017 12:00:00 AM,07/11/2017 12:00:00 AM,06/29/2017 12:00:00 AM,,2017-07-04T00:00:00.000,2017-07-11T00:00:00.000,2017-06-29T00:00:00.000,Done
2018OPA-0434,Done,OPA Close CL,06/16/2018 12:00:00 AM,06/12/2018 12:00:00 AM,06/11/2018 12:00:00 AM,2018-175665,2018-06-16T00:00:00.000,2018-06-12T00:00:00.000,2018-06-11T00:00:00.000,Done
2018OPA-0698,Done,OPA TAC Notification,,01/07/2020 12:00:00 AM,01/07/2020 12:00:00 AM,,,2020-01-07T00:00:00.000,2020-01-07T00:00:00.000,Done
2015OPA-0171,Done,OPA Close CL,,03/02/2015 12:00:00 AM,10/22/2015 12:00:00 AM,,,2015-03-02T00:00:00.000,2015-10-22T00:00:00.000,Done
2015OPA-0338,Done,OPA Close CL,,03/30/2015 12:00:00 AM,10/20/2015 12:00:00 AM,2015-087723,,2015-03-30T00:00:00.000,2015-10-20T00:00:00.000,Done
2015OPA-0720,Done,OPA Close CL,,09/25/2015 12:00:00 AM,10/14/2015 12:00:00 AM,,,2015-09-25T00:00:00.000,2015-10-14T00:00:00.000,Done
2016OPA-1195,Done,OPA Close CL,10/26/2016 12:00:00 AM,10/25/2016 12:00:00 AM,10/21/2016 12:00:00 AM,,2016-10-26T00:00:00.000,2016-10-25T00:00:00.000,2016-10-21T00:00:00.000,Done
2017OPA-0006,Done,OPA Close SA,,03/07/2017 12:00:00 AM,03/07/2017 12:00:00 AM,2017-000133,,2017-03-07T00:00:00.000,2017-03-07T00:00:00.000,Done
2017OPA-0467,Done,OPA Close CL,06/05/2017 12:00:00 AM,06/02/2017 12:00:00 AM,05/26/2017 12:00:00 AM,2014-414754,2017-06-05T00:00:00.000,2017-06-02T00:00:00.000,2017-05-26T00:00:00.000,Done
2018OPA-0133,Done,OPA Close Case,09/01/2018 12:00:00 AM,10/22/2018 12:00:00 AM,08/22/2018 12:00:00 AM,2018-036396,2018-09-01T00:00:00.000,2018-10-22T00:00:00.000,2018-08-22T00:00:00.000,Done
2018OPA-1016,Done,OPA Close CL,11/13/2018 12:00:00 AM,11/20/2018 12:00:00 AM,11/08/2018 12:00:00 AM,,2018-11-13T00:00:00.000,2018-11-20T00:00:00.000,2018-11-08T00:00:00.000,Done
2015OPA-0942,Done,OPA Close CL,,06/30/2015 12:00:00 AM,10/19/2015 12:00:00 AM,,,2015-06-30T00:00:00.000,2015-10-19T00:00:00.000,Done
2015OPA-1646,Done,OPA Close Case,05/26/2016 12:00:00 AM,05/13/2016 12:00:00 AM,05/06/2016 12:00:00 AM,,2016-05-26T00:00:00.000,2016-05-13T00:00:00.000,2016-05-06T00:00:00.000,Done
2016OPA-0421,Done,OPA Close CL,05/07/2016 12:00:00 AM,05/04/2016 12:00:00 AM,05/02/2016 12:00:00 AM,,2016-05-07T00:00:00.000,2016-05-04T00:00:00.000,2016-05-02T00:00:00.000,Done
2017OPA-1244,Done,OPA Close CL,06/05/2018 12:00:00 AM,06/05/2018 12:00:00 AM,05/31/2018 12:00:00 AM,,2018-06-05T00:00:00.000,2018-06-05T00:00:00.000,2018-05-31T00:00:00.000,Done
2019OPA-0830,Done,OPA Close CL,11/14/2019 12:00:00 AM,11/14/2019 12:00:00 AM,11/14/2019 12:00:00 AM,,2019-11-14T00:00:00.000,2019-11-14T00:00:00.000,2019-11-14T00:00:00.000,Done
2020OPA-0055,Done,OPA Case Assignment,02/25/2020 12:00:00 AM,02/20/2020 12:00:00 AM,02/20/2020 12:00:00 AM,2020-023039,2020-02-25T00:00:00.000,2020-02-20T00:00:00.000,2020-02-20T00:00:00.000,Done
2015OPA-0266,Done,OPA Close SA,03/23/2016 12:00:00 AM,03/18/2016 12:00:00 AM,03/18/2016 12:00:00 AM,2012-442960,2016-03-23T00:00:00.000,2016-03-18T00:00:00.000,2016-03-18T00:00:00.000,Done
2015OPA-0467,Done,OPA Close CL,,04/06/2015 12:00:00 AM,10/20/2015 12:00:00 AM,,,2015-04-06T00:00:00.000,2015-10-20T00:00:00.000,Done
2015OPA-0889,Done,OPA Close CL,11/12/2015 12:00:00 AM,11/04/2015 12:00:00 AM,11/02/2015 12:00:00 AM,,2015-11-12T00:00:00.000,2015-11-04T00:00:00.000,2015-11-02T00:00:00.000,Done
2015OPA-1092,Done,OPA Close CL,,08/09/2015 12:00:00 AM,10/15/2015 12:00:00 AM,,,2015-08-09T00:00:00.000,2015-10-15T00:00:00.000,Done
2019OPA-0897,Done,OPA Close Case,,12/18/2019 12:00:00 AM,12/18/2019 12:00:00 AM,,,2019-12-18T00:00:00.000,2019-12-18T00:00:00.000,Done
2018OPA-0042,Done,OPA Close Case,07/08/2018 12:00:00 AM,09/24/2018 12:00:00 AM,06/28/2018 12:00:00 AM,,2018-07-08T00:00:00.000,2018-09-24T00:00:00.000,2018-06-28T00:00:00.000,Done
2018OPA-0504,Done,OPA Close CL,07/06/2018 12:00:00 AM,07/16/2018 12:00:00 AM,06/06/2018 12:00:00 AM,,2018-07-06T00:00:00.000,2018-07-16T00:00:00.000,2018-06-06T00:00:00.000,Done
2018OPA-0788,Done,OPA Close SA,,09/28/2018 12:00:00 AM,09/28/2018 12:00:00 AM,2017-286691,,2018-09-28T00:00:00.000,2018-09-28T00:00:00.000,Done
2019OPA-0220,Done,OPA Send Complainant Closing Letter,04/30/2019 12:00:00 AM,05/02/2019 12:00:00 AM,05/02/2019 12:00:00 AM,2018-436463,2019-04-30T00:00:00.000,2019-05-02T00:00:00.000,2019-05-02T00:00:00.000,Done
2015OPA-1742,Done,OPA Close SA,08/09/2016 12:00:00 AM,07/25/2016 12:00:00 AM,07/25/2016 12:00:00 AM,,2016-08-09T00:00:00.000,2016-07-25T00:00:00.000,2016-07-25T00:00:00.000,Done
2017OPA-0085,Done,OPA Close SA,,03/21/2017 12:00:00 AM,03/17/2017 12:00:00 AM,2016-445049,,2017-03-21T00:00:00.000,2017-03-17T00:00:00.000,Done
2017OPA-0566,Done,OPA Close SA,,08/17/2017 12:00:00 AM,08/17/2017 12:00:00 AM,,,2017-08-17T00:00:00.000,2017-08-17T00:00:00.000,Done
2017OPA-1155,Done,OPA Close Case,05/19/2018 12:00:00 AM,08/20/2018 12:00:00 AM,05/09/2018 12:00:00 AM,,2018-05-19T00:00:00.000,2018-08-20T00:00:00.000,2018-05-09T00:00:00.000,Done
2017OPA-1279,Done,OPA Close CL,01/15/2018 12:00:00 AM,01/10/2018 12:00:00 AM,01/10/2018 12:00:00 AM,2017-433927,2018-01-15T00:00:00.000,2018-01-10T00:00:00.000,2018-01-10T00:00:00.000,Done
2015OPA-0424,Done,OPA Director SA Review,05/17/2015 12:00:00 AM,08/13/2015 12:00:00 AM,05/12/2015 12:00:00 AM,,2015-05-17T00:00:00.000,2015-08-13T00:00:00.000,2015-05-12T00:00:00.000,Done
2015OPA-1421,Done,OPA Close CL,,10/06/2015 12:00:00 AM,10/13/2015 12:00:00 AM,,,2015-10-06T00:00:00.000,2015-10-13T00:00:00.000,Done
2016OPA-0335,Done,OPA Close Case,08/01/2016 12:00:00 AM,08/01/2016 12:00:00 AM,07/20/2016 12:00:00 AM,2016-042200,2016-08-01T00:00:00.000,2016-08-01T00:00:00.000,2016-07-20T00:00:00.000,Done
2017OPA-0891,Done,OPA Close CL,09/16/2017 12:00:00 AM,09/12/2017 12:00:00 AM,09/11/2017 12:00:00 AM,,2017-09-16T00:00:00.000,2017-09-12T00:00:00.000,2017-09-11T00:00:00.000,Done
2018OPA-0080,Done,OPA Close CL,02/21/2018 12:00:00 AM,01/30/2018 12:00:00 AM,01/22/2018 12:00:00 AM,,2018-02-21T00:00:00.000,2018-01-30T00:00:00.000,2018-01-22T00:00:00.000,Done
2018OPA-0329,Done,OPA Close CL,05/14/2018 12:00:00 AM,05/09/2018 12:00:00 AM,05/09/2018 12:00:00 AM,2017-107415,2018-05-14T00:00:00.000,2018-05-09T00:00:00.000,2018-05-09T00:00:00.000,Done
2018OPA-0479,Done,OPA Close Case,11/10/2019 12:00:00 AM,12/09/2019 12:00:00 AM,10/30/2019 12:00:00 AM,2018-187720,2019-11-10T00:00:00.000,2019-12-09T00:00:00.000,2019-10-30T00:00:00.000,Done
2018OPA-0498,Done,OPA Close Case,12/06/2018 12:00:00 AM,02/20/2019 12:00:00 AM,11/26/2018 12:00:00 AM,,2018-12-06T00:00:00.000,2019-02-20T00:00:00.000,2018-11-26T00:00:00.000,Done
2019OPA-0718,Done,OPA SA Review,11/08/2019 12:00:00 AM,11/14/2019 12:00:00 AM,10/24/2019 12:00:00 AM,,2019-11-08T00:00:00.000,2019-11-14T00:00:00.000,2019-10-24T00:00:00.000,Done
2015OPA-0979,Done,OPA Close CL,,07/10/2015 12:00:00 AM,10/16/2015 12:00:00 AM,,,2015-07-10T00:00:00.000,2015-10-16T00:00:00.000,Done
2015OPA-1544,Done,OPA Close CL,,10/27/2015 12:00:00 AM,10/27/2015 12:00:00 AM,,,2015-10-27T00:00:00.000,2015-10-27T00:00:00.000,Done
2016OPA-0279,Done,OPA Close SA,05/05/2016 12:00:00 AM,05/10/2016 12:00:00 AM,04/20/2016 12:00:00 AM,2016-091335,2016-05-05T00:00:00.000,2016-05-10T00:00:00.000,2016-04-20T00:00:00.000,Done
2017OPA-0924,Done,OPA Close CL,10/08/2017 12:00:00 AM,10/11/2017 12:00:00 AM,10/03/2017 12:00:00 AM,2017-320820,2017-10-08T00:00:00.000,2017-10-11T00:00:00.000,2017-10-03T00:00:00.000,Done
2018OPA-0130,Done,OPA Close Case,10/20/2019 12:00:00 AM,10/23/2019 12:00:00 AM,10/10/2019 12:00:00 AM,,2019-10-20T00:00:00.000,2019-10-23T00:00:00.000,2019-10-10T00:00:00.000,Done
2018OPA-0725,Done,OPA Close Case,05/06/2019 12:00:00 AM,01/08/2019 12:00:00 AM,04/26/2019 12:00:00 AM,,2019-05-06T00:00:00.000,2019-01-08T00:00:00.000,2019-04-26T00:00:00.000,Done
2018OPA-0768,Done,OPA Close CL,09/12/2018 12:00:00 AM,09/13/2018 12:00:00 AM,09/07/2018 12:00:00 AM,,2018-09-12T00:00:00.000,2018-09-13T00:00:00.000,2018-09-07T00:00:00.000,Done
2015OPA-0297,Done,OPA Close SA,,12/29/2015 12:00:00 AM,12/29/2015 12:00:00 AM,,,2015-12-29T00:00:00.000,2015-12-29T00:00:00.000,Done
2016OPA-0193,Done,OPA Close Case,10/11/2016 12:00:00 AM,10/11/2016 12:00:00 AM,09/30/2016 12:00:00 AM,2013-092730,2016-10-11T00:00:00.000,2016-10-11T00:00:00.000,2016-09-30T00:00:00.000,Done
2019OPA-0678,Done,OPA Close CL,09/20/2019 12:00:00 AM,09/20/2019 12:00:00 AM,09/20/2019 12:00:00 AM,,2019-09-20T00:00:00.000,2019-09-20T00:00:00.000,2019-09-20T00:00:00.000,Done
2017OPA-1225,Done,OPA Close Case,12/25/2017 12:00:00 AM,12/20/2017 12:00:00 AM,12/20/2017 12:00:00 AM,,2017-12-25T00:00:00.000,2017-12-20T00:00:00.000,2017-12-20T00:00:00.000,Done
2018OPA-0525,Done,OPA Close Case,09/01/2018 12:00:00 AM,10/15/2018 12:00:00 AM,08/22/2018 12:00:00 AM,2018-182178,2018-09-01T00:00:00.000,2018-10-15T00:00:00.000,2018-08-22T00:00:00.000,Done
2018OPA-0822,Done,OPA Close Case,02/25/2019 12:00:00 AM,02/21/2019 12:00:00 AM,02/15/2019 12:00:00 AM,2018-307985,2019-02-25T00:00:00.000,2019-02-21T00:00:00.000,2019-02-15T00:00:00.000,Done
2018OPA-1002,Done,OPA Close CL,10/23/2018 12:00:00 AM,10/18/2018 12:00:00 AM,10/18/2018 12:00:00 AM,,2018-10-23T00:00:00.000,2018-10-18T00:00:00.000,2018-10-18T00:00:00.000,Done
2015OPA-0912,Done,OPA Close CL,,09/30/2015 12:00:00 AM,10/14/2015 12:00:00 AM,2009-390765,,2015-09-30T00:00:00.000,2015-10-14T00:00:00.000,Done
2015OPA-1082,Done,OPA Close Case,,12/23/2015 12:00:00 AM,12/23/2015 12:00:00 AM,2015-222666,,2015-12-23T00:00:00.000,2015-12-23T00:00:00.000,Done
2017OPA-0597,Done,OPA Close CL,07/04/2017 12:00:00 AM,07/11/2017 12:00:00 AM,06/29/2017 12:00:00 AM,,2017-07-04T00:00:00.000,2017-07-11T00:00:00.000,2017-06-29T00:00:00.000,Done
2017OPA-0962,Done,OPA Final Discipline Action Report,,03/09/2018 12:00:00 AM,01/22/2019 12:00:00 AM,2017-340079,,2018-03-09T00:00:00.000,2019-01-22T00:00:00.000,Done
2018OPA-0989,Done,OPA Close CL,11/05/2018 12:00:00 AM,11/16/2018 12:00:00 AM,11/02/2018 12:00:00 AM,2018-378112,2018-11-05T00:00:00.000,2018-11-16T00:00:00.000,2018-11-02T00:00:00.000,Done
2019OPA-0745,Done,OPA Close Case,03/05/2020 12:00:00 AM,04/14/2020 12:00:00 AM,01/31/2020 12:00:00 AM,2019-365647,2020-03-05T00:00:00.000,2020-04-14T00:00:00.000,2020-01-31T00:00:00.000,Done
2020OPA-0040,Done,OPA Director Certification/Finding,07/12/2020 12:00:00 AM,02/17/2020 12:00:00 AM,02/14/2020 12:00:00 AM,,2020-07-12T00:00:00.000,2020-02-17T00:00:00.000,2020-02-14T00:00:00.000,Done
2015OPA-0925,Done,OPA Close CL,,07/01/2015 12:00:00 AM,10/19/2015 12:00:00 AM,,,2015-07-01T00:00:00.000,2015-10-19T00:00:00.000,Done
2016OPA-0254,Done,OPA Close CL,04/06/2016 12:00:00 AM,04/06/2016 12:00:00 AM,04/01/2016 12:00:00 AM,2016-082563,2016-04-06T00:00:00.000,2016-04-06T00:00:00.000,2016-04-01T00:00:00.000,Done
2017OPA-0894,Done,OPA Final Discipline Action Report,,02/15/2018 12:00:00 AM,01/22/2019 12:00:00 AM,2017-320652,,2018-02-15T00:00:00.000,2019-01-22T00:00:00.000,Done
2017OPA-1293,Done,OPA Close CL,01/19/2018 12:00:00 AM,01/18/2018 12:00:00 AM,12/20/2017 12:00:00 AM,,2018-01-19T00:00:00.000,2018-01-18T00:00:00.000,2017-12-20T00:00:00.000,Done
2018OPA-0328,Done,OPA Close Case,10/20/2018 12:00:00 AM,10/23/2018 12:00:00 AM,10/10/2018 12:00:00 AM,2018-126821,2018-10-20T00:00:00.000,2018-10-23T00:00:00.000,2018-10-10T00:00:00.000,Done
2019OPA-0028,Done,OPA Mediation,,06/17/2019 12:00:00 AM,05/01/2019 12:00:00 AM,2019-013530,,2019-06-17T00:00:00.000,2019-05-01T00:00:00.000,Done
2015OPA-0933,Done,OPA Close Case,01/07/2016 12:00:00 AM,12/29/2015 12:00:00 AM,12/28/2015 12:00:00 AM,2015-049571,2016-01-07T00:00:00.000,2015-12-29T00:00:00.000,2015-12-28T00:00:00.000,Done
2015OPA-1111,Done,OPA Close CL,,09/08/2015 12:00:00 AM,10/15/2015 12:00:00 AM,2015-252484,,2015-09-08T00:00:00.000,2015-10-15T00:00:00.000,Done
2018OPA-0561,Done,OPA Close Case,,02/15/2019 12:00:00 AM,01/22/2019 12:00:00 AM,2018-216222,,2019-02-15T00:00:00.000,2019-01-22T00:00:00.000,Done
2015OPA-0347,Done,OPA Close CL,,03/23/2015 12:00:00 AM,10/21/2015 12:00:00 AM,,,2015-03-23T00:00:00.000,2015-10-21T00:00:00.000,Done
2015OPA-1781,Done,OPA Close CL,11/28/2015 12:00:00 AM,11/30/2015 12:00:00 AM,11/23/2015 12:00:00 AM,,2015-11-28T00:00:00.000,2015-11-30T00:00:00.000,2015-11-23T00:00:00.000,Done
2017OPA-0104,Done,OPA Close CL,02/07/2017 12:00:00 AM,02/06/2017 12:00:00 AM,02/02/2017 12:00:00 AM,,2017-02-07T00:00:00.000,2017-02-06T00:00:00.000,2017-02-02T00:00:00.000,Done
2017OPA-0478,Done,OPA Close CL,05/10/2017 12:00:00 AM,05/10/2017 12:00:00 AM,05/10/2017 12:00:00 AM,,2017-05-10T00:00:00.000,2017-05-10T00:00:00.000,2017-05-10T00:00:00.000,Done
2018OPA-0710,Done,OPA Close Case,01/31/2019 12:00:00 AM,02/20/2019 12:00:00 AM,01/21/2019 12:00:00 AM,2018-273964,2019-01-31T00:00:00.000,2019-02-20T00:00:00.000,2019-01-21T00:00:00.000,Done
2019OPA-0169,Done,OPA Close Case,10/26/2019 12:00:00 AM,10/16/2019 12:00:00 AM,10/16/2019 12:00:00 AM,2019-077695,2019-10-26T00:00:00.000,2019-10-16T00:00:00.000,2019-10-16T00:00:00.000,Done
2017OPA-0496,Done,OPA Close Case,10/04/2017 12:00:00 AM,10/13/2017 12:00:00 AM,10/02/2017 12:00:00 AM,2017-164738,2017-10-04T00:00:00.000,2017-10-13T00:00:00.000,2017-10-02T00:00:00.000,Done
2018OPA-0206,Done,OPA Close CL,03/18/2018 12:00:00 AM,04/06/2018 12:00:00 AM,03/13/2018 12:00:00 AM,,2018-03-18T00:00:00.000,2018-04-06T00:00:00.000,2018-03-13T00:00:00.000,Done
2019OPA-0134,Done,OPA Close CL,04/28/2019 12:00:00 AM,04/24/2019 12:00:00 AM,04/23/2019 12:00:00 AM,,2019-04-28T00:00:00.000,2019-04-24T00:00:00.000,2019-04-23T00:00:00.000,Done
2019OPA-0649,Done,OPA Close SA,,10/10/2019 12:00:00 AM,10/10/2019 12:00:00 AM,,,2019-10-10T00:00:00.000,2019-10-10T00:00:00.000,Done
2015OPA-0002,Done,OPA Close CL,,01/26/2015 12:00:00 AM,10/23/2015 12:00:00 AM,,,2015-01-26T00:00:00.000,2015-10-23T00:00:00.000,Done
2015OPA-0362,Done,OPA Monitor SA,05/01/2015 12:00:00 AM,05/11/2015 12:00:00 AM,04/01/2015 12:00:00 AM,2015-020383,2015-05-01T00:00:00.000,2015-05-11T00:00:00.000,2015-04-01T00:00:00.000,Done
2015OPA-0457,Done,OPA Director SA Review,06/28/2015 12:00:00 AM,07/02/2015 12:00:00 AM,06/23/2015 12:00:00 AM,,2015-06-28T00:00:00.000,2015-07-02T00:00:00.000,2015-06-23T00:00:00.000,Done
2016OPA-1186,Done,OPA Close Case,04/24/2017 12:00:00 AM,04/25/2017 12:00:00 AM,04/14/2017 12:00:00 AM,,2017-04-24T00:00:00.000,2017-04-25T00:00:00.000,2017-04-14T00:00:00.000,Done
2017OPA-0138,Done,OPA Close CL,03/08/2017 12:00:00 AM,03/16/2017 12:00:00 AM,03/03/2017 12:00:00 AM,2017-040909,2017-03-08T00:00:00.000,2017-03-16T00:00:00.000,2017-03-03T00:00:00.000,Done
2018OPA-1004,Done,OPA Close CL,11/12/2018 12:00:00 AM,11/16/2018 12:00:00 AM,11/07/2018 12:00:00 AM,,2018-11-12T00:00:00.000,2018-11-16T00:00:00.000,2018-11-07T00:00:00.000,Done
2019OPA-0325,Done,OPA Close CL,06/12/2019 12:00:00 AM,06/24/2019 12:00:00 AM,06/07/2019 12:00:00 AM,,2019-06-12T00:00:00.000,2019-06-24T00:00:00.000,2019-06-07T00:00:00.000,Done
2019OPA-0837,Done,OPA Close SA,,12/30/2019 12:00:00 AM,12/30/2019 12:00:00 AM,,,2019-12-30T00:00:00.000,2019-12-30T00:00:00.000,Done
2015OPA-0445,Done,OPA Close Case,09/22/2015 12:00:00 AM,09/22/2015 12:00:00 AM,08/31/2015 12:00:00 AM,,2015-09-22T00:00:00.000,2015-09-22T00:00:00.000,2015-08-31T00:00:00.000,Done
2015OPA-0812,Done,OPA Close CL,,06/15/2015 12:00:00 AM,10/19/2015 12:00:00 AM,,,2015-06-15T00:00:00.000,2015-10-19T00:00:00.000,Done
2015OPA-0950,Done,OPA Close SA,09/21/2015 12:00:00 AM,09/17/2015 12:00:00 AM,09/16/2015 12:00:00 AM,,2015-09-21T00:00:00.000,2015-09-17T00:00:00.000,2015-09-16T00:00:00.000,Done
2015OPA-1282,Done,OPA Close CL,,09/14/2015 12:00:00 AM,10/14/2015 12:00:00 AM,,,2015-09-14T00:00:00.000,2015-10-14T00:00:00.000,Done
2015OPA-1369,Done,OPA Close Case,02/10/2016 12:00:00 AM,02/10/2016 12:00:00 AM,01/25/2016 12:00:00 AM,2015-303133,2016-02-10T00:00:00.000,2016-02-10T00:00:00.000,2016-01-25T00:00:00.000,Done
2016OPA-0690,Done,OPA Close SA,,09/06/2016 12:00:00 AM,09/06/2016 12:00:00 AM,,,2016-09-06T00:00:00.000,2016-09-06T00:00:00.000,Done
2016OPA-0760,Done,OPA Close Case,12/30/2016 12:00:00 AM,12/30/2016 12:00:00 AM,12/20/2016 12:00:00 AM,,2016-12-30T00:00:00.000,2016-12-30T00:00:00.000,2016-12-20T00:00:00.000,Done
2018OPA-0662,Done,OPA Close CL,08/15/2018 12:00:00 AM,08/15/2018 12:00:00 AM,08/10/2018 12:00:00 AM,2018-243773,2018-08-15T00:00:00.000,2018-08-15T00:00:00.000,2018-08-10T00:00:00.000,Done
2020OPA-0189,Done,OPA OIG Intake Classification Review,03/31/2020 12:00:00 AM,03/27/2020 12:00:00 AM,03/25/2020 12:00:00 AM,,2020-03-31T00:00:00.000,2020-03-27T00:00:00.000,2020-03-25T00:00:00.000,Done
2015OPA-0078,Done,OPA Close CL,,01/26/2015 12:00:00 AM,10/23/2015 12:00:00 AM,2015-019656,,2015-01-26T00:00:00.000,2015-10-23T00:00:00.000,Done
2015OPA-0562,Done,OPA Close SA,,12/29/2015 12:00:00 AM,12/29/2015 12:00:00 AM,2015-017276,,2015-12-29T00:00:00.000,2015-12-29T00:00:00.000,Done
2015OPA-0750,Done,OPA Close SA,08/17/2015 12:00:00 AM,08/13/2015 12:00:00 AM,08/12/2015 12:00:00 AM,2015-143480,2015-08-17T00:00:00.000,2015-08-13T00:00:00.000,2015-08-12T00:00:00.000,Done
2015OPA-1345,Done,OPA Close SA,01/04/2016 12:00:00 AM,12/30/2015 12:00:00 AM,12/30/2015 12:00:00 AM,2015-309320,2016-01-04T00:00:00.000,2015-12-30T00:00:00.000,2015-12-30T00:00:00.000,Done
2015OPA-1626,Done,OPA Management Action,03/31/2018 12:00:00 AM,01/18/2019 12:00:00 AM,03/16/2016 12:00:00 AM,2015-142601,2018-03-31T00:00:00.000,2019-01-18T00:00:00.000,2016-03-16T00:00:00.000,Done
2016OPA-0095,Done,OPA Close CL,02/07/2016 12:00:00 AM,02/03/2016 12:00:00 AM,02/02/2016 12:00:00 AM,,2016-02-07T00:00:00.000,2016-02-03T00:00:00.000,2016-02-02T00:00:00.000,Done
2020OPA-0265,Done,OPA 5 Day Notice,05/08/2020 12:00:00 AM,05/06/2020 12:00:00 AM,05/05/2020 12:00:00 AM,,2020-05-08T00:00:00.000,2020-05-06T00:00:00.000,2020-05-05T00:00:00.000,Done
2017OPA-0173,Done,OPA Close SA,,04/19/2017 12:00:00 AM,04/19/2017 12:00:00 AM,2017-047237,,2017-04-19T00:00:00.000,2017-04-19T00:00:00.000,Done
2017OPA-1216,Done,OPA Director Certification/Finding,05/18/2018 12:00:00 AM,05/15/2018 12:00:00 AM,01/30/2019 12:00:00 AM,2017-428496,2018-05-18T00:00:00.000,2018-05-15T00:00:00.000,2019-01-30T00:00:00.000,Done
2019OPA-0530,Done,OPA Close Case,03/08/2020 12:00:00 AM,04/20/2020 12:00:00 AM,02/23/2020 12:00:00 AM,2019-235080,2020-03-08T00:00:00.000,2020-04-20T00:00:00.000,2020-02-23T00:00:00.000,Done
2020OPA-0251,Done,OPA OIG Intake Classification Review,05/01/2020 12:00:00 AM,04/30/2020 12:00:00 AM,04/29/2020 12:00:00 AM,2020-041898,2020-05-01T00:00:00.000,2020-04-30T00:00:00.000,2020-04-29T00:00:00.000,Done
2015OPA-0402,Done,OPA Close CL,,03/27/2015 12:00:00 AM,10/20/2015 12:00:00 AM,,,2015-03-27T00:00:00.000,2015-10-20T00:00:00.000,Done
2015OPA-1165,Done,OPA Close SA,09/20/2015 12:00:00 AM,09/15/2015 12:00:00 AM,09/15/2015 12:00:00 AM,,2015-09-20T00:00:00.000,2015-09-15T00:00:00.000,2015-09-15T00:00:00.000,Done
2016OPA-0608,Done,OPA Close Case,04/09/2017 12:00:00 AM,04/12/2017 12:00:00 AM,03/30/2017 12:00:00 AM,2016-184121,2017-04-09T00:00:00.000,2017-04-12T00:00:00.000,2017-03-30T00:00:00.000,Done
2016OPA-0844,Done,OPA Close CL,08/21/2016 12:00:00 AM,08/18/2016 12:00:00 AM,08/16/2016 12:00:00 AM,,2016-08-21T00:00:00.000,2016-08-18T00:00:00.000,2016-08-16T00:00:00.000,Done
2018OPA-0030,Done,OPA Close Case,02/06/2018 12:00:00 AM,01/31/2018 12:00:00 AM,01/08/2018 12:00:00 AM,,2018-02-06T00:00:00.000,2018-01-31T00:00:00.000,2018-01-08T00:00:00.000,Done
2019OPA-0073,Done,OPA Close Case,07/19/2019 12:00:00 AM,09/19/2019 12:00:00 AM,07/09/2019 12:00:00 AM,2019-018708,2019-07-19T00:00:00.000,2019-09-19T00:00:00.000,2019-07-09T00:00:00.000,Done
2017OPA-0460,Done,OPA Close SA,,06/27/2017 12:00:00 AM,06/27/2017 12:00:00 AM,2016-431051,,2017-06-27T00:00:00.000,2017-06-27T00:00:00.000,Done
2017OPA-0788,Done,OPA Close SA,,09/19/2017 12:00:00 AM,09/19/2017 12:00:00 AM,,,2017-09-19T00:00:00.000,2017-09-19T00:00:00.000,Done
2019OPA-0143,Done,OPA Close Case,09/08/2019 12:00:00 AM,09/13/2019 12:00:00 AM,08/29/2019 12:00:00 AM,2018-075470,2019-09-08T00:00:00.000,2019-09-13T00:00:00.000,2019-08-29T00:00:00.000,Done
2019OPA-0111,Done,OPA Close CL,04/02/2019 12:00:00 AM,04/03/2019 12:00:00 AM,03/28/2019 12:00:00 AM,,2019-04-02T00:00:00.000,2019-04-03T00:00:00.000,2019-03-28T00:00:00.000,Done
2019OPA-0893,Done,OPA Close CL,01/14/2020 12:00:00 AM,01/09/2020 12:00:00 AM,01/06/2020 12:00:00 AM,2019-450245,2020-01-14T00:00:00.000,2020-01-09T00:00:00.000,2020-01-06T00:00:00.000,Done
2015OPA-0025,Done,OPA Process SA,02/25/2015 12:00:00 AM,01/26/2015 12:00:00 AM,01/26/2015 12:00:00 AM,2014-290441,2015-02-25T00:00:00.000,2015-01-26T00:00:00.000,2015-01-26T00:00:00.000,Done
2015OPA-0374,Done,OPA Appeal Findings Upheld,,04/29/2016 12:00:00 AM,12/23/2016 12:00:00 AM,2015-052471,,2016-04-29T00:00:00.000,2016-12-23T00:00:00.000,Done
2015OPA-1895,Done,OPA Close CL,01/31/2016 12:00:00 AM,04/07/2016 12:00:00 AM,01/25/2016 12:00:00 AM,,2016-01-31T00:00:00.000,2016-04-07T00:00:00.000,2016-01-25T00:00:00.000,Done
2018OPA-0021,Done,OPA Close CL,02/03/2018 12:00:00 AM,01/29/2018 12:00:00 AM,01/04/2018 12:00:00 AM,2017-452583,2018-02-03T00:00:00.000,2018-01-29T00:00:00.000,2018-01-04T00:00:00.000,Done
2018OPA-0595,Done,OPA Close Case,01/06/2019 12:00:00 AM,01/23/2019 12:00:00 AM,12/27/2018 12:00:00 AM,2018-241197,2019-01-06T00:00:00.000,2019-01-23T00:00:00.000,2018-12-27T00:00:00.000,Done
2019OPA-0569,Done,OPA Close Case,03/08/2020 12:00:00 AM,04/16/2020 12:00:00 AM,02/23/2020 12:00:00 AM,,2020-03-08T00:00:00.000,2020-04-16T00:00:00.000,2020-02-23T00:00:00.000,Done
2015OPA-0481,Done,OPA Close CL,,04/10/2015 12:00:00 AM,10/20/2015 12:00:00 AM,,,2015-04-10T00:00:00.000,2015-10-20T00:00:00.000,Done
2015OPA-1851,Done,OPA Close SA,02/15/2016 12:00:00 AM,02/11/2016 12:00:00 AM,02/10/2016 12:00:00 AM,,2016-02-15T00:00:00.000,2016-02-11T00:00:00.000,2016-02-10T00:00:00.000,Done
2016OPA-0269,Done,OPA Close CL,03/21/2016 12:00:00 AM,03/18/2016 12:00:00 AM,03/16/2016 12:00:00 AM,,2016-03-21T00:00:00.000,2016-03-18T00:00:00.000,2016-03-16T00:00:00.000,Done
2016OPA-0540,Done,OPA Close CL,06/15/2016 12:00:00 AM,06/13/2016 12:00:00 AM,06/10/2016 12:00:00 AM,,2016-06-15T00:00:00.000,2016-06-13T00:00:00.000,2016-06-10T00:00:00.000,Done
2016OPA-0898,Done,OPA Close CL,08/10/2016 12:00:00 AM,08/08/2016 12:00:00 AM,08/05/2016 12:00:00 AM,,2016-08-10T00:00:00.000,2016-08-08T00:00:00.000,2016-08-05T00:00:00.000,Done
2016OPA-1106,Done,OPA Close CL,10/11/2016 12:00:00 AM,10/10/2016 12:00:00 AM,10/06/2016 12:00:00 AM,,2016-10-11T00:00:00.000,2016-10-10T00:00:00.000,2016-10-06T00:00:00.000,Done
2017OPA-1265,Done,OPA Close CL,01/07/2018 12:00:00 AM,01/09/2018 12:00:00 AM,12/08/2017 12:00:00 AM,,2018-01-07T00:00:00.000,2018-01-09T00:00:00.000,2017-12-08T00:00:00.000,Done
2018OPA-0003,Done,OPA Close CL,12/31/2018 12:00:00 AM,01/03/2019 12:00:00 AM,12/29/2017 12:00:00 AM,,2018-12-31T00:00:00.000,2019-01-03T00:00:00.000,2017-12-29T00:00:00.000,Done
2018OPA-1037,Done,OPA Training Referral,08/12/2019 12:00:00 AM,08/13/2019 12:00:00 AM,08/02/2019 12:00:00 AM,2018-268089,2019-08-12T00:00:00.000,2019-08-13T00:00:00.000,2019-08-02T00:00:00.000,Done
2018OPA-1099,Done,OPA Close CL,12/18/2018 12:00:00 AM,12/21/2018 12:00:00 AM,12/13/2018 12:00:00 AM,,2018-12-18T00:00:00.000,2018-12-21T00:00:00.000,2018-12-13T00:00:00.000,Done
2015OPA-0042,Done,OPA Director SA Review,04/20/2015 12:00:00 AM,05/11/2015 12:00:00 AM,04/15/2015 12:00:00 AM,2014-235934,2015-04-20T00:00:00.000,2015-05-11T00:00:00.000,2015-04-15T00:00:00.000,Done
2015OPA-0617,Done,OPA Director SA Review,06/28/2015 12:00:00 AM,07/21/2015 12:00:00 AM,06/23/2015 12:00:00 AM,2015-115115,2015-06-28T00:00:00.000,2015-07-21T00:00:00.000,2015-06-23T00:00:00.000,Done
2015OPA-0956,Done,OPA Close SA,09/09/2015 12:00:00 AM,09/04/2015 12:00:00 AM,09/04/2015 12:00:00 AM,2015-143686,2015-09-09T00:00:00.000,2015-09-04T00:00:00.000,2015-09-04T00:00:00.000,Done
2015OPA-1341,Done,OPA Close CL,,10/01/2015 12:00:00 AM,10/13/2015 12:00:00 AM,,,2015-10-01T00:00:00.000,2015-10-13T00:00:00.000,Done
2015OPA-1668,Done,OPA Close CL,11/30/2015 12:00:00 AM,11/30/2015 12:00:00 AM,11/25/2015 12:00:00 AM,,2015-11-30T00:00:00.000,2015-11-30T00:00:00.000,2015-11-25T00:00:00.000,Done
2017OPA-0213,Done,OPA Close CL,03/30/2017 12:00:00 AM,03/21/2017 12:00:00 AM,02/28/2017 12:00:00 AM,,2017-03-30T00:00:00.000,2017-03-21T00:00:00.000,2017-02-28T00:00:00.000,Done
2018OPA-0912,Done,OPA Close CL,10/09/2018 12:00:00 AM,10/19/2018 12:00:00 AM,10/04/2018 12:00:00 AM,2018-343810,2018-10-09T00:00:00.000,2018-10-19T00:00:00.000,2018-10-04T00:00:00.000,Done
2019OPA-0838,Done,OPA Close CL,12/11/2019 12:00:00 AM,12/11/2019 12:00:00 AM,12/03/2019 12:00:00 AM,2019-102138,2019-12-11T00:00:00.000,2019-12-11T00:00:00.000,2019-12-03T00:00:00.000,Done
2016OPA-0564,Done,OPA Send Complainant Closing Letter,06/26/2016 12:00:00 AM,06/21/2016 12:00:00 AM,06/21/2016 12:00:00 AM,2016-112301,2016-06-26T00:00:00.000,2016-06-21T00:00:00.000,2016-06-21T00:00:00.000,Done
2017OPA-0258,Done,OPA Close Case,07/13/2017 12:00:00 AM,08/03/2017 12:00:00 AM,07/11/2017 12:00:00 AM,2017-073995,2017-07-13T00:00:00.000,2017-08-03T00:00:00.000,2017-07-11T00:00:00.000,Done
2017OPA-0913,Done,OPA Close Case,04/13/2018 12:00:00 AM,08/01/2018 12:00:00 AM,04/03/2018 12:00:00 AM,2017-300813,2018-04-13T00:00:00.000,2018-08-01T00:00:00.000,2018-04-03T00:00:00.000,Done
2018OPA-0881,Done,OPA Close SA,,02/06/2019 12:00:00 AM,02/06/2019 12:00:00 AM,,,2019-02-06T00:00:00.000,2019-02-06T00:00:00.000,Done
2020OPA-0143,Done,OPA 30 Day Notice,03/28/2020 12:00:00 AM,03/30/2020 12:00:00 AM,03/30/2020 12:00:00 AM,,2020-03-28T00:00:00.000,2020-03-30T00:00:00.000,2020-03-30T00:00:00.000,Done
2020OPA-0253,Done,OPA 5 Day Notice,05/05/2020 12:00:00 AM,04/28/2020 12:00:00 AM,04/28/2020 12:00:00 AM,2020-137847,2020-05-05T00:00:00.000,2020-04-28T00:00:00.000,2020-04-28T00:00:00.000,Done
2015OPA-1356,Done,OPA Close CL,,09/18/2015 12:00:00 AM,10/14/2015 12:00:00 AM,,,2015-09-18T00:00:00.000,2015-10-14T00:00:00.000,Done
2015OPA-1635,Done,OPA Close Case,05/27/2016 12:00:00 AM,05/26/2016 12:00:00 AM,03/30/2016 12:00:00 AM,2015-157666,2016-05-27T00:00:00.000,2016-05-26T00:00:00.000,2016-03-30T00:00:00.000,Done
2019OPA-0881,Done,OPA 180 Extension Request,07/06/2020 12:00:00 AM,08/05/2020 12:00:00 AM,04/02/2020 12:00:00 AM,,2020-07-06T00:00:00.000,2020-08-05T00:00:00.000,2020-04-02T00:00:00.000,Done
2020OPA-0137,Done,OPA Close Case,,04/23/2020 12:00:00 AM,04/08/2020 12:00:00 AM,2020-065030,,2020-04-23T00:00:00.000,2020-04-08T00:00:00.000,Done
2016OPA-1333,Done,OPA Close Case,05/20/2017 12:00:00 AM,05/26/2017 12:00:00 AM,05/10/2017 12:00:00 AM,,2017-05-20T00:00:00.000,2017-05-26T00:00:00.000,2017-05-10T00:00:00.000,Done
2017OPA-0140,Done,OPA Close CL,02/21/2017 12:00:00 AM,02/27/2017 12:00:00 AM,02/16/2017 12:00:00 AM,,2017-02-21T00:00:00.000,2017-02-27T00:00:00.000,2017-02-16T00:00:00.000,Done
2017OPA-0967,Done,OPA Close Case,04/05/2018 12:00:00 AM,08/08/2018 12:00:00 AM,08/08/2018 12:00:00 AM,2017-341840,2018-04-05T00:00:00.000,2018-08-08T00:00:00.000,2018-08-08T00:00:00.000,Done
2019OPA-0060,Done,OPA Training Referral,07/19/2019 12:00:00 AM,08/05/2019 12:00:00 AM,07/09/2019 12:00:00 AM,,2019-07-19T00:00:00.000,2019-08-05T00:00:00.000,2019-07-09T00:00:00.000,Done
2015OPA-0163,Done,OPA Close CL,,03/04/2015 12:00:00 AM,10/22/2015 12:00:00 AM,2014-262916,,2015-03-04T00:00:00.000,2015-10-22T00:00:00.000,Done
2015OPA-1504,Done,OPA Close CL,,10/19/2015 12:00:00 AM,10/19/2015 12:00:00 AM,,,2015-10-19T00:00:00.000,2015-10-19T00:00:00.000,Done
2016OPA-0172,Done,OPA Close CL,03/01/2016 12:00:00 AM,02/29/2016 12:00:00 AM,02/25/2016 12:00:00 AM,,2016-03-01T00:00:00.000,2016-02-29T00:00:00.000,2016-02-25T00:00:00.000,Done
2016OPA-0332,Done,OPA Close SA,06/01/2016 12:00:00 AM,06/10/2016 12:00:00 AM,05/20/2016 12:00:00 AM,2016-083967,2016-06-01T00:00:00.000,2016-06-10T00:00:00.000,2016-05-20T00:00:00.000,Done
2019OPA-0655,Done,OPA Close SA,,10/22/2019 12:00:00 AM,10/22/2019 12:00:00 AM,,,2019-10-22T00:00:00.000,2019-10-22T00:00:00.000,Done
2016OPA-0971,Done,OPA Close Case,06/09/2017 12:00:00 AM,06/16/2017 12:00:00 AM,05/30/2017 12:00:00 AM,,2017-06-09T00:00:00.000,2017-06-16T00:00:00.000,2017-05-30T00:00:00.000,Done
2016OPA-1140,Done,OPA Close Case,03/17/2017 12:00:00 AM,03/29/2017 12:00:00 AM,03/07/2017 12:00:00 AM,2016-201855,2017-03-17T00:00:00.000,2017-03-29T00:00:00.000,2017-03-07T00:00:00.000,Done
2016OPA-1294,Done,OPA Close SA,,12/28/2016 12:00:00 AM,12/28/2016 12:00:00 AM,2016-108663,,2016-12-28T00:00:00.000,2016-12-28T00:00:00.000,Done
2017OPA-0999,Done,OPA Training Referral,03/16/2018 12:00:00 AM,04/10/2018 12:00:00 AM,03/06/2018 12:00:00 AM,2017-330684,2018-03-16T00:00:00.000,2018-04-10T00:00:00.000,2018-03-06T00:00:00.000,Done
2017OPA-1117,Done,OPA Close CL,11/25/2017 12:00:00 AM,04/06/2018 12:00:00 AM,11/20/2017 12:00:00 AM,,2017-11-25T00:00:00.000,2018-04-06T00:00:00.000,2017-11-20T00:00:00.000,Done
2017OPA-0026,Done,OPA Close CL,02/01/2017 12:00:00 AM,01/30/2017 12:00:00 AM,01/27/2017 12:00:00 AM,,2017-02-01T00:00:00.000,2017-01-30T00:00:00.000,2017-01-27T00:00:00.000,Done
2017OPA-0807,Done,OPA Close Case,01/20/2018 12:00:00 AM,04/19/2018 12:00:00 AM,01/10/2018 12:00:00 AM,2017-252765,2018-01-20T00:00:00.000,2018-04-19T00:00:00.000,2018-01-10T00:00:00.000,Done
2020OPA-0020,Done,OPA Close CL,02/06/2020 12:00:00 AM,02/10/2020 12:00:00 AM,01/30/2020 12:00:00 AM,,2020-02-06T00:00:00.000,2020-02-10T00:00:00.000,2020-01-30T00:00:00.000,Done
2015OPA-0964,Done,OPA Close SA,08/22/2015 12:00:00 AM,08/19/2015 12:00:00 AM,08/17/2015 12:00:00 AM,,2015-08-22T00:00:00.000,2015-08-19T00:00:00.000,2015-08-17T00:00:00.000,Done
2015OPA-1078,Done,OPA Close CL,,07/23/2015 12:00:00 AM,10/16/2015 12:00:00 AM,,,2015-07-23T00:00:00.000,2015-10-16T00:00:00.000,Done
2015OPA-1272,Done,OPA Close Case,07/01/2016 12:00:00 AM,07/01/2016 12:00:00 AM,06/20/2016 12:00:00 AM,2015-346904,2016-07-01T00:00:00.000,2016-07-01T00:00:00.000,2016-06-20T00:00:00.000,Done
2015OPA-1932,Done,OPA Close SA,03/12/2016 12:00:00 AM,03/07/2016 12:00:00 AM,03/07/2016 12:00:00 AM,2015-402617,2016-03-12T00:00:00.000,2016-03-07T00:00:00.000,2016-03-07T00:00:00.000,Done
2017OPA-0185,Done,OPA Close SA,,04/27/2017 12:00:00 AM,04/27/2017 12:00:00 AM,2017-063526,,2017-04-27T00:00:00.000,2017-04-27T00:00:00.000,Done
2017OPA-0806,Done,OPA Close SA,,09/21/2017 12:00:00 AM,09/21/2017 12:00:00 AM,,,2017-09-21T00:00:00.000,2017-09-21T00:00:00.000,Done
2019OPA-0027,Done,OPA Training Referral,07/08/2019 12:00:00 AM,07/17/2019 12:00:00 AM,06/28/2019 12:00:00 AM,2019-003893,2019-07-08T00:00:00.000,2019-07-17T00:00:00.000,2019-06-28T00:00:00.000,Done
2016OPA-0162,Done,OPA SA Close,04/12/2016 12:00:00 AM,07/18/2016 12:00:00 AM,03/23/2016 12:00:00 AM,,2016-04-12T00:00:00.000,2016-07-18T00:00:00.000,2016-03-23T00:00:00.000,Done
2016OPA-0894,Done,OPA Classification,09/03/2016 12:00:00 AM,09/01/2016 12:00:00 AM,08/29/2016 12:00:00 AM,,2016-09-03T00:00:00.000,2016-09-01T00:00:00.000,2016-08-29T00:00:00.000,Done
2020OPA-0152,Done,OPA 180 Extension Request,08/22/2020 12:00:00 AM,09/21/2020 12:00:00 AM,04/04/2020 12:00:00 AM,2020-069358,2020-08-22T00:00:00.000,2020-09-21T00:00:00.000,2020-04-04T00:00:00.000,Done
2016OPA-1471,Done,OPA Close Case,06/15/2017 12:00:00 AM,06/28/2017 12:00:00 AM,06/13/2017 12:00:00 AM,2016-439967,2017-06-15T00:00:00.000,2017-06-28T00:00:00.000,2017-06-13T00:00:00.000,Done
2017OPA-0711,Done,OPA Close SA,,09/19/2017 12:00:00 AM,09/19/2017 12:00:00 AM,,,2017-09-19T00:00:00.000,2017-09-19T00:00:00.000,Done
2017OPA-0987,Done,OPA Close Case,04/02/2018 12:00:00 AM,07/24/2018 12:00:00 AM,03/23/2018 12:00:00 AM,2017-353734,2018-04-02T00:00:00.000,2018-07-24T00:00:00.000,2018-03-23T00:00:00.000,Done
2019OPA-0600,Done,OPA Close CL,09/16/2019 12:00:00 AM,09/11/2019 12:00:00 AM,09/09/2019 12:00:00 AM,,2019-09-16T00:00:00.000,2019-09-11T00:00:00.000,2019-09-09T00:00:00.000,Done
2020OPA-0083,Done,OPA Close CL,03/11/2020 12:00:00 AM,03/11/2020 12:00:00 AM,03/03/2020 12:00:00 AM,2020-045273,2020-03-11T00:00:00.000,2020-03-11T00:00:00.000,2020-03-03T00:00:00.000,Done
2015OPA-1011,Done,OPA Close SA,08/22/2015 12:00:00 AM,08/19/2015 12:00:00 AM,08/17/2015 12:00:00 AM,,2015-08-22T00:00:00.000,2015-08-19T00:00:00.000,2015-08-17T00:00:00.000,Done
2015OPA-1190,Done,OPA Close SA,10/20/2015 12:00:00 AM,10/16/2015 12:00:00 AM,10/15/2015 12:00:00 AM,,2015-10-20T00:00:00.000,2015-10-16T00:00:00.000,2015-10-15T00:00:00.000,Done
2015OPA-1258,Done,OPA Close SA,10/20/2015 12:00:00 AM,10/16/2015 12:00:00 AM,10/15/2015 12:00:00 AM,,2015-10-20T00:00:00.000,2015-10-16T00:00:00.000,2015-10-15T00:00:00.000,Done
2015OPA-1481,Done,OPA Close CL,,10/27/2015 12:00:00 AM,10/27/2015 12:00:00 AM,2015-335966,,2015-10-27T00:00:00.000,2015-10-27T00:00:00.000,Done
2016OPA-0075,Done,OPA Close CL,02/22/2016 12:00:00 AM,02/18/2016 12:00:00 AM,02/17/2016 12:00:00 AM,2016-029296,2016-02-22T00:00:00.000,2016-02-18T00:00:00.000,2016-02-17T00:00:00.000,Done
2017OPA-0723,Done,OPA Close SA,,09/21/2017 12:00:00 AM,09/21/2017 12:00:00 AM,,,2017-09-21T00:00:00.000,2017-09-21T00:00:00.000,Done
2015OPA-1034,Done,OPA Close SA,09/09/2015 12:00:00 AM,09/04/2015 12:00:00 AM,09/04/2015 12:00:00 AM,2015-201287,2015-09-09T00:00:00.000,2015-09-04T00:00:00.000,2015-09-04T00:00:00.000,Done
2016OPA-0629,Done,OPA Close Case,12/08/2016 12:00:00 AM,11/28/2016 12:00:00 AM,11/28/2016 12:00:00 AM,2016-027335,2016-12-08T00:00:00.000,2016-11-28T00:00:00.000,2016-11-28T00:00:00.000,Done
2016OPA-0788,Done,OPA Close CL,08/13/2016 12:00:00 AM,08/10/2016 12:00:00 AM,07/29/2016 12:00:00 AM,,2016-08-13T00:00:00.000,2016-08-10T00:00:00.000,2016-07-29T00:00:00.000,Done
2016OPA-1355,Done,OPA Close Case,04/24/2017 12:00:00 AM,04/25/2017 12:00:00 AM,04/14/2017 12:00:00 AM,2016-403352,2017-04-24T00:00:00.000,2017-04-25T00:00:00.000,2017-04-14T00:00:00.000,Done
2018OPA-0965,Done,OPA Close SA,,01/28/2019 12:00:00 AM,01/28/2019 12:00:00 AM,,,2019-01-28T00:00:00.000,2019-01-28T00:00:00.000,Done
2019OPA-0009,Done,OPA Close CL,01/30/2019 12:00:00 AM,02/01/2019 12:00:00 AM,01/25/2019 12:00:00 AM,,2019-01-30T00:00:00.000,2019-02-01T00:00:00.000,2019-01-25T00:00:00.000,Done
2019OPA-0458,Done,OPA Close CL,07/30/2019 12:00:00 AM,08/05/2019 12:00:00 AM,07/25/2019 12:00:00 AM,,2019-07-30T00:00:00.000,2019-08-05T00:00:00.000,2019-07-25T00:00:00.000,Done
2015OPA-0282,Done,OPA Close CL,,03/20/2015 12:00:00 AM,10/22/2015 12:00:00 AM,,,2015-03-20T00:00:00.000,2015-10-22T00:00:00.000,Done
2016OPA-0430,Done,OPA Close CL,05/16/2016 12:00:00 AM,05/16/2016 12:00:00 AM,05/11/2016 12:00:00 AM,,2016-05-16T00:00:00.000,2016-05-16T00:00:00.000,2016-05-11T00:00:00.000,Done
2016OPA-0806,Done,OPA Close Case,05/11/2017 12:00:00 AM,05/11/2017 12:00:00 AM,04/14/2017 12:00:00 AM,2016-251323,2017-05-11T00:00:00.000,2017-05-11T00:00:00.000,2017-04-14T00:00:00.000,Done
2017OPA-0021,Done,OPA Close CL,01/23/2017 12:00:00 AM,01/25/2017 12:00:00 AM,01/18/2017 12:00:00 AM,,2017-01-23T00:00:00.000,2017-01-25T00:00:00.000,2017-01-18T00:00:00.000,Done
2017OPA-0950,Done,OPA Chief of Police Disagreed Findings,,06/20/2018 12:00:00 AM,01/14/2019 12:00:00 AM,2017-333366,,2018-06-20T00:00:00.000,2019-01-14T00:00:00.000,Done
2018OPA-0417,Done,OPA Close Case,12/07/2018 12:00:00 AM,01/04/2019 12:00:00 AM,11/27/2018 12:00:00 AM,2018-166614,2018-12-07T00:00:00.000,2019-01-04T00:00:00.000,2018-11-27T00:00:00.000,Done
2018OPA-0566,Done,OPA Close CL,07/23/2018 12:00:00 AM,07/20/2018 12:00:00 AM,07/18/2018 12:00:00 AM,2017-459975,2018-07-23T00:00:00.000,2018-07-20T00:00:00.000,2018-07-18T00:00:00.000,Done
2018OPA-1125,Done,OPA Close CL,01/02/2019 12:00:00 AM,01/10/2019 12:00:00 AM,12/28/2018 12:00:00 AM,2018-445456,2019-01-02T00:00:00.000,2019-01-10T00:00:00.000,2018-12-28T00:00:00.000,Done
2019OPA-0582,Done,OPA Close Case,02/18/2020 12:00:00 AM,04/10/2020 12:00:00 AM,02/04/2020 12:00:00 AM,2019-293196,2020-02-18T00:00:00.000,2020-04-10T00:00:00.000,2020-02-04T00:00:00.000,Done
2019OPA-0906,Done,OPA 180 Extension Request,07/10/2020 12:00:00 AM,08/09/2020 12:00:00 AM,04/02/2020 12:00:00 AM,2019-461023,2020-07-10T00:00:00.000,2020-08-09T00:00:00.000,2020-04-02T00:00:00.000,Done
2015OPA-0292,Done,OPA Monitor DA,04/18/2015 12:00:00 AM,04/13/2015 12:00:00 AM,03/19/2015 12:00:00 AM,2014-336876,2015-04-18T00:00:00.000,2015-04-13T00:00:00.000,2015-03-19T00:00:00.000,Done
2016OPA-0036,Done,OPA Close CL,01/25/2016 12:00:00 AM,01/25/2016 12:00:00 AM,01/20/2016 12:00:00 AM,,2016-01-25T00:00:00.000,2016-01-25T00:00:00.000,2016-01-20T00:00:00.000,Done
2017OPA-0551,Done,OPA Close CL,06/23/2017 12:00:00 AM,06/15/2017 12:00:00 AM,06/13/2017 12:00:00 AM,2017-187806,2017-06-23T00:00:00.000,2017-06-15T00:00:00.000,2017-06-13T00:00:00.000,Done
2018OPA-1009,Done,OPA Close SA,,02/20/2019 12:00:00 AM,02/20/2019 12:00:00 AM,2018-385082,,2019-02-20T00:00:00.000,2019-02-20T00:00:00.000,Done
2019OPA-0500,Done,OPA Close CL,08/24/2019 12:00:00 AM,08/21/2019 12:00:00 AM,08/19/2019 12:00:00 AM,2019-262561,2019-08-24T00:00:00.000,2019-08-21T00:00:00.000,2019-08-19T00:00:00.000,Done
2019OPA-0666,Done,OPA Close SA,,10/18/2019 12:00:00 AM,10/18/2019 12:00:00 AM,,,2019-10-18T00:00:00.000,2019-10-18T00:00:00.000,Done
2015OPA-0215,Done,OPA Close CL,,03/05/2015 12:00:00 AM,10/22/2015 12:00:00 AM,2015-054957,,2015-03-05T00:00:00.000,2015-10-22T00:00:00.000,Done
2015OPA-1026,Done,OPA Close Case,12/22/2015 12:00:00 AM,12/23/2015 12:00:00 AM,12/10/2015 12:00:00 AM,2015-210026,2015-12-22T00:00:00.000,2015-12-23T00:00:00.000,2015-12-10T00:00:00.000,Done
2015OPA-1595,Done,OPA Close Case,04/12/2016 12:00:00 AM,04/12/2016 12:00:00 AM,03/29/2016 12:00:00 AM,,2016-04-12T00:00:00.000,2016-04-12T00:00:00.000,2016-03-29T00:00:00.000,Done
2016OPA-0425,Done,OPA Close Case,02/05/2017 12:00:00 AM,02/05/2017 12:00:00 AM,01/26/2017 12:00:00 AM,2016-131531,2017-02-05T00:00:00.000,2017-02-05T00:00:00.000,2017-01-26T00:00:00.000,Done
2017OPA-1059,Done,OPA Close Case,07/23/2018 12:00:00 AM,10/11/2018 12:00:00 AM,09/13/2018 12:00:00 AM,2017-374877,2018-07-23T00:00:00.000,2018-10-11T00:00:00.000,2018-09-13T00:00:00.000,Done
2018OPA-0461,Done,OPA Director Certification/Finding,12/02/2018 12:00:00 AM,11/24/2018 12:00:00 AM,01/13/2019 12:00:00 AM,2018-175510,2018-12-02T00:00:00.000,2018-11-24T00:00:00.000,2019-01-13T00:00:00.000,Done
2019OPA-0284,Done,OPA Close CL,06/03/2019 12:00:00 AM,05/31/2019 12:00:00 AM,05/29/2019 12:00:00 AM,,2019-06-03T00:00:00.000,2019-05-31T00:00:00.000,2019-05-29T00:00:00.000,Done
2015OPA-0550,Done,OPA Close CL,,04/27/2015 12:00:00 AM,10/20/2015 12:00:00 AM,,,2015-04-27T00:00:00.000,2015-10-20T00:00:00.000,Done
2015OPA-1567,Done,OPA Close SA,11/24/2015 12:00:00 AM,11/20/2015 12:00:00 AM,11/19/2015 12:00:00 AM,2015-255785,2015-11-24T00:00:00.000,2015-11-20T00:00:00.000,2015-11-19T00:00:00.000,Done
2019OPA-0088,Done,OPA Close CL,03/02/2019 12:00:00 AM,03/01/2019 12:00:00 AM,02/25/2019 12:00:00 AM,,2019-03-02T00:00:00.000,2019-03-01T00:00:00.000,2019-02-25T00:00:00.000,Done
2019OPA-0292,Done,OPA Close Case,09/22/2019 12:00:00 AM,09/24/2019 12:00:00 AM,09/12/2019 12:00:00 AM,2019-107751,2019-09-22T00:00:00.000,2019-09-24T00:00:00.000,2019-09-12T00:00:00.000,Done
2015OPA-1791,Done,OPA Close CL,11/28/2015 12:00:00 AM,11/30/2015 12:00:00 AM,11/23/2015 12:00:00 AM,,2015-11-28T00:00:00.000,2015-11-30T00:00:00.000,2015-11-23T00:00:00.000,Done
2016OPA-0318,Done,OPA Close CL,04/11/2016 12:00:00 AM,04/06/2016 12:00:00 AM,04/06/2016 12:00:00 AM,2016-094243,2016-04-11T00:00:00.000,2016-04-06T00:00:00.000,2016-04-06T00:00:00.000,Done
2016OPA-1193,Done,OPA Close CL,10/12/2016 12:00:00 AM,10/10/2016 12:00:00 AM,10/07/2016 12:00:00 AM,,2016-10-12T00:00:00.000,2016-10-10T00:00:00.000,2016-10-07T00:00:00.000,Done
2017OPA-0307,Done,OPA Send Complainant Closing Letter,04/27/2017 12:00:00 AM,04/04/2017 12:00:00 AM,03/28/2017 12:00:00 AM,,2017-04-27T00:00:00.000,2017-04-04T00:00:00.000,2017-03-28T00:00:00.000,Done
2018OPA-0615,Done,OPA Close CL,08/04/2018 12:00:00 AM,08/01/2018 12:00:00 AM,07/30/2018 12:00:00 AM,2018-079177,2018-08-04T00:00:00.000,2018-08-01T00:00:00.000,2018-07-30T00:00:00.000,Done
2016OPA-0615,Done,OPA Close CL,07/06/2016 12:00:00 AM,07/07/2016 12:00:00 AM,07/01/2016 12:00:00 AM,,2016-07-06T00:00:00.000,2016-07-07T00:00:00.000,2016-07-01T00:00:00.000,Done
2017OPA-1106,Done,OPA Training Referral,05/04/2018 12:00:00 AM,05/03/2018 12:00:00 AM,04/24/2018 12:00:00 AM,2017-397119,2018-05-04T00:00:00.000,2018-05-03T00:00:00.000,2018-04-24T00:00:00.000,Done
2018OPA-0027,Done,OPA Close Case,06/01/2018 12:00:00 AM,08/24/2018 12:00:00 AM,05/22/2018 12:00:00 AM,2017-456717,2018-06-01T00:00:00.000,2018-08-24T00:00:00.000,2018-05-22T00:00:00.000,Done
2018OPA-0182,Done,OPA Close CL,03/11/2018 12:00:00 AM,03/06/2018 12:00:00 AM,03/06/2018 12:00:00 AM,2018-037078,2018-03-11T00:00:00.000,2018-03-06T00:00:00.000,2018-03-06T00:00:00.000,Done
2018OPA-0367,Done,OPA Close SA,,06/26/2018 12:00:00 AM,06/26/2018 12:00:00 AM,2018-146143,,2018-06-26T00:00:00.000,2018-06-26T00:00:00.000,Done
2015OPA-0248,Done,OPA Close CL,,03/12/2015 12:00:00 AM,10/22/2015 12:00:00 AM,,,2015-03-12T00:00:00.000,2015-10-22T00:00:00.000,Done
2015OPA-1658,Done,OPA Close CL,12/19/2015 12:00:00 AM,12/18/2015 12:00:00 AM,12/14/2015 12:00:00 AM,,2015-12-19T00:00:00.000,2015-12-18T00:00:00.000,2015-12-14T00:00:00.000,Done
2019OPA-0892,Done,OPA Close CL,01/15/2020 12:00:00 AM,01/16/2020 12:00:00 AM,01/08/2020 12:00:00 AM,,2020-01-15T00:00:00.000,2020-01-16T00:00:00.000,2020-01-08T00:00:00.000,Done
2017OPA-1010,Done,OPA Close Case,02/21/2018 12:00:00 AM,06/15/2018 12:00:00 AM,02/09/2018 12:00:00 AM,2016-270536,2018-02-21T00:00:00.000,2018-06-15T00:00:00.000,2018-02-09T00:00:00.000,Done
2017OPA-1272,Done,OPA Send Complainant Closing Letter,01/11/2018 12:00:00 AM,01/08/2018 12:00:00 AM,12/12/2017 12:00:00 AM,,2018-01-11T00:00:00.000,2018-01-08T00:00:00.000,2017-12-12T00:00:00.000,Done
2018OPA-0389,Done,OPA Close SA,07/08/2018 12:00:00 AM,06/28/2018 12:00:00 AM,06/28/2018 12:00:00 AM,2018-097840,2018-07-08T00:00:00.000,2018-06-28T00:00:00.000,2018-06-28T00:00:00.000,Done
2019OPA-0064,Done,OPA Close CL,02/19/2019 12:00:00 AM,02/19/2019 12:00:00 AM,02/14/2019 12:00:00 AM,,2019-02-19T00:00:00.000,2019-02-19T00:00:00.000,2019-02-14T00:00:00.000,Done
2019OPA-0884,Done,OPA Close SA,,01/30/2020 12:00:00 AM,01/30/2020 12:00:00 AM,,,2020-01-30T00:00:00.000,2020-01-30T00:00:00.000,Done
2015OPA-0036,Done,OPA Close CL,,01/26/2015 12:00:00 AM,10/23/2015 12:00:00 AM,,,2015-01-26T00:00:00.000,2015-10-23T00:00:00.000,Done
2015OPA-1335,Done,OPA Close SA,10/19/2015 12:00:00 AM,10/14/2015 12:00:00 AM,10/14/2015 12:00:00 AM,2015-218739,2015-10-19T00:00:00.000,2015-10-14T00:00:00.000,2015-10-14T00:00:00.000,Done
2015OPA-1403,Done,OPA Close SA,01/31/2016 12:00:00 AM,01/26/2016 12:00:00 AM,01/26/2016 12:00:00 AM,,2016-01-31T00:00:00.000,2016-01-26T00:00:00.000,2016-01-26T00:00:00.000,Done
2016OPA-0139,Done,OPA Close Case,10/27/2016 12:00:00 AM,10/27/2016 12:00:00 AM,10/17/2016 12:00:00 AM,2015-136971,2016-10-27T00:00:00.000,2016-10-27T00:00:00.000,2016-10-17T00:00:00.000,Done
2016OPA-0678,Done,OPA Close CL,07/20/2016 12:00:00 AM,07/18/2016 12:00:00 AM,07/15/2016 12:00:00 AM,,2016-07-20T00:00:00.000,2016-07-18T00:00:00.000,2016-07-15T00:00:00.000,Done
2016OPA-0851,Done,OPA Close CL,08/16/2016 12:00:00 AM,08/15/2016 12:00:00 AM,08/11/2016 12:00:00 AM,,2016-08-16T00:00:00.000,2016-08-15T00:00:00.000,2016-08-11T00:00:00.000,Done
2017OPA-1035,Done,OPA Close CL,11/04/2017 12:00:00 AM,11/02/2017 12:00:00 AM,10/05/2017 12:00:00 AM,,2017-11-04T00:00:00.000,2017-11-02T00:00:00.000,2017-10-05T00:00:00.000,Done
2019OPA-0578,Done,OPA Close Case,02/20/2020 12:00:00 AM,04/15/2020 12:00:00 AM,02/06/2020 12:00:00 AM,2019-294943,2020-02-20T00:00:00.000,2020-04-15T00:00:00.000,2020-02-06T00:00:00.000,Done
2019OPA-0806,Done,OPA OIG Intake Classification Review,11/27/2019 12:00:00 AM,11/27/2019 12:00:00 AM,11/26/2019 12:00:00 AM,,2019-11-27T00:00:00.000,2019-11-27T00:00:00.000,2019-11-26T00:00:00.000,Done
2015OPA-0746,Done,OPA Close Case,,12/23/2015 12:00:00 AM,11/25/2015 12:00:00 AM,,,2015-12-23T00:00:00.000,2015-11-25T00:00:00.000,Done
2015OPA-1041,Done,OPA Close SA,09/09/2015 12:00:00 AM,09/04/2015 12:00:00 AM,09/04/2015 12:00:00 AM,2015-215319,2015-09-09T00:00:00.000,2015-09-04T00:00:00.000,2015-09-04T00:00:00.000,Done
2016OPA-0802,Done,OPA Close CL,08/10/2016 12:00:00 AM,08/10/2016 12:00:00 AM,08/05/2016 12:00:00 AM,,2016-08-10T00:00:00.000,2016-08-10T00:00:00.000,2016-08-05T00:00:00.000,Done
2016OPA-0988,Done,OPA Close SA,,10/24/2016 12:00:00 AM,10/24/2016 12:00:00 AM,,,2016-10-24T00:00:00.000,2016-10-24T00:00:00.000,Done
2017OPA-1187,Done,OPA Close CL,12/15/2017 12:00:00 AM,12/13/2017 12:00:00 AM,11/15/2017 12:00:00 AM,,2017-12-15T00:00:00.000,2017-12-13T00:00:00.000,2017-11-15T00:00:00.000,Done
2018OPA-0974,Done,OPA Close CL,10/23/2018 12:00:00 AM,10/18/2018 12:00:00 AM,10/18/2018 12:00:00 AM,,2018-10-23T00:00:00.000,2018-10-18T00:00:00.000,2018-10-18T00:00:00.000,Done
2020OPA-0180,Done,OPA Close CL,04/09/2020 12:00:00 AM,04/10/2020 12:00:00 AM,04/04/2020 12:00:00 AM,,2020-04-09T00:00:00.000,2020-04-10T00:00:00.000,2020-04-04T00:00:00.000,Done
2015OPA-0310,Done,OPA Close CL,,03/23/2015 12:00:00 AM,10/21/2015 12:00:00 AM,2015-061970,,2015-03-23T00:00:00.000,2015-10-21T00:00:00.000,Done
2015OPA-0696,Done,OPA Close SA,09/01/2015 12:00:00 AM,08/28/2015 12:00:00 AM,08/27/2015 12:00:00 AM,2015-149329,2015-09-01T00:00:00.000,2015-08-28T00:00:00.000,2015-08-27T00:00:00.000,Done
2015OPA-1146,Done,OPA Close CL,,08/27/2015 12:00:00 AM,10/15/2015 12:00:00 AM,2015-232690,,2015-08-27T00:00:00.000,2015-10-15T00:00:00.000,Done
2015OPA-1724,Done,OPA Close CL,,12/10/2015 12:00:00 AM,12/10/2015 12:00:00 AM,,,2015-12-10T00:00:00.000,2015-12-10T00:00:00.000,Done
2019OPA-0738,Done,OPA Close Case,02/09/2020 12:00:00 AM,02/27/2020 12:00:00 AM,01/30/2020 12:00:00 AM,,2020-02-09T00:00:00.000,2020-02-27T00:00:00.000,2020-01-30T00:00:00.000,Done
2020OPA-0047,Done,OPA Close CL,02/19/2020 12:00:00 AM,02/19/2020 12:00:00 AM,02/12/2020 12:00:00 AM,2016-084748,2020-02-19T00:00:00.000,2020-02-19T00:00:00.000,2020-02-12T00:00:00.000,Done
2016OPA-0206,Done,OPA Send Disregard Notice,03/30/2016 12:00:00 AM,03/29/2016 12:00:00 AM,03/25/2016 12:00:00 AM,2015-443809,2016-03-30T00:00:00.000,2016-03-29T00:00:00.000,2016-03-25T00:00:00.000,Done
2017OPA-0859,Done,OPA Chief of Police Disagreed Findings,,06/20/2018 12:00:00 AM,05/23/2019 12:00:00 AM,2017-309329,,2018-06-20T00:00:00.000,2019-05-23T00:00:00.000,Done
2018OPA-0744,Done,OPA Close CL,08/26/2018 12:00:00 AM,08/21/2018 12:00:00 AM,08/21/2018 12:00:00 AM,,2018-08-26T00:00:00.000,2018-08-21T00:00:00.000,2018-08-21T00:00:00.000,Done
2019OPA-0855,Done,OPA Close CL,12/28/2019 12:00:00 AM,12/26/2019 12:00:00 AM,12/18/2019 12:00:00 AM,2019-435083,2019-12-28T00:00:00.000,2019-12-26T00:00:00.000,2019-12-18T00:00:00.000,Done
2015OPA-0592,Done,OPA Director SA Review,07/06/2015 12:00:00 AM,07/21/2015 12:00:00 AM,07/01/2015 12:00:00 AM,2015-056256,2015-07-06T00:00:00.000,2015-07-21T00:00:00.000,2015-07-01T00:00:00.000,Done
2016OPA-0364,Done,OPA Close CL,04/25/2016 12:00:00 AM,04/25/2016 12:00:00 AM,04/20/2016 12:00:00 AM,,2016-04-25T00:00:00.000,2016-04-25T00:00:00.000,2016-04-20T00:00:00.000,Done
2016OPA-1108,Done,OPA Close CL,10/12/2016 12:00:00 AM,10/16/2016 12:00:00 AM,10/07/2016 12:00:00 AM,,2016-10-12T00:00:00.000,2016-10-16T00:00:00.000,2016-10-07T00:00:00.000,Done
2016OPA-1316,Done,OPA Close Case,04/17/2017 12:00:00 AM,04/17/2017 12:00:00 AM,04/07/2017 12:00:00 AM,2016-362818,2017-04-17T00:00:00.000,2017-04-17T00:00:00.000,2017-04-07T00:00:00.000,Done
2017OPA-0405,Done,OPA Close Case,01/29/2018 12:00:00 AM,01/30/2018 12:00:00 AM,10/16/2017 12:00:00 AM,2017-103361,2018-01-29T00:00:00.000,2018-01-30T00:00:00.000,2017-10-16T00:00:00.000,Done
2019OPA-0621,Done,OPA Close SA,,10/25/2019 12:00:00 AM,10/25/2019 12:00:00 AM,,,2019-10-25T00:00:00.000,2019-10-25T00:00:00.000,Done
2019OPA-0693,Done,OPA Close CL,10/19/2019 12:00:00 AM,01/09/2020 12:00:00 AM,10/14/2019 12:00:00 AM,,2019-10-19T00:00:00.000,2020-01-09T00:00:00.000,2019-10-14T00:00:00.000,Done
2020OPA-0124,Done,OPA 180 Extension Request,08/07/2020 12:00:00 AM,09/06/2020 12:00:00 AM,04/04/2020 12:00:00 AM,2020-063522,2020-08-07T00:00:00.000,2020-09-06T00:00:00.000,2020-04-04T00:00:00.000,Done
2015OPA-1287,Done,OPA Close CL,,09/18/2015 12:00:00 AM,10/14/2015 12:00:00 AM,,,2015-09-18T00:00:00.000,2015-10-14T00:00:00.000,Done
2016OPA-0353,Done,OPA Close CL,04/30/2016 12:00:00 AM,05/02/2016 12:00:00 AM,04/25/2016 12:00:00 AM,,2016-04-30T00:00:00.000,2016-05-02T00:00:00.000,2016-04-25T00:00:00.000,Done
2017OPA-0413,Done,OPA Close Case,10/28/2017 12:00:00 AM,10/31/2017 12:00:00 AM,10/18/2017 12:00:00 AM,,2017-10-28T00:00:00.000,2017-10-31T00:00:00.000,2017-10-18T00:00:00.000,Done
2017OPA-1171,Done,OPA Close Case,12/10/2017 12:00:00 AM,12/07/2017 12:00:00 AM,11/13/2017 12:00:00 AM,,2017-12-10T00:00:00.000,2017-12-07T00:00:00.000,2017-11-13T00:00:00.000,Done
2015OPA-0096,Done,OPA Close Case,07/31/2015 12:00:00 AM,07/31/2015 12:00:00 AM,07/20/2015 12:00:00 AM,2015-024377,2015-07-31T00:00:00.000,2015-07-31T00:00:00.000,2015-07-20T00:00:00.000,Done
2018OPA-0704,Done,OPA Training Referral,02/10/2019 12:00:00 AM,02/12/2019 12:00:00 AM,02/12/2019 12:00:00 AM,2018-146018,2019-02-10T00:00:00.000,2019-02-12T00:00:00.000,2019-02-12T00:00:00.000,Done
2019OPA-0900,Done,OPA Case Assignment,01/11/2020 12:00:00 AM,01/11/2020 12:00:00 AM,01/11/2020 12:00:00 AM,,2020-01-11T00:00:00.000,2020-01-11T00:00:00.000,2020-01-11T00:00:00.000,Done
2017OPA-1183,Done,OPA Close CL,12/13/2017 12:00:00 AM,12/11/2017 12:00:00 AM,12/08/2017 12:00:00 AM,2017-418547,2017-12-13T00:00:00.000,2017-12-11T00:00:00.000,2017-12-08T00:00:00.000,Done
2018OPA-0181,Done,OPA Close SA,,05/10/2018 12:00:00 AM,05/10/2018 12:00:00 AM,2017-425959,,2018-05-10T00:00:00.000,2018-05-10T00:00:00.000,Done
2018OPA-0651,Done,OPA Close Case,01/27/2019 12:00:00 AM,01/23/2019 12:00:00 AM,01/17/2019 12:00:00 AM,2018-255290,2019-01-27T00:00:00.000,2019-01-23T00:00:00.000,2019-01-17T00:00:00.000,Done
2015OPA-1276,Done,OPA Close CL,,09/03/2015 12:00:00 AM,10/15/2015 12:00:00 AM,,,2015-09-03T00:00:00.000,2015-10-15T00:00:00.000,Done
2016OPA-0375,Done,OPA Close Case,12/14/2016 12:00:00 AM,12/13/2016 12:00:00 AM,11/02/2016 12:00:00 AM,2016-118323,2016-12-14T00:00:00.000,2016-12-13T00:00:00.000,2016-11-02T00:00:00.000,Done
2016OPA-0777,Done,OPA Send Complainant Closing Letter,08/08/2016 12:00:00 AM,08/10/2016 12:00:00 AM,08/03/2016 12:00:00 AM,,2016-08-08T00:00:00.000,2016-08-10T00:00:00.000,2016-08-03T00:00:00.000,Done
2017OPA-0621,Done,OPA Close CL,07/19/2017 12:00:00 AM,07/19/2017 12:00:00 AM,07/14/2017 12:00:00 AM,2010-095269,2017-07-19T00:00:00.000,2017-07-19T00:00:00.000,2017-07-14T00:00:00.000,Done
2017OPA-1319,Done,OPA Close Case,01/29/2018 12:00:00 AM,01/24/2018 12:00:00 AM,01/24/2018 12:00:00 AM,2017-460568,2018-01-29T00:00:00.000,2018-01-24T00:00:00.000,2018-01-24T00:00:00.000,Done
2018OPA-0411,Done,OPA Close CL,06/12/2018 12:00:00 AM,06/08/2018 12:00:00 AM,06/06/2018 12:00:00 AM,,2018-06-12T00:00:00.000,2018-06-08T00:00:00.000,2018-06-06T00:00:00.000,Done
2018OPA-0544,Done,OPA Close Case,09/20/2018 12:00:00 AM,09/10/2018 12:00:00 AM,09/10/2018 12:00:00 AM,,2018-09-20T00:00:00.000,2018-09-10T00:00:00.000,2018-09-10T00:00:00.000,Done
2015OPA-0388,Done,OPA Close CL,,03/30/2015 12:00:00 AM,10/20/2015 12:00:00 AM,,,2015-03-30T00:00:00.000,2015-10-20T00:00:00.000,Done
2015OPA-1726,Done,OPA Close SA,01/04/2016 12:00:00 AM,12/30/2015 12:00:00 AM,12/30/2015 12:00:00 AM,,2016-01-04T00:00:00.000,2015-12-30T00:00:00.000,2015-12-30T00:00:00.000,Done
2016OPA-0505,Done,OPA Close CL,05/23/2016 12:00:00 AM,05/23/2016 12:00:00 AM,05/18/2016 12:00:00 AM,,2016-05-23T00:00:00.000,2016-05-23T00:00:00.000,2016-05-18T00:00:00.000,Done
2017OPA-1056,Done,OPA Close Case,03/31/2018 12:00:00 AM,07/30/2018 12:00:00 AM,03/21/2018 12:00:00 AM,,2018-03-31T00:00:00.000,2018-07-30T00:00:00.000,2018-03-21T00:00:00.000,Done
2018OPA-0040,Done,OPA Close Case,02/08/2018 12:00:00 AM,01/31/2018 12:00:00 AM,01/09/2018 12:00:00 AM,2017-431732,2018-02-08T00:00:00.000,2018-01-31T00:00:00.000,2018-01-09T00:00:00.000,Done
2015OPA-0538,Done,OPA Close CL,,04/27/2015 12:00:00 AM,10/20/2015 12:00:00 AM,,,2015-04-27T00:00:00.000,2015-10-20T00:00:00.000,Done
2015OPA-0651,Done,OPA Close SA,08/22/2015 12:00:00 AM,08/19/2015 12:00:00 AM,08/17/2015 12:00:00 AM,2015-048630,2015-08-22T00:00:00.000,2015-08-19T00:00:00.000,2015-08-17T00:00:00.000,Done
2015OPA-0909,Done,OPA Close SA,09/02/2015 12:00:00 AM,08/28/2015 12:00:00 AM,08/28/2015 12:00:00 AM,,2015-09-02T00:00:00.000,2015-08-28T00:00:00.000,2015-08-28T00:00:00.000,Done
2016OPA-0896,Done,OPA Close CL,08/31/2016 12:00:00 AM,08/29/2016 12:00:00 AM,08/26/2016 12:00:00 AM,,2016-08-31T00:00:00.000,2016-08-29T00:00:00.000,2016-08-26T00:00:00.000,Done
2016OPA-1261,Done,OPA Close SA,,11/30/2016 12:00:00 AM,11/30/2016 12:00:00 AM,2016-357240,,2016-11-30T00:00:00.000,2016-11-30T00:00:00.000,Done
2017OPA-0676,Done,OPA Close SA,,11/20/2017 12:00:00 AM,11/20/2017 12:00:00 AM,2017-215963,,2017-11-20T00:00:00.000,2017-11-20T00:00:00.000,Done
2015OPA-1477,Done,OPA Close CL,,10/27/2015 12:00:00 AM,10/27/2015 12:00:00 AM,,,2015-10-27T00:00:00.000,2015-10-27T00:00:00.000,Done
2016OPA-0069,Done,OPA Close CL,02/16/2016 12:00:00 AM,02/12/2016 12:00:00 AM,02/11/2016 12:00:00 AM,,2016-02-16T00:00:00.000,2016-02-12T00:00:00.000,2016-02-11T00:00:00.000,Done
2016OPA-0913,Done,OPA Close CL,08/31/2016 12:00:00 AM,08/29/2016 12:00:00 AM,08/26/2016 12:00:00 AM,,2016-08-31T00:00:00.000,2016-08-29T00:00:00.000,2016-08-26T00:00:00.000,Done
2018OPA-0604,Done,OPA Close Case,12/14/2018 12:00:00 AM,01/10/2019 12:00:00 AM,12/04/2018 12:00:00 AM,2018-228327,2018-12-14T00:00:00.000,2019-01-10T00:00:00.000,2018-12-04T00:00:00.000,Done
2018OPA-0679,Done,OPA Close CL,08/21/2018 12:00:00 AM,08/21/2018 12:00:00 AM,08/16/2018 12:00:00 AM,,2018-08-21T00:00:00.000,2018-08-21T00:00:00.000,2018-08-16T00:00:00.000,Done
2018OPA-1082,Done,OPA Training Referral,05/18/2019 12:00:00 AM,06/18/2019 12:00:00 AM,05/08/2019 12:00:00 AM,,2019-05-18T00:00:00.000,2019-06-18T00:00:00.000,2019-05-08T00:00:00.000,Done
2019OPA-0069,Done,OPA Close Case,08/08/2019 12:00:00 AM,08/28/2019 12:00:00 AM,07/29/2019 12:00:00 AM,2019-014258,2019-08-08T00:00:00.000,2019-08-28T00:00:00.000,2019-07-29T00:00:00.000,Done
2020OPA-0082,Done,OPA 180 Extension Request,08/28/2020 12:00:00 AM,09/27/2020 12:00:00 AM,04/04/2020 12:00:00 AM,2020-038646,2020-08-28T00:00:00.000,2020-09-27T00:00:00.000,2020-04-04T00:00:00.000,Done
2015OPA-1157,Done,OPA Close CL,,08/27/2015 12:00:00 AM,10/15/2015 12:00:00 AM,,,2015-08-27T00:00:00.000,2015-10-15T00:00:00.000,Done
2019OPA-0491,Done,OPA Close SA,,10/02/2019 12:00:00 AM,10/02/2019 12:00:00 AM,2019-242644,,2019-10-02T00:00:00.000,2019-10-02T00:00:00.000,Done
2019OPA-0572,Done,OPA Close SA,,10/10/2019 12:00:00 AM,10/10/2019 12:00:00 AM,,,2019-10-10T00:00:00.000,2019-10-10T00:00:00.000,Done
2015OPA-1776,Done,OPA Close CL,11/30/2015 12:00:00 AM,11/30/2015 12:00:00 AM,11/25/2015 12:00:00 AM,,2015-11-30T00:00:00.000,2015-11-30T00:00:00.000,2015-11-25T00:00:00.000,Done
2016OPA-0080,Done,OPA Appeal Findings Reversed,,12/07/2016 12:00:00 AM,12/21/2016 12:00:00 AM,2015-337427,,2016-12-07T00:00:00.000,2016-12-21T00:00:00.000,Done
2017OPA-0685,Done,OPA Close Case,01/12/2018 12:00:00 AM,04/13/2018 12:00:00 AM,01/12/2018 12:00:00 AM,2017-245131,2018-01-12T00:00:00.000,2018-04-13T00:00:00.000,2018-01-12T00:00:00.000,Done
2017OPA-1252,Done,OPA Close CL,01/04/2018 12:00:00 AM,12/29/2017 12:00:00 AM,12/05/2017 12:00:00 AM,,2018-01-04T00:00:00.000,2017-12-29T00:00:00.000,2017-12-05T00:00:00.000,Done
2018OPA-0901,Done,OPA Close Case,03/07/2019 12:00:00 AM,03/07/2019 12:00:00 AM,02/25/2019 12:00:00 AM,2018-330389,2019-03-07T00:00:00.000,2019-03-07T00:00:00.000,2019-02-25T00:00:00.000,Done
2017OPA-0928,Done,OPA Close CL,10/07/2017 12:00:00 AM,10/03/2017 12:00:00 AM,10/02/2017 12:00:00 AM,,2017-10-07T00:00:00.000,2017-10-03T00:00:00.000,2017-10-02T00:00:00.000,Done
2015OPA-0065,Done,OPA Close CL,,01/26/2015 12:00:00 AM,10/23/2015 12:00:00 AM,,,2015-01-26T00:00:00.000,2015-10-23T00:00:00.000,Done
2015OPA-0456,Done,OPA Close Case,,09/11/2015 12:00:00 AM,08/31/2015 12:00:00 AM,,,2015-09-11T00:00:00.000,2015-08-31T00:00:00.000,Done
2018OPA-0397,Done,OPA Close SA,08/02/2018 12:00:00 AM,07/23/2018 12:00:00 AM,07/23/2018 12:00:00 AM,,2018-08-02T00:00:00.000,2018-07-23T00:00:00.000,2018-07-23T00:00:00.000,Done
2018OPA-0852,Done,OPA Close CL,09/29/2018 12:00:00 AM,09/28/2018 12:00:00 AM,09/24/2018 12:00:00 AM,,2018-09-29T00:00:00.000,2018-09-28T00:00:00.000,2018-09-24T00:00:00.000,Done
2019OPA-0701,Done,OPA Close CL,,10/03/2019 12:00:00 AM,10/09/2019 12:00:00 AM,2019-351895,,2019-10-03T00:00:00.000,2019-10-09T00:00:00.000,Done
2015OPA-1664,Done,OPA Close Case,05/26/2016 12:00:00 AM,05/13/2016 12:00:00 AM,05/06/2016 12:00:00 AM,,2016-05-26T00:00:00.000,2016-05-13T00:00:00.000,2016-05-06T00:00:00.000,Done
2017OPA-0116,Done,OPA Close CL,02/21/2017 12:00:00 AM,02/22/2017 12:00:00 AM,02/16/2017 12:00:00 AM,,2017-02-21T00:00:00.000,2017-02-22T00:00:00.000,2017-02-16T00:00:00.000,Done
2017OPA-0159,Done,OPA Close CL,02/28/2017 12:00:00 AM,02/27/2017 12:00:00 AM,02/18/2017 12:00:00 AM,,2017-02-28T00:00:00.000,2017-02-27T00:00:00.000,2017-02-18T00:00:00.000,Done
2015OPA-0113,Done,OPA Close CL,,02/13/2015 12:00:00 AM,10/22/2015 12:00:00 AM,,,2015-02-13T00:00:00.000,2015-10-22T00:00:00.000,Done
2015OPA-1682,Done,OPA Close SA,12/19/2015 12:00:00 AM,12/15/2015 12:00:00 AM,12/14/2015 12:00:00 AM,,2015-12-19T00:00:00.000,2015-12-15T00:00:00.000,2015-12-14T00:00:00.000,Done
2016OPA-0290,Done,OPA Close CL,04/19/2016 12:00:00 AM,04/19/2016 12:00:00 AM,04/19/2016 12:00:00 AM,,2016-04-19T00:00:00.000,2016-04-19T00:00:00.000,2016-04-19T00:00:00.000,Done
2016OPA-0614,Done,OPA Send Complainant Closing Letter,07/06/2016 12:00:00 AM,07/07/2016 12:00:00 AM,07/01/2016 12:00:00 AM,,2016-07-06T00:00:00.000,2016-07-07T00:00:00.000,2016-07-01T00:00:00.000,Done
2017OPA-0870,Done,OPA Close CL,09/23/2017 12:00:00 AM,09/19/2017 12:00:00 AM,09/18/2017 12:00:00 AM,,2017-09-23T00:00:00.000,2017-09-19T00:00:00.000,2017-09-18T00:00:00.000,Done
2018OPA-0821,Done,OPA Close Case,02/07/2019 12:00:00 AM,02/19/2019 12:00:00 AM,01/28/2019 12:00:00 AM,2018-307179,2019-02-07T00:00:00.000,2019-02-19T00:00:00.000,2019-01-28T00:00:00.000,Done
2019OPA-0018,Done,OPA Close CL,02/03/2019 12:00:00 AM,02/01/2019 12:00:00 AM,01/29/2019 12:00:00 AM,,2019-02-03T00:00:00.000,2019-02-01T00:00:00.000,2019-01-29T00:00:00.000,Done
2019OPA-0700,Done,OPA Close Case,02/09/2020 12:00:00 AM,04/21/2020 12:00:00 AM,01/30/2020 12:00:00 AM,2019-348272,2020-02-09T00:00:00.000,2020-04-21T00:00:00.000,2020-01-30T00:00:00.000,Done
2015OPA-0125,Done,OPA Close CL,,02/18/2015 12:00:00 AM,10/22/2015 12:00:00 AM,2014-222942,,2015-02-18T00:00:00.000,2015-10-22T00:00:00.000,Done
2015OPA-0289,Done,OPA Close CL,,03/23/2015 12:00:00 AM,10/21/2015 12:00:00 AM,,,2015-03-23T00:00:00.000,2015-10-21T00:00:00.000,Done
2015OPA-1643,Done,OPA Close Case,05/02/2016 12:00:00 AM,05/03/2016 12:00:00 AM,04/18/2016 12:00:00 AM,,2016-05-02T00:00:00.000,2016-05-03T00:00:00.000,2016-04-18T00:00:00.000,Done
2016OPA-1097,Done,OPA Close Case,07/07/2017 12:00:00 AM,07/21/2017 12:00:00 AM,06/16/2017 12:00:00 AM,,2017-07-07T00:00:00.000,2017-07-21T00:00:00.000,2017-06-16T00:00:00.000,Done
2018OPA-0594,Done,OPA Close CL,08/04/2018 12:00:00 AM,08/07/2018 12:00:00 AM,07/30/2018 12:00:00 AM,,2018-08-04T00:00:00.000,2018-08-07T00:00:00.000,2018-07-30T00:00:00.000,Done
2019OPA-0393,Done,OPA Close Case,12/19/2019 12:00:00 AM,12/18/2019 12:00:00 AM,12/09/2019 12:00:00 AM,2019-195273,2019-12-19T00:00:00.000,2019-12-18T00:00:00.000,2019-12-09T00:00:00.000,Done
2016OPA-0073,Done,OPA Close CL,02/01/2016 12:00:00 AM,01/28/2016 12:00:00 AM,01/27/2016 12:00:00 AM,2016-028952,2016-02-01T00:00:00.000,2016-01-28T00:00:00.000,2016-01-27T00:00:00.000,Done
2016OPA-1020,Done,OPA Close CL,09/25/2016 12:00:00 AM,09/20/2016 12:00:00 AM,09/20/2016 12:00:00 AM,2016-300937,2016-09-25T00:00:00.000,2016-09-20T00:00:00.000,2016-09-20T00:00:00.000,Done
2016OPA-1522,Done,OPA Close CL,01/31/2017 12:00:00 AM,01/26/2017 12:00:00 AM,01/26/2017 12:00:00 AM,,2017-01-31T00:00:00.000,2017-01-26T00:00:00.000,2017-01-26T00:00:00.000,Done
2015OPA-0031,Done,OPA Director SA Review,03/07/2015 12:00:00 AM,03/11/2015 12:00:00 AM,03/02/2015 12:00:00 AM,2014-354808,2015-03-07T00:00:00.000,2015-03-11T00:00:00.000,2015-03-02T00:00:00.000,Done
2015OPA-0953,Done,OPA Close CL,,08/09/2015 12:00:00 AM,10/15/2015 12:00:00 AM,,,2015-08-09T00:00:00.000,2015-10-15T00:00:00.000,Done
2015OPA-1275,Done,OPA Close CL,,09/03/2015 12:00:00 AM,10/15/2015 12:00:00 AM,2015-278089,,2015-09-03T00:00:00.000,2015-10-15T00:00:00.000,Done
2019OPA-0478,Done,OPA Process SA,,08/07/2019 12:00:00 AM,08/07/2019 12:00:00 AM,2019-096201,,2019-08-07T00:00:00.000,2019-08-07T00:00:00.000,Done
2020OPA-0015,Done,OPA Close SA,,02/28/2020 12:00:00 AM,02/28/2020 12:00:00 AM,2020-004139,,2020-02-28T00:00:00.000,2020-02-28T00:00:00.000,Done
2020OPA-0252,Done,OPA OIG Intake Classification Review,05/05/2020 12:00:00 AM,05/04/2020 12:00:00 AM,04/29/2020 12:00:00 AM,2020-083869,2020-05-05T00:00:00.000,2020-05-04T00:00:00.000,2020-04-29T00:00:00.000,Done
2016OPA-0517,Done,OPA Close CL,06/20/2016 12:00:00 AM,06/15/2016 12:00:00 AM,06/15/2016 12:00:00 AM,2016-062644,2016-06-20T00:00:00.000,2016-06-15T00:00:00.000,2016-06-15T00:00:00.000,Done
2016OPA-1346,Done,OPA Send Complainant Closing Letter,12/15/2016 12:00:00 AM,11/30/2016 12:00:00 AM,11/15/2016 12:00:00 AM,,2016-12-15T00:00:00.000,2016-11-30T00:00:00.000,2016-11-15T00:00:00.000,Done
2017OPA-0005,Done,OPA TAC Notification,03/11/2019 12:00:00 AM,03/11/2019 12:00:00 AM,03/05/2019 12:00:00 AM,2016-401104,2019-03-11T00:00:00.000,2019-03-11T00:00:00.000,2019-03-05T00:00:00.000,Done
2017OPA-0058,Done,OPA Close CL,02/26/2017 12:00:00 AM,02/22/2017 12:00:00 AM,02/16/2017 12:00:00 AM,,2017-02-26T00:00:00.000,2017-02-22T00:00:00.000,2017-02-16T00:00:00.000,Done
2017OPA-1082,Done,OPA Close CL,11/15/2017 12:00:00 AM,10/24/2017 12:00:00 AM,10/17/2017 12:00:00 AM,,2017-11-15T00:00:00.000,2017-10-24T00:00:00.000,2017-10-17T00:00:00.000,Done
2018OPA-0935,Done,OPA Close CL,10/20/2018 12:00:00 AM,10/19/2018 12:00:00 AM,10/15/2018 12:00:00 AM,,2018-10-20T00:00:00.000,2018-10-19T00:00:00.000,2018-10-15T00:00:00.000,Done
2015OPA-0825,Done,OPA Close SA,08/03/2015 12:00:00 AM,07/29/2015 12:00:00 AM,07/29/2015 12:00:00 AM,,2015-08-03T00:00:00.000,2015-07-29T00:00:00.000,2015-07-29T00:00:00.000,Done
2015OPA-1519,Done,OPA Close SA,11/24/2015 12:00:00 AM,11/20/2015 12:00:00 AM,11/19/2015 12:00:00 AM,,2015-11-24T00:00:00.000,2015-11-20T00:00:00.000,2015-11-19T00:00:00.000,Done
2019OPA-0924,Done,OPA Close SA,,02/19/2020 12:00:00 AM,02/19/2020 12:00:00 AM,2019-470127,,2020-02-19T00:00:00.000,2020-02-19T00:00:00.000,Done
2016OPA-0668,Done,OPA Close Case,03/06/2017 12:00:00 AM,03/17/2017 12:00:00 AM,02/23/2017 12:00:00 AM,,2017-03-06T00:00:00.000,2017-03-17T00:00:00.000,2017-02-23T00:00:00.000,Done
2017OPA-0414,Done,OPA Close CL,05/20/2017 12:00:00 AM,05/16/2017 12:00:00 AM,05/12/2017 12:00:00 AM,,2017-05-20T00:00:00.000,2017-05-16T00:00:00.000,2017-05-12T00:00:00.000,Done
2015OPA-0268,Done,OPA Monitor ICV SAN,04/08/2015 12:00:00 AM,03/20/2015 12:00:00 AM,03/09/2015 12:00:00 AM,2015-013190,2015-04-08T00:00:00.000,2015-03-20T00:00:00.000,2015-03-09T00:00:00.000,Done
2015OPA-0474,Done,OPA Close Case,10/02/2015 12:00:00 AM,10/02/2015 12:00:00 AM,09/23/2015 12:00:00 AM,2014-431136,2015-10-02T00:00:00.000,2015-10-02T00:00:00.000,2015-09-23T00:00:00.000,Done
2015OPA-1096,Done,OPA Close SA,10/20/2015 12:00:00 AM,10/16/2015 12:00:00 AM,10/15/2015 12:00:00 AM,,2015-10-20T00:00:00.000,2015-10-16T00:00:00.000,2015-10-15T00:00:00.000,Done
2016OPA-0232,Done,OPA Close Case,10/15/2016 12:00:00 AM,10/17/2016 12:00:00 AM,10/04/2016 12:00:00 AM,2016-072094,2016-10-15T00:00:00.000,2016-10-17T00:00:00.000,2016-10-04T00:00:00.000,Done
2019OPA-0672,Done,OPA Classification,10/19/2019 12:00:00 AM,10/19/2019 12:00:00 AM,10/19/2019 12:00:00 AM,2019-330114,2019-10-19T00:00:00.000,2019-10-19T00:00:00.000,2019-10-19T00:00:00.000,Done
2016OPA-1113,Done,OPA Close Case,03/17/2017 12:00:00 AM,03/29/2017 12:00:00 AM,03/07/2017 12:00:00 AM,,2017-03-17T00:00:00.000,2017-03-29T00:00:00.000,2017-03-07T00:00:00.000,Done
2017OPA-0708,Done,OPA Training Referral,01/06/2018 12:00:00 AM,05/22/2018 12:00:00 AM,12/27/2017 12:00:00 AM,2017-234969,2018-01-06T00:00:00.000,2018-05-22T00:00:00.000,2017-12-27T00:00:00.000,Done
2018OPA-0314,Done,OPA Close SA,,06/28/2018 12:00:00 AM,06/28/2018 12:00:00 AM,,,2018-06-28T00:00:00.000,2018-06-28T00:00:00.000,Done
2019OPA-0175,Done,OPA Close CL,04/27/2019 12:00:00 AM,04/23/2019 12:00:00 AM,04/22/2019 12:00:00 AM,,2019-04-27T00:00:00.000,2019-04-23T00:00:00.000,2019-04-22T00:00:00.000,Done
2015OPA-0084,Done,OPA Close Case,07/28/2015 12:00:00 AM,07/28/2015 12:00:00 AM,07/14/2015 12:00:00 AM,2013-457904,2015-07-28T00:00:00.000,2015-07-28T00:00:00.000,2015-07-14T00:00:00.000,Done
2015OPA-0491,Done,OPA Close Case,03/09/2016 12:00:00 AM,03/16/2016 12:00:00 AM,02/25/2016 12:00:00 AM,2014-417754,2016-03-09T00:00:00.000,2016-03-16T00:00:00.000,2016-02-25T00:00:00.000,Done
2016OPA-0200,Done,OPA Close SA,04/12/2016 12:00:00 AM,04/20/2016 12:00:00 AM,03/28/2016 12:00:00 AM,2016-063029,2016-04-12T00:00:00.000,2016-04-20T00:00:00.000,2016-03-28T00:00:00.000,Done
2019OPA-0789,Done,OPA 180 Extension Request,05/20/2020 12:00:00 AM,06/19/2020 12:00:00 AM,04/02/2020 12:00:00 AM,,2020-05-20T00:00:00.000,2020-06-19T00:00:00.000,2020-04-02T00:00:00.000,Done
2016OPA-0225,Done,OPA Close SA,04/27/2016 12:00:00 AM,04/20/2016 12:00:00 AM,04/12/2016 12:00:00 AM,,2016-04-27T00:00:00.000,2016-04-20T00:00:00.000,2016-04-12T00:00:00.000,Done
2016OPA-1302,Done,OPA Close CL,11/28/2016 12:00:00 AM,11/23/2016 12:00:00 AM,11/01/2016 12:00:00 AM,2016-376465,2016-11-28T00:00:00.000,2016-11-23T00:00:00.000,2016-11-01T00:00:00.000,Done
2018OPA-0347,Done,OPA Training Referral,,10/20/2018 12:00:00 AM,03/11/2019 12:00:00 AM,2018-127166,,2018-10-20T00:00:00.000,2019-03-11T00:00:00.000,Done
2018OPA-1119,Done,OPA Close CL,12/10/2018 12:00:00 AM,12/12/2018 12:00:00 AM,12/04/2018 12:00:00 AM,,2018-12-10T00:00:00.000,2018-12-12T00:00:00.000,2018-12-04T00:00:00.000,Done
2019OPA-0437,Done,OPA Training Referral,05/01/2020 12:00:00 AM,03/26/2020 12:00:00 AM,04/10/2020 12:00:00 AM,,2020-05-01T00:00:00.000,2020-03-26T00:00:00.000,2020-04-10T00:00:00.000,Done
2016OPA-0020,Done,OPA Close CL,02/09/2016 12:00:00 AM,02/05/2016 12:00:00 AM,02/04/2016 12:00:00 AM,2015-428908,2016-02-09T00:00:00.000,2016-02-05T00:00:00.000,2016-02-04T00:00:00.000,Done
2016OPA-1528,Done,OPA Close SA,,02/21/2017 12:00:00 AM,02/21/2017 12:00:00 AM,,,2017-02-21T00:00:00.000,2017-02-21T00:00:00.000,Done
2018OPA-0128,Done,OPA Close CL,03/08/2018 12:00:00 AM,02/14/2018 12:00:00 AM,02/08/2018 12:00:00 AM,,2018-03-08T00:00:00.000,2018-02-14T00:00:00.000,2018-02-08T00:00:00.000,Done
2018OPA-0932,Done,OPA Close SA,,11/26/2018 12:00:00 AM,11/26/2018 12:00:00 AM,2018-354668,,2018-11-26T00:00:00.000,2018-11-26T00:00:00.000,Done
2019OPA-0914,Done,OPA Director Certification/Finding,06/16/2020 12:00:00 AM,02/26/2020 12:00:00 AM,01/15/2020 12:00:00 AM,2019-469089,2020-06-16T00:00:00.000,2020-02-26T00:00:00.000,2020-01-15T00:00:00.000,Done
2015OPA-0694,Done,OPA Close CL,,06/08/2015 12:00:00 AM,10/19/2015 12:00:00 AM,,,2015-06-08T00:00:00.000,2015-10-19T00:00:00.000,Done
2016OPA-0536,Done,OPA Close CL,06/12/2016 12:00:00 AM,06/09/2016 12:00:00 AM,06/07/2016 12:00:00 AM,,2016-06-12T00:00:00.000,2016-06-09T00:00:00.000,2016-06-07T00:00:00.000,Done
2016OPA-0685,Done,OPA Close CL,07/16/2016 12:00:00 AM,07/13/2016 12:00:00 AM,07/11/2016 12:00:00 AM,,2016-07-16T00:00:00.000,2016-07-13T00:00:00.000,2016-07-11T00:00:00.000,Done
2018OPA-0224,Done,OPA Close CL,04/01/2018 12:00:00 AM,04/12/2018 12:00:00 AM,03/27/2018 12:00:00 AM,,2018-04-01T00:00:00.000,2018-04-12T00:00:00.000,2018-03-27T00:00:00.000,Done
2019OPA-0030,Done,OPA Close Case,10/05/2019 12:00:00 AM,09/27/2019 12:00:00 AM,09/25/2019 12:00:00 AM,,2019-10-05T00:00:00.000,2019-09-27T00:00:00.000,2019-09-25T00:00:00.000,Done
2019OPA-0113,Done,OPA Close CL,03/02/2019 12:00:00 AM,03/06/2019 12:00:00 AM,02/25/2019 12:00:00 AM,2019-049379,2019-03-02T00:00:00.000,2019-03-06T00:00:00.000,2019-02-25T00:00:00.000,Done
2016OPA-0204,Done,OPA Close CL,03/01/2016 12:00:00 AM,02/29/2016 12:00:00 AM,02/25/2016 12:00:00 AM,2015-413562,2016-03-01T00:00:00.000,2016-02-29T00:00:00.000,2016-02-25T00:00:00.000,Done
2016OPA-0419,Done,OPA Close CL,05/07/2016 12:00:00 AM,05/04/2016 12:00:00 AM,05/02/2016 12:00:00 AM,,2016-05-07T00:00:00.000,2016-05-04T00:00:00.000,2016-05-02T00:00:00.000,Done
2017OPA-0097,Done,OPA Send Complainant Closing Letter,02/21/2017 12:00:00 AM,02/27/2017 12:00:00 AM,02/16/2017 12:00:00 AM,2017-030656,2017-02-21T00:00:00.000,2017-02-27T00:00:00.000,2017-02-16T00:00:00.000,Done
2017OPA-0282,Done,OPA Close Case,09/15/2017 12:00:00 AM,09/25/2017 12:00:00 AM,09/14/2017 12:00:00 AM,,2017-09-15T00:00:00.000,2017-09-25T00:00:00.000,2017-09-14T00:00:00.000,Done
2017OPA-0422,Done,OPA Close CL,05/21/2017 12:00:00 AM,05/17/2017 12:00:00 AM,05/16/2017 12:00:00 AM,,2017-05-21T00:00:00.000,2017-05-17T00:00:00.000,2017-05-16T00:00:00.000,Done
2017OPA-1298,Done,OPA Close Case,06/08/2018 12:00:00 AM,08/24/2018 12:00:00 AM,05/29/2018 12:00:00 AM,2017-461972,2018-06-08T00:00:00.000,2018-08-24T00:00:00.000,2018-05-29T00:00:00.000,Done
2018OPA-0529,Done,OPA Close CL,07/16/2018 12:00:00 AM,07/11/2018 12:00:00 AM,07/11/2018 12:00:00 AM,,2018-07-16T00:00:00.000,2018-07-11T00:00:00.000,2018-07-11T00:00:00.000,Done
2015OPA-1651,Done,OPA Close Case,11/26/2016 12:00:00 AM,12/09/2016 12:00:00 AM,11/21/2016 12:00:00 AM,,2016-11-26T00:00:00.000,2016-12-09T00:00:00.000,2016-11-21T00:00:00.000,Done
2019OPA-0654,Done,OPA Close CL,10/08/2019 12:00:00 AM,10/11/2019 12:00:00 AM,10/01/2019 12:00:00 AM,,2019-10-08T00:00:00.000,2019-10-11T00:00:00.000,2019-10-01T00:00:00.000,Done
2017OPA-0874,Done,OPA Close CL,09/23/2017 12:00:00 AM,09/20/2017 12:00:00 AM,09/18/2017 12:00:00 AM,,2017-09-23T00:00:00.000,2017-09-20T00:00:00.000,2017-09-18T00:00:00.000,Done
2018OPA-0087,Done,OPA Close Case,01/25/2019 12:00:00 AM,02/13/2019 12:00:00 AM,01/15/2019 12:00:00 AM,2018-026855,2019-01-25T00:00:00.000,2019-02-13T00:00:00.000,2019-01-15T00:00:00.000,Done
2018OPA-0300,Done,OPA Close Case,09/27/2018 12:00:00 AM,10/23/2018 12:00:00 AM,10/23/2018 12:00:00 AM,2018-103318,2018-09-27T00:00:00.000,2018-10-23T00:00:00.000,2018-10-23T00:00:00.000,Done
2018OPA-0812,Done,OPA Close Case,02/15/2019 12:00:00 AM,02/20/2019 12:00:00 AM,02/05/2019 12:00:00 AM,2018-290705,2019-02-15T00:00:00.000,2019-02-20T00:00:00.000,2019-02-05T00:00:00.000,Done
2018OPA-0867,Done,OPA Close CL,10/03/2018 12:00:00 AM,09/28/2018 12:00:00 AM,09/28/2018 12:00:00 AM,2014-412453,2018-10-03T00:00:00.000,2018-09-28T00:00:00.000,2018-09-28T00:00:00.000,Done
2019OPA-0548,Done,OPA Close CL,09/07/2019 12:00:00 AM,09/09/2019 12:00:00 AM,08/30/2019 12:00:00 AM,2019-287328,2019-09-07T00:00:00.000,2019-09-09T00:00:00.000,2019-08-30T00:00:00.000,Done
2015OPA-0775,Done,OPA Training Referral,02/02/2016 12:00:00 AM,02/08/2016 12:00:00 AM,11/02/2015 12:00:00 AM,2015-093682,2016-02-02T00:00:00.000,2016-02-08T00:00:00.000,2015-11-02T00:00:00.000,Done
2017OPA-0485,Done,OPA Close SA,,07/05/2017 12:00:00 AM,07/05/2017 12:00:00 AM,2017-097147,,2017-07-05T00:00:00.000,2017-07-05T00:00:00.000,Done
2017OPA-0784,Done,OPA Close CL,08/23/2017 12:00:00 AM,08/22/2017 12:00:00 AM,08/18/2017 12:00:00 AM,,2017-08-23T00:00:00.000,2017-08-22T00:00:00.000,2017-08-18T00:00:00.000,Done
2018OPA-0257,Done,OPA Close CL,04/21/2018 12:00:00 AM,04/25/2018 12:00:00 AM,04/16/2018 12:00:00 AM,,2018-04-21T00:00:00.000,2018-04-25T00:00:00.000,2018-04-16T00:00:00.000,Done
2018OPA-1137,Done,OPA Close Case,02/10/2019 12:00:00 AM,01/31/2019 12:00:00 AM,01/31/2019 12:00:00 AM,,2019-02-10T00:00:00.000,2019-01-31T00:00:00.000,2019-01-31T00:00:00.000,Done
2015OPA-1687,Done,OPA Close CL,11/30/2015 12:00:00 AM,11/30/2015 12:00:00 AM,11/25/2015 12:00:00 AM,,2015-11-30T00:00:00.000,2015-11-30T00:00:00.000,2015-11-25T00:00:00.000,Done
2017OPA-0070,Done,OPA Close SA,03/14/2017 12:00:00 AM,03/08/2017 12:00:00 AM,03/07/2017 12:00:00 AM,,2017-03-14T00:00:00.000,2017-03-08T00:00:00.000,2017-03-07T00:00:00.000,Done
2018OPA-0176,Done,OPA Close SA,,04/26/2018 12:00:00 AM,04/26/2018 12:00:00 AM,,,2018-04-26T00:00:00.000,2018-04-26T00:00:00.000,Done
2018OPA-0779,Done,OPA Close CL,09/15/2018 12:00:00 AM,09/10/2018 12:00:00 AM,09/07/2018 12:00:00 AM,,2018-09-15T00:00:00.000,2018-09-10T00:00:00.000,2018-09-07T00:00:00.000,Done
2018OPA-0811,Done,OPA Close SA,,10/01/2018 12:00:00 AM,10/01/2018 12:00:00 AM,2018-273964,,2018-10-01T00:00:00.000,2018-10-01T00:00:00.000,Done
2018OPA-1155,Done,OPA Close SA,,04/24/2019 12:00:00 AM,04/24/2019 12:00:00 AM,2018-393820,,2019-04-24T00:00:00.000,2019-04-24T00:00:00.000,Done
2019OPA-0036,Done,OPA Close CL,02/05/2019 12:00:00 AM,02/07/2019 12:00:00 AM,01/31/2019 12:00:00 AM,,2019-02-05T00:00:00.000,2019-02-07T00:00:00.000,2019-01-31T00:00:00.000,Done
2019OPA-0099,Done,OPA Close SA,,03/04/2019 12:00:00 AM,03/04/2019 12:00:00 AM,2019-024935,,2019-03-04T00:00:00.000,2019-03-04T00:00:00.000,Done
2019OPA-0487,Done,OPA Close CL,08/11/2019 12:00:00 AM,08/07/2019 12:00:00 AM,08/06/2019 12:00:00 AM,,2019-08-11T00:00:00.000,2019-08-07T00:00:00.000,2019-08-06T00:00:00.000,Done
2015OPA-0281,Done,OPA Director SA Review,04/13/2015 12:00:00 AM,04/13/2015 12:00:00 AM,04/08/2015 12:00:00 AM,2014-430414,2015-04-13T00:00:00.000,2015-04-13T00:00:00.000,2015-04-08T00:00:00.000,Done
2015OPA-0894,Done,OPA Close Case,12/09/2015 12:00:00 AM,12/14/2015 12:00:00 AM,11/25/2015 12:00:00 AM,,2015-12-09T00:00:00.000,2015-12-14T00:00:00.000,2015-11-25T00:00:00.000,Done
2015OPA-0922,Done,OPA Training Referral,04/29/2016 12:00:00 AM,04/25/2016 12:00:00 AM,12/17/2015 12:00:00 AM,2015-094285,2016-04-29T00:00:00.000,2016-04-25T00:00:00.000,2015-12-17T00:00:00.000,Done
2015OPA-1366,Done,OPA Close CL,,10/01/2015 12:00:00 AM,10/13/2015 12:00:00 AM,,,2015-10-01T00:00:00.000,2015-10-13T00:00:00.000,Done
2016OPA-0220,Done,OPA Close CL,04/05/2016 12:00:00 AM,04/05/2016 12:00:00 AM,03/31/2016 12:00:00 AM,,2016-04-05T00:00:00.000,2016-04-05T00:00:00.000,2016-03-31T00:00:00.000,Done
2016OPA-0830,Done,OPA Close CL,08/16/2016 12:00:00 AM,08/15/2016 12:00:00 AM,08/11/2016 12:00:00 AM,2016-240149,2016-08-16T00:00:00.000,2016-08-15T00:00:00.000,2016-08-11T00:00:00.000,Done
2018OPA-0592,Done,OPA Close CL,07/23/2018 12:00:00 AM,07/26/2018 12:00:00 AM,07/18/2018 12:00:00 AM,,2018-07-23T00:00:00.000,2018-07-26T00:00:00.000,2018-07-18T00:00:00.000,Done
2020OPA-0229,To do,OPA 180 Timeline Calculation,04/14/2020 12:00:00 AM,10/11/2020 12:00:00 AM,04/27/2020 12:00:00 AM,2019-463929,2020-04-14T00:00:00.000,2020-10-11T00:00:00.000,2020-04-27T00:00:00.000,To do
2015OPA-0056,Done,OPA Close CL,,01/26/2015 12:00:00 AM,10/23/2015 12:00:00 AM,,,2015-01-26T00:00:00.000,2015-10-23T00:00:00.000,Done
2018OPA-0652,Done,OPA Close SA,,09/04/2018 12:00:00 AM,09/04/2018 12:00:00 AM,2018-254630,,2018-09-04T00:00:00.000,2018-09-04T00:00:00.000,Done
2015OPA-0378,Done,OPA SA Review,10/14/2015 12:00:00 AM,10/09/2015 12:00:00 AM,10/09/2015 12:00:00 AM,2015-095995,2015-10-14T00:00:00.000,2015-10-09T00:00:00.000,2015-10-09T00:00:00.000,Done
2015OPA-1155,Done,OPA Close Case,02/16/2016 12:00:00 AM,03/10/2016 12:00:00 AM,11/24/2015 12:00:00 AM,,2016-02-16T00:00:00.000,2016-03-10T00:00:00.000,2015-11-24T00:00:00.000,Done
2015OPA-1748,Done,OPA Close SA,01/04/2016 12:00:00 AM,12/30/2015 12:00:00 AM,12/30/2015 12:00:00 AM,,2016-01-04T00:00:00.000,2015-12-30T00:00:00.000,2015-12-30T00:00:00.000,Done
2015OPA-1886,Done,OPA Close CL,01/16/2016 12:00:00 AM,01/14/2016 12:00:00 AM,01/11/2016 12:00:00 AM,,2016-01-16T00:00:00.000,2016-01-14T00:00:00.000,2016-01-11T00:00:00.000,Done
2016OPA-0319,Done,OPA Close CL,04/01/2016 12:00:00 AM,03/29/2016 12:00:00 AM,03/27/2016 12:00:00 AM,,2016-04-01T00:00:00.000,2016-03-29T00:00:00.000,2016-03-27T00:00:00.000,Done
2016OPA-0519,Done,OPA Close Case,12/17/2016 12:00:00 AM,12/17/2016 12:00:00 AM,12/07/2016 12:00:00 AM,2016-171195,2016-12-17T00:00:00.000,2016-12-17T00:00:00.000,2016-12-07T00:00:00.000,Done
2017OPA-0803,Done,OPA Close Case,04/10/2020 12:00:00 AM,04/22/2020 12:00:00 AM,03/25/2020 12:00:00 AM,2017-287883,2020-04-10T00:00:00.000,2020-04-22T00:00:00.000,2020-03-25T00:00:00.000,Done
2017OPA-0886,Done,OPA Management Action,07/11/2019 12:00:00 AM,07/03/2019 12:00:00 AM,06/26/2019 12:00:00 AM,,2019-07-11T00:00:00.000,2019-07-03T00:00:00.000,2019-06-26T00:00:00.000,Done
2017OPA-1066,Done,OPA Close CL,11/13/2017 12:00:00 AM,11/08/2017 12:00:00 AM,11/08/2017 12:00:00 AM,,2017-11-13T00:00:00.000,2017-11-08T00:00:00.000,2017-11-08T00:00:00.000,Done
2019OPA-0268,Done,OPA Close CL,05/15/2019 12:00:00 AM,05/13/2019 12:00:00 AM,05/10/2019 12:00:00 AM,,2019-05-15T00:00:00.000,2019-05-13T00:00:00.000,2019-05-10T00:00:00.000,Done
2015OPA-1179,Done,OPA Close CL,,08/09/2015 12:00:00 AM,10/16/2015 12:00:00 AM,,,2015-08-09T00:00:00.000,2015-10-16T00:00:00.000,Done
2015OPA-1754,Done,OPA Close SA,12/05/2015 12:00:00 AM,11/30/2015 12:00:00 AM,11/30/2015 12:00:00 AM,,2015-12-05T00:00:00.000,2015-11-30T00:00:00.000,2015-11-30T00:00:00.000,Done
2017OPA-0515,Done,OPA Close SA,,07/13/2017 12:00:00 AM,07/13/2017 12:00:00 AM,,,2017-07-13T00:00:00.000,2017-07-13T00:00:00.000,Done
2017OPA-0610,Done,OPA Close SA,,07/25/2017 12:00:00 AM,07/25/2017 12:00:00 AM,,,2017-07-25T00:00:00.000,2017-07-25T00:00:00.000,Done
2017OPA-1026,Done,OPA Close CL,11/01/2017 12:00:00 AM,10/06/2017 12:00:00 AM,10/02/2017 12:00:00 AM,,2017-11-01T00:00:00.000,2017-10-06T00:00:00.000,2017-10-02T00:00:00.000,Done
2018OPA-1120,Done,OPA OIG Certification,08/20/2019 12:00:00 AM,08/14/2019 12:00:00 AM,08/09/2019 12:00:00 AM,2018-434332,2019-08-20T00:00:00.000,2019-08-14T00:00:00.000,2019-08-09T00:00:00.000,Done
2019OPA-0684,Done,OPA Process SA,,11/07/2019 12:00:00 AM,11/07/2019 12:00:00 AM,2019-349442,,2019-11-07T00:00:00.000,2019-11-07T00:00:00.000,Done
2019OPA-0741,Done,OPA SA Review,03/20/2020 12:00:00 AM,03/27/2020 12:00:00 AM,03/05/2020 12:00:00 AM,2019-376755,2020-03-20T00:00:00.000,2020-03-27T00:00:00.000,2020-03-05T00:00:00.000,Done
2015OPA-0917,Done,OPA Close SA,07/27/2015 12:00:00 AM,07/23/2015 12:00:00 AM,07/22/2015 12:00:00 AM,2015-066210,2015-07-27T00:00:00.000,2015-07-23T00:00:00.000,2015-07-22T00:00:00.000,Done
2015OPA-1118,Done,OPA Close CL,,08/09/2015 12:00:00 AM,10/15/2015 12:00:00 AM,,,2015-08-09T00:00:00.000,2015-10-15T00:00:00.000,Done
2015OPA-1293,Done,OPA Close CL,,09/14/2015 12:00:00 AM,10/14/2015 12:00:00 AM,,,2015-09-14T00:00:00.000,2015-10-14T00:00:00.000,Done
2015OPA-1715,Done,OPA Close SA,01/04/2016 12:00:00 AM,12/30/2015 12:00:00 AM,12/30/2015 12:00:00 AM,,2016-01-04T00:00:00.000,2015-12-30T00:00:00.000,2015-12-30T00:00:00.000,Done
2017OPA-1190,Done,OPA Close SA,,01/25/2018 12:00:00 AM,01/22/2018 12:00:00 AM,,,2018-01-25T00:00:00.000,2018-01-22T00:00:00.000,Done
2017OPA-1297,Done,OPA Final Discipline Action Report,,05/22/2018 12:00:00 AM,01/22/2019 12:00:00 AM,2017-437174,,2018-05-22T00:00:00.000,2019-01-22T00:00:00.000,Done
2018OPA-0591,Done,OPA Close CL,07/25/2018 12:00:00 AM,07/20/2018 12:00:00 AM,07/20/2018 12:00:00 AM,,2018-07-25T00:00:00.000,2018-07-20T00:00:00.000,2018-07-20T00:00:00.000,Done
2019OPA-0781,Done,OPA Close CL,11/23/2019 12:00:00 AM,11/18/2019 12:00:00 AM,11/16/2019 12:00:00 AM,,2019-11-23T00:00:00.000,2019-11-18T00:00:00.000,2019-11-16T00:00:00.000,Done
2015OPA-0348,Done,OPA Director SA Review,05/07/2015 12:00:00 AM,04/30/2015 12:00:00 AM,04/27/2015 12:00:00 AM,2015-089601,2015-05-07T00:00:00.000,2015-04-30T00:00:00.000,2015-04-27T00:00:00.000,Done
2015OPA-0477,Done,OPA Director SA Review,07/07/2015 12:00:00 AM,07/21/2015 12:00:00 AM,07/02/2015 12:00:00 AM,,2015-07-07T00:00:00.000,2015-07-21T00:00:00.000,2015-07-02T00:00:00.000,Done
2016OPA-0058,Done,OPA Close Case,07/03/2017 12:00:00 AM,07/19/2017 12:00:00 AM,06/23/2017 12:00:00 AM,2015-256265,2017-07-03T00:00:00.000,2017-07-19T00:00:00.000,2017-06-23T00:00:00.000,Done
2016OPA-0474,Done,OPA Close Case,11/22/2016 12:00:00 AM,10/31/2016 12:00:00 AM,10/31/2016 12:00:00 AM,2016-118147,2016-11-22T00:00:00.000,2016-10-31T00:00:00.000,2016-10-31T00:00:00.000,Done
2019OPA-0103,Done,OPA Training Referral,06/24/2019 12:00:00 AM,07/10/2019 12:00:00 AM,06/14/2019 12:00:00 AM,2019-000329,2019-06-24T00:00:00.000,2019-07-10T00:00:00.000,2019-06-14T00:00:00.000,Done
2015OPA-0607,Done,OPA Training Referral,,05/15/2015 12:00:00 AM,05/05/2016 12:00:00 AM,,,2015-05-15T00:00:00.000,2016-05-05T00:00:00.000,Done
2016OPA-0347,Done,OPA Close CL,04/20/2016 12:00:00 AM,04/19/2016 12:00:00 AM,04/15/2016 12:00:00 AM,,2016-04-20T00:00:00.000,2016-04-19T00:00:00.000,2016-04-15T00:00:00.000,Done
2016OPA-1127,Done,OPA Close CL,10/10/2016 12:00:00 AM,10/10/2016 12:00:00 AM,10/05/2016 12:00:00 AM,,2016-10-10T00:00:00.000,2016-10-10T00:00:00.000,2016-10-05T00:00:00.000,Done
2016OPA-1510,Done,OPA Close CL,01/14/2017 12:00:00 AM,01/10/2017 12:00:00 AM,01/04/2017 12:00:00 AM,,2017-01-14T00:00:00.000,2017-01-10T00:00:00.000,2017-01-04T00:00:00.000,Done
2017OPA-0107,Done,OPA Close Case,07/20/2017 12:00:00 AM,08/03/2017 12:00:00 AM,07/10/2017 12:00:00 AM,,2017-07-20T00:00:00.000,2017-08-03T00:00:00.000,2017-07-10T00:00:00.000,Done
2018OPA-0162,Done,OPA Training Referral,,10/15/2018 12:00:00 AM,10/15/2018 12:00:00 AM,2018-057344,,2018-10-15T00:00:00.000,2018-10-15T00:00:00.000,Done
2015OPA-0364,Done,OPA Close CL,,03/30/2015 12:00:00 AM,10/20/2015 12:00:00 AM,,,2015-03-30T00:00:00.000,2015-10-20T00:00:00.000,Done
2015OPA-0766,Done,OPA Training Referral,,12/11/2015 12:00:00 AM,12/11/2015 12:00:00 AM,,,2015-12-11T00:00:00.000,2015-12-11T00:00:00.000,Done
2015OPA-0991,Done,OPA Close SA,08/15/2015 12:00:00 AM,08/11/2015 12:00:00 AM,08/10/2015 12:00:00 AM,2015-207335,2015-08-15T00:00:00.000,2015-08-11T00:00:00.000,2015-08-10T00:00:00.000,Done
2015OPA-1551,Done,OPA Close CL,,10/27/2015 12:00:00 AM,10/27/2015 12:00:00 AM,,,2015-10-27T00:00:00.000,2015-10-27T00:00:00.000,Done
2016OPA-0531,Done,OPA Close CL,06/06/2016 12:00:00 AM,06/03/2016 12:00:00 AM,06/01/2016 12:00:00 AM,,2016-06-06T00:00:00.000,2016-06-03T00:00:00.000,2016-06-01T00:00:00.000,Done
2018OPA-1173,Done,OPA Close CL,01/19/2019 12:00:00 AM,01/17/2019 12:00:00 AM,01/14/2019 12:00:00 AM,,2019-01-19T00:00:00.000,2019-01-17T00:00:00.000,2019-01-14T00:00:00.000,Done
2019OPA-0400,Done,OPA Close SA,,07/23/2019 12:00:00 AM,07/23/2019 12:00:00 AM,,,2019-07-23T00:00:00.000,2019-07-23T00:00:00.000,Done
2015OPA-1084,Done,OPA Close SA,10/28/2015 12:00:00 AM,10/23/2015 12:00:00 AM,10/23/2015 12:00:00 AM,2015-236065,2015-10-28T00:00:00.000,2015-10-23T00:00:00.000,2015-10-23T00:00:00.000,Done
2015OPA-1137,Done,OPA Close CL,,08/09/2015 12:00:00 AM,10/15/2015 12:00:00 AM,,,2015-08-09T00:00:00.000,2015-10-15T00:00:00.000,Done
2015OPA-1242,Done,OPA Training Referral,03/06/2016 12:00:00 AM,03/10/2016 12:00:00 AM,01/29/2016 12:00:00 AM,2015-249613,2016-03-06T00:00:00.000,2016-03-10T00:00:00.000,2016-01-29T00:00:00.000,Done
2015OPA-1375,Done,OPA Close CL,,10/01/2015 12:00:00 AM,10/13/2015 12:00:00 AM,,,2015-10-01T00:00:00.000,2015-10-13T00:00:00.000,Done
2015OPA-1848,Done,OPA Close Case,06/13/2016 12:00:00 AM,06/27/2016 12:00:00 AM,05/26/2016 12:00:00 AM,2015-412248,2016-06-13T00:00:00.000,2016-06-27T00:00:00.000,2016-05-26T00:00:00.000,Done
2016OPA-0842,Done,OPA Close CL,08/10/2016 12:00:00 AM,08/08/2016 12:00:00 AM,08/05/2016 12:00:00 AM,,2016-08-10T00:00:00.000,2016-08-08T00:00:00.000,2016-08-05T00:00:00.000,Done
2018OPA-0290,Done,OPA Training Referral,,10/05/2018 12:00:00 AM,03/08/2019 12:00:00 AM,2018-109626,,2018-10-05T00:00:00.000,2019-03-08T00:00:00.000,Done
2018OPA-0384,Done,OPA Close CL,05/28/2018 12:00:00 AM,06/14/2018 12:00:00 AM,05/23/2018 12:00:00 AM,,2018-05-28T00:00:00.000,2018-06-14T00:00:00.000,2018-05-23T00:00:00.000,Done
2018OPA-0885,Done,OPA Close Case,03/07/2019 12:00:00 AM,03/07/2019 12:00:00 AM,02/25/2019 12:00:00 AM,2018-336750,2019-03-07T00:00:00.000,2019-03-07T00:00:00.000,2019-02-25T00:00:00.000,Done
2015OPA-0076,Done,OPA Close CL,,01/26/2015 12:00:00 AM,10/23/2015 12:00:00 AM,2014-029215,,2015-01-26T00:00:00.000,2015-10-23T00:00:00.000,Done
2018OPA-0987,Done,OPA Close Case,03/28/2019 12:00:00 AM,03/28/2019 12:00:00 AM,03/18/2019 12:00:00 AM,2018-378536,2019-03-28T00:00:00.000,2019-03-28T00:00:00.000,2019-03-18T00:00:00.000,Done
2019OPA-0438,Done,OPA Close CL,07/22/2019 12:00:00 AM,07/24/2019 12:00:00 AM,07/17/2019 12:00:00 AM,,2019-07-22T00:00:00.000,2019-07-24T00:00:00.000,2019-07-17T00:00:00.000,Done
2019OPA-0529,Done,OPA Close CL,08/15/2019 12:00:00 AM,09/12/2019 12:00:00 AM,08/10/2019 12:00:00 AM,2018-480491,2019-08-15T00:00:00.000,2019-09-12T00:00:00.000,2019-08-10T00:00:00.000,Done
2020OPA-0219,To do,OPA 180 Timeline Calculation,03/19/2020 12:00:00 AM,09/15/2020 12:00:00 AM,04/24/2020 12:00:00 AM,2020-097769,2020-03-19T00:00:00.000,2020-09-15T00:00:00.000,2020-04-24T00:00:00.000,To do
2015OPA-0752,Done,OPA Close CL,,06/15/2015 12:00:00 AM,10/19/2015 12:00:00 AM,,,2015-06-15T00:00:00.000,2015-10-19T00:00:00.000,Done
2017OPA-0082,Done,OPA Close CL,07/17/2017 12:00:00 AM,07/14/2017 12:00:00 AM,07/07/2017 12:00:00 AM,,2017-07-17T00:00:00.000,2017-07-14T00:00:00.000,2017-07-07T00:00:00.000,Done
2018OPA-0503,Done,OPA Close Case,02/07/2019 12:00:00 AM,02/15/2019 12:00:00 AM,01/28/2019 12:00:00 AM,,2019-02-07T00:00:00.000,2019-02-15T00:00:00.000,2019-01-28T00:00:00.000,Done
2016OPA-1406,Done,OPA Close Case,06/09/2017 12:00:00 AM,06/14/2017 12:00:00 AM,05/30/2017 12:00:00 AM,,2017-06-09T00:00:00.000,2017-06-14T00:00:00.000,2017-05-30T00:00:00.000,Done
2017OPA-0050,Done,OPA Send Complainant Closing Letter,01/25/2017 12:00:00 AM,01/20/2017 12:00:00 AM,01/20/2017 12:00:00 AM,,2017-01-25T00:00:00.000,2017-01-20T00:00:00.000,2017-01-20T00:00:00.000,Done
2020OPA-0258,Done,OPA 5 Day Notice,05/06/2020 12:00:00 AM,05/05/2020 12:00:00 AM,05/01/2020 12:00:00 AM,,2020-05-06T00:00:00.000,2020-05-05T00:00:00.000,2020-05-01T00:00:00.000,Done
2015OPA-0784,Done,OPA Close Case,12/21/2015 12:00:00 AM,12/23/2015 12:00:00 AM,12/09/2015 12:00:00 AM,2015-181824,2015-12-21T00:00:00.000,2015-12-23T00:00:00.000,2015-12-09T00:00:00.000,Done
2016OPA-0163,Done,OPA Close CL,03/01/2016 12:00:00 AM,02/29/2016 12:00:00 AM,02/25/2016 12:00:00 AM,,2016-03-01T00:00:00.000,2016-02-29T00:00:00.000,2016-02-25T00:00:00.000,Done
2016OPA-0980,Done,OPA Close SA,,10/04/2016 12:00:00 AM,10/04/2016 12:00:00 AM,,,2016-10-04T00:00:00.000,2016-10-04T00:00:00.000,Done
2016OPA-1160,Done,OPA Close SA,,01/09/2017 12:00:00 AM,01/09/2017 12:00:00 AM,,,2017-01-09T00:00:00.000,2017-01-09T00:00:00.000,Done
2016OPA-1296,Done,OPA Send Complainant Closing Letter,11/27/2016 12:00:00 AM,11/16/2016 12:00:00 AM,10/31/2016 12:00:00 AM,,2016-11-27T00:00:00.000,2016-11-16T00:00:00.000,2016-10-31T00:00:00.000,Done
2015OPA-0254,Done,OPA SA Review,04/04/2015 12:00:00 AM,04/03/2015 12:00:00 AM,03/30/2015 12:00:00 AM,2015-063616,2015-04-04T00:00:00.000,2015-04-03T00:00:00.000,2015-03-30T00:00:00.000,Done
2015OPA-0654,Done,OPA Director SA Review,06/13/2015 12:00:00 AM,06/17/2015 12:00:00 AM,06/08/2015 12:00:00 AM,,2015-06-13T00:00:00.000,2015-06-17T00:00:00.000,2015-06-08T00:00:00.000,Done
2016OPA-0288,Done,OPA Close SA,07/01/2016 12:00:00 AM,06/16/2016 12:00:00 AM,06/16/2016 12:00:00 AM,,2016-07-01T00:00:00.000,2016-06-16T00:00:00.000,2016-06-16T00:00:00.000,Done
2016OPA-0636,Done,OPA Close Case,12/09/2016 12:00:00 AM,12/09/2016 12:00:00 AM,12/02/2016 12:00:00 AM,,2016-12-09T00:00:00.000,2016-12-09T00:00:00.000,2016-12-02T00:00:00.000,Done
2018OPA-0327,Done,OPA Close SA,,07/10/2018 12:00:00 AM,07/10/2018 12:00:00 AM,2018-105488,,2018-07-10T00:00:00.000,2018-07-10T00:00:00.000,Done
2019OPA-0619,Done,OPA Close CL,09/05/2019 12:00:00 AM,09/04/2019 12:00:00 AM,08/29/2019 12:00:00 AM,,2019-09-05T00:00:00.000,2019-09-04T00:00:00.000,2019-08-29T00:00:00.000,Done
2016OPA-0443,Done,OPA Close CL,05/04/2016 12:00:00 AM,05/04/2016 12:00:00 AM,05/04/2016 12:00:00 AM,,2016-05-04T00:00:00.000,2016-05-04T00:00:00.000,2016-05-04T00:00:00.000,Done
2016OPA-0770,Done,OPA Close CL,08/03/2016 12:00:00 AM,08/01/2016 12:00:00 AM,07/29/2016 12:00:00 AM,,2016-08-03T00:00:00.000,2016-08-01T00:00:00.000,2016-07-29T00:00:00.000,Done
2017OPA-0133,Done,OPA Close SA,,03/27/2017 12:00:00 AM,03/27/2017 12:00:00 AM,2017-045283,,2017-03-27T00:00:00.000,2017-03-27T00:00:00.000,Done
2018OPA-0853,Done,OPA Close CL,09/29/2018 12:00:00 AM,09/27/2018 12:00:00 AM,09/24/2018 12:00:00 AM,,2018-09-29T00:00:00.000,2018-09-27T00:00:00.000,2018-09-24T00:00:00.000,Done
2019OPA-0399,Done,OPA Close CL,07/04/2019 12:00:00 AM,07/02/2019 12:00:00 AM,06/29/2019 12:00:00 AM,,2019-07-04T00:00:00.000,2019-07-02T00:00:00.000,2019-06-29T00:00:00.000,Done
2015OPA-1192,Done,OPA Close SA,11/07/2015 12:00:00 AM,11/02/2015 12:00:00 AM,11/02/2015 12:00:00 AM,2015-218467,2015-11-07T00:00:00.000,2015-11-02T00:00:00.000,2015-11-02T00:00:00.000,Done
2016OPA-0226,Done,OPA Close CL,03/30/2016 12:00:00 AM,03/28/2016 12:00:00 AM,03/25/2016 12:00:00 AM,,2016-03-30T00:00:00.000,2016-03-28T00:00:00.000,2016-03-25T00:00:00.000,Done
2017OPA-0578,Done,OPA Close CL,06/28/2017 12:00:00 AM,06/30/2017 12:00:00 AM,06/23/2017 12:00:00 AM,,2017-06-28T00:00:00.000,2017-06-30T00:00:00.000,2017-06-23T00:00:00.000,Done
2018OPA-1064,Done,OPA Loudermill Hearing,,01/03/2020 12:00:00 AM,01/06/2020 12:00:00 AM,,,2020-01-03T00:00:00.000,2020-01-06T00:00:00.000,Done
2019OPA-0414,Done,OPA Close CL,07/11/2019 12:00:00 AM,07/11/2019 12:00:00 AM,07/06/2019 12:00:00 AM,,2019-07-11T00:00:00.000,2019-07-11T00:00:00.000,2019-07-06T00:00:00.000,Done
2015OPA-0398,Done,OPA Close Case,10/07/2015 12:00:00 AM,10/07/2015 12:00:00 AM,09/24/2015 12:00:00 AM,2015-026760,2015-10-07T00:00:00.000,2015-10-07T00:00:00.000,2015-09-24T00:00:00.000,Done
2015OPA-0660,Done,OPA SA to be closed,07/13/2015 12:00:00 AM,07/10/2015 12:00:00 AM,07/08/2015 12:00:00 AM,,2015-07-13T00:00:00.000,2015-07-10T00:00:00.000,2015-07-08T00:00:00.000,Done
2016OPA-0231,Done,OPA Close Case,08/25/2016 12:00:00 AM,08/25/2016 12:00:00 AM,08/15/2016 12:00:00 AM,2016-047334,2016-08-25T00:00:00.000,2016-08-25T00:00:00.000,2016-08-15T00:00:00.000,Done
2016OPA-0931,Done,OPA Close CL,08/17/2016 12:00:00 AM,08/15/2016 12:00:00 AM,08/12/2016 12:00:00 AM,,2016-08-17T00:00:00.000,2016-08-15T00:00:00.000,2016-08-12T00:00:00.000,Done
2019OPA-0302,Done,OPA Close SA,,07/12/2019 12:00:00 AM,07/12/2019 12:00:00 AM,2019-162868,,2019-07-12T00:00:00.000,2019-07-12T00:00:00.000,Done
2020OPA-0035,Done,OPA 180 Extension Request,08/03/2020 12:00:00 AM,09/02/2020 12:00:00 AM,03/26/2020 12:00:00 AM,,2020-08-03T00:00:00.000,2020-09-02T00:00:00.000,2020-03-26T00:00:00.000,Done
2015OPA-0418,Done,OPA Close CL,,03/27/2015 12:00:00 AM,10/21/2015 12:00:00 AM,,,2015-03-27T00:00:00.000,2015-10-21T00:00:00.000,Done
2016OPA-0480,Done,OPA Close SA,08/05/2016 12:00:00 AM,08/26/2016 12:00:00 AM,07/29/2016 12:00:00 AM,,2016-08-05T00:00:00.000,2016-08-26T00:00:00.000,2016-07-29T00:00:00.000,Done
2017OPA-0530,Done,OPA Close CL,06/24/2017 12:00:00 AM,06/02/2017 12:00:00 AM,06/02/2017 12:00:00 AM,,2017-06-24T00:00:00.000,2017-06-02T00:00:00.000,2017-06-02T00:00:00.000,Done
2017OPA-1138,Done,OPA Close Case,04/02/2018 12:00:00 AM,04/09/2018 12:00:00 AM,03/23/2018 12:00:00 AM,2016-406737,2018-04-02T00:00:00.000,2018-04-09T00:00:00.000,2018-03-23T00:00:00.000,Done
2018OPA-0495,Done,OPA Close Case,12/06/2018 12:00:00 AM,01/08/2019 12:00:00 AM,11/26/2018 12:00:00 AM,,2018-12-06T00:00:00.000,2019-01-08T00:00:00.000,2018-11-26T00:00:00.000,Done
2019OPA-0626,Done,OPA Close SA,,10/17/2019 12:00:00 AM,10/17/2019 12:00:00 AM,2019-275525,,2019-10-17T00:00:00.000,2019-10-17T00:00:00.000,Done
2015OPA-0177,Done,OPA Director SA Review,04/21/2015 12:00:00 AM,04/21/2015 12:00:00 AM,04/16/2015 12:00:00 AM,,2015-04-21T00:00:00.000,2015-04-21T00:00:00.000,2015-04-16T00:00:00.000,Done
2015OPA-0974,Done,OPA Close Case,12/17/2015 12:00:00 AM,12/23/2015 12:00:00 AM,12/04/2015 12:00:00 AM,2015-219119,2015-12-17T00:00:00.000,2015-12-23T00:00:00.000,2015-12-04T00:00:00.000,Done
2015OPA-1182,Done,OPA Close CL,,08/27/2015 12:00:00 AM,10/15/2015 12:00:00 AM,,,2015-08-27T00:00:00.000,2015-10-15T00:00:00.000,Done
2015OPA-1659,Done,OPA Close Case,05/27/2016 12:00:00 AM,05/26/2016 12:00:00 AM,05/02/2016 12:00:00 AM,,2016-05-27T00:00:00.000,2016-05-26T00:00:00.000,2016-05-02T00:00:00.000,Done
2016OPA-0256,Done,OPA Close SA,04/27/2016 12:00:00 AM,05/02/2016 12:00:00 AM,05/02/2016 12:00:00 AM,2016-084046,2016-04-27T00:00:00.000,2016-05-02T00:00:00.000,2016-05-02T00:00:00.000,Done
2016OPA-1330,Done,OPA Close SA,,01/04/2017 12:00:00 AM,01/04/2017 12:00:00 AM,2016-404746,,2017-01-04T00:00:00.000,2017-01-04T00:00:00.000,Done
2018OPA-0147,Done,OPA Close Case,11/24/2018 12:00:00 AM,01/07/2019 12:00:00 AM,11/14/2018 12:00:00 AM,,2018-11-24T00:00:00.000,2019-01-07T00:00:00.000,2018-11-14T00:00:00.000,Done
2018OPA-0621,Done,OPA Training Referral,04/01/2019 12:00:00 AM,03/28/2019 12:00:00 AM,03/21/2019 12:00:00 AM,2018-172363,2019-04-01T00:00:00.000,2019-03-28T00:00:00.000,2019-03-21T00:00:00.000,Done
2018OPA-1114,Done,OPA Close CL,12/15/2018 12:00:00 AM,12/18/2018 12:00:00 AM,12/10/2018 12:00:00 AM,,2018-12-15T00:00:00.000,2018-12-18T00:00:00.000,2018-12-10T00:00:00.000,Done
2015OPA-0328,Done,OPA Close CL,,03/23/2015 12:00:00 AM,10/21/2015 12:00:00 AM,2015-074151,,2015-03-23T00:00:00.000,2015-10-21T00:00:00.000,Done
2015OPA-0938,Done,OPA Close SA,08/23/2015 12:00:00 AM,08/19/2015 12:00:00 AM,08/18/2015 12:00:00 AM,2015-208503,2015-08-23T00:00:00.000,2015-08-19T00:00:00.000,2015-08-18T00:00:00.000,Done
2015OPA-1259,Done,OPA Close CL,,09/03/2015 12:00:00 AM,10/15/2015 12:00:00 AM,,,2015-09-03T00:00:00.000,2015-10-15T00:00:00.000,Done
2018OPA-0113,Done,OPA Close Case,08/12/2018 12:00:00 AM,09/26/2018 12:00:00 AM,08/02/2018 12:00:00 AM,2017-169122,2018-08-12T00:00:00.000,2018-09-26T00:00:00.000,2018-08-02T00:00:00.000,Done
2019OPA-0187,Done,OPA Close CL,04/02/2019 12:00:00 AM,04/02/2019 12:00:00 AM,04/02/2019 12:00:00 AM,2019-99926,2019-04-02T00:00:00.000,2019-04-02T00:00:00.000,2019-04-02T00:00:00.000,Done
2019OPA-0249,Done,OPA Close SA,,06/04/2019 12:00:00 AM,06/04/2019 12:00:00 AM,2019-136027,,2019-06-04T00:00:00.000,2019-06-04T00:00:00.000,Done
2019OPA-0480,Done,OPA Close Case,01/12/2020 12:00:00 AM,02/05/2020 12:00:00 AM,01/14/2020 12:00:00 AM,2019-244680,2020-01-12T00:00:00.000,2020-02-05T00:00:00.000,2020-01-14T00:00:00.000,Done
2015OPA-1510,Done,OPA Close Case,04/14/2016 12:00:00 AM,04/20/2016 12:00:00 AM,03/30/2016 12:00:00 AM,2015-350814,2016-04-14T00:00:00.000,2016-04-20T00:00:00.000,2016-03-30T00:00:00.000,Done
2015OPA-1821,Done,OPA Close CL,12/19/2015 12:00:00 AM,12/17/2015 12:00:00 AM,12/14/2015 12:00:00 AM,,2015-12-19T00:00:00.000,2015-12-17T00:00:00.000,2015-12-14T00:00:00.000,Done
2015OPA-1855,Done,OPA Close CL,12/23/2015 12:00:00 AM,12/21/2015 12:00:00 AM,12/18/2015 12:00:00 AM,,2015-12-23T00:00:00.000,2015-12-21T00:00:00.000,2015-12-18T00:00:00.000,Done
2016OPA-0043,Done,OPA Close CL,02/21/2016 12:00:00 AM,02/18/2016 12:00:00 AM,02/16/2016 12:00:00 AM,,2016-02-21T00:00:00.000,2016-02-18T00:00:00.000,2016-02-16T00:00:00.000,Done
2017OPA-0993,Done,OPA Close CL,10/25/2017 12:00:00 AM,10/19/2017 12:00:00 AM,09/25/2017 12:00:00 AM,,2017-10-25T00:00:00.000,2017-10-19T00:00:00.000,2017-09-25T00:00:00.000,Done
2015OPA-1359,Done,OPA Close CL,,09/14/2015 12:00:00 AM,10/14/2015 12:00:00 AM,,,2015-09-14T00:00:00.000,2015-10-14T00:00:00.000,Done
2016OPA-0383,Done,OPA Close SA,06/28/2016 12:00:00 AM,06/13/2016 12:00:00 AM,06/13/2016 12:00:00 AM,2016-119685,2016-06-28T00:00:00.000,2016-06-13T00:00:00.000,2016-06-13T00:00:00.000,Done
2015OPA-0210,Done,OPA Close CL,,03/02/2015 12:00:00 AM,10/22/2015 12:00:00 AM,,,2015-03-02T00:00:00.000,2015-10-22T00:00:00.000,Done
2015OPA-1285,Done,OPA Training Referral,,02/16/2016 12:00:00 AM,05/05/2016 12:00:00 AM,2015-256265,,2016-02-16T00:00:00.000,2016-05-05T00:00:00.000,Done
2015OPA-1351,Done,OPA Close CL,,10/06/2015 12:00:00 AM,10/13/2015 12:00:00 AM,,,2015-10-06T00:00:00.000,2015-10-13T00:00:00.000,Done
2018OPA-0483,Done,OPA Close Case,11/17/2018 12:00:00 AM,12/05/2018 12:00:00 AM,11/07/2018 12:00:00 AM,2018-151281,2018-11-17T00:00:00.000,2018-12-05T00:00:00.000,2018-11-07T00:00:00.000,Done
2015OPA-1501,Done,OPA Close CL,,10/19/2015 12:00:00 AM,10/19/2015 12:00:00 AM,,,2015-10-19T00:00:00.000,2015-10-19T00:00:00.000,Done
2015OPA-1796,Done,OPA Close SA,03/26/2016 12:00:00 AM,03/21/2016 12:00:00 AM,03/21/2016 12:00:00 AM,,2016-03-26T00:00:00.000,2016-03-21T00:00:00.000,2016-03-21T00:00:00.000,Done
2017OPA-0608,Done,OPA Close SA,,09/19/2017 12:00:00 AM,09/19/2017 12:00:00 AM,,,2017-09-19T00:00:00.000,2017-09-19T00:00:00.000,Done
2017OPA-0917,Done,OPA Close CL,10/05/2017 12:00:00 AM,10/02/2017 12:00:00 AM,09/06/2017 12:00:00 AM,,2017-10-05T00:00:00.000,2017-10-02T00:00:00.000,2017-09-06T00:00:00.000,Done
2015OPA-0723,Done,OPA Training Referral,,11/10/2015 12:00:00 AM,05/05/2016 12:00:00 AM,,,2015-11-10T00:00:00.000,2016-05-05T00:00:00.000,Done
2019OPA-0005,Done,OPA Close Case,,09/04/2019 12:00:00 AM,09/04/2019 12:00:00 AM,,,2019-09-04T00:00:00.000,2019-09-04T00:00:00.000,Done
2019OPA-0075,Done,OPA Training Referral,08/08/2019 12:00:00 AM,08/12/2019 12:00:00 AM,07/29/2019 12:00:00 AM,2019-024181,2019-08-08T00:00:00.000,2019-08-12T00:00:00.000,2019-07-29T00:00:00.000,Done
2015OPA-0527,Done,OPA Close CL,,04/16/2015 12:00:00 AM,10/20/2015 12:00:00 AM,,,2015-04-16T00:00:00.000,2015-10-20T00:00:00.000,Done
2015OPA-0608,Done,OPA Close CL,,05/19/2015 12:00:00 AM,10/20/2015 12:00:00 AM,,,2015-05-19T00:00:00.000,2015-10-20T00:00:00.000,Done
2015OPA-1405,Done,OPA Training Referral,04/14/2016 12:00:00 AM,04/05/2016 12:00:00 AM,03/09/2016 12:00:00 AM,2015-322054,2016-04-14T00:00:00.000,2016-04-05T00:00:00.000,2016-03-09T00:00:00.000,Done
2015OPA-1479,Done,OPA Close CL,,10/20/2015 12:00:00 AM,10/20/2015 12:00:00 AM,,,2015-10-20T00:00:00.000,2015-10-20T00:00:00.000,Done
2020OPA-0250,Done,OPA 5 Day Notice,04/30/2020 12:00:00 AM,04/28/2020 12:00:00 AM,04/27/2020 12:00:00 AM,,2020-04-30T00:00:00.000,2020-04-28T00:00:00.000,2020-04-27T00:00:00.000,Done
2016OPA-0305,Done,OPA Close CL,03/28/2016 12:00:00 AM,04/11/2016 12:00:00 AM,03/23/2016 12:00:00 AM,2016-089990,2016-03-28T00:00:00.000,2016-04-11T00:00:00.000,2016-03-23T00:00:00.000,Done
2016OPA-0852,Done,OPA Close CL,08/13/2016 12:00:00 AM,08/09/2016 12:00:00 AM,08/08/2016 12:00:00 AM,,2016-08-13T00:00:00.000,2016-08-09T00:00:00.000,2016-08-08T00:00:00.000,Done
2017OPA-0100,Done,OPA Close SA,,05/16/2017 12:00:00 AM,03/21/2017 12:00:00 AM,2017-037121,,2017-05-16T00:00:00.000,2017-03-21T00:00:00.000,Done
2017OPA-0445,Done,OPA Close SA,,06/28/2017 12:00:00 AM,06/28/2017 12:00:00 AM,2017-151195,,2017-06-28T00:00:00.000,2017-06-28T00:00:00.000,Done
2019OPA-0195,Done,OPA Close Case,09/22/2019 12:00:00 AM,09/24/2019 12:00:00 AM,09/12/2019 12:00:00 AM,2019-106487,2019-09-22T00:00:00.000,2019-09-24T00:00:00.000,2019-09-12T00:00:00.000,Done
2015OPA-0841,Done,OPA Close Case,,12/23/2015 12:00:00 AM,11/25/2015 12:00:00 AM,,,2015-12-23T00:00:00.000,2015-11-25T00:00:00.000,Done
2015OPA-1614,Done,OPA Close CL,11/15/2015 12:00:00 AM,11/12/2015 12:00:00 AM,11/10/2015 12:00:00 AM,,2015-11-15T00:00:00.000,2015-11-12T00:00:00.000,2015-11-10T00:00:00.000,Done
2016OPA-0051,Done,OPA Close CL,02/21/2016 12:00:00 AM,02/18/2016 12:00:00 AM,02/18/2016 12:00:00 AM,,2016-02-21T00:00:00.000,2016-02-18T00:00:00.000,2016-02-18T00:00:00.000,Done
2016OPA-0554,Done,OPA Close CL,06/21/2016 12:00:00 AM,06/21/2016 12:00:00 AM,06/16/2016 12:00:00 AM,,2016-06-21T00:00:00.000,2016-06-21T00:00:00.000,2016-06-16T00:00:00.000,Done
2016OPA-1068,Done,OPA Close CL,10/05/2016 12:00:00 AM,10/03/2016 12:00:00 AM,09/30/2016 12:00:00 AM,,2016-10-05T00:00:00.000,2016-10-03T00:00:00.000,2016-09-30T00:00:00.000,Done
2017OPA-0270,Done,OPA Close Case,02/05/2018 12:00:00 AM,08/29/2018 12:00:00 AM,08/28/2018 12:00:00 AM,2017-095006,2018-02-05T00:00:00.000,2018-08-29T00:00:00.000,2018-08-28T00:00:00.000,Done
2017OPA-1264,Done,OPA Close CL,12/31/2017 12:00:00 AM,12/31/2017 12:00:00 AM,12/07/2017 12:00:00 AM,,2017-12-31T00:00:00.000,2017-12-31T00:00:00.000,2017-12-07T00:00:00.000,Done
2018OPA-0196,Done,OPA Close Case,08/23/2018 12:00:00 AM,10/10/2018 12:00:00 AM,08/13/2018 12:00:00 AM,2018-051086,2018-08-23T00:00:00.000,2018-10-10T00:00:00.000,2018-08-13T00:00:00.000,Done
2015OPA-0235,Done,OPA Close CL,,03/05/2015 12:00:00 AM,10/22/2015 12:00:00 AM,,,2015-03-05T00:00:00.000,2015-10-22T00:00:00.000,Done
2018OPA-0015,Done,OPA Send Complaint Receipt,01/08/2018 12:00:00 AM,01/04/2018 12:00:00 AM,01/04/2018 12:00:00 AM,,2018-01-08T00:00:00.000,2018-01-04T00:00:00.000,2018-01-04T00:00:00.000,Done
2018OPA-0077,Done,OPA Close SA,,02/21/2018 12:00:00 AM,02/21/2018 12:00:00 AM,2017-464057,,2018-02-21T00:00:00.000,2018-02-21T00:00:00.000,Done
2016OPA-1118,Done,OPA Close Case,02/19/2017 12:00:00 AM,03/06/2017 12:00:00 AM,02/09/2017 12:00:00 AM,,2017-02-19T00:00:00.000,2017-03-06T00:00:00.000,2017-02-09T00:00:00.000,Done
2016OPA-1411,Done,OPA Close CL,12/07/2016 12:00:00 AM,12/06/2016 12:00:00 AM,12/02/2016 12:00:00 AM,,2016-12-07T00:00:00.000,2016-12-06T00:00:00.000,2016-12-02T00:00:00.000,Done
2015OPA-0744,Done,OPA Close Case,,12/23/2015 12:00:00 AM,11/25/2015 12:00:00 AM,,,2015-12-23T00:00:00.000,2015-11-25T00:00:00.000,Done
2015OPA-0998,Done,OPA Close CL,,07/10/2015 12:00:00 AM,10/16/2015 12:00:00 AM,,,2015-07-10T00:00:00.000,2015-10-16T00:00:00.000,Done
2017OPA-0027,Done,OPA Close CL,02/01/2017 12:00:00 AM,01/27/2017 12:00:00 AM,01/27/2017 12:00:00 AM,2017-008762,2017-02-01T00:00:00.000,2017-01-27T00:00:00.000,2017-01-27T00:00:00.000,Done
2017OPA-0188,Done,OPA Close CL,03/23/2017 12:00:00 AM,03/24/2017 12:00:00 AM,02/22/2017 12:00:00 AM,,2017-03-23T00:00:00.000,2017-03-24T00:00:00.000,2017-02-22T00:00:00.000,Done
2017OPA-1206,Done,OPA Close Case,06/17/2018 12:00:00 AM,06/17/2019 12:00:00 AM,06/29/2018 12:00:00 AM,,2018-06-17T00:00:00.000,2019-06-17T00:00:00.000,2018-06-29T00:00:00.000,Done
2018OPA-0841,Done,OPA Training Referral,03/07/2019 12:00:00 AM,03/06/2019 12:00:00 AM,02/25/2019 12:00:00 AM,,2019-03-07T00:00:00.000,2019-03-06T00:00:00.000,2019-02-25T00:00:00.000,Done
2015OPA-0502,Done,OPA Director SA Review,05/10/2015 12:00:00 AM,05/20/2015 12:00:00 AM,05/05/2015 12:00:00 AM,2013-304762,2015-05-10T00:00:00.000,2015-05-20T00:00:00.000,2015-05-05T00:00:00.000,Done
2015OPA-0802,Done,OPA Close CL,,06/15/2015 12:00:00 AM,10/19/2015 12:00:00 AM,,,2015-06-15T00:00:00.000,2015-10-19T00:00:00.000,Done
2015OPA-1592,Done,OPA Close CL,11/10/2015 12:00:00 AM,11/12/2015 12:00:00 AM,11/05/2015 12:00:00 AM,2015-373382,2015-11-10T00:00:00.000,2015-11-12T00:00:00.000,2015-11-05T00:00:00.000,Done
2019OPA-0486,Done,OPA Close CL,08/04/2019 12:00:00 AM,08/05/2019 12:00:00 AM,07/30/2019 12:00:00 AM,,2019-08-04T00:00:00.000,2019-08-05T00:00:00.000,2019-07-30T00:00:00.000,Done
2016OPA-0871,Done,OPA Close CL,08/16/2016 12:00:00 AM,08/15/2016 12:00:00 AM,08/11/2016 12:00:00 AM,,2016-08-16T00:00:00.000,2016-08-15T00:00:00.000,2016-08-11T00:00:00.000,Done
2016OPA-0969,Done,OPA Close Case,02/19/2017 12:00:00 AM,03/06/2017 12:00:00 AM,02/09/2017 12:00:00 AM,,2017-02-19T00:00:00.000,2017-03-06T00:00:00.000,2017-02-09T00:00:00.000,Done
2017OPA-0130,Done,OPA Close SA,,04/14/2017 12:00:00 AM,04/12/2017 12:00:00 AM,,,2017-04-14T00:00:00.000,2017-04-12T00:00:00.000,Done
2017OPA-0424,Done,OPA Close CL,05/01/2017 12:00:00 AM,05/01/2017 12:00:00 AM,04/24/2017 12:00:00 AM,,2017-05-01T00:00:00.000,2017-05-01T00:00:00.000,2017-04-24T00:00:00.000,Done
2017OPA-0834,Done,OPA Close SA,12/11/2017 12:00:00 AM,06/21/2018 12:00:00 AM,12/01/2017 12:00:00 AM,,2017-12-11T00:00:00.000,2018-06-21T00:00:00.000,2017-12-01T00:00:00.000,Done
2015OPA-0087,Done,OPA Close Case,07/28/2015 12:00:00 AM,07/28/2015 12:00:00 AM,07/14/2015 12:00:00 AM,2014-428283,2015-07-28T00:00:00.000,2015-07-28T00:00:00.000,2015-07-14T00:00:00.000,Done
2016OPA-1473,Done,OPA Close CL,01/22/2017 12:00:00 AM,01/18/2017 12:00:00 AM,01/12/2017 12:00:00 AM,,2017-01-22T00:00:00.000,2017-01-18T00:00:00.000,2017-01-12T00:00:00.000,Done
2017OPA-0884,Done,OPA Missed 180 Day Deadline,02/16/2018 12:00:00 AM,08/05/2018 12:00:00 AM,09/12/2018 12:00:00 AM,2017-308564,2018-02-16T00:00:00.000,2018-08-05T00:00:00.000,2018-09-12T00:00:00.000,Done
2019OPA-0742,Done,OPA Close Case,,04/21/2020 12:00:00 AM,02/26/2020 12:00:00 AM,2019-328351,,2020-04-21T00:00:00.000,2020-02-26T00:00:00.000,Done
2015OPA-0309,Done,OPA Director SA Review,05/07/2015 12:00:00 AM,04/30/2015 12:00:00 AM,04/27/2015 12:00:00 AM,2014-380002,2015-05-07T00:00:00.000,2015-04-30T00:00:00.000,2015-04-27T00:00:00.000,Done
2016OPA-1150,Done,OPA Close CL,09/26/2016 12:00:00 AM,09/25/2016 12:00:00 AM,09/19/2016 12:00:00 AM,,2016-09-26T00:00:00.000,2016-09-25T00:00:00.000,2016-09-19T00:00:00.000,Done
2018OPA-0780,Done,OPA Close CL,09/15/2018 12:00:00 AM,09/12/2018 12:00:00 AM,09/07/2018 12:00:00 AM,,2018-09-15T00:00:00.000,2018-09-12T00:00:00.000,2018-09-07T00:00:00.000,Done
2019OPA-0316,Done,OPA Close Case,12/19/2019 12:00:00 AM,12/09/2019 12:00:00 AM,12/09/2019 12:00:00 AM,,2019-12-19T00:00:00.000,2019-12-09T00:00:00.000,2019-12-09T00:00:00.000,Done
2016OPA-0300,Done,OPA Close CL,03/30/2016 12:00:00 AM,03/30/2016 12:00:00 AM,03/23/2016 12:00:00 AM,,2016-03-30T00:00:00.000,2016-03-30T00:00:00.000,2016-03-23T00:00:00.000,Done
2016OPA-0478,Done,OPA Close CL,05/09/2016 12:00:00 AM,05/09/2016 12:00:00 AM,05/09/2016 12:00:00 AM,,2016-05-09T00:00:00.000,2016-05-09T00:00:00.000,2016-05-09T00:00:00.000,Done
2016OPA-0642,Done,OPA Close CL,07/11/2016 12:00:00 AM,07/08/2016 12:00:00 AM,07/06/2016 12:00:00 AM,,2016-07-11T00:00:00.000,2016-07-08T00:00:00.000,2016-07-06T00:00:00.000,Done
2016OPA-0824,Done,OPA Close CL,08/17/2016 12:00:00 AM,08/15/2016 12:00:00 AM,08/12/2016 12:00:00 AM,,2016-08-17T00:00:00.000,2016-08-15T00:00:00.000,2016-08-12T00:00:00.000,Done
2018OPA-0877,Done,OPA Close SA,,10/26/2018 12:00:00 AM,10/26/2018 12:00:00 AM,2018-319832,,2018-10-26T00:00:00.000,2018-10-26T00:00:00.000,Done
2019OPA-0331,Done,OPA Close CL,06/17/2019 12:00:00 AM,06/24/2019 12:00:00 AM,06/12/2019 12:00:00 AM,,2019-06-17T00:00:00.000,2019-06-24T00:00:00.000,2019-06-12T00:00:00.000,Done
2020OPA-0245,Done,OPA Intake,05/12/2020 12:00:00 AM,05/04/2020 12:00:00 AM,04/27/2020 12:00:00 AM,2020-117632,2020-05-12T00:00:00.000,2020-05-04T00:00:00.000,2020-04-27T00:00:00.000,Done
2015OPA-0899,Done,OPA Close SA,08/29/2015 12:00:00 AM,08/24/2015 12:00:00 AM,08/24/2015 12:00:00 AM,2014-351805,2015-08-29T00:00:00.000,2015-08-24T00:00:00.000,2015-08-24T00:00:00.000,Done
2015OPA-1261,Done,OPA Close SA,11/07/2015 12:00:00 AM,11/02/2015 12:00:00 AM,11/02/2015 12:00:00 AM,2015-061177,2015-11-07T00:00:00.000,2015-11-02T00:00:00.000,2015-11-02T00:00:00.000,Done
2015OPA-1804,Done,OPA Close CL,04/06/2016 12:00:00 AM,04/07/2016 12:00:00 AM,04/01/2016 12:00:00 AM,,2016-04-06T00:00:00.000,2016-04-07T00:00:00.000,2016-04-01T00:00:00.000,Done
2016OPA-0426,Done,OPA Close SA,05/21/2016 12:00:00 AM,05/17/2016 12:00:00 AM,05/06/2016 12:00:00 AM,2016-089371,2016-05-21T00:00:00.000,2016-05-17T00:00:00.000,2016-05-06T00:00:00.000,Done
2016OPA-1047,Done,OPA Close CL,09/07/2016 12:00:00 AM,09/12/2016 12:00:00 AM,09/02/2016 12:00:00 AM,2016-305740,2016-09-07T00:00:00.000,2016-09-12T00:00:00.000,2016-09-02T00:00:00.000,Done
2016OPA-1369,Done,OPA Close SA,,01/19/2017 12:00:00 AM,01/19/2017 12:00:00 AM,,,2017-01-19T00:00:00.000,2017-01-19T00:00:00.000,Done
2017OPA-0973,Done,OPA Final Discipline Action Report,,02/15/2018 12:00:00 AM,01/22/2019 12:00:00 AM,2017-313937,,2018-02-15T00:00:00.000,2019-01-22T00:00:00.000,Done
2018OPA-0508,Done,OPA Close CL,07/07/2018 12:00:00 AM,07/10/2018 12:00:00 AM,07/02/2018 12:00:00 AM,2018-203006,2018-07-07T00:00:00.000,2018-07-10T00:00:00.000,2018-07-02T00:00:00.000,Done
2015OPA-0278,Done,OPA Close Case,10/16/2015 12:00:00 AM,10/16/2015 12:00:00 AM,10/05/2015 12:00:00 AM,,2015-10-16T00:00:00.000,2015-10-16T00:00:00.000,2015-10-05T00:00:00.000,Done
2015OPA-1399,Done,OPA Close SA,11/28/2015 12:00:00 AM,11/24/2015 12:00:00 AM,11/23/2015 12:00:00 AM,2014-295233,2015-11-28T00:00:00.000,2015-11-24T00:00:00.000,2015-11-23T00:00:00.000,Done
2015OPA-1435,Done,OPA Close CL,,10/06/2015 12:00:00 AM,10/13/2015 12:00:00 AM,,,2015-10-06T00:00:00.000,2015-10-13T00:00:00.000,Done
2015OPA-1826,Done,OPA Close CL,12/19/2015 12:00:00 AM,12/16/2015 12:00:00 AM,12/14/2015 12:00:00 AM,2015-388072,2015-12-19T00:00:00.000,2015-12-16T00:00:00.000,2015-12-14T00:00:00.000,Done
2016OPA-0733,Done,OPA Close Case,03/16/2017 12:00:00 AM,03/29/2017 12:00:00 AM,03/06/2017 12:00:00 AM,2016-220028,2017-03-16T00:00:00.000,2017-03-29T00:00:00.000,2017-03-06T00:00:00.000,Done
2016OPA-1397,Done,OPA Close Case,06/12/2017 12:00:00 AM,06/28/2017 12:00:00 AM,05/10/2017 12:00:00 AM,2016-419481,2017-06-12T00:00:00.000,2017-06-28T00:00:00.000,2017-05-10T00:00:00.000,Done
2017OPA-0167,Done,OPA Close Case,05/31/2017 12:00:00 AM,06/06/2017 12:00:00 AM,05/17/2017 12:00:00 AM,2017-009960,2017-05-31T00:00:00.000,2017-06-06T00:00:00.000,2017-05-17T00:00:00.000,Done
2017OPA-0426,Done,OPA Close SA,,06/20/2017 12:00:00 AM,06/20/2017 12:00:00 AM,2017-138043,,2017-06-20T00:00:00.000,2017-06-20T00:00:00.000,Done
2017OPA-0453,Done,OPA Close Case,10/25/2017 12:00:00 AM,10/27/2017 12:00:00 AM,10/23/2017 12:00:00 AM,2016-225415,2017-10-25T00:00:00.000,2017-10-27T00:00:00.000,2017-10-23T00:00:00.000,Done
2018OPA-1049,Done,OPA Close Case,05/06/2019 12:00:00 AM,05/06/2019 12:00:00 AM,04/26/2019 12:00:00 AM,,2019-05-06T00:00:00.000,2019-05-06T00:00:00.000,2019-04-26T00:00:00.000,Done
2015OPA-0657,Done,OPA Close CL,,06/08/2015 12:00:00 AM,10/19/2015 12:00:00 AM,,,2015-06-08T00:00:00.000,2015-10-19T00:00:00.000,Done
2015OPA-1787,Done,OPA Close CL,11/28/2015 12:00:00 AM,11/30/2015 12:00:00 AM,11/23/2015 12:00:00 AM,,2015-11-28T00:00:00.000,2015-11-30T00:00:00.000,2015-11-23T00:00:00.000,Done
2017OPA-0985,Done,OPA Close CL,10/22/2017 12:00:00 AM,10/18/2017 12:00:00 AM,09/22/2017 12:00:00 AM,2017-349438,2017-10-22T00:00:00.000,2017-10-18T00:00:00.000,2017-09-22T00:00:00.000,Done
2018OPA-0443,Done,OPA Close CL,06/10/2018 12:00:00 AM,06/06/2018 12:00:00 AM,06/05/2018 12:00:00 AM,,2018-06-10T00:00:00.000,2018-06-06T00:00:00.000,2018-06-05T00:00:00.000,Done
2018OPA-1113,Done,OPA Close CL,12/22/2018 12:00:00 AM,12/20/2018 12:00:00 AM,12/17/2018 12:00:00 AM,,2018-12-22T00:00:00.000,2018-12-20T00:00:00.000,2018-12-17T00:00:00.000,Done
2017OPA-0687,Done,OPA Send Complainant Closing Letter,07/24/2017 12:00:00 AM,07/24/2017 12:00:00 AM,07/19/2017 12:00:00 AM,,2017-07-24T00:00:00.000,2017-07-24T00:00:00.000,2017-07-19T00:00:00.000,Done
2017OPA-0977,Done,OPA Close SA,,12/04/2017 12:00:00 AM,12/04/2017 12:00:00 AM,2017-252295,,2017-12-04T00:00:00.000,2017-12-04T00:00:00.000,Done
2018OPA-0321,Done,OPA Training Referral,04/25/2019 12:00:00 AM,06/21/2019 12:00:00 AM,02/26/2019 12:00:00 AM,2018-121831,2019-04-25T00:00:00.000,2019-06-21T00:00:00.000,2019-02-26T00:00:00.000,Done
2018OPA-0548,Done,OPA Training Referral,,01/08/2019 12:00:00 AM,01/13/2019 12:00:00 AM,,,2019-01-08T00:00:00.000,2019-01-13T00:00:00.000,Done
2018OPA-0683,Done,OPA Close Case,,02/20/2019 12:00:00 AM,01/21/2019 12:00:00 AM,2018-169141,,2019-02-20T00:00:00.000,2019-01-21T00:00:00.000,Done
2020OPA-0169,Done,OPA Close CL,04/09/2020 12:00:00 AM,04/10/2020 12:00:00 AM,04/04/2020 12:00:00 AM,,2020-04-09T00:00:00.000,2020-04-10T00:00:00.000,2020-04-04T00:00:00.000,Done
2015OPA-0482,Done,OPA Director SA Review,07/06/2015 12:00:00 AM,08/13/2015 12:00:00 AM,07/01/2015 12:00:00 AM,,2015-07-06T00:00:00.000,2015-08-13T00:00:00.000,2015-07-01T00:00:00.000,Done
2015OPA-1099,Done,OPA Close Case,12/22/2015 12:00:00 AM,12/23/2015 12:00:00 AM,12/11/2015 12:00:00 AM,2014-241242,2015-12-22T00:00:00.000,2015-12-23T00:00:00.000,2015-12-11T00:00:00.000,Done
2015OPA-1072,Done,OPA Close CL,,09/03/2015 12:00:00 AM,10/15/2015 12:00:00 AM,,,2015-09-03T00:00:00.000,2015-10-15T00:00:00.000,Done
2017OPA-0862,Done,OPA Close Case,02/14/2018 12:00:00 AM,06/01/2018 12:00:00 AM,02/14/2018 12:00:00 AM,2017-310838,2018-02-14T00:00:00.000,2018-06-01T00:00:00.000,2018-02-14T00:00:00.000,Done
2017OPA-1322,Done,OPA Close Case,01/19/2018 12:00:00 AM,01/09/2018 12:00:00 AM,01/09/2018 12:00:00 AM,,2018-01-19T00:00:00.000,2018-01-09T00:00:00.000,2018-01-09T00:00:00.000,Done
2018OPA-0173,Done,OPA Close SA,,05/10/2018 12:00:00 AM,05/10/2018 12:00:00 AM,,,2018-05-10T00:00:00.000,2018-05-10T00:00:00.000,Done
2018OPA-0522,Done,OPA Close CL,07/17/2018 12:00:00 AM,07/13/2018 12:00:00 AM,07/12/2018 12:00:00 AM,2018-213964,2018-07-17T00:00:00.000,2018-07-13T00:00:00.000,2018-07-12T00:00:00.000,Done
2018OPA-1186,Done,OPA Close CL,01/22/2019 12:00:00 AM,01/29/2019 12:00:00 AM,01/17/2019 12:00:00 AM,2018-476725,2019-01-22T00:00:00.000,2019-01-29T00:00:00.000,2019-01-17T00:00:00.000,Done
2019OPA-0213,Done,OPA Close CL,04/30/2019 12:00:00 AM,04/29/2019 12:00:00 AM,04/25/2019 12:00:00 AM,,2019-04-30T00:00:00.000,2019-04-29T00:00:00.000,2019-04-25T00:00:00.000,Done
2015OPA-1588,Done,OPA Close Case,04/26/2016 12:00:00 AM,05/04/2016 12:00:00 AM,04/13/2016 12:00:00 AM,2015-363339,2016-04-26T00:00:00.000,2016-05-04T00:00:00.000,2016-04-13T00:00:00.000,Done
2016OPA-0240,Done,OPA Close CL,03/21/2016 12:00:00 AM,03/18/2016 12:00:00 AM,03/16/2016 12:00:00 AM,2016-075968,2016-03-21T00:00:00.000,2016-03-18T00:00:00.000,2016-03-16T00:00:00.000,Done
2016OPA-0546,Done,OPA Close SA,08/02/2016 12:00:00 AM,07/29/2016 12:00:00 AM,06/22/2016 12:00:00 AM,,2016-08-02T00:00:00.000,2016-07-29T00:00:00.000,2016-06-22T00:00:00.000,Done
2017OPA-0303,Done,OPA Send Complainant Closing Letter,04/27/2017 12:00:00 AM,04/19/2017 12:00:00 AM,03/28/2017 12:00:00 AM,,2017-04-27T00:00:00.000,2017-04-19T00:00:00.000,2017-03-28T00:00:00.000,Done
2015OPA-0141,Done,OPA Close Case,08/11/2015 12:00:00 AM,08/11/2015 12:00:00 AM,07/29/2015 12:00:00 AM,,2015-08-11T00:00:00.000,2015-08-11T00:00:00.000,2015-07-29T00:00:00.000,Done
2017OPA-0297,Done,OPA Send Complainant Closing Letter,04/26/2017 12:00:00 AM,03/31/2017 12:00:00 AM,03/27/2017 12:00:00 AM,,2017-04-26T00:00:00.000,2017-03-31T00:00:00.000,2017-03-27T00:00:00.000,Done
2018OPA-0421,Done,OPA Close CL,06/12/2018 12:00:00 AM,06/08/2018 12:00:00 AM,06/08/2018 12:00:00 AM,2018-168558,2018-06-12T00:00:00.000,2018-06-08T00:00:00.000,2018-06-08T00:00:00.000,Done
2015OPA-0151,Done,OPA Close CL,,02/18/2015 12:00:00 AM,10/22/2015 12:00:00 AM,,,2015-02-18T00:00:00.000,2015-10-22T00:00:00.000,Done
2015OPA-1581,Done,OPA Close CL,11/02/2015 12:00:00 AM,11/02/2015 12:00:00 AM,10/28/2015 12:00:00 AM,,2015-11-02T00:00:00.000,2015-11-02T00:00:00.000,2015-10-28T00:00:00.000,Done
2015OPA-1604,Done,OPA Close CL,,11/10/2015 12:00:00 AM,11/10/2015 12:00:00 AM,,,2015-11-10T00:00:00.000,2015-11-10T00:00:00.000,Done
2016OPA-1408,Done,OPA Close CL,12/12/2016 12:00:00 AM,12/16/2016 12:00:00 AM,12/07/2016 12:00:00 AM,,2016-12-12T00:00:00.000,2016-12-16T00:00:00.000,2016-12-07T00:00:00.000,Done
2017OPA-0867,Done,OPA Training Referral,03/02/2018 12:00:00 AM,03/01/2018 12:00:00 AM,03/01/2018 12:00:00 AM,2016-383208,2018-03-02T00:00:00.000,2018-03-01T00:00:00.000,2018-03-01T00:00:00.000,Done
2017OPA-1006,Done,OPA Close Case,04/02/2018 12:00:00 AM,02/19/2019 12:00:00 AM,03/23/2018 12:00:00 AM,2017-346941,2018-04-02T00:00:00.000,2019-02-19T00:00:00.000,2018-03-23T00:00:00.000,Done
2019OPA-0279,Done,OPA Close CL,06/03/2019 12:00:00 AM,05/31/2019 12:00:00 AM,05/29/2019 12:00:00 AM,,2019-06-03T00:00:00.000,2019-05-31T00:00:00.000,2019-05-29T00:00:00.000,Done
2015OPA-0161,Done,OPA Close CL,,03/02/2015 12:00:00 AM,10/22/2015 12:00:00 AM,,,2015-03-02T00:00:00.000,2015-10-22T00:00:00.000,Done
2015OPA-0881,Done,OPA Close CL,,08/09/2015 12:00:00 AM,10/15/2015 12:00:00 AM,,,2015-08-09T00:00:00.000,2015-10-15T00:00:00.000,Done
2019OPA-0349,Done,OPA Close Case,11/11/2019 12:00:00 AM,12/10/2019 12:00:00 AM,10/28/2019 12:00:00 AM,2019-152818,2019-11-11T00:00:00.000,2019-12-10T00:00:00.000,2019-10-28T00:00:00.000,Done
2015OPA-1537,Done,OPA Close CL,10/31/2015 12:00:00 AM,10/28/2015 12:00:00 AM,10/26/2015 12:00:00 AM,,2015-10-31T00:00:00.000,2015-10-28T00:00:00.000,2015-10-26T00:00:00.000,Done
2017OPA-0989,Done,OPA Close CL,10/25/2017 12:00:00 AM,10/19/2017 12:00:00 AM,09/25/2017 12:00:00 AM,,2017-10-25T00:00:00.000,2017-10-19T00:00:00.000,2017-09-25T00:00:00.000,Done
2019OPA-0343,Done,OPA Close CL,06/04/2019 12:00:00 AM,06/06/2019 12:00:00 AM,05/30/2019 12:00:00 AM,,2019-06-04T00:00:00.000,2019-06-06T00:00:00.000,2019-05-30T00:00:00.000,Done
2016OPA-0014,Done,OPA Close Case,07/06/2016 12:00:00 AM,07/06/2016 12:00:00 AM,06/23/2016 12:00:00 AM,2014-321673,2016-07-06T00:00:00.000,2016-07-06T00:00:00.000,2016-06-23T00:00:00.000,Done
2016OPA-1251,Done,OPA Close CL,11/14/2016 12:00:00 AM,11/15/2016 12:00:00 AM,11/09/2016 12:00:00 AM,,2016-11-14T00:00:00.000,2016-11-15T00:00:00.000,2016-11-09T00:00:00.000,Done
2017OPA-0968,Done,OPA Close CL,10/16/2017 12:00:00 AM,10/13/2017 12:00:00 AM,10/11/2017 12:00:00 AM,,2017-10-16T00:00:00.000,2017-10-13T00:00:00.000,2017-10-11T00:00:00.000,Done
2018OPA-0586,Done,OPA Close Case,,02/05/2019 12:00:00 AM,01/13/2019 12:00:00 AM,2018-191761,,2019-02-05T00:00:00.000,2019-01-13T00:00:00.000,Done
2016OPA-1213,Done,OPA Close SA,,12/19/2016 12:00:00 AM,12/19/2016 12:00:00 AM,2016-260158,,2016-12-19T00:00:00.000,2016-12-19T00:00:00.000,Done
2019OPA-0464,Done,OPA Close Case,02/15/2020 12:00:00 AM,02/17/2020 12:00:00 AM,01/02/2020 12:00:00 AM,,2020-02-15T00:00:00.000,2020-02-17T00:00:00.000,2020-01-02T00:00:00.000,Done
2020OPA-0224,Done,OPA Create SAN,05/08/2020 12:00:00 AM,05/05/2020 12:00:00 AM,05/05/2020 12:00:00 AM,,2020-05-08T00:00:00.000,2020-05-05T00:00:00.000,2020-05-05T00:00:00.000,Done
2016OPA-0525,Done,OPA Close CL,05/23/2016 12:00:00 AM,05/27/2016 12:00:00 AM,05/23/2016 12:00:00 AM,,2016-05-23T00:00:00.000,2016-05-27T00:00:00.000,2016-05-23T00:00:00.000,Done
2016OPA-1075,Done,OPA Close CL,10/05/2016 12:00:00 AM,10/03/2016 12:00:00 AM,09/30/2016 12:00:00 AM,,2016-10-05T00:00:00.000,2016-10-03T00:00:00.000,2016-09-30T00:00:00.000,Done
2017OPA-0956,Done,OPA Close Case,03/05/2018 12:00:00 AM,06/29/2018 12:00:00 AM,03/05/2018 12:00:00 AM,,2018-03-05T00:00:00.000,2018-06-29T00:00:00.000,2018-03-05T00:00:00.000,Done
2019OPA-0637,Done,OPA Close SA,,09/27/2019 12:00:00 AM,09/27/2019 12:00:00 AM,2019-083749,,2019-09-27T00:00:00.000,2019-09-27T00:00:00.000,Done
2019OPA-0850,Done,OPA Close Case,02/19/2020 12:00:00 AM,03/19/2020 12:00:00 AM,02/09/2020 12:00:00 AM,2019-430746,2020-02-19T00:00:00.000,2020-03-19T00:00:00.000,2020-02-09T00:00:00.000,Done
2019OPA-0880,Done,OPA 180 Extension Request,07/04/2020 12:00:00 AM,08/03/2020 12:00:00 AM,04/02/2020 12:00:00 AM,2019-453163,2020-07-04T00:00:00.000,2020-08-03T00:00:00.000,2020-04-02T00:00:00.000,Done
2019OPA-0919,Done,OPA Close Case,02/23/2020 12:00:00 AM,04/14/2020 12:00:00 AM,02/13/2020 12:00:00 AM,2019-441441,2020-02-23T00:00:00.000,2020-04-14T00:00:00.000,2020-02-13T00:00:00.000,Done
2020OPA-0029,Done,OPA Close SA,,03/31/2020 12:00:00 AM,03/31/2020 12:00:00 AM,2020-010314,,2020-03-31T00:00:00.000,2020-03-31T00:00:00.000,Done
2020OPA-0138,Done,OPA Process SA,,03/19/2020 12:00:00 AM,03/19/2020 12:00:00 AM,,,2020-03-19T00:00:00.000,2020-03-19T00:00:00.000,Done
2015OPA-0855,Done,OPA Close CL,,07/23/2015 12:00:00 AM,10/16/2015 12:00:00 AM,,,2015-07-23T00:00:00.000,2015-10-16T00:00:00.000,Done
2016OPA-1354,Done,OPA Close Case,06/09/2017 12:00:00 AM,06/13/2017 12:00:00 AM,05/30/2017 12:00:00 AM,2016-326843,2017-06-09T00:00:00.000,2017-06-13T00:00:00.000,2017-05-30T00:00:00.000,Done
2017OPA-0729,Done,OPA Close CL,08/09/2017 12:00:00 AM,08/15/2017 12:00:00 AM,08/04/2017 12:00:00 AM,,2017-08-09T00:00:00.000,2017-08-15T00:00:00.000,2017-08-04T00:00:00.000,Done
2018OPA-0764,Done,OPA Close CL,09/12/2018 12:00:00 AM,09/12/2018 12:00:00 AM,09/07/2018 12:00:00 AM,2018-258011,2018-09-12T00:00:00.000,2018-09-12T00:00:00.000,2018-09-07T00:00:00.000,Done
2018OPA-0836,Done,OPA Close SA,,10/12/2018 12:00:00 AM,10/12/2018 12:00:00 AM,2018-296150,,2018-10-12T00:00:00.000,2018-10-12T00:00:00.000,Done
2015OPA-0214,Done,OPA Close CL,,03/05/2015 12:00:00 AM,10/22/2015 12:00:00 AM,,,2015-03-05T00:00:00.000,2015-10-22T00:00:00.000,Done
2018OPA-0559,Done,OPA Close CL,07/23/2018 12:00:00 AM,07/19/2018 12:00:00 AM,07/18/2018 12:00:00 AM,2018-219319,2018-07-23T00:00:00.000,2018-07-19T00:00:00.000,2018-07-18T00:00:00.000,Done
2018OPA-1112,Done,OPA Close CL,12/22/2018 12:00:00 AM,12/27/2018 12:00:00 AM,12/17/2018 12:00:00 AM,,2018-12-22T00:00:00.000,2018-12-27T00:00:00.000,2018-12-17T00:00:00.000,Done
2019OPA-0646,Done,OPA Close Case,02/18/2020 12:00:00 AM,04/10/2020 12:00:00 AM,02/04/2020 12:00:00 AM,2019-227301,2020-02-18T00:00:00.000,2020-04-10T00:00:00.000,2020-02-04T00:00:00.000,Done
2016OPA-0147,Done,OPA Close Case,08/18/2016 12:00:00 AM,08/18/2016 12:00:00 AM,08/09/2016 12:00:00 AM,2015-370177,2016-08-18T00:00:00.000,2016-08-18T00:00:00.000,2016-08-09T00:00:00.000,Done
2016OPA-0865,Done,OPA Close Case,02/16/2017 12:00:00 AM,03/06/2017 12:00:00 AM,02/06/2017 12:00:00 AM,2016-145105,2017-02-16T00:00:00.000,2017-03-06T00:00:00.000,2017-02-06T00:00:00.000,Done
2017OPA-0209,Done,OPA Close SA,,04/21/2017 12:00:00 AM,04/21/2017 12:00:00 AM,,,2017-04-21T00:00:00.000,2017-04-21T00:00:00.000,Done
2017OPA-0433,Done,OPA Close CL,05/03/2017 12:00:00 AM,05/02/2017 12:00:00 AM,04/28/2017 12:00:00 AM,,2017-05-03T00:00:00.000,2017-05-02T00:00:00.000,2017-04-28T00:00:00.000,Done
2017OPA-1251,Done,OPA Close SA,,02/15/2018 12:00:00 AM,02/15/2018 12:00:00 AM,2017-443834,,2018-02-15T00:00:00.000,2018-02-15T00:00:00.000,Done
2015OPA-1445,Done,OPA Close CL,,10/06/2015 12:00:00 AM,10/13/2015 12:00:00 AM,,,2015-10-06T00:00:00.000,2015-10-13T00:00:00.000,Done
2015OPA-1933,Done,OPA Close CL,04/05/2016 12:00:00 AM,04/07/2016 12:00:00 AM,03/31/2016 12:00:00 AM,2015-386906,2016-04-05T00:00:00.000,2016-04-07T00:00:00.000,2016-03-31T00:00:00.000,Done
2016OPA-1360,Done,OPA Close CL,12/19/2016 12:00:00 AM,12/21/2016 12:00:00 AM,12/14/2016 12:00:00 AM,,2016-12-19T00:00:00.000,2016-12-21T00:00:00.000,2016-12-14T00:00:00.000,Done
2016OPA-1438,Done,OPA Close CL,01/11/2017 12:00:00 AM,01/06/2017 12:00:00 AM,01/06/2017 12:00:00 AM,2016-184779,2017-01-11T00:00:00.000,2017-01-06T00:00:00.000,2017-01-06T00:00:00.000,Done
2017OPA-0183,Done,OPA Close CL,03/22/2017 12:00:00 AM,03/09/2017 12:00:00 AM,02/21/2017 12:00:00 AM,,2017-03-22T00:00:00.000,2017-03-09T00:00:00.000,2017-02-21T00:00:00.000,Done
2017OPA-1134,Done,OPA Close SA,,01/11/2018 12:00:00 AM,01/11/2018 12:00:00 AM,2017-347315,,2018-01-11T00:00:00.000,2018-01-11T00:00:00.000,Done
2017OPA-1313,Done,OPA Close CL,01/09/2018 12:00:00 AM,01/08/2018 12:00:00 AM,01/04/2018 12:00:00 AM,,2018-01-09T00:00:00.000,2018-01-08T00:00:00.000,2018-01-04T00:00:00.000,Done
2015OPA-0123,Done,OPA Close CL,,02/18/2015 12:00:00 AM,10/22/2015 12:00:00 AM,2014-222942,,2015-02-18T00:00:00.000,2015-10-22T00:00:00.000,Done
2015OPA-0927,Done,OPA Close CL,,06/30/2015 12:00:00 AM,10/19/2015 12:00:00 AM,,,2015-06-30T00:00:00.000,2015-10-19T00:00:00.000,Done
2016OPA-0079,Done,opa closing letter to complainant,02/23/2016 12:00:00 AM,02/18/2016 12:00:00 AM,02/18/2016 12:00:00 AM,,2016-02-23T00:00:00.000,2016-02-18T00:00:00.000,2016-02-18T00:00:00.000,Done
2016OPA-0591,Done,OPA Close SA,08/05/2016 12:00:00 AM,07/21/2016 12:00:00 AM,07/21/2016 12:00:00 AM,,2016-08-05T00:00:00.000,2016-07-21T00:00:00.000,2016-07-21T00:00:00.000,Done
2017OPA-0745,Done,OPA Close SA,,09/19/2017 12:00:00 AM,09/19/2017 12:00:00 AM,2017-269139,,2017-09-19T00:00:00.000,2017-09-19T00:00:00.000,Done
2018OPA-1199,Done,OPA Close CL,01/27/2019 12:00:00 AM,01/29/2019 12:00:00 AM,01/22/2019 12:00:00 AM,2018-333705,2019-01-27T00:00:00.000,2019-01-29T00:00:00.000,2019-01-22T00:00:00.000,Done
2015OPA-0052,Done,OPA Close Case,07/24/2014 12:00:00 AM,07/28/2015 12:00:00 AM,07/10/2015 12:00:00 AM,,2014-07-24T00:00:00.000,2015-07-28T00:00:00.000,2015-07-10T00:00:00.000,Done
2016OPA-0868,Done,OPA Close CL,08/21/2016 12:00:00 AM,08/18/2016 12:00:00 AM,08/16/2016 12:00:00 AM,,2016-08-21T00:00:00.000,2016-08-18T00:00:00.000,2016-08-16T00:00:00.000,Done
2016OPA-1527,Done,OPA Close Case,07/07/2017 12:00:00 AM,07/21/2017 12:00:00 AM,06/16/2017 12:00:00 AM,2016-459362,2017-07-07T00:00:00.000,2017-07-21T00:00:00.000,2017-06-16T00:00:00.000,Done
2017OPA-0284,Done,OPA Close CL,04/10/2017 12:00:00 AM,04/14/2017 12:00:00 AM,04/05/2017 12:00:00 AM,,2017-04-10T00:00:00.000,2017-04-14T00:00:00.000,2017-04-05T00:00:00.000,Done
2017OPA-1078,Done,OPA Close CL,10/21/2017 12:00:00 AM,10/17/2017 12:00:00 AM,10/16/2017 12:00:00 AM,2017-318926,2017-10-21T00:00:00.000,2017-10-17T00:00:00.000,2017-10-16T00:00:00.000,Done
2019OPA-0121,Done,OPA Close Case,09/28/2019 12:00:00 AM,09/24/2019 12:00:00 AM,09/18/2019 12:00:00 AM,2019-054548,2019-09-28T00:00:00.000,2019-09-24T00:00:00.000,2019-09-18T00:00:00.000,Done
2019OPA-0353,Done,OPA Close Case,11/29/2019 12:00:00 AM,12/17/2019 12:00:00 AM,11/19/2019 12:00:00 AM,,2019-11-29T00:00:00.000,2019-12-17T00:00:00.000,2019-11-19T00:00:00.000,Done
2015OPA-0032,Done,OPA Director SA Review,04/20/2015 12:00:00 AM,06/16/2015 12:00:00 AM,04/15/2015 12:00:00 AM,2014-342233,2015-04-20T00:00:00.000,2015-06-16T00:00:00.000,2015-04-15T00:00:00.000,Done
2015OPA-0342,Done,OPA Close CL,,05/11/2015 12:00:00 AM,10/20/2015 12:00:00 AM,,,2015-05-11T00:00:00.000,2015-10-20T00:00:00.000,Done
2019OPA-0412,Done,OPA Close CL,07/11/2019 12:00:00 AM,07/10/2019 12:00:00 AM,07/06/2019 12:00:00 AM,,2019-07-11T00:00:00.000,2019-07-10T00:00:00.000,2019-07-06T00:00:00.000,Done
2015OPA-0698,Done,OPA Close SA,,07/15/2015 12:00:00 AM,07/13/2015 12:00:00 AM,2011-320807,,2015-07-15T00:00:00.000,2015-07-13T00:00:00.000,Done
2017OPA-0826,Done,OPA Close CL,09/07/2017 12:00:00 AM,09/13/2017 12:00:00 AM,09/02/2017 12:00:00 AM,2017-276374,2017-09-07T00:00:00.000,2017-09-13T00:00:00.000,2017-09-02T00:00:00.000,Done
2017OPA-1304,Done,OPA Close SA,,08/13/2018 12:00:00 AM,08/13/2018 12:00:00 AM,,,2018-08-13T00:00:00.000,2018-08-13T00:00:00.000,Done
2018OPA-0643,Done,OPA Training Referral,,02/07/2019 12:00:00 AM,01/21/2019 12:00:00 AM,,,2019-02-07T00:00:00.000,2019-01-21T00:00:00.000,Done
2019OPA-0364,Done,OPA Close Case,11/24/2019 12:00:00 AM,11/14/2019 12:00:00 AM,11/14/2019 12:00:00 AM,2019-166644,2019-11-24T00:00:00.000,2019-11-14T00:00:00.000,2019-11-14T00:00:00.000,Done
2015OPA-0016,Done,OPA Close CL,,01/22/2015 12:00:00 AM,10/23/2015 12:00:00 AM,,,2015-01-22T00:00:00.000,2015-10-23T00:00:00.000,Done
2015OPA-0460,Done,OPA Director SA Review,05/10/2015 12:00:00 AM,05/20/2015 12:00:00 AM,05/05/2015 12:00:00 AM,,2015-05-10T00:00:00.000,2015-05-20T00:00:00.000,2015-05-05T00:00:00.000,Done
2015OPA-1200,Done,OPA Close Case,02/12/2016 12:00:00 AM,03/01/2016 12:00:00 AM,01/13/2016 12:00:00 AM,,2016-02-12T00:00:00.000,2016-03-01T00:00:00.000,2016-01-13T00:00:00.000,Done
2018OPA-0359,Done,OPA Close CL,06/04/2018 12:00:00 AM,05/30/2018 12:00:00 AM,05/30/2018 12:00:00 AM,2018-090451,2018-06-04T00:00:00.000,2018-05-30T00:00:00.000,2018-05-30T00:00:00.000,Done
2018OPA-0603,Done,OPA Close Case,,02/05/2019 12:00:00 AM,01/13/2019 12:00:00 AM,,,2019-02-05T00:00:00.000,2019-01-13T00:00:00.000,Done
2018OPA-0736,Done,OPA Close CL,08/26/2018 12:00:00 AM,08/22/2018 12:00:00 AM,08/21/2018 12:00:00 AM,,2018-08-26T00:00:00.000,2018-08-22T00:00:00.000,2018-08-21T00:00:00.000,Done
2020OPA-0074,Done,OPA Close CL,02/25/2020 12:00:00 AM,02/24/2020 12:00:00 AM,02/18/2020 12:00:00 AM,2020-027992,2020-02-25T00:00:00.000,2020-02-24T00:00:00.000,2020-02-18T00:00:00.000,Done
2015OPA-0451,Done,OPA Close Case,,09/11/2015 12:00:00 AM,08/31/2015 12:00:00 AM,,,2015-09-11T00:00:00.000,2015-08-31T00:00:00.000,Done
2016OPA-0371,Done,OPA Close Case,10/13/2016 12:00:00 AM,10/13/2016 12:00:00 AM,10/11/2016 12:00:00 AM,2016-108160,2016-10-13T00:00:00.000,2016-10-13T00:00:00.000,2016-10-11T00:00:00.000,Done
2016OPA-0903,Done,OPA Close SA,,10/07/2016 12:00:00 AM,10/07/2016 12:00:00 AM,2015-298301,,2016-10-07T00:00:00.000,2016-10-07T00:00:00.000,Done
2019OPA-0308,Done,OPA Close Case,09/20/2019 12:00:00 AM,09/24/2019 12:00:00 AM,09/10/2019 12:00:00 AM,2019-069009,2019-09-20T00:00:00.000,2019-09-24T00:00:00.000,2019-09-10T00:00:00.000,Done
2015OPA-0195,Done,OPA Close Case,10/09/2015 12:00:00 AM,10/09/2015 12:00:00 AM,10/02/2015 12:00:00 AM,2015-002794,2015-10-09T00:00:00.000,2015-10-09T00:00:00.000,2015-10-02T00:00:00.000,Done
2015OPA-0245,Done,OPA Director SA Review,04/20/2015 12:00:00 AM,04/30/2015 12:00:00 AM,04/15/2015 12:00:00 AM,2014-288888,2015-04-20T00:00:00.000,2015-04-30T00:00:00.000,2015-04-15T00:00:00.000,Done
2018OPA-0507,Done,OPA Close Case,12/06/2018 12:00:00 AM,01/08/2019 12:00:00 AM,11/26/2018 12:00:00 AM,2018-172647,2018-12-06T00:00:00.000,2019-01-08T00:00:00.000,2018-11-26T00:00:00.000,Done
2015OPA-1798,Done,OPA Close SA,04/18/2016 12:00:00 AM,04/29/2016 12:00:00 AM,04/13/2016 12:00:00 AM,,2016-04-18T00:00:00.000,2016-04-29T00:00:00.000,2016-04-13T00:00:00.000,Done
2016OPA-0367,Done,OPA Close Case,03/09/2017 12:00:00 AM,03/21/2017 12:00:00 AM,02/27/2017 12:00:00 AM,2016-095718,2017-03-09T00:00:00.000,2017-03-21T00:00:00.000,2017-02-27T00:00:00.000,Done
2016OPA-1012,Done,OPA Close SA,,11/16/2016 12:00:00 AM,11/16/2016 12:00:00 AM,,,2016-11-16T00:00:00.000,2016-11-16T00:00:00.000,Done
2017OPA-0377,Done,OPA Close CL,05/13/2017 12:00:00 AM,05/02/2017 12:00:00 AM,04/13/2017 12:00:00 AM,,2017-05-13T00:00:00.000,2017-05-02T00:00:00.000,2017-04-13T00:00:00.000,Done
2017OPA-0972,Done,OPA Final Discipline Action Report,,03/16/2018 12:00:00 AM,01/22/2019 12:00:00 AM,2017-348322,,2018-03-16T00:00:00.000,2019-01-22T00:00:00.000,Done
2015OPA-1216,Done,OPA Close SA,10/13/2015 12:00:00 AM,10/09/2015 12:00:00 AM,10/08/2015 12:00:00 AM,2015-262466,2015-10-13T00:00:00.000,2015-10-09T00:00:00.000,2015-10-08T00:00:00.000,Done
2015OPA-1507,Done,OPA Close CL,,10/27/2015 12:00:00 AM,10/27/2015 12:00:00 AM,,,2015-10-27T00:00:00.000,2015-10-27T00:00:00.000,Done
2017OPA-0136,Done,OPA Close CL,03/11/2017 12:00:00 AM,03/10/2017 12:00:00 AM,02/09/2017 12:00:00 AM,2016-215280,2017-03-11T00:00:00.000,2017-03-10T00:00:00.000,2017-02-09T00:00:00.000,Done
2017OPA-0900,Done,OPA Close Case,03/02/2018 12:00:00 AM,06/15/2018 12:00:00 AM,02/20/2018 12:00:00 AM,2017-231974,2018-03-02T00:00:00.000,2018-06-15T00:00:00.000,2018-02-20T00:00:00.000,Done
2018OPA-0082,Done,OPA Close CL,07/17/2018 12:00:00 AM,07/12/2018 12:00:00 AM,07/12/2018 12:00:00 AM,,2018-07-17T00:00:00.000,2018-07-12T00:00:00.000,2018-07-12T00:00:00.000,Done
2018OPA-1139,Done,OPA Close Case,06/02/2019 12:00:00 AM,05/30/2019 12:00:00 AM,05/23/2019 12:00:00 AM,2018-110460,2019-06-02T00:00:00.000,2019-05-30T00:00:00.000,2019-05-23T00:00:00.000,Done
2019OPA-0903,Done,OPA Close CL,12/28/2019 12:00:00 AM,01/16/2020 12:00:00 AM,12/18/2019 12:00:00 AM,,2019-12-28T00:00:00.000,2020-01-16T00:00:00.000,2019-12-18T00:00:00.000,Done
2017OPA-0764,Done,OPA Close Case,01/20/2018 12:00:00 AM,04/20/2018 12:00:00 AM,01/10/2018 12:00:00 AM,,2018-01-20T00:00:00.000,2018-04-20T00:00:00.000,2018-01-10T00:00:00.000,Done
2017OPA-1103,Done,OPA Close Case,04/24/2018 12:00:00 AM,07/24/2018 12:00:00 AM,04/24/2018 12:00:00 AM,2017-396205,2018-04-24T00:00:00.000,2018-07-24T00:00:00.000,2018-04-24T00:00:00.000,Done
2017OPA-1267,Done,OPA Close Case,01/02/2018 12:00:00 AM,12/28/2017 12:00:00 AM,12/28/2017 12:00:00 AM,2017-455296,2018-01-02T00:00:00.000,2017-12-28T00:00:00.000,2017-12-28T00:00:00.000,Done
2015OPA-1470,Done,OPA Close SA,11/14/2015 12:00:00 AM,11/10/2015 12:00:00 AM,11/09/2015 12:00:00 AM,,2015-11-14T00:00:00.000,2015-11-10T00:00:00.000,2015-11-09T00:00:00.000,Done
2016OPA-0029,Done,OPA Close CL,03/11/2016 12:00:00 AM,03/11/2016 12:00:00 AM,03/11/2016 12:00:00 AM,2013-321925,2016-03-11T00:00:00.000,2016-03-11T00:00:00.000,2016-03-11T00:00:00.000,Done
2016OPA-0208,Done,OPA Close CL,03/28/2016 12:00:00 AM,03/28/2016 12:00:00 AM,03/23/2016 12:00:00 AM,,2016-03-28T00:00:00.000,2016-03-28T00:00:00.000,2016-03-23T00:00:00.000,Done
2016OPA-0612,Done,OPA Close SA,08/11/2016 12:00:00 AM,07/27/2016 12:00:00 AM,07/27/2016 12:00:00 AM,,2016-08-11T00:00:00.000,2016-07-27T00:00:00.000,2016-07-27T00:00:00.000,Done
2017OPA-0172,Done,OPA Management Action,03/31/2018 12:00:00 AM,01/01/2018 12:00:00 AM,08/14/2017 12:00:00 AM,2017-026457,2018-03-31T00:00:00.000,2018-01-01T00:00:00.000,2017-08-14T00:00:00.000,Done
2015OPA-0047,Done,OPA Director SA Review,02/11/2015 12:00:00 AM,02/17/2015 12:00:00 AM,02/06/2015 12:00:00 AM,2014-358464,2015-02-11T00:00:00.000,2015-02-17T00:00:00.000,2015-02-06T00:00:00.000,Done
2017OPA-1150,Done,OPA Close CL,12/04/2017 12:00:00 AM,12/04/2017 12:00:00 AM,11/06/2017 12:00:00 AM,,2017-12-04T00:00:00.000,2017-12-04T00:00:00.000,2017-11-06T00:00:00.000,Done
2018OPA-0059,Done,OPA Director Certification/Finding,07/15/2018 12:00:00 AM,07/06/2018 12:00:00 AM,01/22/2019 12:00:00 AM,2018-017914,2018-07-15T00:00:00.000,2018-07-06T00:00:00.000,2019-01-22T00:00:00.000,Done
2018OPA-0324,Done,OPA Close Case,10/20/2018 12:00:00 AM,10/23/2018 12:00:00 AM,10/10/2018 12:00:00 AM,,2018-10-20T00:00:00.000,2018-10-23T00:00:00.000,2018-10-10T00:00:00.000,Done
2018OPA-0344,Done,OPA Close CL,05/23/2018 12:00:00 AM,05/31/2018 12:00:00 AM,05/18/2018 12:00:00 AM,,2018-05-23T00:00:00.000,2018-05-31T00:00:00.000,2018-05-18T00:00:00.000,Done
2018OPA-0826,Done,OPA Close SA,,10/12/2018 12:00:00 AM,10/12/2018 12:00:00 AM,,,2018-10-12T00:00:00.000,2018-10-12T00:00:00.000,Done
2015OPA-0492,Done,OPA Close CL,,04/14/2015 12:00:00 AM,10/20/2015 12:00:00 AM,2015-111455,,2015-04-14T00:00:00.000,2015-10-20T00:00:00.000,Done
2016OPA-1112,Done,OPA Close Case,02/09/2017 12:00:00 AM,02/09/2017 12:00:00 AM,01/31/2017 12:00:00 AM,,2017-02-09T00:00:00.000,2017-02-09T00:00:00.000,2017-01-31T00:00:00.000,Done
2016OPA-1286,Done,OPA Close CL,11/21/2016 12:00:00 AM,12/05/2016 12:00:00 AM,11/16/2016 12:00:00 AM,,2016-11-21T00:00:00.000,2016-12-05T00:00:00.000,2016-11-16T00:00:00.000,Done
2017OPA-0707,Done,OPA Send Complaint Receipt,07/22/2017 12:00:00 AM,07/17/2017 12:00:00 AM,07/17/2017 12:00:00 AM,2017-253129,2017-07-22T00:00:00.000,2017-07-17T00:00:00.000,2017-07-17T00:00:00.000,Done
2015OPA-1649,Done,OPA Close Case,03/12/2017 12:00:00 AM,03/28/2017 12:00:00 AM,03/02/2017 12:00:00 AM,,2017-03-12T00:00:00.000,2017-03-28T00:00:00.000,2017-03-02T00:00:00.000,Done
2016OPA-0046,Done,OPA Close CL,02/21/2016 12:00:00 AM,02/18/2016 12:00:00 AM,02/18/2016 12:00:00 AM,,2016-02-21T00:00:00.000,2016-02-18T00:00:00.000,2016-02-18T00:00:00.000,Done
2016OPA-0826,Done,OPA Close Case,12/25/2017 12:00:00 AM,02/28/2018 12:00:00 AM,12/15/2017 12:00:00 AM,2016-245303,2017-12-25T00:00:00.000,2018-02-28T00:00:00.000,2017-12-15T00:00:00.000,Done
2016OPA-1423,Done,OPA Close CL,12/12/2016 12:00:00 AM,12/20/2016 12:00:00 AM,12/07/2016 12:00:00 AM,,2016-12-12T00:00:00.000,2016-12-20T00:00:00.000,2016-12-07T00:00:00.000,Done
2019OPA-0652,Done,OPA Close CL,10/10/2019 12:00:00 AM,10/17/2019 12:00:00 AM,10/03/2019 12:00:00 AM,2019-104749,2019-10-10T00:00:00.000,2019-10-17T00:00:00.000,2019-10-03T00:00:00.000,Done
2020OPA-0110,Done,OPA Close CL,03/11/2020 12:00:00 AM,03/11/2020 12:00:00 AM,03/03/2020 12:00:00 AM,,2020-03-11T00:00:00.000,2020-03-11T00:00:00.000,2020-03-03T00:00:00.000,Done
2020OPA-0204,To do,OPA 180 Timeline Calculation,03/08/2020 12:00:00 AM,09/04/2020 12:00:00 AM,04/21/2020 12:00:00 AM,2020-086243,2020-03-08T00:00:00.000,2020-09-04T00:00:00.000,2020-04-21T00:00:00.000,To do
2017OPA-0220,Done,OPA Close CL,03/31/2017 12:00:00 AM,03/13/2017 12:00:00 AM,03/01/2017 12:00:00 AM,,2017-03-31T00:00:00.000,2017-03-13T00:00:00.000,2017-03-01T00:00:00.000,Done
2017OPA-0873,Done,OPA Close CL,09/23/2017 12:00:00 AM,09/19/2017 12:00:00 AM,09/18/2017 12:00:00 AM,,2017-09-23T00:00:00.000,2017-09-19T00:00:00.000,2017-09-18T00:00:00.000,Done
2017OPA-1121,Done,OPA Training Referral,04/20/2018 12:00:00 AM,04/24/2018 12:00:00 AM,04/10/2018 12:00:00 AM,,2018-04-20T00:00:00.000,2018-04-24T00:00:00.000,2018-04-10T00:00:00.000,Done
2018OPA-0352,Done,OPA Close Case,10/22/2018 12:00:00 AM,10/19/2018 12:00:00 AM,10/12/2018 12:00:00 AM,2018-130285,2018-10-22T00:00:00.000,2018-10-19T00:00:00.000,2018-10-12T00:00:00.000,Done
2015OPA-1547,Done,OPA Close CL,,10/27/2015 12:00:00 AM,10/27/2015 12:00:00 AM,,,2015-10-27T00:00:00.000,2015-10-27T00:00:00.000,Done
2017OPA-0323,Done,OPA Send Complainant Closing Letter,04/30/2017 12:00:00 AM,04/03/2017 12:00:00 AM,03/31/2017 12:00:00 AM,,2017-04-30T00:00:00.000,2017-04-03T00:00:00.000,2017-03-31T00:00:00.000,Done
2017OPA-0790,Done,OPA Close CL,09/23/2017 12:00:00 AM,08/07/2017 12:00:00 AM,08/01/2017 12:00:00 AM,2017-185652,2017-09-23T00:00:00.000,2017-08-07T00:00:00.000,2017-08-01T00:00:00.000,Done
2018OPA-0390,Done,OPA Close Case,11/17/2018 12:00:00 AM,11/30/2018 12:00:00 AM,11/07/2018 12:00:00 AM,2018-125621,2018-11-17T00:00:00.000,2018-11-30T00:00:00.000,2018-11-07T00:00:00.000,Done
2018OPA-0620,Done,OPA Close CL,08/04/2018 12:00:00 AM,08/09/2018 12:00:00 AM,07/30/2018 12:00:00 AM,2018-244941,2018-08-04T00:00:00.000,2018-08-09T00:00:00.000,2018-07-30T00:00:00.000,Done
2018OPA-1136,Done,OPA Close CL,12/24/2018 12:00:00 AM,01/02/2019 12:00:00 AM,12/19/2018 12:00:00 AM,2018-452726,2018-12-24T00:00:00.000,2019-01-02T00:00:00.000,2018-12-19T00:00:00.000,Done
2019OPA-0402,Done,OPA Training Referral,12/15/2019 12:00:00 AM,02/24/2020 12:00:00 AM,12/05/2019 12:00:00 AM,,2019-12-15T00:00:00.000,2020-02-24T00:00:00.000,2019-12-05T00:00:00.000,Done
2015OPA-1422,Done,OPA Close CL,,10/01/2015 12:00:00 AM,10/13/2015 12:00:00 AM,,,2015-10-01T00:00:00.000,2015-10-13T00:00:00.000,Done
2015OPA-1832,Done,OPA Close Case,06/13/2016 12:00:00 AM,06/27/2016 12:00:00 AM,05/26/2016 12:00:00 AM,2015-413809,2016-06-13T00:00:00.000,2016-06-27T00:00:00.000,2016-05-26T00:00:00.000,Done
2017OPA-0650,Done,OPA Close CL,07/31/2017 12:00:00 AM,07/19/2017 12:00:00 AM,07/03/2017 12:00:00 AM,,2017-07-31T00:00:00.000,2017-07-19T00:00:00.000,2017-07-03T00:00:00.000,Done
2018OPA-0313,Done,OPA Close CL,05/02/2018 12:00:00 AM,05/10/2018 12:00:00 AM,04/27/2018 12:00:00 AM,,2018-05-02T00:00:00.000,2018-05-10T00:00:00.000,2018-04-27T00:00:00.000,Done
2018OPA-0414,Done,OPA Close Case,11/17/2018 12:00:00 AM,12/03/2018 12:00:00 AM,11/07/2018 12:00:00 AM,2018-163938,2018-11-17T00:00:00.000,2018-12-03T00:00:00.000,2018-11-07T00:00:00.000,Done
2018OPA-1045,Done,OPA Close CL,11/25/2018 12:00:00 AM,11/27/2018 12:00:00 AM,11/20/2018 12:00:00 AM,,2018-11-25T00:00:00.000,2018-11-27T00:00:00.000,2018-11-20T00:00:00.000,Done
2020OPA-0261,Done,OPA 5 Day Notice,05/04/2020 12:00:00 AM,05/04/2020 12:00:00 AM,05/04/2020 12:00:00 AM,,2020-05-04T00:00:00.000,2020-05-04T00:00:00.000,2020-05-04T00:00:00.000,Done
2015OPA-1734,Done,OPA Close SA,03/23/2016 12:00:00 AM,03/18/2016 12:00:00 AM,03/18/2016 12:00:00 AM,,2016-03-23T00:00:00.000,2016-03-18T00:00:00.000,2016-03-18T00:00:00.000,Done
2018OPA-0823,Done,OPA Close CL,09/23/2018 12:00:00 AM,09/19/2018 12:00:00 AM,09/18/2018 12:00:00 AM,2018-311651,2018-09-23T00:00:00.000,2018-09-19T00:00:00.000,2018-09-18T00:00:00.000,Done
2018OPA-0860,Done,OPA Close CL,09/29/2018 12:00:00 AM,09/24/2018 12:00:00 AM,09/24/2018 12:00:00 AM,,2018-09-29T00:00:00.000,2018-09-24T00:00:00.000,2018-09-24T00:00:00.000,Done
2019OPA-0225,Done,OPA Close Case,10/14/2019 12:00:00 AM,10/29/2019 12:00:00 AM,10/03/2019 12:00:00 AM,2019-093842,2019-10-14T00:00:00.000,2019-10-29T00:00:00.000,2019-10-03T00:00:00.000,Done
2020OPA-0080,Done,OPA Close CL,02/25/2020 12:00:00 AM,02/24/2020 12:00:00 AM,02/18/2020 12:00:00 AM,2020-043679,2020-02-25T00:00:00.000,2020-02-24T00:00:00.000,2020-02-18T00:00:00.000,Done
2020OPA-0167,Done,OPA Close SA,,04/29/2020 12:00:00 AM,04/29/2020 12:00:00 AM,,,2020-04-29T00:00:00.000,2020-04-29T00:00:00.000,Done
2015OPA-0683,Done,OPA Close CL,,06/08/2015 12:00:00 AM,10/19/2015 12:00:00 AM,,,2015-06-08T00:00:00.000,2015-10-19T00:00:00.000,Done
2015OPA-1333,Done,OPA Close CL,,09/14/2015 12:00:00 AM,10/14/2015 12:00:00 AM,,,2015-09-14T00:00:00.000,2015-10-14T00:00:00.000,Done
2016OPA-0071,Done,OPA Close Case,10/15/2016 12:00:00 AM,10/17/2016 12:00:00 AM,10/04/2016 12:00:00 AM,2015-142601,2016-10-15T00:00:00.000,2016-10-17T00:00:00.000,2016-10-04T00:00:00.000,Done
2018OPA-0245,Done,OPA Close Case,10/19/2019 12:00:00 AM,10/15/2019 12:00:00 AM,10/09/2019 12:00:00 AM,2018-079644,2019-10-19T00:00:00.000,2019-10-15T00:00:00.000,2019-10-09T00:00:00.000,Done
2020OPA-0101,Done,OPA Close SA,,04/17/2020 12:00:00 AM,04/17/2020 12:00:00 AM,,,2020-04-17T00:00:00.000,2020-04-17T00:00:00.000,Done
2020OPA-0195,Done,OPA Director Certification/Finding,09/23/2020 12:00:00 AM,04/20/2020 12:00:00 AM,04/07/2020 12:00:00 AM,,2020-09-23T00:00:00.000,2020-04-20T00:00:00.000,2020-04-07T00:00:00.000,Done
2015OPA-0573,Done,OPA Close CL,,05/19/2015 12:00:00 AM,10/20/2015 12:00:00 AM,,,2015-05-19T00:00:00.000,2015-10-20T00:00:00.000,Done
2015OPA-1305,Done,OPA Close CL,,10/19/2015 12:00:00 AM,10/19/2015 12:00:00 AM,,,2015-10-19T00:00:00.000,2015-10-19T00:00:00.000,Done
2017OPA-0484,Done,OPA Close SA,,06/20/2017 12:00:00 AM,06/20/2017 12:00:00 AM,,,2017-06-20T00:00:00.000,2017-06-20T00:00:00.000,Done
2018OPA-0634,Done,OPA Send Complaint Receipt,07/12/2018 12:00:00 AM,07/11/2018 12:00:00 AM,08/07/2018 12:00:00 AM,2018-231881,2018-07-12T00:00:00.000,2018-07-11T00:00:00.000,2018-08-07T00:00:00.000,Done
2018OPA-0740,Done,OPA Management Action,05/28/2019 12:00:00 AM,06/11/2019 12:00:00 AM,05/21/2019 12:00:00 AM,2018-245354,2019-05-28T00:00:00.000,2019-06-11T00:00:00.000,2019-05-21T00:00:00.000,Done
2019OPA-0170,Done,OPA Training Referral,10/18/2019 12:00:00 AM,11/19/2019 12:00:00 AM,09/25/2019 12:00:00 AM,2019-067245,2019-10-18T00:00:00.000,2019-11-19T00:00:00.000,2019-09-25T00:00:00.000,Done
2019OPA-0489,Done,OPA Close Case,,03/25/2020 12:00:00 AM,01/07/2020 12:00:00 AM,2019-254958,,2020-03-25T00:00:00.000,2020-01-07T00:00:00.000,Done
2020OPA-0241,Done,OPA OIG Intake Classification Review,05/08/2020 12:00:00 AM,05/06/2020 12:00:00 AM,05/02/2020 12:00:00 AM,,2020-05-08T00:00:00.000,2020-05-06T00:00:00.000,2020-05-02T00:00:00.000,Done
2016OPA-0235,Done,OPA Close SA,04/12/2016 12:00:00 AM,04/06/2016 12:00:00 AM,03/28/2016 12:00:00 AM,,2016-04-12T00:00:00.000,2016-04-06T00:00:00.000,2016-03-28T00:00:00.000,Done
2016OPA-0943,Done,OPA Close Case,02/23/2017 12:00:00 AM,03/08/2017 12:00:00 AM,02/13/2017 12:00:00 AM,2016-287110,2017-02-23T00:00:00.000,2017-03-08T00:00:00.000,2017-02-13T00:00:00.000,Done
2017OPA-0736,Done,OPA Close CL,08/19/2017 12:00:00 AM,08/17/2017 12:00:00 AM,07/21/2017 12:00:00 AM,,2017-08-19T00:00:00.000,2017-08-17T00:00:00.000,2017-07-21T00:00:00.000,Done
2017OPA-1022,Done,OPA Close CL,10/31/2017 12:00:00 AM,11/06/2017 12:00:00 AM,10/02/2017 12:00:00 AM,,2017-10-31T00:00:00.000,2017-11-06T00:00:00.000,2017-10-02T00:00:00.000,Done
2015OPA-0465,Done,OPA Director SA Review,05/10/2015 12:00:00 AM,05/20/2015 12:00:00 AM,05/05/2015 12:00:00 AM,2015-101251,2015-05-10T00:00:00.000,2015-05-20T00:00:00.000,2015-05-05T00:00:00.000,Done
2016OPA-0889,Done,OPA Close SA,,09/27/2016 12:00:00 AM,09/27/2016 12:00:00 AM,,,2016-09-27T00:00:00.000,2016-09-27T00:00:00.000,Done
2016OPA-1426,Done,OPA Close CL,12/28/2016 12:00:00 AM,12/28/2016 12:00:00 AM,12/23/2016 12:00:00 AM,,2016-12-28T00:00:00.000,2016-12-28T00:00:00.000,2016-12-23T00:00:00.000,Done
2017OPA-0079,Done,OPA Close CL,02/20/2017 12:00:00 AM,02/16/2017 12:00:00 AM,01/24/2017 12:00:00 AM,,2017-02-20T00:00:00.000,2017-02-16T00:00:00.000,2017-01-24T00:00:00.000,Done
2017OPA-0668,Done,OPA Close CL,08/07/2017 12:00:00 AM,08/01/2017 12:00:00 AM,07/10/2017 12:00:00 AM,,2017-08-07T00:00:00.000,2017-08-01T00:00:00.000,2017-07-10T00:00:00.000,Done
2015OPA-0832,Done,OPA Close Case,,12/16/2015 12:00:00 AM,11/25/2015 12:00:00 AM,,,2015-12-16T00:00:00.000,2015-11-25T00:00:00.000,Done
2015OPA-1454,Done,OPA Close CL,,10/06/2015 12:00:00 AM,10/13/2015 12:00:00 AM,,,2015-10-06T00:00:00.000,2015-10-13T00:00:00.000,Done
2016OPA-0048,Done,OPA SA Review,,06/15/2016 12:00:00 AM,06/15/2016 12:00:00 AM,,,2016-06-15T00:00:00.000,2016-06-15T00:00:00.000,Done
2016OPA-0373,Done,OPA Close CL,04/25/2016 12:00:00 AM,04/25/2016 12:00:00 AM,04/20/2016 12:00:00 AM,2014-040717,2016-04-25T00:00:00.000,2016-04-25T00:00:00.000,2016-04-20T00:00:00.000,Done
2015OPA-1438,Done,OPA Close Case,03/11/2016 12:00:00 AM,03/16/2016 12:00:00 AM,02/26/2016 12:00:00 AM,2015-265402,2016-03-11T00:00:00.000,2016-03-16T00:00:00.000,2016-02-26T00:00:00.000,Done
2017OPA-0620,Done,OPA Close SA,,08/17/2017 12:00:00 AM,08/17/2017 12:00:00 AM,2017-223722,,2017-08-17T00:00:00.000,2017-08-17T00:00:00.000,Done
2019OPA-0549,Done,OPA Close Case,,04/16/2020 12:00:00 AM,04/16/2020 12:00:00 AM,2019-279292,,2020-04-16T00:00:00.000,2020-04-16T00:00:00.000,Done
2016OPA-0424,Done,OPA Close Case,12/20/2016 12:00:00 AM,12/20/2016 12:00:00 AM,12/06/2016 12:00:00 AM,2016-120294,2016-12-20T00:00:00.000,2016-12-20T00:00:00.000,2016-12-06T00:00:00.000,Done
2016OPA-0747,Done,OPA Close SA,,09/02/2016 12:00:00 AM,09/02/2016 12:00:00 AM,,,2016-09-02T00:00:00.000,2016-09-02T00:00:00.000,Done
2019OPA-0340,Done,OPA Close CL,06/23/2019 12:00:00 AM,06/24/2019 12:00:00 AM,06/18/2019 12:00:00 AM,,2019-06-23T00:00:00.000,2019-06-24T00:00:00.000,2019-06-18T00:00:00.000,Done
2017OPA-1054,Done,OPA Close Case,04/08/2018 12:00:00 AM,08/14/2018 12:00:00 AM,03/29/2018 12:00:00 AM,2017-374577,2018-04-08T00:00:00.000,2018-08-14T00:00:00.000,2018-03-29T00:00:00.000,Done
2018OPA-0038,Done,OPA Missed 180 Day Deadline,08/17/2018 12:00:00 AM,09/04/2018 12:00:00 AM,02/22/2019 12:00:00 AM,,2018-08-17T00:00:00.000,2018-09-04T00:00:00.000,2019-02-22T00:00:00.000,Done
2018OPA-0406,Done,OPA Close CL,06/12/2018 12:00:00 AM,06/07/2018 12:00:00 AM,06/06/2018 12:00:00 AM,2017-398786,2018-06-12T00:00:00.000,2018-06-07T00:00:00.000,2018-06-06T00:00:00.000,Done
2018OPA-0484,Done,OPA Close Case,11/29/2018 12:00:00 AM,01/07/2019 12:00:00 AM,11/19/2018 12:00:00 AM,2018-191533,2018-11-29T00:00:00.000,2019-01-07T00:00:00.000,2018-11-19T00:00:00.000,Done
2019OPA-0166,Done,OPA Close CL,03/15/2019 12:00:00 AM,03/14/2019 12:00:00 AM,03/14/2019 12:00:00 AM,2019-006807,2019-03-15T00:00:00.000,2019-03-14T00:00:00.000,2019-03-14T00:00:00.000,Done
2015OPA-1389,Done,OPA Close Case,03/21/2016 12:00:00 AM,03/22/2016 12:00:00 AM,03/08/2016 12:00:00 AM,2015-145045,2016-03-21T00:00:00.000,2016-03-22T00:00:00.000,2016-03-08T00:00:00.000,Done
2015OPA-1462,Done,OPA Close CL,,10/06/2015 12:00:00 AM,10/13/2015 12:00:00 AM,,,2015-10-06T00:00:00.000,2015-10-13T00:00:00.000,Done
2016OPA-0351,Done,OPA Close CL,05/02/2016 12:00:00 AM,04/27/2016 12:00:00 AM,04/27/2016 12:00:00 AM,,2016-05-02T00:00:00.000,2016-04-27T00:00:00.000,2016-04-27T00:00:00.000,Done
2016OPA-0755,Done,OPA Close Case,04/01/2017 12:00:00 AM,04/03/2017 12:00:00 AM,03/22/2017 12:00:00 AM,,2017-04-01T00:00:00.000,2017-04-03T00:00:00.000,2017-03-22T00:00:00.000,Done
2016OPA-1282,Done,OPA Close CL,11/20/2016 12:00:00 AM,11/22/2016 12:00:00 AM,11/15/2016 12:00:00 AM,2016-385120,2016-11-20T00:00:00.000,2016-11-22T00:00:00.000,2016-11-15T00:00:00.000,Done
2016OPA-1375,Done,OPA Close Case,04/29/2017 12:00:00 AM,05/09/2017 12:00:00 AM,04/19/2017 12:00:00 AM,2016-413476,2017-04-29T00:00:00.000,2017-05-09T00:00:00.000,2017-04-19T00:00:00.000,Done
2019OPA-0167,Done,OPA Close SA,,05/30/2019 12:00:00 AM,05/30/2019 12:00:00 AM,2019-062585,,2019-05-30T00:00:00.000,2019-05-30T00:00:00.000,Done
2019OPA-0338,Done,OPA Close Case,11/29/2019 12:00:00 AM,12/17/2019 12:00:00 AM,11/19/2019 12:00:00 AM,,2019-11-29T00:00:00.000,2019-12-17T00:00:00.000,2019-11-19T00:00:00.000,Done
2015OPA-0095,Done,OPA Director SA Review,05/04/2015 12:00:00 AM,05/11/2015 12:00:00 AM,04/29/2015 12:00:00 AM,2014-265002,2015-05-04T00:00:00.000,2015-05-11T00:00:00.000,2015-04-29T00:00:00.000,Done
2016OPA-0363,Done,OPA Close CL,05/02/2016 12:00:00 AM,05/02/2016 12:00:00 AM,05/02/2016 12:00:00 AM,,2016-05-02T00:00:00.000,2016-05-02T00:00:00.000,2016-05-02T00:00:00.000,Done
2016OPA-1252,Done,OPA Send Complainant Closing Letter,11/11/2016 12:00:00 AM,10/17/2016 12:00:00 AM,10/12/2016 12:00:00 AM,,2016-11-11T00:00:00.000,2016-10-17T00:00:00.000,2016-10-12T00:00:00.000,Done
2016OPA-1370,Done,OPA Close CL,12/11/2016 12:00:00 AM,12/09/2016 12:00:00 AM,12/06/2016 12:00:00 AM,,2016-12-11T00:00:00.000,2016-12-09T00:00:00.000,2016-12-06T00:00:00.000,Done
2018OPA-0048,Done,OPA Close Case,10/26/2019 12:00:00 AM,11/04/2019 12:00:00 AM,10/16/2019 12:00:00 AM,,2019-10-26T00:00:00.000,2019-11-04T00:00:00.000,2019-10-16T00:00:00.000,Done
2018OPA-0929,Done,OPA Close Case,03/31/2019 12:00:00 AM,06/17/2019 12:00:00 AM,03/21/2019 12:00:00 AM,2018-352479,2019-03-31T00:00:00.000,2019-06-17T00:00:00.000,2019-03-21T00:00:00.000,Done
2019OPA-0577,Done,OPA Close Case,03/08/2020 12:00:00 AM,04/20/2020 12:00:00 AM,02/23/2020 12:00:00 AM,,2020-03-08T00:00:00.000,2020-04-20T00:00:00.000,2020-02-23T00:00:00.000,Done
2015OPA-0142,Done,OPA Close Case,08/13/2015 12:00:00 AM,08/13/2015 12:00:00 AM,08/03/2015 12:00:00 AM,,2015-08-13T00:00:00.000,2015-08-13T00:00:00.000,2015-08-03T00:00:00.000,Done
2015OPA-1130,Done,OPA Close SA,09/20/2015 12:00:00 AM,09/15/2015 12:00:00 AM,09/15/2015 12:00:00 AM,2015-253647,2015-09-20T00:00:00.000,2015-09-15T00:00:00.000,2015-09-15T00:00:00.000,Done
2015OPA-1135,Done,OPA Close CL,,08/09/2015 12:00:00 AM,10/15/2015 12:00:00 AM,,,2015-08-09T00:00:00.000,2015-10-15T00:00:00.000,Done
2015OPA-1410,Done,OPA Close SA,11/28/2015 12:00:00 AM,11/24/2015 12:00:00 AM,11/23/2015 12:00:00 AM,2015-323712,2015-11-28T00:00:00.000,2015-11-24T00:00:00.000,2015-11-23T00:00:00.000,Done
2015OPA-1495,Done,OPA Close SA,12/05/2015 12:00:00 AM,11/30/2015 12:00:00 AM,11/30/2015 12:00:00 AM,,2015-12-05T00:00:00.000,2015-11-30T00:00:00.000,2015-11-30T00:00:00.000,Done
2018OPA-0410,Done,OPA Close SA,07/12/2018 12:00:00 AM,07/02/2018 12:00:00 AM,07/02/2018 12:00:00 AM,,2018-07-12T00:00:00.000,2018-07-02T00:00:00.000,2018-07-02T00:00:00.000,Done
2018OPA-0649,Done,OPA Close Case,01/25/2019 12:00:00 AM,02/15/2019 12:00:00 AM,01/15/2019 12:00:00 AM,2018-248357,2019-01-25T00:00:00.000,2019-02-15T00:00:00.000,2019-01-15T00:00:00.000,Done
2019OPA-0055,Done,OPA Close CL,02/20/2019 12:00:00 AM,02/20/2019 12:00:00 AM,02/15/2019 12:00:00 AM,,2019-02-20T00:00:00.000,2019-02-20T00:00:00.000,2019-02-15T00:00:00.000,Done
2019OPA-0087,Done,OPA Close CL,03/02/2019 12:00:00 AM,03/07/2019 12:00:00 AM,02/25/2019 12:00:00 AM,2019-040062,2019-03-02T00:00:00.000,2019-03-07T00:00:00.000,2019-02-25T00:00:00.000,Done
2015OPA-1859,Done,OPA Close Case,08/15/2016 12:00:00 AM,08/15/2016 12:00:00 AM,08/05/2016 12:00:00 AM,2015-378739,2016-08-15T00:00:00.000,2016-08-15T00:00:00.000,2016-08-05T00:00:00.000,Done
2016OPA-0393,Done,OPA SA Review,05/31/2016 12:00:00 AM,06/01/2016 12:00:00 AM,05/16/2016 12:00:00 AM,,2016-05-31T00:00:00.000,2016-06-01T00:00:00.000,2016-05-16T00:00:00.000,Done
2017OPA-0677,Done,OPA Close CL,10/29/2017 12:00:00 AM,09/22/2017 12:00:00 AM,08/04/2017 12:00:00 AM,2017-237103,2017-10-29T00:00:00.000,2017-09-22T00:00:00.000,2017-08-04T00:00:00.000,Done
2017OPA-1037,Done,OPA 180 Expiration,04/01/2018 12:00:00 AM,08/16/2018 12:00:00 AM,01/30/2019 12:00:00 AM,,2018-04-01T00:00:00.000,2018-08-16T00:00:00.000,2019-01-30T00:00:00.000,Done
2018OPA-0013,Done,OPA Training Referral,02/01/2019 12:00:00 AM,02/14/2019 12:00:00 AM,01/22/2019 12:00:00 AM,2018-000011,2019-02-01T00:00:00.000,2019-02-14T00:00:00.000,2019-01-22T00:00:00.000,Done
2015OPA-0152,Done,OPA Close CL,,02/18/2015 12:00:00 AM,10/22/2015 12:00:00 AM,,,2015-02-18T00:00:00.000,2015-10-22T00:00:00.000,Done
2015OPA-1140,Done,OPA Close CL,,08/27/2015 12:00:00 AM,10/15/2015 12:00:00 AM,,,2015-08-27T00:00:00.000,2015-10-15T00:00:00.000,Done
2017OPA-0661,Done,OPA Close CL,07/10/2017 12:00:00 AM,07/21/2017 12:00:00 AM,07/06/2017 12:00:00 AM,,2017-07-10T00:00:00.000,2017-07-21T00:00:00.000,2017-07-06T00:00:00.000,Done
2018OPA-0004,Done,OPA Close Case,01/23/2018 12:00:00 AM,01/18/2018 12:00:00 AM,01/18/2018 12:00:00 AM,2018-001034,2018-01-23T00:00:00.000,2018-01-18T00:00:00.000,2018-01-18T00:00:00.000,Done
2018OPA-0583,Done,OPA Close Case,12/14/2018 12:00:00 AM,01/10/2019 12:00:00 AM,12/04/2018 12:00:00 AM,2018-226937,2018-12-14T00:00:00.000,2019-01-10T00:00:00.000,2018-12-04T00:00:00.000,Done
2018OPA-0731,Done,OPA Close SA,,09/12/2018 12:00:00 AM,09/12/2018 12:00:00 AM,,,2018-09-12T00:00:00.000,2018-09-12T00:00:00.000,Done
2018OPA-1187,Done,OPA Close CL,01/23/2019 12:00:00 AM,01/23/2019 12:00:00 AM,01/18/2019 12:00:00 AM,,2019-01-23T00:00:00.000,2019-01-23T00:00:00.000,2019-01-18T00:00:00.000,Done
2019OPA-0155,Done,OPA Close CL,03/24/2019 12:00:00 AM,03/21/2019 12:00:00 AM,03/19/2019 12:00:00 AM,,2019-03-24T00:00:00.000,2019-03-21T00:00:00.000,2019-03-19T00:00:00.000,Done
2015OPA-0632,Done,SA Monitor,06/19/2015 12:00:00 AM,07/02/2015 12:00:00 AM,05/20/2015 12:00:00 AM,2015-144714,2015-06-19T00:00:00.000,2015-07-02T00:00:00.000,2015-05-20T00:00:00.000,Done
2015OPA-1154,Done,OPA Close CL,,08/09/2015 12:00:00 AM,10/15/2015 12:00:00 AM,,,2015-08-09T00:00:00.000,2015-10-15T00:00:00.000,Done
2015OPA-1397,Done,OPA Close SA,12/12/2015 12:00:00 AM,12/07/2015 12:00:00 AM,12/07/2015 12:00:00 AM,,2015-12-12T00:00:00.000,2015-12-07T00:00:00.000,2015-12-07T00:00:00.000,Done
2016OPA-0714,Done,OPA Close SA,,09/12/2016 12:00:00 AM,09/12/2016 12:00:00 AM,2016-226680,,2016-09-12T00:00:00.000,2016-09-12T00:00:00.000,Done
2017OPA-1051,Done,OPA Close CL,11/03/2017 12:00:00 AM,11/02/2017 12:00:00 AM,10/29/2017 12:00:00 AM,,2017-11-03T00:00:00.000,2017-11-02T00:00:00.000,2017-10-29T00:00:00.000,Done
2017OPA-1052,Done,OPA Training Referral,03/29/2019 12:00:00 AM,06/27/2019 12:00:00 AM,03/19/2019 12:00:00 AM,2017-352672,2019-03-29T00:00:00.000,2019-06-27T00:00:00.000,2019-03-19T00:00:00.000,Done
2018OPA-0677,Done,OPA Close Case,02/03/2019 12:00:00 AM,02/14/2019 12:00:00 AM,01/21/2019 12:00:00 AM,2018-262367,2019-02-03T00:00:00.000,2019-02-14T00:00:00.000,2019-01-21T00:00:00.000,Done
2018OPA-0757,Done,OPA Close Case,02/15/2019 12:00:00 AM,02/20/2019 12:00:00 AM,02/20/2019 12:00:00 AM,2018-237609,2019-02-15T00:00:00.000,2019-02-20T00:00:00.000,2019-02-20T00:00:00.000,Done
