the_geom,OBJECTID,School Name,Site Address,Open or Closed,CMO,Enrollment,PublicVsPrivate
POINT (-90.058479804748 30.003997472301),108,Brother Martin High School,4401 Elysian Fields Ave,OPEN,,,PRIVATE
POINT (-90.114707499132 29.954895933985),148,St. Rita School,65 Fontainebleau Dr,OPEN,,,PRIVATE
POINT (-90.03743367443 29.99390433197),13,G.W. Carver High School,3059 Higgins Blvd,OPEN,Collegiate Academies,820,PUBLIC
POINT (-90.100241151145 29.922019589012),150,The Chartwell Center,4239 Camp St,OPEN,,,PRIVATE
POINT (-90.068669715466 29.976988260376),114,Corpus Christi School,2022 St. Bernard Ave,OPEN,,,PRIVATE
POINT (-90.117270871923 29.95829561771),61,Lafayette Academy Charter School,2727 S Carrollton Ave,OPEN,Choice Foundation,823,PUBLIC
POINT (-90.056662195003 30.018609666242),85,Pierre A. Capdau Charter School at Avery Alexander Elementary,5800 St Roch Ave,OPEN,New Beginnings,746,PUBLIC
POINT (-90.099075197838 29.933812152194),64,Lawrence D. Crocker College Prep: A School for the Arts and Technology,2301 Marengo St,OPEN,New Orleans College Preparatory Academies (NOCP),547,PUBLIC
POINT (-89.998819264378 29.921450852346),129,St. Andrew The Apostle Elementary School,3131 Eton St,OPEN,,,PRIVATE
POINT (-90.002025061373 29.931854599587),112,Children's College Of Academics,4614 General Meyer Ave,OPEN,,,PRIVATE
POINT (-90.065515531388 30.024361548889),10,Benjamin Franklin High School,2001 Leon C Simon Dr,OPEN,Non-Network,970,PUBLIC
POINT (-90.099184743307 29.973867480365),146,St. John Lutheran School,3937 Canal St,OPEN,,,PRIVATE
POINT (-90.097919908762 29.981443753187),17,Cypress Academy,4217 Orleans Ave,OPEN,OPSB Direct Run,153,PUBLIC
POINT (-90.013640259497 29.966777460048),18,Dr. Martin Luther King Jr. Charter School For Science and Technology,1617 Caffin Ave,OPEN,Friends of King,590,PUBLIC
POINT (-90.09088487663 30.024125472681),137,St. Pius X School,6600 Spanish Fort Blvd,OPEN,,,PRIVATE
POINT (-90.094200679693 29.930380236062),100,Walter L. Cohen College Prep,3520 Dryades St,OPEN,New Orleans College Preparatory Academies (NOCP),417,PUBLIC
POINT (-90.049373062406 29.96277749623),79,New Orleans Center for Creative Arts,2800 Chartres St,OPEN,,228,PUBLIC
POINT (-90.041814036114 29.934918933561),102,William J. Fischer Accelerated Academy,1801 LB Landry Ave,OPEN,Algiers Charter School Association,350,PUBLIC
POINT (-90.054285817555 29.992329640887),71,Mary McLeod Bethune Elementary School of Literature and Technology,2401 Humanity St,OPEN,OPSB Direct Run,715,PUBLIC
POINT (-90.036728484468 29.966273856609),4,ARISE Academy,3819 St Claude Ave,OPEN,ARISE Schools,485,PUBLIC
POINT (-90.036912734329 29.965692821631),58,KIPP Renaissance High School,3820 St Claude Ave,OPEN,KIPP,553,PUBLIC
POINT (-90.101191339656 29.926990544856),104,Academy Of The Sacred Heart,4301 St. Charles Ave,OPEN,,,PRIVATE
POINT (-90.070961852838 29.978212398081),74,McDonogh #42 Elementary Charter School,1651 N Tonti St,OPEN,Inspire NOLA,408,PUBLIC
POINT (-90.068580983246 29.933226537385),133,St. Michael Special School,1522 Chippewa St,OPEN,,,PRIVATE
POINT (-90.100540646302 29.926392063118),92,Rooted School,4238 St Charles Ave,OPEN,Non-Network,40,PUBLIC
POINT (-89.930773740715 30.042044950075),24,Einstein Charter High School at Sarah Towles Reed,5316 Michoud Blvd,OPEN,Einstein Charter Schools,161,PUBLIC
POINT (-90.075881374908 30.014146393484),117,Holy Cross Middle and High School,5500 Paris Ave,OPEN,,,PRIVATE
POINT (-90.01933751422 29.921267229757),84,Paul Habans Charter School,3501 Seine St,OPEN,Crescent City Schools,645,PUBLIC
POINT (-90.111868411844 29.94198935414),29,Eleanor McMain Secondary School,5721 S Claiborne Ave,OPEN,Inspire NOLA,802,PUBLIC
POINT (-90.073373160797 29.968571421259),136,St. Peter Claver School,1020 N Prieur St,OPEN,,,PRIVATE
POINT (-89.979565669045 30.01628388005),127,Prince Of Peace Lutheran School,9301 Chef Menteur Hwy,OPEN,,,PRIVATE
POINT (-90.102343046615 29.925471091498),93,Sophie B. Wright Charter School,1426 Napoleon Ave,OPEN,Non-Network,508,PUBLIC
POINT (-90.128115270124 29.9483966489),82,Noble Minds Institute for Whole Child Learning,1333 S Carrollton Ave,OPEN,,34,PUBLIC
POINT (-90.113960718487 29.941319148713),155,Ursuline Academy,2635 State St,OPEN,,,PRIVATE
POINT (-90.059258155627 29.96556590288),144,St. Gerard Majella Alternative School,1941 Dauphine St,OPEN,,,PRIVATE
POINT (-90.053787079814 29.968229705086),56,KIPP Leadership,2300 St Claude Ave,OPEN,KIPP,937,PUBLIC
POINT (-90.129890729119 29.934181790821),6,Audubon Charter School: Uptown,428 Broadway St,OPEN,Non-Network,,PUBLIC
POINT (-90.033596752133 29.976752318545),1,Akili Academy,3811 N Galvez St,OPEN,Crescent City Schools,624,PUBLIC
POINT (-90.078010319417 30.010106505124),33,Arthur Ashe,1456 Gardena Dr,OPEN,FirstLine Schools,836,PUBLIC
POINT (-90.123918537981 29.970592268046),62,Lafayette Extension at Paul L. Dunbar School,9330 Forshey St,OPEN,Choice Foundation,,PUBLIC
POINT (-90.100351263865 29.92021063069),116,Ecole Bilingue De La Nouvelle Orleans,812 General Pershing St,OPEN,,,PRIVATE
POINT (-90.078121407092 29.969153252172),36,Phillis Wheatley Community School,2300 Dumaine St,OPEN,FirstLine Schools,789,PUBLIC
POINT (-89.967767653835 30.057761911607),88,Schaumburg Elementary,12000 Hayne Blvd,OPEN,ReNEW Schools,853,PUBLIC
POINT (-90.076216739386 30.018994659636),47,John F. Kennedy High School at Lake Area,6026 Paris Ave,OPEN,New Beginnings,677,PUBLIC
POINT (-90.075196441309 29.927529522255),89,SciTech Academy,820 Jackson Ave,OPEN,ReNEW Schools,598,PUBLIC
POINT (-89.958830916952 30.034732565732),63,Lake Forest Elementary Charter School,11110 Lake Forest Blvd,OPEN,Non-Network,629,PUBLIC
POINT (-90.112013167104 29.931314298057),120,Isidore Newman School,1903 Jefferson Ave,OPEN,,,PRIVATE
POINT (-90.047989997938 29.943551789999),72,McDonogh #32 Literacy Charter School,800 De Armas St,OPEN,Algiers Charter School Association,379,PUBLIC
POINT (-90.10128613441 29.922636388881),138,St. Stephen School,1027 Napoleon Ave,OPEN,,,PRIVATE
POINT (-90.104067502442 29.971727835404),31,Esperanza Charter School,4407 S Carrollton Ave,OPEN,Choice Foundation,528,PUBLIC
POINT (-90.074062951565 29.930205707586),139,St. Alphonsus Elementary School,2001 Constance St,OPEN,,,PRIVATE
POINT (-90.078112237411 29.931837703037),153,Trinity Episcopal School,1315 Jackson Ave,OPEN,,,PRIVATE
POINT (-90.040681346027 29.942298134039),59,L. B. Landry – O. Perry Walker College and Career Preparatory High School,1200 LB Landry Ave,OPEN,Algiers Charter School Association,1155,PUBLIC
POINT (-90.103940587008 29.926931558613),103,Academy Of The Sacred Heart,4521 St. Charles Ave,OPEN,,,PRIVATE
POINT (-90.080046507995 29.977861617391),38,Foundation Preparatory,2733 Esplanade Ave,OPEN,Non-Network,146,PUBLIC
POINT (-90.122722250109 29.944692677534),65,Lusher Charter Elementary School,7315 Willow St,OPEN,Non-Network,666,PUBLIC
POINT (-90.036191314388 29.944729776667),39,Harriet Tubman Charter School,2013 General Meyer Ave,OPEN,Crescent City Schools,647,PUBLIC
POINT (-90.112125246028 29.927129134525),115,De La Salle High School,5300 St. Charles Ave,OPEN,,,PRIVATE
POINT (-90.094200679693 29.930380236062),99,Walter L. Cohen Academy of Career and Community Education (ACCE),3520 Dryades St,OPEN,New Orleans College Preparatory Academies (NOCP),,PUBLIC
POINT (-89.924968161433 30.03979694548),27,Einstein Charter School at Village De L’est,5100 Cannes St,OPEN,Einstein Charter Schools,468,PUBLIC
POINT (-90.090382197854 29.939780627254),52,KIPP Booker T. Washington High School,2514 Third St,OPEN,KIPP,226,PUBLIC
POINT (-89.984771438272 29.917088686736),15,Rosenwald Collegiate Academy,6501 Berkley Dr,OPEN,Collegiate Academies,,PUBLIC
POINT (-90.101628400406 30.003508739454),23,Edward Hynes Charter School,990 Harrison Ave,OPEN,Non-Network,691,PUBLIC
POINT (-90.093297961551 29.943585545823),164,McMillian's FIRST Steps CDC/Academy,2601 S Claiborne Ave,OPEN,,,PRIVATE
POINT (-90.051278030257 29.983675489576),30,ENCORE Academy,2518 Arts St,OPEN,Non-Network,561,PUBLIC
POINT (-90.072918312608 29.951240279005),151,The Good Shepherd Nativity Mission Elementary School,353 Baronne St,OPEN,,,PRIVATE
POINT (-90.099079770038 29.923235788359),7,Audubon Charter School: Uptown,1111 Milan St,OPEN,Non-Network,,PUBLIC
POINT (-90.11465693575 29.933335645287),80,New Orleans Charter Science and Math High School (Sci High),5625 Loyola Ave,OPEN,Non-Network,473,PUBLIC
POINT (-89.978213302749 30.051312111272),106,Auntie B Preschool & Kindergarten,8001 Lafourche St,OPEN,,,PRIVATE
POINT (-90.082495294393 29.998164270824),73,McDonogh #35 College Preparatory High School,4000 Cadillac St,OPEN,OPSB Direct Run,860,PUBLIC
POINT (-90.076410238484 29.974369423802),11,Bricolage Academy,2426 Esplanade Ave,OPEN,Non-Network,443,PUBLIC
POINT (-90.088216635802 29.981331844333),109,Cabrini High School,1400 Moss St,OPEN,,,PRIVATE
POINT (-90.028701799677 29.938141966691),16,Crescent Leadership Academy Accelerated High School,2701 Lawrence St,OPEN,Non-Network,70,PUBLIC
POINT (-90.033715519199 29.929623893984),110,Calvary Baptist School,2401 General Degaulle Dr,OPEN,,,PRIVATE
POINT (-90.117270871923 29.95829561771),60,Lafayette Academy Charter School,2727 S Carrollton Ave,OPEN,Choice Foundation,107,PUBLIC
POINT (-90.092402856036 29.920081623642),86,Accelerated High School,3649 Laurel St,OPEN,ReNEW Schools,319,PUBLIC
POINT (-90.047194496792 29.939719092523),28,Elan Academy,709 Park Blvd,OPEN,Non-Network,58,PUBLIC
POINT (-90.048733520711 29.94838686796),69,Martin Behrman Charter School Academy of Creative Arts and Sciences,715 Opelousas Ave,OPEN,Algiers Charter School Association,749,PUBLIC
POINT (-90.037118055615 30.011066685816),70,Mary D. Coghill Elementary School,4617 Mirabeau Ave,OPEN,Non-Network,600,PUBLIC
POINT (-90.034505663793 29.950747147773),81,New Orleans Military and Maritime Academy (NOMMA),425 O'Bannon St,OPEN,,763,PUBLIC
POINT (-90.069329869014 29.982160021089),123,Life Of Christ Christian Academy,1851 N Dorgenois St,OPEN,,,PRIVATE
POINT (-90.065159853164 29.96060441511),111,Cathedral Academy,820 Dauphine St,OPEN,,,PRIVATE
POINT (-90.069058005124 29.965073386155),48,Joseph A. Craig Charter School,1423 St Philip St,OPEN,Friends of King,300,PUBLIC
POINT (-90.016997027112 30.020588880421),55,KIPP East Community,6519 Virgilian St,OPEN,KIPP,330,PUBLIC
POINT (-90.129247837557 29.94677772813),140,St. Andrew's Episcopal School,8012 Oak St,OPEN,,,PRIVATE
POINT (-90.079831673543 29.94003933659),95,The NET Charter High School,1614 Oretha Castle Haley Blvd,OPEN,Educators for Quality Alternatives,154,PUBLIC
POINT (-90.062956576851 29.960925956682),40,Homer A. Plessy Community School,721 St Philip St,OPEN,Non-Network,286,PUBLIC
POINT (-90.113960718487 29.941319148713),156,Ursuline Academy Elementary School,2635 State St,OPEN,,,PRIVATE
POINT (-90.073146728764 30.020411387085),8,Benjamin Franklin Elementary Mathematics and Science School (Lower),6101 Chatham Dr,OPEN,OPSB Direct Run,518,PUBLIC
POINT (-90.105717597559 29.933595397683),37,Samuel J Green Charter School,2319 Valence St,OPEN,FirstLine Schools,513,PUBLIC
POINT (-90.080629527858 29.987903889179),34,Langston Hughes Academy,3519 Trafalgar St,OPEN,FirstLine Schools,806,PUBLIC
POINT (-90.085125607992 29.9233077197),35,Live Oak Academy,3128 Constance St,OPEN,FirstLine Schools,637,PUBLIC
POINT (-90.010560230298 29.959987814466),124,Light City Christian Academy,6117 St. Claude Ave,OPEN,,,PRIVATE
POINT (-90.094716916863 29.960304822756),97,Travis Hill School: Orleans Justice Center,2800 Perdido St,OPEN,,,PUBLIC
POINT (-90.102604755236 29.946262703349),3,Andrew Wilson,3617 General Pershing St,OPEN,Inspire NOLA,643,PUBLIC
POINT (-90.069913527792 29.969877854462),49,Joseph S. Clark High School,1301 N Derbigny St,OPEN,FirstLine Schools,97,PUBLIC
POINT (-90.068288806426 29.983649810625),142,St. Augustine Senior High School,2600 Ap Tureaud Ave,OPEN,,,PRIVATE
POINT (-90.003100435401 30.023245312316),14,Livingston Collegiate Academy,7301 Dwyer Rd,OPEN,Collegiate Academies,308,PUBLIC
POINT (-89.954338394593 30.024920480257),26,Einstein Charter School at Sherwood Forest,4801 Maid Marion Dr,OPEN,Einstein Charter Schools,480,PUBLIC
POINT (-90.090382197854 29.939780627254),54,KIPP Central City,2514 Third St,OPEN,KIPP,446,PUBLIC
POINT (-90.125882975857 29.94996948566),90,SciTech Academy,1607 S Carrollton Ave,OPEN,ReNEW Schools,202,PUBLIC
POINT (-89.999537304407 29.918452476524),2,Alice Harte,5300 Berkley Dr,OPEN,Inspire NOLA,788,PUBLIC
POINT (-89.995909311673 30.039337481898),91,Robert Russa Moton Charter School,8550 Curran Blvd,OPEN,Non-Network,349,PUBLIC
POINT (-90.036904357259 30.012897978124),143,St. Benedict The Moor Elementary School,5010 Piety Dr,OPEN,,,PRIVATE
POINT (-89.998864557845 30.04164833605),122,Lake Castle Private School,8400 Hayne Blvd,OPEN,,,PRIVATE
POINT (-90.052110568086 29.940788316427),46,JCFA Algiers,1415 Teche St,OPEN,,,PUBLIC
POINT (-90.121444198123 29.920409655088),67,LFNO (Lower),5951 Patton St,OPEN,,423,PUBLIC
POINT (-90.091961234749 29.942956597218),21,E. P. Harney Spirit of Excellence Academy,2503 Willow St,OPEN,Non-Network,298,PUBLIC
POINT (-89.950495255857 30.054400871007),107,Bishop McManus Academy,13123 I-10 Service Rd,OPEN,,,PRIVATE
POINT (-90.110556521536 29.919866268101),147,St. Katharine Drexel,5116 Magazine St,OPEN,,,PRIVATE
POINT (-90.11057948029 30.018607362571),125,Mount Carmel Academy High School,7027 Milne Blvd,OPEN,,,PRIVATE
POINT (-90.093629823633 29.967648082017),77,Morris Jeff Community School,211 S Lopez St,OPEN,Non-Network,891,PUBLIC
POINT (-90.049747826031 29.950464213619),43,International School of Louisiana,502 Olivier St,OPEN,,,PUBLIC
POINT (-90.106392452156 29.978061523617),141,St. Anthony Of Padua School,4601 Cleveland Ave,OPEN,,,PRIVATE
POINT (-90.075966615925 29.977361834967),78,New Harmony High,2539 Columbus St,OPEN,,,PUBLIC
POINT (-89.978985311386 30.046974203905),87,Dolores T. Aaron Academy,10200 Curran Blvd,OPEN,ReNEW Schools,857,PUBLIC
POINT (-90.106392452156 29.978061523617),158,Christian Brothers School,4600 Canal St,OPEN,,,PRIVATE
POINT (-90.103324888234 29.97243059009),121,Jesuit High School,4133 Banks St,OPEN,,,PRIVATE
POINT (-89.972736791327 30.023793790628),128,Resurrection Of Our Lord Elementary School,4861 Rosalia Dr,OPEN,,,PRIVATE
POINT (-90.081693551162 29.932000289452),163,The Louise S. McGehee School,2343 Prytania St,OPEN,,,PRIVATE
POINT (-90.072818212116 29.947082738125),41,International High School,727 Carondelet St,OPEN,,558,PUBLIC
POINT (-90.119482506105 29.918176458192),9,Benjamin Franklin Elementary Mathematics and Science School (Upper),401 Nashville Ave,OPEN,OPSB Direct Run,272,PUBLIC
POINT (-90.091306563932 29.98867375976),113,Christian Brothers School,8 Friederichs Ave,OPEN,,,PRIVATE
POINT (-90.052980565882 30.007718813603),5,Audubon Charter School: Gentilly,4720 Painters St,OPEN,Non-Network,,PUBLIC
POINT (-90.104093938227 29.935023164586),119,Holy Rosary Academy and High School,2437 Jena St,OPEN,,,PRIVATE
POINT (-90.123283621511 29.953729474815),149,Stuart Hall,2032 S Carrollton Ave,OPEN,,,PRIVATE
POINT (-90.073022787679 29.936419287499),44,International School of Louisiana,1400 Camp St,OPEN,,,PUBLIC
POINT (-90.090408107719 29.968537818328),101,Warren Easton High School,3019 Canal St,OPEN,Non-Network,989,PUBLIC
POINT (-90.073712887647 29.988003701667),159,St. Leo the Great,1501 Abundance St,OPEN,,,PRIVATE
POINT (-90.084716105654 29.945790130933),53,KIPP Central City,2625 Thalia St,OPEN,KIPP,509,PUBLIC
POINT (-89.930773740715 30.042044950075),25,Einstein Charter Middle School at Sarah Towles Reed,5316 Michoud Blvd,OPEN,Einstein Charter Schools,356,PUBLIC
POINT (-90.114042679255 29.956538433876),132,St. Marys Dominican High School,7701 Walmsley Ave,OPEN,,,PRIVATE
POINT (-90.083402438004 29.936453749969),45,James M. Singleton Charter School,2220 Oretha Castle Haley Blvd,OPEN,Non-Network,432,PUBLIC
POINT (-90.004177266771 29.921169843226),22,Edna Karr High School,3332 Huntlee Dr,OPEN,Inspire NOLA,1109,PUBLIC
POINT (-90.105943731826 29.978992637193),94,Success Preparatory Academy,4621 Canal St,OPEN,Non-Network,436,PUBLIC
POINT (-90.127597226257 29.941509946392),154,University Montessori School,7508 Burthe St,OPEN,,,PRIVATE
POINT (-90.015433802599 30.033874827319),76,Mildred Osborne Charter School,6701 Curran Blvd,OPEN,ARISE Schools,490,PUBLIC
POINT (-90.007671035248 30.015488542284),131,St. Mary's Academy,6905 Chef Menteur Hwy,OPEN,,,PRIVATE
POINT (-90.105977238721 30.005565317896),178,St. Dominic School,6326 Memphis St,OPEN,,,Private
POINT (-90.050235813206 29.96634498262),134,St. Paul Lutheran Ok,2624 Burgundy St,OPEN,,,PRIVATE
POINT (-90.074771186412 29.989516155504),75,Medard H. Nelson Charter School,3121 St Bernard Ave,OPEN,New Beginnings,411,PUBLIC
,19,Dr. Martin Luther King Jr. Charter School For Science and Technology,5300 N Rocheblave St,OPEN,Friends of King,430,PUBLIC
POINT (-89.998168480584 29.905641084108),20,Dwight D. Eisenhower Academy of Global Studies,3700 Tall Pines Dr,OPEN,Inspire NOLA,686,PUBLIC
POINT (-90.132775980599 29.939904344824),51,KIPP Believe,421 Burdette St,OPEN,KIPP,435,PUBLIC
POINT (-90.119682437112 29.935890613535),118,Holy Name Of Jesus Elementary School,6325 Cromwell Pl,OPEN,,,PRIVATE
POINT (-90.133915894222 29.947812704898),145,St. Joan Of Arc School,919 Cambronne St,OPEN,,,PRIVATE
POINT (-89.989001979413 30.027213656585),152,The Upperroom Bible Church Academy,8600 Lake Forest Blvd,OPEN,,,PRIVATE
POINT (-89.949483674003 30.029379748434),32,Fannie C. Williams Charter School,11755 Dwyer Rd,OPEN,Non-Network,574,PUBLIC
POINT (-89.997510790779 30.018059590718),57,KIPP Morial (McDonogh 15),7701 Grant St,OPEN,KIPP,933,PUBLIC
POINT (-90.051300647217 30.027430535),96,The NET Charter High School: Gentilly,6601 Franklin Ave,OPEN,Educators for Quality Alternatives,135,PUBLIC
POINT (-90.11397334321 29.93548009149),66,Lusher Middle and High Charter School,5624 Freret St,OPEN,Non-Network,1095,PUBLIC
POINT (-90.107581676192 30.004200384365),135,St. Paul's Episcopal School,6249 Canal Blvd,OPEN,,,PRIVATE
POINT (-89.971978506024 30.028904618594),12,Abramson Sci Academy,5552 Read Blvd,OPEN,Collegiate Academies,591,PUBLIC
POINT (-90.114000428831 29.972623853738),42,International School of Louisiana,4040 Eagle St,OPEN,,,PUBLIC
POINT (-90.084081505611 29.995367667647),98,Travis Hill School: Youth Study Center,1100 Milton St,OPEN,,,PUBLIC
POINT (-90.052110568086 29.940788316427),105,All Saints Catholic School,1415 Teche St,OPEN,,,PRIVATE
POINT (-90.03743367443 29.99390433197),83,Opportunities Academy,3059 Higgins Blvd,OPEN,Collegiate Academies,,PUBLIC
POINT (-90.130299201337 29.956339130463),68,LFNO (Upper),1800 Monroe St,OPEN,,398,PUBLIC
POINT (-90.100756804135 29.921629198481),130,St. Georges Episcopal School,923 Napoleon Ave,OPEN,,,PRIVATE
POINT (-89.986587040085 30.016722196106),126,New Orleans Adventist Academy,4500 Gawain Dr,OPEN,,,PRIVATE
POINT (-90.123918537981 29.970592268046),50,KIPP Believe,9330 Forshey St,OPEN,KIPP,414,PUBLIC
POINT (-90.07461277944 29.923947325829),157,Waldorf School Of New Orleans,517 Soraparu St Suite 101,OPEN,,,PRIVATE
